基于性格特征的社会化媒体用户学术信息搜寻行为感知差异研究	张晋朝:25249619|罗博:34440049|查先进:09002352|	11	性格特征;社会化媒体;学术信息;信息搜寻行为;感知差异;	"考虑到性格特征是引导用户行为的一种重要心理机制,本文考察了不同性格特征水平的用户在社会化媒体环境下学术信息搜寻行为的感知差异,以及用户的性格特征和基本特征对学术信息搜寻行为的交互作用。采用问卷调查法收集数据。研究发现社会化媒体用户的学术信息搜寻行为因其外向性、尽责性、开放性和随和性特征水平的不同而有显著的差异性。同时,用户的性格特征与学术信息搜寻行为之间的关系因基本特征的不同而存在不同程度的显著差异和影响。"	XNZY201804010
学科合作网络链路预测结果的排序鲁棒性	张斌:08992752|李亚婷:25163258|	9	合作网络;链路预测;网络结构;鲁棒性;	"在学科合作网络研究中,会根据不同目的采取不同抽取网络的方案,由此带来实验网络结构的改变,会影响到链路预测结果的排序鲁棒性。从CSSCI数据库中选取图书馆情报文献学期刊论文,构建合作网络,根据不同网络抽取方案,构建网络结构扰动的实验环境,通过比较在网络结构发生扰动时,不同预测指标的预测结果和排序情况以及在相同规模下的重叠情况来判断排序鲁棒性的好坏。研究发现,网络结构的扰动对于Katz指标的预测结果影响最小,对Rooted PageRank指标的预测结果影响最大。通过比较在网络结构发生扰动时,不同预测指标的预测效果。研究发现,AA、Katz和SimRank在预测效果方面显得较为稳定,它们受到网络结构扰动的影响相对较小。"	XNZY201804011
图书情报领域认知负荷测量研究综述	陆泉:08985964;08985964|田敏:09009714|陈静:07624450|	8	认知负荷;认知负荷测量;图书馆学情报学;用户行为;	"通过对用户的认知负荷进行有效测量,可以反映其在信息处理过程中的心理状况。主要选取图书情报与数字图书馆学科里有关认知负荷测量的国内外研究,从测量方法、测量指标和研究领域三个维度分析了研究现状与热点。最终得到图情领域中关于认知负荷测量的五点研究启示,为情报学对认知负荷测量的进一步研究提供参考。"	XNZY201804012
国际网络视频直播研究述评	刘颖:10135818|孟健:09006740|	13	网络视频直播;直播;视频传输;用户行为;用户动机;直播平台;	"本文回顾了53篇国际上关于网络视频直播的论文,分析了文献的研究主题、涉及平台和研究方法,并对未来的研究方向提出了建议。研究发现,当前的研究主题主要分为8类,其中,视频传输、网站设计、用户行为和用户使用动机是主要的研究主题;相关的平台主要涉及到Twitch.tv、Periscope、YouTube Live等;在研究方法上,采用最多的是实证研究、技术设计和模拟法等。研究结论:在目前的研究主题下,未来的研究应更深入地关注网络视频直播的个性化应用、特定的用户群体、网络视频直播的可应用领域等方面。"	XNZY201804013
全文本文献计量分析学术沙龙综述	王佳敏:38423099;38423099|李信:35477957;35477957|刘齐进:40532213;40532213|	7	全文本;文献计量分析;引文内容分析;引用行为;引用动机;引用情感;	"以""科学计量与科技评价的理论、方法与应用""为主题的""2018科学计量与科技评价天府论坛""于2018年9月19―21日在成都顺利召开,""全文本文献计量分析""沙龙作为此次论坛的一项重要学术活动,为与会学者们提供了一个开放探讨的平台。本文通过对沙龙嘉宾的发言和讨论内容进行梳理与总结,将沙龙的主要内容归纳为引用位置与引用程度分析、引用行为与引用动机分析、引用情感分析与论文评价、全文本知识单元与实体抽取、数据开放、数据标注与评测、新兴研究话题发现与预测等六个主题,以期揭示全文本文献计量分析的研究现状和发展趋势。"	XNZY201804014
卷首语	王晓光:|	1		"&lt;正&gt;时光荏苒,2018已经与我们告别。回首2018,不仅是具有时代纪念意义的一年,我国改革开放40周年,恢复高考40周年,也是《信息资源管理学报》(以下简称《学报》)发展史上具有里程碑意义的一年。2018年,是《学报》创刊的第八个年头,也是第二届编委会正式运行的第一年。专家们为期刊发展提出了""紧跟数据时代发展""的新目标。"	XNZY201901001
论情报学与情报工作“智慧”发展的几个问题	孙建军:08067678|李阳:27845879|	5	情报学;情报工作;大数据;智慧;发展;	"在新环境下,情报学与情报工作如何发展一直是一个引人注目的问题。围绕新时代背景下的""情报""新内涵、新内容、新方位,文中从思维、资源、技术、教育、路径等五个方面简要论述了情报学与情报工作发展的""智慧""元素,为促进具有特色的情报学学科建设与情报事业发展提供参考。"	XNZY201901002
专题前言・智慧养老研究	朱庆华:08722091|	1		"&lt;正&gt;老龄化是国际社会必须面对的世界性问题,更是中国正在面临的严峻挑战。截至2017年底,我国60岁及以上老人数量达到2.41亿,占比超过17.3%。今后一段时期60岁以上老人平均每年约增加800万,预计2020年将增加到2.55亿人左右。严峻的老龄化形势使传统的劳动密集型养老方式面临重重困难,养老模式的智慧化将是必然的选择。智慧养老是指通过物联网、互"	XNZY201901003
智慧养老领域的研究现状与热点分析	王坚:08718899|张h:08046730|朱庆华:08722091|	12	智慧养老;互联网+;文献计量;养老产业;养老产品;信息技术;物联网;	"本文以中国知网、Web of Science作为数据来源,从论文数量、作者关系、机构来源和研究热点等维度,结合文献计量经典定律,对国内外智慧养老领域研究现状进行科学计量、可视化分析和综述研究,并分别在概念、技术和产品三个不同层面对国内外智慧养老研究热点和发展趋势进行探讨。研究表明,国内智慧养老领域主要关注于养老模式、养老体系、养老产业及养老产品等重要内容的研究与实践,而国外智慧养老领域则更多侧重养老实践中的传感技术与设备,特别是技术在老年人病理和生活中的应用与功能性研究等。"	XNZY201901004
2013―2017年我国养老政策量化研究	何振宇:40594786|白枚:41046883|朱庆华:08722091;08722091|	9	养老政策;共词分析;TF-IDF算法;高频关键词;智慧养老;养老产业;	"分析我国养老政策的核心要点,为智慧健康养老产业的发展提供借鉴与参考。首先通过量化研究的方法,梳理养老政策的主要脉络,其次通过TF-IDF算法从目标政策文件中提取高频关键词,采用共词分析对提取的高频关键词进行聚类,并针对聚类结果展开分析。最后总结了我国养老政策的几个核心类别,为养老体系建设提出了几点建议。本文高频关键词的选取采用了人工筛选的方式,可能会存在错漏;共现算法使用ochiia系数,无法区分共现中特征词的频度。"	XNZY201901005
认知闭合需要对城市人口养老决策的影响	余译青:40554434|柴蕴娟:41046884|朱庆华:08722091|白玫:34627473|	7	养老决策;养老模式;认知闭合需要;老龄化;中国城市居民;	"在中国面临严峻的人口老龄化挑战的大背景下,以昆明市城市人口为样本,实证分析了认知闭合需要对个体养老决策过程的影响。通过Logistic回归,发现城市居民的认知闭合需要越高,越倾向于依靠他人而非自己作出养老决策;通过OLS回归,证实了认知闭合水平越高,城市居民越容易作出与父母养老现状类似的养老决策。这一研究结果可促进未来养老领域的跨学科交叉研究,在实践上能帮助养老机构未来进行精准营销,也可提供人口的认知特征以供政府更好地制定与养老相关的政策。"	XNZY201901006
基于链接分析的老年用户网站综合影响力评价研究	匡宇扬:41046885|朱庆华:08722091|袁勤俭:08721133|	9	老年用户网站;链接分析;灰色关联;网站评价;影响力评价;老年人服务;	"随着计算机和网络的普及,老年人的信息素养不断提高。近年来,我国老年网民的数量稳步增长,老年用户逐渐从边缘人群过渡成为有极具增长空间的潜力群体。本文通过链接分析法和灰色关联法探究15个中国老年用户网站的影响力情况。首先根据网站情况及前人成果选择10个指标,接着通过层次分析法对指标赋权,最后计算各网站的加权关联度。研究结果表明我国老年用户网站发展不均衡,综合类网站具有更高的影响力,单一功能类网站的影响力有待提高。"	XNZY201901007
时序分析相关方法在信息检索研究中的应用（英文）	王彦妍:24017280|张进:39666507|	20	时序分析;时序分析应用;研究方法;方法论;信息检索;	"时序分析是自然科学和人文社会科学研究的常用方法,在信息检索领域也被广泛使用。本文采用定性与定量相结合的研究方法回顾并分析了1991至2016年时序分析的相关方法在信息检索领域内的应用情况。本文在Web of Science,EBSCOhost和Pro Quest三个数据库中检索了1991至2016年信息检索领域内使用时序分析相关方法的期刊论文、会议论文和学位论文,共计2240篇。本文采用趋势分析和文本内容分析方法对所获得的文献进行梳理和研究。研究结果显示在信息检索领域中,自2004年起时序分析方法的应用呈现明显上升趋势。时序分析方法包括定性和定量两大类,被广泛应用于传统(如文献计量、图书馆学等)、新兴(如社交媒体、商业智能等)的信息检索相关领域,及交叉学科(如健康信息等)的研究中。信息可视化方法和技术经常采用时序分析的理论和方法,同时也频繁地被用于时序分析的研究中。本文的研究结果将有助于信息检索领域的学者们进一步了解时序分析方法及其应用,并在日后的研究中更好地使用和创新时序分析方法。"	XNZY201901008
一种基于政策文本计算的政策内容分析方法实证研究――以互联网租赁自行车为例	张涛:45672626|蔡庆平:10893631|马海群:05964571|	11	政策文本计算;政策内容分析;互联网租赁自行车;文档主题生成模型(LDA);内容分析方法;	"政策文本计算是信息科学、政策科学与计算科学交叉融合的产物,通过对政策文件及政策评论内容进行计算分析,使政策制定研究过程更加科学有效。文章首先利用关键词抽取法对政策文件进行框架提取;其次利用主题分析法对政策评论数据进行聚类分析;再次利用共现分析法对政策文件及政策评论共现强度数据计算;最后依据计算所得数据对政策内容进行综合分析,进而形成一种新的政策内容分析方法并以互联网租赁自行车为例证实了该方法的有效性,此方法的提出也为未来政策分析研究提供了新思路。"	XNZY201901009
国内外网络社区研究热点揭示	何伟军:08196375|王慧:10825549|黄正伟:10754361|杨艳妮:29374818|	8	网络社区;关键词分析;活跃度指数;影响力指数;学科差异;	"网络社区作为一种虚拟的用户交互平台,是目前众多国内外学者聚焦的热点话题之一。对国内外网络社区研究的热点进行综合研究,可以为今后相关主题的研究提供借鉴。本文从时间、期刊和机构分布三个方面对国外Web of Science和国内知网数据库采集的文献数据进行分析,以探析网络社区主题研究的发展状况,并基于活跃度指数(KAI)和影响力指数(KII),衡量不同学科在网络社区研究的热点分布。通过构建网络社区研究学科优势判断矩阵,发现国内外网络社区相关研究主要集中在新闻传媒、图书情报、计算机科学、社会学、企业经济等学科领域,且不同学科间关于网络社区的研究均呈现出典型的科学背景和学科领域属性。"	XNZY201901010
知识图谱软件学术影响力研究	周春雷:24810369|张猛:10310481|	9	知识图谱软件;学术影响力;图情领域;信息可视化;软件应用;	"以中国知网(CNKI)全文数据库为数据源,调查在国内学术界有一定知名度的27种知识图谱软件在学术论文中的使用情况,从机构、用户及学科角度探讨其在学术界的影响力。研究发现,知识图谱软件在国内学术界的应用范围很广,在图情领域尤为普及;不同知识图谱软件的学术影响力差别很大,少数""明星""软件对学术研究的影响较大;高频使用者通常具有一定的学术地位且相互之间有着较为密切的关系,在软件传播、应用过程中发挥着核心作用。"	XNZY201901011
自主学习情境下用户信息搜寻行为的实证研究	刘萍:09017739|邓叶芝:41046886|杨志伟:40325833|	11	自主学习;信息搜寻;用户信息行为;信息检索;	"采用实验法针对大学生用户设置真实的自主学习任务,通过日志分析探寻用户的信息搜寻行为模式特征,并比较不同信息搜寻行为所导致的学习效果。结果表明,在自主学习情境下,用户的主要信息搜寻行为特征为:(1)信息源选择单一;(2)检索式重构次数少;(3)较少浏览和下载排名靠后的检索结果。此外,不同搜寻模式下学习效果具有差异。本文丰富了信息搜寻行为的研究情境,且对学生、教师和系统设计者等都具有一定的实践意义和实践启示。"	XNZY201901012
基于链接分析和规则分类的恶意网站识别技术研究	胡忠义|王超群|吴江|陈远:|	10	恶意网站;链接分析;分类规则;机器学习;网站识别;	"采用多源链接分析指标,构建了基于链接分析和规则分类技术的恶意网站识别模型。通过分析四种规则分类技术的识别性能和识别规则,并与四种传统的机器学习分类技术进行对比,验证所构建模型的有效性。在所提取的识别规则中,来自Alexa和Moz平台上的网站链接指标在恶意网站识别中有重要作用;与传统的机器学习分类技术相比,基于链接分析和规则分类的识别模型不仅能提取出多组易于理解的恶意网站识别规则,还具有更好的识别性能。本研究不仅拓展了链接分析在恶意网站识别中的应用,有效提升了恶意网站识别的准确性,还提取出易于理解的恶意网站识别规则。"	XNZY201901013
新时代文献资源共享创新模式探索――国家哲学社会科学文献中心的资源建设与服务优化	郭哲敏:27443645|	8	国家哲学社会科学文献中心;开放存取;大数据;学术图书馆;文献资源建设;文献资源服务;	"为促进哲学社会科学繁荣发展,中国社会科学院图书馆在实现哲学社会科学文献资源的共建共享方面进行了一系列积极探索,建设国家级公益免费的哲学社会科学文献资源平台――国家哲学社会科学文献中心,为构建方便快捷、资源共享的哲学社会科学研究信息化平台做出了探索和努力。笔者分析了国家哲学社会科学文献中心的建设思路和建设现状,并基于资源融合、学科融合、数据融合的时代环境,从资源建设与服务等方面提出了推进国家哲学社会科学文献中心建设的建议。"	XNZY201901014
情报学与情报工作发展论坛(2018)纪要	司湘云:38612920|赵海平:33022055|王吉秀:41046887|秦岩:40558020|	6		"&lt;正&gt;1引言大数据和人工智能时代给情报学和情报工作带来了机遇和挑战,传统的情报思想、教育、理论、方法以及工作都需要发生根本的变革。情报学与情报工作如何改变、如何发展,如何真正在社会治理、政府决策、科技进步、国家安全中发挥更大作用、凸显情报本质、""引领""科学研究,是每一位情报学人和情报工作者必须认真面对的问题。2018年11月10日,""情报学与情报工作发展论坛(2018)""在武汉隆重召开。本次论坛由中国科学技术情报学会、全国高等学校图书"	XNZY201901015
基于知识概念的技术新陈代谢分析:以3G到5G的技术升级为例	王贤文:06532500;06532500|田文灿:38112327;38112327|胡志刚:06527352;06527352|	7	技术升级;技术新陈代谢;3G;4G;5G;LLR算法;IEEE Xplore;	"本研究提出基于知识概念的产生、生长和消亡的技术新陈代谢分析方法。基于IEEE Xplore数据库,以3G―5G技术为例,利用LLR算法和相关数据库技术,探讨了在技术升级过程中新知识概念随时间的生长情况,对各领域的研究主题进行历时分析,并对有长久生命力的研究主题进行挖掘。研究结果表明:技术升级会带来技术的新陈代谢,造成知识概念波峰的产生,延长研究领域的生命周期;在技术升级过程中新研究主题侧重于时代名词及技术方法,而那些长盛不衰的研究主题更侧重于理论与模型。"	XNZY201902001
专题前言:超越地理疆界的网络与数据主权	冉从敬:08986855|	1		"&lt;正&gt;主权是国家概念的核心。传统的国家主权概念,总是与地理空间因素相关联。信息科技的不断发展,网络空间无处不在、无所不及、无人不用,数据资源成为重要的战略资源,网络空间生态与综合国力的格局发生深刻变化,网络空间的国际冲突和安全危机成为国家主权安全的巨大隐患。在此背景下,主权概念开始与地理要素脱离,数据主权成为新的概念分支并占据主权体系版图核心,对国家的日常运行和长远发展产生重要影响,越来越成为综合国力竞争的核心要素。"	XNZY201902002
网络主权安全的国际战略模式研究	冉从敬:08986855;08986855|王冰洁:36415261|	13	网络主权;网络安全战略;网络军事化;网络空间防御;网络空间治理;	"本文在调研近10年世界上部分主要国家及国际组织的网络安全战略的基础上,从国家主权视角分析网络空间的国际整体法制现状,归纳不同典型代表的国家网络主权安全战略模式。在整体国际框架下,国际电信联盟ITU、信息社会世界峰会WSIS、联合国信息安全政府专家组及网络犯罪问题专家组,以及各区域间所缔约的组织联盟如欧盟EU、北约NATO、经合组织OECD等,均体现了不同主权国家间对于网络空间的合作治理。在各国家主权视角下,按照网络空间的发展权、主导权及控制权等由强到弱,本文从战略规划、组织机制等方面归纳总结了以美国为代表的美国式网络军事化战略、以英法德为代表的欧洲式防御威慑型战略,以及以日韩为代表的日韩式合作阵营型战略。"	XNZY201902003
欧盟GDPR中数据可携权对中国的借鉴研究	冉从敬:08986855;08986855|张沫:34305576|	10	数据可携权;数据安全;数据隐私;数据保护;通用数据保护条例;欧盟;	"欧盟《通用数据保护条例》自2018年5月起开始施行,其对于增强数据主体权利、促进欧盟地区的自由竞争与发展具有开拓性的意义。数据可携权是《通用数据保护条例》引入的一项新型权利,由欧盟长期的立法规范演化而来,以副本获取权和副本转移权为核心内容,对加强数据主体权利、促进行业数据传输格式标准的建立具有积极的影响,但也可能会损害有价值的专有信息或知识产权、造成隐私和数据安全风险、提高企业合规成本。我国处于信息技术发展的高速时期,对于数据保护愈发重视,我国是否应引入数据可携权、应当如何借鉴,是本文探究的重点。"	XNZY201902004
基于CLOUD法案的美国数据主权战略解读	黄海瑛:10134100|何梦婷:36070871|	12	CLOUD法案;数据主权;战略体系;跨境数据流动;网络空间;数据安全;	"在竞争日益激烈的国际网络空间中,数据主权治理边界愈发模糊,各主权国家积极展开数据主权战略建设,保障本国数据主权安全。美国于2018年3月通过了CLOUD法案,力图通过法案解决跨境数据流动中的安全威胁,维护国家数据主权,对此法案进行研究对于提升我国数据主权战略、完善我国数据战略体系具有重要意义。本文全面剖析CLOUD法案,解读其基本内容,探讨其核心目标和构建模式。在此基础上,对比我国与美国数据主权战略建设现状,发现我国数据主权战略以""网络主权""为原则、以发展为核心诉求、以国家权力机关为核心主体、自上而下多级建设等特征。同时,借鉴CLOUD法案,从宏观顶层设计指导、考察具体管辖方略、促进国际数据交流、协作治理网络空间等方面对我国数据主权战略体系提出了建议。"	XNZY201902005
大数据时代美国网络空间战略体系研究	盛祥:33394066|宋凯:30505496|	12	网络空间;网络安全;国家战略;安全战略体系;网络治理;	"随着当前网络信息技术水平的高速发展,网络空间战略竞争成为国家间关系最重要的内容之一,中国目前正处于战略被动地位,网络空间战略体系建设态势愈发急迫。本文将当前网络空间绝对优势国家――美国作为重点研究对象,以三大战略为基础,从战略背景、战略核心内容、战略实施措施三个角度出发,对美国的网络空间战略体系进行系统的阐述,并与我国当前的网络空间战略进行对比。分析发现,美国已形成较为完善的网络空间战略体系,中国可考虑在借鉴的基础上进行创新,从战略规划、技术研发、安全体系、国际合作四个方面出发,构建中国特色的网络空间战略体系。"	XNZY201902006
网络研究中的数据伦理问题研究进展	陈一:30571375|	8	网络研究;数据伦理;隐私;知情同意;数据安全;	"互联网的发展改变了传统的研究模式,越来越多的人以互联网为中介开展研究,而其中个人隐私泄露、数据安全等伦理问题也日益凸显。本研究考察了目前网络研究中数据伦理问题的研究进展,归纳了网络研究的内涵及特点,梳理了网络研究中存在的典型伦理问题,总结了网络研究中数据伦理的治理方式。"	XNZY201902007
社交媒体信息过载、功能过载与用户焦虑情绪的关系:一项实验研究	刘鲁川:26184466|张冰倩:38211407|李旭:09643221|	11	社交媒体;信息过载;功能过载;用户焦虑;实验研究;	"本文探究社交媒体的信息过载、功能过载与用户焦虑情绪之间的关系,弥补信息系统持续使用理论的不足。借鉴临床医学中常用的焦虑情绪测评量表,设计了4个用户心理实验,分析信息过载及功能过载层面的四种社交媒体外部特性与用户焦虑水平之间的关系。研究发现用户在使用社交媒体的过程中,感知到信息冗余与虚假信息时用户的焦虑水平显著升高。而系统功能因素对于社交媒体用户焦虑情绪的影响并没有信息因素那样显著。研究对全面理解社交媒体用户的焦虑情绪具有理论意义,对用户心理疏导及干预具有指导意义。"	XNZY201902008
面子对社会化媒体用户网络口碑传播的影响	赖胜强:26123422|郑显涛:29165688|张旭辉:08191722|	8	面子;社会化媒体;口碑;口碑传播意愿;网络口碑;	"网络口碑传播是消费者对产品、服务所做的评论,口碑具有双向性。过去西方学者研究认为人们更倾向于传播负向口碑而非正向口碑。由于东西方文化差异,在中国面子是人际交往中表现出的一种普遍心理,为了塑造良好的自我形象,中国人往往会做面子功夫。研究通过实证探讨了面子心理对社会化媒体用户网络口碑传播的影响。为了得面子,社会化媒体用户更愿意向朋友传播正向口碑,因怕丢面子不愿意传播负向口碑,并且在谈论高端品牌和初次传播时面子影响大,谈论低端品牌和口碑再传播时面子影响不大。"	XNZY201902009
近10年国外SNS用户自我披露行为研究述评	黄程松:36694891|王雪:09010877|	9	社交网站;自我披露;成本―收益;隐私计算;计划行为理论;人格特质;依恋理论;	"对近10年国外SNS用户自我披露研究进行综述,借助Web of Science平台检索、筛选得到47篇相关文献。根据已有成熟标准梳理、分析其所采用的主要理论及影响因素,归纳出当前SNS用户自我披露研究中常用的8种理论,重点介绍隐私计算、计划行为理论、人格特质和依恋理论,并从自我披露的收益、成本及成本减轻因素和用户自身与社会影响因素两方面对检验的各种影响因素进行分析和讨论。"	XNZY201902010
