顾客感知价值、满意度与忠诚度的关系研究――电子商务环境下的实证分析	刘丽:08199908|张宁:08200835|	9	顾客感知价值;顾客满意度;顾客忠诚度;感知-情感-意向理论;结构方程模型;	"文章发展了电子商务环境下客户感知价值的概念,并基于CAC理论对感知价值、满意度与忠诚度的关系进行了实证检验,深入分析了满意度作为中介变量对感知价值与客户忠诚度关系的影响。研究将顾客感知价值分为功能性价值、情感性价值、社会性价值与程序性价值。运用结构方程模型进行实证研究发现,功能性价值、情感性价值与顾客忠诚度正相关;功能性价值、情感性价值以及社会性价值与满意度正相关。顾客满意度在感知价值与忠诚度的关系中具有中介作用。程序性价值对满意度及忠诚度均没有显著影响。"	XNZY201603006
社会化商务环境下电子红包用户使用行为研究	严炜炜:14248465|王玲:08989103|	8	社会化商务;电子红包;使用行为;影响因素;	"社会化商务环境下,移动支付服务提供商开发了电子红包应用以开拓用户市场并丰富用户基于社会化关系的电子支付体验,探究电子红包的使用行为对提升电子红包服务质量与深化移动支付业务社会化应用场景具有重要意义。本文在UTAUT模型的基础上结合电子红包产品特征,提出了电子红包使用行为影响因素模型,并利用结构方程模型方法,揭示电子红包使用行为的影响因素及各影响因素之间的关系。结果显示,电子红包的使用情境、努力期望、社会影响和心理满足显著影响电子红包的使用行为意向,而使用行为意向与促成因素进一步影响其实际使用行为。"	XNZY201603007
电子支付网站效率的DEA启发式评估分析	张敏:09036350|霍朝光:32572914|吴郁松:32572913|	11	数据包络分析;启发式算法;电子支付;效率评估;	"为探究电子支付网站运营效率的影响因素,本文构建了多投入/多产出的效率评估指标体系,采用基于DEA/启发式的混合算法对我国主流的16家电子支付网站展开实证研究。结果表明,现有电子支付网站仅形成支付宝和易宝支付2个两个生产前沿面,其余网站均存在不同程度的APS、DOC、FLP、TO投入冗余和DPV、DIP产出不足的问题,并结合生产前沿面进行了非DEA有效电子支付网站改进空间分析。"	XNZY201603008
基于文献计量的综合性国立科研机构科研产出研究	慕慧鸽:33047993;33252426|张军:15161058|马廷灿:10567586|	8	国立科研机构;科研产出;文献计量学;期刊论文;	"利用2008~2013年SCI数据,从论文整体产出规模、国际合作参与程度、论文的质量及学术影响力四个方面比较分析了中国科学院、法国国家科研中心、德国马克斯・普朗克科学促进学会的科研产出状况,以期为中国科学院的宏观管理和政策制定提供参考价值。研究结果发现:与国外同类国立科研机构相比,近年来中国科学院的论文产出规模增长迅速,但在论文质量和影响力以及国际合作研究的参与度三个方面仍存在明显差距。"	XNZY201603009
国内心血管疾病期刊论文文献计量分析	吕小萍:08441440|石晓敬:29096001|王晓洁:08433558|	6	心血管疾病;文献计量;共词聚类分析;研究热点;	"本文选择中国学术期刊网络出版总库作为数据源,对近5年主题词为""心血管疾病""的期刊论文进行检索。利用书目共现分析系统对数据进行统计,提取高频关键词,生成关键词共现矩阵,通过统计软件SPSS19.0的聚类分析,深入研究近五年来心血管疾病研究的热点以及研究现状,以期为广大有关心血管疾病研究学者、临床工作者提供参考。"	XNZY201603010
网络群体性事件的预警系统及应对措施	钱钰:35503725|	9	网络群体性事件;舆情预警;情报;应急决策;预警系统;	"网络群体性事件的预警及处理是新时代条件下要面对的一个重要挑战。为了能在网络群体性事件发生时作出有效预警和完善处置,本文构建了一个网络群体性事件预警及应急处理系统框架,建立适应该处置系统的网络群体性事件的评级标准,并对网络群体性事件的处置策略提出一些建议。"	XNZY201603011
我国数字资源长期保存的瓶颈与归因	聂云霞:10558749|徐滢:11515380|	8	数字资源;长期保存;瓶颈;影响因素;	"经过近20年的发展,目前我国数字资源长期保存的实践仍处于起步阶段,其步伐落后于我国经济社会的发展进程。随着数字资源国家战略地位的日益凸显,深入分析影响我国数字资源长期保存的相关因素就显得十分必要且紧迫。本文从政治、经济、科技、文化等角度,全面探析了我国数字资源长期保存的制约因素,旨在为切实推进其发展进程提供参考。"	XNZY201603012
电网企业数据资源增值利用的障碍认知研究	陈传夫:09002383|王甜甜:26832170|张扬:09016138|	7	电网企业;数据资源;信息增值利用;增值利用障碍;认知研究;	"企业数据资源蕴含重要的决策价值。本文对电网企业采集与加工的数据资源增值利用现状进行了调查,分析总结其增值利用的障碍。研究表明目前电网企业数据资源增值利用的障碍主要来自于机构内部的政策方面。其次,无论在机构内外,政策和文化影响密切相关。"	XNZY201603013
专题・健康信息行为研究	邓胜利:10132783|	1		"&lt;正&gt;根据2010年中国科学技术协会发布的《中国公民科学素养调查报告》显示,82.7%的公众对医学与健康信息最感兴趣;然而根据卫生部发布的《2013年中国居民健康素养水平调查报告》显示,我国居民中具备健康素养的总体水平仅为18.16%,公众日益增长的健康信息需求与其健康信息素养严重不足形成了强烈的反差。互联网环境下,网络健康信息良莠不齐,这对用户的健康"	XNZY201603014
专题・健康信息行为研究	邓胜利:10132783|	1		"&lt;正&gt;当前,建设""健康中国""上升为国家战略,人们健康意识日益增强。随着健康信息需求的不断增长,用户健康信息的获取途径日益多样化。随着互联网与智能手机的迅速发展和普及,相关移动应用与网络社区研究已逐渐成为信息科学领域新的研究热点,特别是在公众对个人健康关注持续升温的前提下,健康信息行为的研究成为重要的前沿课题。本期所刊发的四篇专题论文便是健康信息行为专项研究的一部分。《用户群体特征差异对健康信息搜寻行为的影响研究》一文通过问卷调查,利用统计分析方法,对具有不同群体特征差异用"	XNZY201604001
用户群体特征差异对健康信息搜寻行为的影响研究	邓胜利:10132783|付少雄:35503722|	7	健康信息搜寻;群体特征差异;健康信息用户;影响;	"本文通过网络问卷收集了341位用户的数据,利用相关统计方法,对具有不同群体特征差异用户的健康信息搜寻行为进行分析,探讨用户群体特征差异对不同媒介下健康信息搜寻的影响,以期改善国内健康信息服务,为用户提供有针对性的健康信息支持。"	XNZY201604002
学术型健康社区科研协同交互行为绩效分析――以丁香园为例	严炜炜:14248465|刘倩:10757161|周知:31863500|林鑫:35681380|	8	学术型健康社区;科研协同;交互行为;绩效;丁香园;	"为探究科研协同交互行为在学术型健康社区中的表现,推进学术型健康社区科研活动的持续、有效开展,本文以丁香园为例,对社区内用户间科研协同交互行为整体开展情况,及协同交互效率和效果进行调研分析。结果显示,丁香园社区具有良好的专业性,其中科研协同交互行为较容易引发,且普遍得到了快速、有效的回复;用户协同交互内容与主题的相关性表现最为突出,帖子交互的权威性、完整性、易读性和简洁性亦有良好保障,但丰富性有待提升和完善;分享类帖子的协同交互效率和效果整体上均要优于提问类帖子。"	XNZY201604003
基于社会化问答平台的用户健康信息行为研究综述	赵海平:33022055|邓胜利:10132783|	9	在线问答平台;健康信息行为;研究综述;用户行为研究;	"社会化问答服务逐渐成为人们搜寻健康信息和寻求社会支持的主要途径。本文采用数据库检索和追溯检索两种方法,搜集近年来国外学者关于社会化问答平台用户健康信息行为的文章并进行系统性综述,对文献的研究主题从健康信息质量评价、健康信息分享行为、健康信息搜寻行为、健康信息需求、健康信息使用行为以及用户特征等六个方面进行归类分析,希望综述结果可以为我国学者开展相关研究提供依据和指引。"	XNZY201604004
国外健康类APP评价研究综述	仝晶晶:36155798|邓胜利:10132783|	13	健康类APP;评价标准;评价方法;综述;软件评价;	"随着智能手机的快速发展,越来越多的用户使用手机APP管理健康信息。本文以""健康类APP的评价""为主要研究对象,对国外与健康类APP评价相关的文章进行收集、整理和分析。从评价标准、评价方法、评价结果三个主要方面对健康类APP的评价进行研究。总结并归纳了健康类APP的评价标准和指标,为健康类APP的评估与选择提供参考。最后指出了未来研究的方向。"	XNZY201604005
企业知识化大变革时代管理咨询理论的演进与展望――基于WOS的文献计量分析	朱蓓琳:36155799|侯经川:24923223|	16	管理咨询;文献计量;理论演进;	"从19世纪末20世纪初开始陆续出现管理咨询相关概念和设立相关公司至今,管理咨询学科领域已经发展了一个多世纪。它基于管理学理论基础不断发展,并且在大数据的时代背景下开始逐步成熟,能够帮助企业实行知识化大变革。本文运用成熟的文献计量分析软件对Web of Science上与管理咨询相关的文献进行了计量分析,梳理了理论发展推演进程,并对未来趋势进行展望。管理咨询理论发展正处于回归宏观概念深化阶段,新概念的兴起为其不断注入新鲜的血液,并在不断促使咨询行为改善的同时推动企业知识化变革的进展。"	XNZY201604006
中外企业知识分享模式研究――基于MAKE获奖企业的分析	张晓娟:09016101|秦洁:36155800|孙成:24490573|	9	知识分享;企业知识管理;MAKE奖;	"本文首先通过对2010年以来MAKE获奖数据的分析,对比全球企业在Global MAKE(全球MAKE大奖)和China MAKE(中国MAKE大奖)中的表现,并对两个奖项的评选指标进行数据分析,选择""组织知识分享""这一近年来国外企业知识管理的关注热点作为研究对象,从MAKE获奖企业名单中选取青岛啤酒和斯伦贝谢作为企业知识分享的国内外优秀案例,对企业知识分享的原因、发展过程、模型及措施等进行系统的对比分析,以期为我国企业知识管理与创新提供借鉴。"	XNZY201604007
面向应急管理的仿真模型构建过程评述	李纲:08984698|柳明飞:36155806|叶光辉:30514478|	9	突发事件;应急管理;仿真模型;	"模拟仿真分析是描述、解释突发事件形成机理,提升人类应对突发事件决策能力的重要方法。为政府及相关部门仿真分析提供可实施的模式,本文从概念设计、系统设计和应用设计三个层面,依次综述了面向突发事件的仿真模型构建过程。概念设计说明了情景从描述、构建到演化的整个过程;系统设计对比了现有的仿真分析方法与平台,描述了仿真建模与评估过程;应用设计分别论述仿真模型在三类突发事件中的应用状况。最后指出当前仿真分析过程中存在的挑战。"	XNZY201604008
面向泛在学习的嵌入式推荐服务研究	曾子明:10140198|秦思琪:36155807|	9	泛在学习;嵌入式;推荐服务;智慧图书馆;	"将资源推荐服务动态无缝地嵌入到用户的学习过程、以用户为中心提供智慧型服务是智慧图书馆建设的一个重要内容。本文通过分析泛在学习环境下的用户需求和嵌入式推荐服务的相关研究,阐释了面向泛在学习的嵌入式推荐服务的含义和特点,研究了面向泛在学习的嵌入式推荐服务模式,并探讨了该服务模式的要素构成、体系结构和保障机制,旨在为用户提供全面、互联、泛在的嵌入式推荐服务。"	XNZY201604009
国内社会化标注研究的知识图谱分析	邰杨芳:36155808;23678242|陈新国:08863480|	8	社会标注;网络信息组织;知识图谱;研究热点;	"社会标注作为当前web2.0环境下一种重要的网络信息资源的组织方式,受到情报学研究领域学者们的广泛关注,国内相关的研究也越来越多。本文运用了社会网络分析法、共词聚类分析法和词频分析法对现有相关研究文献进行分析,揭示该领域的科学研究结构,重点分析该领域的科研合作团体及其研究主题、当前研究热点及未来研究趋势,旨在促进领域内科研合作与交流、提供社会标注领域的未来研究方向。"	XNZY201604010
虚拟社区用户持续知识共享意愿影响因素实证研究――以知识贡献和知识搜寻为视角	李力:08984793|	10	虚拟社区;持续知识共享;知识贡献;知识搜寻;结构方程模型;	"用户持续知识共享是虚拟社区保持活力的本质所在。知识贡献和知识搜寻是构成知识共享的两个基本构成,二者紧密联系、缺一不可。从知识贡献和知识搜寻的视角出发,本文构建虚拟社区用户持续知识共享意愿的影响因素的理论模型,采用问卷调查法、并运用偏最小二乘结构方程模型方法对研究模型和假设进行验证。研究结果表明,用户感知知识增长、心流体验是影响用户对知识贡献和知识搜寻经历满意度的重要因素,并进而影响用户的持续知识贡献和知识搜寻意愿;出于互惠,当用户打算在社区中继续搜寻知识时,用户往往也会选择继续在社区中贡献知识。本文的研究也存在一些局限,会继续扩大调研范围,并考虑与客观数据相结合,共同揭示虚拟社区用户的行为规律。"	XNZY201604011
基于CSSCI来源期刊的我国LIS学科研究领域及其演化分析	徐晴:09033183|	8	中文社会科学引文索引;图书情报学科;研究领域;演化;共词分析;	"以1998年以来持续被CSSCI收录的图书情报学科(LIS)期刊所刊载的文献作为数据来源,运用词频分析、共词分析、聚类分析、多维尺度分析等多种研究方法,揭示我国LIS学科的主要研究领域及其演化趋势。研究发现,LIS学科在不同时间段有不同的关注点,传统的图书情报理论不断与网络环境、网络技术、大数据背景相结合,产生着具有现实意义的新主题;跨学科研究趋势明显,呈现出重视技术的研究特征,技术应用和管理创新成为热点。"	XNZY201604012
国外个人数字存档的实践经验及其启示	王新才:08989203|徐欣欣:32633447|	7	个人数字存档;国外实践经验;启示;	"个人数字存档是指对个人实践中产生的且归属于个人的、具有保存价值的原生性和再生性数字文件进行长期保存。存档主体是个人。文章从面向个人的产品和服务、探索个人如何进行数字存档的研究项目、以及图书馆、档案馆等文化机构面向公众的宣传指导三方面分析了国外的实践经验。最后,介绍了国内的实践情况,分析了国内的不足,并结合国外经验指出这些不足产生的根源,即个人动因不足和社会动因不受重视,为此,倡议图书馆、档案馆等机构积极开展面向公众的宣传指导工作。"	XNZY201604013
基于Python挖掘的大数据学术研究与人才需求的关系研究	夏火松:24609123|潘筱听:36563598|	9	大数据;CNKI;智联招聘;人才需求;	"本文以CNKI数据库收录的2006―2016年的硕博士相关论文与智联招聘网站27个热门城市硕博士学历的相关招聘信息为数据来源,分析了当前我国大数据在学界和业界的地域分布,学科(行业)分布和热点分布的现状,呈现了研究结果的可视化关系,发现了我国大数据人才需求特点与学术研究间的关系。从研究和人才需求关系的视角上弥补了关于大数据的文献计量重视学界研究分布趋势,而忽视业界人才需求的不足,其研究结果对企业和高校均有所启示。"	XNZY201701001
突发性灾难中受灾地区社交媒体用户行为研究――基于对“天津8.12爆炸”相关微博日志的内容分析和纵向分析	宗乾进:17735445|杨淑芳:36070870|谌莹:36070869|沈洪洲:32414951|	8	微博;社会化媒体;社交网络;灾难;用户行为;信息传播;	"受灾地区社交媒体用户能够提供有关灾难的第一手信息,对其行为进行研究,可以为灾难应急响应提供有针对性的策略。基于""8.12天津爆炸""后24小时天津地区用户发布的13757条有关爆炸的微博日志展开内容分析和纵向研究。主要研究发现如下:突发性灾难爆发后,受灾地社交媒体用户发布有关灾难日志的时间远快于传统媒体;受灾地社交媒体用户更倾向于宣泄情感,超过20%的内容为祈福信息;灾难爆发后的2小时内,受灾地社交媒体用户主要发布亲历灾难时的体验以及对灾难的恐惧,随后将""祈福""、""对人生的感触""等情感表达贯穿于灾难应急响应的全过程。在研究结果的基础上,提出政府机构应当在灾难爆发后为受灾地区民众提供心理干预等建议。"	XNZY201701002
面向大城市病的政府政策有效性实证研究――以“北京市摇号购车”政策为例	李纲:08984698|郭超:25755870|张新:09036463|	12	政府政策评估;大城市病;定量方法;舆情分析;北京市摇号购车;	"当前,大城市病已成为城市科学、可持续发展必须面对和解决的问题。为此,政府出台各种政策予以应对,但实施效果还有待进一步观察和评估。适用于大城市病政策的定量评估模型将有利于深入解读政策效果,为政策后续调整提供参考建议。基于已有相关研究成果,综合目标达成模型和用户导向模型的特点,同时借鉴情报学网络舆情分析思路,本文提出一种定量与定性、客观与主观相结合的综合评估模型,并以""北京市摇号购车""政策为例进行实证分析。结果显示该政策客观有效但民众满意度低,并就这种矛盾背后的原因给出分析。模型的合理性和可行性得到验证,将为相关部门进一步优化和完善政策提供新的思路。"	XNZY201701003
我国文化产业信息服务平台现状及特色分析	方婧:34423235;#|邓胜利:10132783|陆伟:09006361;#|	8	文化产业;信息服务平台;网站建设;	"随着我国文化产业的不断发展,各层次、各类型的文化产业信息服务平台不断建成。本文运用网络调研法以我国67个文化产业信息服务平台为研究对象,分别从网站建设模式、网站功能、资源建设情况及网站特色四个方面入手,对各类平台的发展现状进行了调研。针对我国文化产业信息服务平台的现状,总结出各类平台的优势特色与不足,并与国外相关平台进行了对比分析,提出相关改善建议。"	XNZY201701004
我国P2P网络借贷平台信息服务改进策略研究――基于20家知名平台的实证分析	张敏:09036350|李胡蓉:34943710|阳小水:34943711|	8	P2P网络借贷;信息服务;运营效率;网站测评;数据包络分析;	"科学评价P2P网络借贷平台运营绩效,并在此基础上改进信息服务策略对全面促进P2P网络借贷平台的健康发展具有重要意义。基于P2P网络借贷平台的特征分析,从多输入、多输出的角度选用包括网站内容、链接量及网站影响力等在内的10项指标构建了绩效评价体系。实证研究部分,采用数据包络分析中的BCC模型对我国20家知名P2P网络借贷平台的运营绩效展开测评。数据分析结果表明:20家研究样本中仅有13家DEA有效,其余7家非DEA有效;平台的运营效率与其内容架构、链接量和影响力均有较大相关性,加强内容建设和加大推广力度会对P2P网络借贷平台运营效率的提高和用户持续关注度的全面提升起到积极作用。"	XNZY201701005
基于信息采纳理论的在线商品评论有用性影响因素研究	吴江:10138517|刘弯弯:36563599|	9	评论有用性;信息采纳;在线评论;评论信息量;	"在线商品评论存在质量参差不齐、信息过载的问题,因而帮助用户找出对其有用的评论有助于用户做出购物决策。本文以信息采纳理论为基础,构建评论有用性影响因素模型。研究结果表明,消费者感知评论有用性受评论信息相关性、客观性、及时性影响。评论中蕴含的有效信息量越多,评论有用性越高;中间评分评论相比于极端评分评论更有用;新发表的评论比早期发表的评论更有用;而评论者购买的真实性对消费者感知在线评论有用性没有影响。"	XNZY201701006
基于Sci~2工具包的国际创业研究文献引文耦合分析	许振亮:22487082|刘冬潇:34943713|刘喜美:35935944|	14	创业研究;知识图谱;Sci2工具包;文献引文耦合分析;	"以三大国际顶尖创业研究专业期刊(JBV、ETP和JSBM)为样本,利用科学学研究工具Sci 2工具包对所采集的有关创业研究的文献进行引文耦合分析,绘制国际创业研究领域的知识图谱。通过对施引文献进行聚类分析,对该领域不同时间段的代表作者、重要文献及其主要研究主题进行梳理,深入解读国际创业研究文献引文耦合图谱的特点,总结国际创业研究的发展态势。"	XNZY201701007
基于USPTO的锂电池专利引用状况分析	赵蓉英:10141193|全薇:34374464|	9	USPTO;专利引用;专利计量;锂电池;专利;	"锂电池不仅广泛应用于手机、计算机、照相机等各种电子产品,新能源汽车的发展也依赖锂电池技术的提升。为了探究美国锂电池技术的发展状况、技术分布、锂电池技术与科学研究之间的关系,为我国锂电池产品在美国市场竞争提供参考,本研究利用专利引文分析的相关方法与指标,对美国专利商标局(USPTO)数据库中锂电池专利的引用状况进行了宏观统计和微观分析,发现锂电池技术分布不均衡,韩国、美国和日本拥有的锂电池专利数量远高于其他国家和地区;关键技术主要掌握在三星集团、日本三洋电器股份有限公司等少数企业。"	XNZY201701008
基于H指数的校园微博影响力评价研究	安璐:09010272|陈思菁:36563600|	10	H指数;校园微博;微博影响力;信息计量学;	"本文尝试将信息计量学领域中的H指数扩展应用于微博影响力评价中,解决目前以转发数、评论数、平均转发数等单一数据作为评价指标所存在的缺陷,进一步完善基于H指数的微博影响力评价方法。以十所有代表性的校园官方微博帐号发布的微博条目以及一百条最热门微博为例,验证改进的微博影响力评价方法的有效性,并将热门微博按主题分为九个类,分析它们在主题内容上的特征。"	XNZY201701009
基于“多看阅读”的电子书定价规律数据挖掘分析	许洁:09033463|丁乐华:36563601|彭威:08986736|	8	电子书;定价规律;数据爬取;多看;	"以""多看阅读""电子书平台为例,通过网络数据爬取的方法调查了制作成本、电子书价格与相应的纸质书价格比对用户购买电子书的影响,证明成本因素对电子书价格影响不显著,电子书价格与与其对应的纸质书价格比会影响电子书销量,而且电子书定价存在一个合理区间,价格在此区间的电子书拥有较大的销量。在此基础上对电子书定价提出建议:不同主题类别的电子书应采取不同的定价,同一主题的电子书应采取分级定价,电子书定价应在合理区间。"	XNZY201701010
基于四维度模型的视频网站服务创新研究――以爱奇艺为例	袁雅倩:36563602|张斌:08992752|	9	视频网站;四维度模型;信息服务;服务创新;	"随着网络视频应用的不断深化,我国视频网站必须通过自身的战略转型和差异化服务来实现创新,进而抢占更多的市场。在激烈的行业竞争下,爱奇艺通过自身的服务创新表现突出。本文基于服务创新视角,尝试利用服务创新四维度模型对爱奇艺的服务创新模式进行初步探讨。研究表明,爱奇艺服务创新是概念创新、界面创新、组织创新和技术创新四个维度的整合。本研究对于深化服务创新理论研究和我国视频行业的服务创新实践有一定的价值。"	XNZY201701011
