关于传统图书馆管理与人力资源管理机制的思考,李玲:12466570|,2,图书馆;管理;人力资源;,"通过对传统图书馆基于有形信息载体提供而形成的业务流程与人力资源管理种种弊病的分析,强调在新的环境下,应对传统图书馆进行全面改造,而不仅仅是进行简单的功能添加。",DXTQ200203018
基于Web Services的动态联盟知识集成结构体系研究,赵柴厚:07583381|罗松江:07579147|,3,分布;数据;集成体系;,分析了动态联盟敏捷信息系统的特点及其实施过程中存在的问题;提出一个基于WebServices的解决方案。,DXTQ200203019
论图书馆硬盘阵列系统的选型,林泽明:06141681|高大志:06138238|,3,图书馆;硬盘阵列;RAID;SCSI;,"通过对大量资料的总结、分析并结合工作中的实践经验,对目前图书馆大容量存储系统的主流设备——硬盘阵列做了概括性的介绍,并从结构和性能等角度对硬盘阵列的选型做了一些探讨。",DXTQ200203020
"它山之石,可以攻玉——利用网吧管理器改制电子阅览室管理系统",陆丹晨:09007605|罗雨舟:09007602|,3,电子阅览室;图书馆;管理系统;,"介绍了利用网吧管理器改制电子阅览室管理系统的具体方法,为中小型图书馆管理电子阅览室提供良策。",DXTQ200203021
电子阅览室管理中的安全问题与对策,郑新:07974425|,2,电子阅览室;硬件安全;软件安全;环境安全;,"硬件安全、软件安全、环境安全是现代电子阅览室管理中重要的安全问题,文章从这三方面进行了探讨,并提出了相应的对策。",DXTQ200203022
论网络环境下高校图书馆信息资源的开发利用,游梦兰:06756705|,3,网络环境;高校图书馆;信息资源;,"分析论述了中国网络的发展情况以及网络环境对信息资源开发利用的影响、高校图书馆信息资源开发利用的变化及存在的问题,提出了高校图书馆信息资源开发利用的新措施。",DXTQ200203023
信息技术条件下高校图书馆馆藏变化,吴兆文:07649816|,2,信息技术;高校图书馆;馆藏;,"概略介绍了传统高校图书馆馆藏特点,并论述了信息技术的发展对图书馆的冲击,认为面对信息技术的发展,高校图书馆应改变传统的藏书模式,制定新的藏书战略。",DXTQ200203024
建立馆藏报纸书目数据库的实践,熊太纯:00399540|,2,报纸合订本;机读目录;信息检索;,"报纸目录数据库是建立在图书情报工作自动化基础之上的书目数据库,是图书情报机构开展数字化书目情报服务的内容之一。馆藏报纸书目数据库的建设与完善,将方便用户快速查询与检索报纸信息,并得以追根溯源。",DXTQ200203025
网络环境下的高校图书馆参考咨询服务模式,黄继东:09317528|王洪:10256910|,2,网络环境;图书馆;参考咨询;服务模式;,"网络环境下的高校图书馆参考咨询服务,无论在内容还是形式上与传统的手工检索时代已大相径庭。这对高校图书馆参考咨询工作的发展既是机遇也是挑战。文章对网络环境下的图书馆参考咨询工作重新定位,并探讨了现代高校图书馆参考咨询服务模式,提出参考咨询服务发展方向。",DXTQ200203026
试论高校图书购置的制度创新,关键:09367730|,3,图书经费;图书购置;制度创新;,"在图书经费有限的条件下,为最大限度地满足高校师生对图书资料的需要,其重要途径就是图书采购的制度创新。通过制度创新,引导高校师生参与图书采购工作,使所购置的图书资料更好地满足教学科研的需要,以提高图书经费的使用效益。",DXTQ200203027
谈网络环境下图书馆的参考咨询服务,王虹:07660882|,2,网络环境;图书馆;参考咨询;,"从当前现状出发,分析了在网络环境下图书馆加强参考咨询服务的必要性,并着重阐述了为加强参考咨询服务所应采取的一些措施。",DXTQ200203028
期刊变化的多样性及其管理对策,何琳:07449156|周舟:07448358|,2,期刊管理;期刊变化;对策;,"在连续出版的过程中,期刊的刊名、内容、刊期、发行方式、各种代号等都有可能发生变化,文章主要论述期刊变化的多样性及图书馆在期刊订购、著录、排架等方面的对策。",DXTQ200203029
网络环境下高校期刊人员的继续教育,王文莉:10067514|,2,网络环境;期刊人员;继续教育;,"阐述了网络环境下高校图书馆期刊工作的特点,论述了高校图书馆对期刊人员进行继续教育的必要性以及继续教育的内容和方法。",DXTQ200203030
论网络环境下高校图书馆期刊资源建设,潘杏仙:06210937|李柏林:06198577|,2,网络环境;高校图书馆;期刊;资源建设;,"文章分析了目前高校图书馆的网络及期刊资源建设的现状,就如何处理好购买电子期刊和印刷型期刊、网上资源利用和本馆馆藏开发,以及资源共享共建等几个方面提出了期刊资源建设的设想和解决措施。",DXTQ200203031
面向研究生读者的高校图书馆古籍工作,赵明:09891637|,3,高校图书馆;古籍工作;研究生读者;,"研究生教育作为教育领域中最高层次的快速发展,对高等院校办学条件提出了更高的要求,是图书馆工作不可忽视的重要一环。古籍部作为图书馆的一个服务单元,因收藏文献的特殊性,在服务程序和服务对象方面有别于图书馆其他部门。为研究生读者服务,定位要高,服务思路应围绕培养高质量有创新精神的研究生这一战略目标。",DXTQ200203032
试论图书馆随书光盘的管理与利用,王志坚:08770633|,2,图书馆;光盘;信息服务;信息资源;,"探讨随书光盘的著录、管理、服务与利用,介绍我院图书馆的作法。",DXTQ200203033
浅析科研管理中的情报信息工作,黄训端:06138122|王修玲:06142771|陈如:06142279|,2,情报信息;科研管理;,"阐释了情报信息在科研管理中的重要地位和作用,认为情报信息在科研管理中有决策参考、调控依据、评价反馈等作用,探讨了科研情报信息的获取和利用,并对在科研管理中加强科研情报信息工作进行了策略思考。",DXTQ200203034
建立高校图书馆重点读者群琐议,刘昆雄:10236352|,2,高校图书馆;重点读者;服务;,"高校图书馆建立重点读者群有益于激发读者的阅读积极性、创造性;有益于提高图书馆服务的主动性、针对性;有益于树立图书馆的形象,更好地为高校的教学、科研及人才培养服务。",DXTQ200203035
网络时代大学图书馆在高校德育教育中的作用,任琴:09508070|,2,网络时代;高校图书馆;德育教育;,"分析了社会转型期大学生的特点,介绍了当代大学生道德观念趋向,并在此基础上阐述了高校德育教育工作的必要性以及网络时代高校图书馆在德育教育中所具有的优势和重要作用。",DXTQ200203036
信息时代图书馆员的角色,罗钧:08065830|,3,信息时代;图书馆;图书馆员;,"从现代化技术手段和服务方式给图书馆带来的几点变化出发,阐述了信息时代图书馆员发展中的一些思考性问题及对策,并提出了图书馆员未来发展的方向。",DXTQ200203037
信息时代女性馆员面临的发展契机和挑战,范宇青:07472083|,2,信息时代;女性馆员;发展契机;,"信息时代,科学技术的飞速发展给女性馆员带来了发展契机,更新了观念,使得她们的信息意识、竞争意识、主体意识增强,并为她们的发展提供了优越的条件。同时,也向女性馆员提出了严峻的挑战,面对挑战,女性馆员的自身素质的提高显得尤为重要。",DXTQ200203038
文献检索课与大学生创新能力的培养,尹雪梅:07246118|,2,文献检索;创新能力;教学改革;,"从信息社会需要创新人才的角度出发,阐述了文献检索课在大学生创新能力的培养中发挥的作用,在分析文献检索教学弊端的基础上探讨了文献检索教学的课程安排、教学内容、教学方式的改革。",DXTQ200203039
古希腊图书馆探源,陶静:06139072|,3,古典时期;希腊化时期;泥版;纸草纸;羊皮纸;,"虽说有关古希腊图书馆的记载很少,但现存的古希腊文献本身可以证明希腊图书馆的存在。文章旨在通过有限的历史记载,探究古代希腊图书馆的起源、演变和发展,并对有关的图书馆作一简要概述。",DXTQ200203040
试论非法出版物流入图书馆的法律问题,王玉林:06152714|,3,非法出版物;图书馆;行政责任;刑事责任;,"非法出版物流入图书馆后 ,会对图书馆事业造成严重的影响。根据有关法律、法规的规定 ,对非法出版物流入图书馆 ,并造成不良后果负有责任的人员和单位应追究行政或刑事责任。",DXTQ200204001
发挥高校图书馆教育优势的探讨,施蓓:08649352|,2,高校图书馆;教学;素质教育;创新教育;,"论述了高校图书馆在辅助课堂教学、素质教育、创新教育中的优势 ,提出了进一步发挥这些优势的相应措施。",DXTQ200204002
浅论知识组织的原理和方法,李爱珍:06700880|,2,知识组织;原理;方法;意义;,"知识是经过浓缩加工、系统化、理论化的信息。知识组织就是知识的再加工 ,便于人们认识、学习、理解和接受 ,促进知识运用和知识创新。知识组织原理包括 :语法学原理、语议学原理和语用学原理。据此 ,知识组织的方法包括 :语法知识组织方法、语义知识组织方法和语用知识组织方法。在当今信息爆炸的时代 ,知识组织具有重要意义。",DXTQ200204003
解读《规程》,王华芳:09260615|,3,高校图书馆;规程;特点;完善;,"新的《普通高等学校图书馆规程 (修订 )》正式颁布了 ,它在1987年颁布的《规程》基础上究竟做了哪些修改 ?修改后《规程》特点鲜明的同时 ,还存在哪些需要完善的地方 ?文章试图在这些方面做些阐述。",DXTQ200204004
高校合并后图书馆面临的问题与对策思考,张正:06906170|,2,高校合并;图书馆工作;问题;对策;,"高校合并 ,是知识资源的一次重新整合。图书馆在高校合并之后 ,面临新挑战。文章就图书馆面临的馆藏结构的重新调整 ,计算机管理软件的统一和统一采购联机编目等五个问题作深入的思考 ,分析其成因 ,探讨其解决之策。",DXTQ200204005
建筑高校数字图书馆建设中的若干问题探讨,张承华:08875501|,3,数字化:自动化:图书馆建设;,"结合山东建筑工程学院图书馆数字化建设方案 ,分析了数字图书馆建设面临的问题、对策及注意的问题。提出了结构化数据的选择方法 ,提供了数字化信息平台的构建方案 ,给出了软件选择和版权利用的方法。",DXTQ200204006
提高高校图书馆知识效益的对策探讨,李翔:08031891|宋桂兰:08067369|,3,高校图书馆;知识效益;,"探讨了高校图书馆在知识时代中所扮演的角色 ,倡议高校图书馆应主动发挥其拥有的知识资源的潜能 ,开展全面知识服务 ,提高知识效益 ,这既是其职责所在 ,也是其发展方向。",DXTQ200204007
我国图书馆事业建设存在的问题及其发展对策,方宝花:00091779|,3,图书馆;事业建设;未来发展;,"文章系统论述了我国图书馆事业建设存在的问题 ,提出了我国图书馆事业发展的对策。",DXTQ200204008
高校网络化与图书馆发展,蒋高娜:09376156|董静:09370656|,2,高校;网络化;图书馆;信息服务;,"校园网络化 ,使图书馆成为校园网中最重要的部分。网络环境使图书馆的工作方式、服务方式都发生了转变 ,同时提出了创造信息服务的新途径和图书馆员的新角色。",DXTQ200204009
图书馆有偿服务的创新,李名腾:06480171|刘远航:06482572|,2,信息环境;网络营销;有偿服务;,"信息技术的发展 ,知识经济的来临 ,国家政策的支持 ,使图书馆有偿服务的信息环境得到进一步优化。创新服务形式 ,提升服务质量 ,是有偿服务发展的必由之路。",DXTQ200204010
关于我国图书馆规范化运营的几点思考,郭淑玲:06151666|张敏勤:06146505|,3,图书馆运营;规章制度;图书馆法律;规范管理;,"我国图书馆事业规范化运营迫在眉睫 ,文章从内部规章制度建设、借助相关法律规范、促进图书馆法制化建设 ,建立良好的法治环境等来规范图书馆运营进行了论述。",DXTQ200204011
试析当前高校图书馆工作中的若干问题,戴晓英:06138454|吴文武:06143697|,2,高校图书馆;管理工作;,"分析了当前我国高校图书馆工作中所面临的诸多问题 ,并提出了探讨解决问题 ,提高其管理水平及服务质量的若干措施。",DXTQ200204012
新时期教育学院图书馆的发展模式,刘莹:07389540|,3,教育学院图书馆;发展模式;,"教育学院图书馆不能单纯模仿普通高校图书馆 ,要根据自己的特点 ,选择合适的发展模式 ,要加强与中小学图书馆 (室 )的联系。",DXTQ200204013
论网络环境与高校图书馆管理,郭强:20059099|刘霖:21038538|王保生:20855464|,2,网络环境;高校图书馆;管理;,"文章阐述了当前网络发展的现状 ,认为高校图书馆的管理要跟上网络发展的步伐 ,适应在网络环境下的发展需要。",DXTQ200204014
高校合并后图书馆面临的问题及对策,夏红:06153669|,2,高校图书馆;图书馆合并;管理;资源建设;,"对高校合并图书馆的优势及存在的问题进行了分析 ,并提出了相关对策。",DXTQ200204015
浅论WTO与高校图书馆工作,白美玲:08079741|,2,高校图书馆;WTO;国际化;,"文章分析了加入WTO对高校图书馆的影响 ,指出了加入WTO给高校图书馆带来的机遇与挑战 ,探讨了迎接挑战的策略。",DXTQ200204016
新世纪高校图书馆的功能浅析,张金飞:07630284|,2,图书馆;新功能;网上服务;,"论述了新世纪高校图书馆应发挥的几项新功能 :(1)建立网络化信息服务体系 ,发挥网上服务功能。(2)深化文献信息中心功能。(3)优化馆藏 ,深化数字馆藏功能。",DXTQ200204017
元数据与网络数字资源组织管理,赵润娣:09142954|,2,元数据;DC;数字资源;数字图书馆;,"当今时代互联网飞速发展,网络信息资源急剧增加 ,对网络数字资源的组织与管理成为重要问题。解决该问题的基础是要有一套通用、合理、规范的著录格式。元数据———网络信息资源合理化、标准化的著录格式应运而生。文章介绍、分析了元数据产生的原因、概念内涵、DC元数据 ,并全面阐述了元数据在数字化图书馆中的应用。",DXTQ200204018
图书馆一卡通系统,李丽宾:07750018|,3,IC卡;智能卡;一卡通;图书馆管理;,"IC卡具有存储量大、数据保密性好、抗干扰能力强等优点 ,将其应用于图书馆管理 ,读者凭借一张卡就可享受图书馆提供的全部免费及收费服务 ,十分便捷。文章主要介绍了图书馆一卡通系统目标、系统组成、系统结构以及系统功能。",DXTQ200204019
正确认识信息资源的开发利用价值,石玫:08545258|韩喜运:08544193|,4,资源管理;信息管理;网络建设;,"文章就信息资源的开发利用对社会进步和经济发展的诸多影响 ,进行了分析研究 ,指出了网络环境下的开发利用策略 ,并就可行性做了深入探讨。",DXTQ200204020
资源共享与虚拟馆藏,徐华洋:06153577|李蓉梅:06150721|,2,文献资源建设;资源共享;虚拟馆藏;,"文章简要回顾我国文献资源共建、共知、共享的历史与现状 ,探讨网络环境下图书馆文献资源建设的数据化与虚拟化 ,着重分析了虚拟馆藏的构成与建设及目前存在的问题 ,提出了采编工作如何适应新时期的工作需要。",DXTQ200204021
试析网络环境下图书馆信息资源的合理建设,卢松苗:12128137|,2,图书馆;信息资源;现实馆藏;虚拟馆藏;,"通过对现实馆藏与虚拟馆藏的相互关系及其各组成部分的分析 ,探讨在网络环境下 ,应如何合理地建设图书馆信息资源。",DXTQ200204022
国际标准书号(ISBN)与文献采编工作,冯会勤:10187607|惠海龙:09100092|,3,国际标准书号;采编工作;,"文章分析了国际标准书号(ISBN)的特点 ,总结了ISBN在实际著录工作中的要点与注意事项 ,从图书馆文献采编工作的角度论述了ISBN的主要功能。",DXTQ200204023
图书馆技术职称评聘工作得失谈,李修波:08852634|,2,图书馆;职称;评聘工作;,"分析了我国图书馆职称评聘工作存在的一些不足 ,并针对这些问题提出了几点改革建议。",DXTQ200204024
网络环境下高校图书馆参考咨询工作的思考,刘瑞:06941597|,3,网络环境;高校图书馆;参考咨询;,"论述网络环境下加强高校图书馆参考咨询工作的重要性和必要性 ,以及网络环境下原有的参考咨询工作存在的困难 ,提出应对对策。",DXTQ200204025
我国高校图书馆部门主任工作初探,李映兵:08992388|,3,图书馆;管理;部门主任;关系;,"运用事物的联系观点 ,客观分析了当前高校图书馆部门主任所面临的内部关系 ,及由此引发的矛盾与冲突。同时初步探索解决矛盾应具备的素质及解决矛盾的对策。",DXTQ200204026
高校图书馆情报工作与学科专业教学的整合,时光新:09897640|,3,高校图书馆;情报工作;学科教学;信息集成;,"鉴于目前高校图书馆的情报服务难以满足学科专业教学对文献信息系统性、完整性更高要求的现状,本文通过对某一具体学科从教育模式设计到文献信息的选择与链接具体内容的探讨 ,阐述了高校图书馆转变办馆思想 ,将自身融合到学科专业教学的课程体系中 ,更直接地发挥教育功能。",DXTQ200204027
Internet标准信息检索,徐雄风:21594749|李玲:21296683|,4,标准;文献;信息;Internet;检索;,文章介绍一些国内外标准信息站点。从不同侧面介绍了我国的、国际的和各国或著名团体组织网站的标准信息。,DXTQ200204028
试析我国加入WTO对图书馆期刊工作的影响及对策,赵功群:08135175|,2,WTO;图书馆;期刊工作;,"中国加入WTO ,是全球经济发展的大趋势。加入WTO后 ,图书馆期刊工作作为我国文化产业的一部分 ,必然受到一定的影响。图书馆如何抓住机遇迎接挑战 ,如何让期刊工作在加入WTO后出现生机勃勃的局面 ,是一个值得关注的问题。",DXTQ200204029
新的服务方式下流通工作两大误区,黄奕红:09574199|,2,自动化管理;服务方式;服务手段;读者至上;,"就计算机管理的全开架流通服务工作中出现的两大误区进行了分析 ,强调“读者至上”的服务理念是图书馆发展的永恒目标。",DXTQ200204030
高校扩招与图书采访,陈丽春:10275950|,3,高等教育;教育改革;高校图书馆;藏书建设;,"分析了高等教育改革特别是高校扩招对高校图书馆图书采访工作的影响 ,并结合我院实际 ,提出了图书采访工作适应高校发展要求的新思路。",DXTQ200204031
高校图书馆档案的管理与利用,李云东:06879859|,2,高校图书馆;档案;管理;利用;,对高校图书馆档案工作的作用、管理和利用等方面进行了探讨。,DXTQ200204032
论档案文献编纂工作与可持续发展战略思想,杜其秀:06136039|蔡俊萍:12116636|,2,档案文献;编纂;可持续发展;信息服务与资源发展;,"从档案文献编纂与提供档案信息相结合的角度 ,提出了档案应积极服务于一个国家的政治、经济、文化等方面。论述了档案编纂与可持续发展战略之间的内在联系 ,以及档案编纂对促进人类可持续性发展的重要性。同时阐述了档案信息是一种重要的资源 ,在社会经济发展中应充分加以利用。",DXTQ200204033
高校图书馆应重视加强学生主体性培养,李银萍:08119422|,2,高校图书馆;学生主体性;图书馆员;,"揭示了学生主体性的内涵 ,阐述了高校图书馆对学生主体性培养的作用 ,提出了高校图书馆培养学生主体性的几点方法及由此对图书馆员的要求。",DXTQ200204034
"大学图书馆公关空间的有效拓展——面向新生开展公关活动,塑造图书馆形象",闻祥花:08636156|曾宏葡:09704125|黄琛:09704169|刘梦溪:08659415|,4,大学图书馆;新生读者;公共关系;形象塑造;,"论述了大学图书馆应用公共关系原理 ,面向新生读者开展公关活动的目标和实施的具体措施。",DXTQ200204035
竞争环境下图书馆读者工作的思考,翟军平:07156772|聂延平:07150208|,2,竞争;读者;读者工作;,"文章专注于竞争环境下的读者和读者工作 ,从尊重读者权益、加强读者管理、开发读者资源等方面对改革读者工作进行了研究分析。",DXTQ200204036
试论网络型电子期刊,夏明春:09454370|,3,网络;电子;期刊;,"文章对我国网络型电子期刊的概况作了简要介绍,分析了我国目前网络型电子期刊的现状 ,提出了一种新的网络型电子期刊的分类方法 ,让人们对网络型期刊有一个比较直观的了解 ,并对期刊上网到网络版期刊的特点进行了讨论。",DXTQ200204037
试论三种新形态图书馆之比较,刘景宇:12099485|,2,电子图书馆;虚拟图书馆;数字图书馆;,文章从概念、形态和功能等方面对三种新形态图书馆———电子图书馆、虚拟图书馆和数字图书馆进行了系统地分析和比较。,DXTQ200204038
中英百科全书索引之比较,宁艳梅:10154005|,4,百科全书;索引;检索;标目;,"对《中国大百科全书》与《Britannica》的索引进行了比较 ,分析了两个索引中款目结构、编排方式、检索功能的优点及不足之处 ,并指出了索引中需改进之处 ,以促进百科全书索引的理论研究和今后的编制工作。",DXTQ200204039
信息组织管理与图书馆员的新职责,黄建国:07904897|,3,信息管理;知识管理;专家系统;图书馆员;,"信息技术的迅速发展 ,给图书馆管理带来了空前的挑战 ,由传统的文献管理向知识信息管理已不可避免 ,在这一转变过程中 ,图书馆员的传统角色也将发生变化 ,基于知识信息管理的专家系统 ,正是其发展前途所在。",DXTQ200204041
面向新世纪  面向信息时代  全面加强安徽省高校图书馆建设——在全省高校图书馆工作会议上的讲话(摘要),徐根应:|,3,,,DXTQ200301000
"落实《规程》,开拓创新,建设数字化图书馆",许俊达:|,3,,,DXTQ200301001
数字图书馆与高等教育创新,田丁:09562091|,2,数字图书馆建设;高等教育创新;,"论述了高等教育创新以及面对教育创新的数字图书馆建设,总结了高等教育创新对数字图书馆信息技术人员的启示及其对策。",DXTQ200301003
基于数字图书馆构建中的复制权问题,王青:07293122|,2,数字图书馆;复制权;版权保护;,"随着信息时代的到来,版权作品在计算机网络上的传输将成为重要的作品使用方式。复制权是构建数字图书馆的主要问题,文章就此以构建数字图书馆面临的复制权问题、数字传输与侵权、数字图书馆与合理使用等方面加以阐述。",DXTQ200301004
数字化文献及其版权保护,周密:08786378|但旺:08119258|,3,数字化文献;版权保护;法律;技术;,"进入电子信息时代,数字化文献的大量涌现,给数字化文献的版权保护带来了极大的挑战,数字化文献的版权保护不仅是法律的问题,也需要计算机技术的支持,文章就以电子出版物及其版权保护的现状及其存在的问题作了一些分析和探讨。",DXTQ200301005
21世纪图书馆组织文化发展模式探讨,刘海燕:07156633|张开凤:07149236|,2,组织文化;图书馆文化;图书馆;发展模式;,阐述了图书馆组织文化现状并从三个方面对21世纪图书馆组织文化的发展模式进行了探讨。,DXTQ200301006
信息商品价格界定的理论基础,储结兵:06155085|,3,信息商品;价格界定;价格原理;,"信息产品的生产主要以脑力劳动为主,作为一种商品,在生产、交换、分配及消费等环节与物质商品有着根本性的区别。马克思的劳动价值理论在界定信息商品价格时受到了严峻的挑战。文章以政治经济学、信息学、价格学的基本原理为依据,通过对影响信息商品价格的因素的分析,提出以效用价值论作为信息商品价格界定的理论基础更具有可操作性和现实意义的观点。",DXTQ200301007
网络环境下的大学图书馆管理,张敏:07034369|,3,并键词:网络化;大学图书馆;图书馆管理;,"21世纪把我们带进了网络时代,网络技术对大学图书馆的管理产生了深刻的影响。文章力图谈谈在网络环境下大学图书馆在人性化、图书馆馆藏、信息子系统、人才资源、资源共享等方面的管理。",DXTQ200301008
顺应时代发展  完成高校图书馆的新使命,张敏勤:06151666|,4,高校图书馆;新型信息环境;图书馆使命;,"分析了新世纪高校图书馆面临的新形势,提出了新形势赋予的新使命,并对高校图书馆完成新使命的对策和措施等进行了讨论。",DXTQ200301009
知识经济时代的图书馆管理理念,韦文辉:00112344|,3,知识经济;图书馆管理;管理理念;,"知识经济时代的来临,必将使未来图书馆的管理理念发生巨大的变化,文章主要探讨了在新形势下,图书馆管理理念将出现的变革趋势。",DXTQ200301010
