高校图书馆如何应对网络论坛读者投诉,冯彦平:08226875|王碧琴:07798382|,3,高校图书馆;读者投诉;网络论坛;,"网络论坛已经成为高校图书馆读者进行咨询、表达意见的重要渠道。高校图书馆应重视网络论坛读者投诉,并制定相应的策略妥善解决读者投诉。",DXTQ200904029
应对读者需求  调整信息服务策略,贾增岁:07167365|默秀红:07162485|,4,高职图书馆;读者需求;读者服务;问卷调查;,"文章根据2007年河北政法职业学院和河北铁路职业技术学院两所学校读者问卷调查数据,分析了当前高校图书馆用户在信息需求服务上具有对图书馆依赖性强、阅读兴趣广泛,但获取信息的意识和能力有待提高等特点,提出了加强高职图书馆文献信息资源建设,做好实体和数字文献载体的管理工作,大力开展读者培训教育,强化文献信息宣传导读以及实施传统和虚拟并重的参考咨询服务模式策略。",DXTQ200904030
"纳须弥于芥子,兼实证与融通——陈允吉先生《古典文学佛教溯缘十论》",段双喜:22304234|,2,,"&lt;正&gt;《古典文学佛教溯缘十论》是一本论文集,收录陈允吉先生论述佛教与唐代诗歌关系方面的论文10篇。这些论文考辨周详,阐发深入,解决了文学上的难题,体现了作者对文学与古代文化关系的见解和独特的治学思路。它不仅是作者生平心血的结晶,也是新时期古典文学研究的奇葩。",DXTQ200904031
全球化思潮下民族精神的提升——评徐培均《中华爱国文学史》,朱丽霞:09532274|,2,,"&lt;正&gt;在全球化文化思潮日益高涨的时代,作为支撑中国民族魂的爱国精神是否还需提倡?在地球村即将出现的前夕,国人是否还需要爱国主义?这是许多学者长久深思并感到迷茫的问题。何为爱国?爱国的概念将如何界定?也是近年来学术研究的困惑和引发激烈学术争论的焦点。近日,上海社会科学院文学所徐培均先生推出的力作《中华爱国文学史》(上海社会科学院出版社2006年5月出版),对目前普遍存在的爱国主义的概念危机做出了明确解答。",DXTQ200904032
对“公共图书馆法”两线伦理的考量,王坚方:44957763|,4,好政治;图书馆伦理;立法原则;,"好政治的底蕴包含着一线伦理和二线伦理的价值维度,不仅需要对基本权利的尊重、维护与坚守的一线伦理,而且也需要对不确定事物的审慎、宽容与协调的二线伦理,两线伦理的考量丰富了对好政治底蕴的认识。2009年文化部正式启动我国""公共图书馆法""立法工作,从好政治的视角来讨论图书馆立法原则的伦理问题,无疑是开拓了法理学研究的新领域。",DXTQ200905002
面向用户需求的图书馆信息服务,王玲:10753694|,4,用户需求;信息服务;服务标准;,"在知识经济环境下,传统图书馆的服务方式将会发生新的变化。文章从用户需求的几种趋势出发,根据信息服务的特点,结合效用分析、服务管理以及部分信息经济学的理论,从用户、服务者和管理者三个角度阐释图书馆信息服务的基本内涵,提出了图书馆信息服务质量的评估体系及标准。",DXTQ200905003
基于学科馆员制度的学科知识服务研究,盛剑锋:06137388|,5,高校图书馆;学科馆员;学科馆员制度;学科知识服务;,"高校图书馆建立学科馆员制度是信息社会的必然趋势。文章通过目前国内高校图书馆实行学科馆员制度的现状分析,认为学科知识服务是学科馆员制度的核心,并提出了学科知识服务的具体内容,以及提升学科知识服务的对策措施。",DXTQ200905004
大学图书馆组织创新三题,徐玉萍:14281545|张云:07948360|,3,图书馆组织;大学图书馆;组织创新;,"文章以大学图书馆为对象,阐述组织创新在大学图书馆中的运用。首先,介绍了大学图书馆进行组织创新的动因;其次,探讨大学图书馆组织创新需要考量的因素以及面临的障碍。最后,强调了创新已经成为图书馆发展的趋势,大学图书馆应该科学求实地谋求发展。",DXTQ200905005
图书馆休闲文化建设,陆和建:23579542|赵芷涵:23579543|,4,图书馆;休闲文化;以人为本;,"文章从图书馆休闲文化的认知着手,强调了在现代环境下图书馆休闲文化的建设应该从人的角度出发,重视""以人为本"",提出了在进行图书馆休闲文化建设中应关注馆员素质、服务质量、资源布局、馆舍建设、室内布局等问题,阐明图书馆建设休闲文化的意义所在。",DXTQ200905006
重树经典阅读精神  弘扬阅读个性,任萍萍:14199524|,3,阅读;阅读个性;图书馆工作;,"阅读具有很强的时代性,同时也是件颇具个性化的事情。阅读的时代性孕育阅读个性。当今,要弘扬阅读个性,培养全民阅读意识,重树经典阅读精神。",DXTQ200905008
高校图书馆人力资源的职业生涯开发,刘君君:08884141|,3,高等学校图书馆;图书馆员;职业生涯;,"图书馆员的职业生涯可分为职业生涯初期、职业生涯中期和职业生涯后期三个阶段,图书馆领导要根据每个阶段不同特点对图书馆员进行职业生涯开发,达到图书馆与图书馆员双赢的效果。",DXTQ200905009
纳什均衡与图书馆人才流失困境,邹萍:07018247|,4,博弈论;人才流失;纳什均衡;,"面对经济、技术高速发展的今天,竞争的实质成为人才的竞争。图书馆人才的培养和流失,影响了图书馆的可持续发展。作者试从博弈的视角对之进行重新考量,通过建立、分析博弈模型,求出纳什均衡解,并以此为依据,结合具体实践探讨解决问题的途径。",DXTQ200905010
人才租赁模式下高校图书馆人才资源构建与管理,唐虹:07425676|米欣:07436831|,4,人才租赁;高校图书馆;人才资源管理;,"随着高校人事制度改革的推进,各高校图书馆在提升自己核心竞争力的同时必然要从更广的角度、更大的范围、更高的效率来配置人力资源,人才租赁用人机制正是其改革的一个亮点。文章简要介绍人才租赁的关系模型,分析了实施人才租赁模式给高校图书馆带来的影响,并提出在人才租赁模式下高校图书馆人才资源构建与管理的具体措施。",DXTQ200905011
数字环境下图书馆员信息素质培养策略研究,杨小凤:07980711|,3,高校图书馆;馆员素质;栏目建设;馆员培养;,"通过对212所高校图书馆网站的馆员信息素质学习栏目建设情况进行调查,从栏目设置、培训内容、培训方式等方面进行了分析。在此基础上,提出要从职业道德、业务素质和学术素质三方面培养高校图书馆馆员的信息素质,并强调高校图书馆馆员信息素质培养网上平台的建设策略:一是注重平台的互动性;二是提供课程资源共享;三是提供网上模拟考试系统。",DXTQ200905012
网络学术资源组织——高校图书馆建设重点学科导航系统的思考,景海燕:07747062|,3,网络资源;信息组织;学科导航;,"随着现代信息技术的迅猛发展以及网络的普遍应用,网络信息资源迅速增长且成为现代图书馆资源的重要组成部分。为解决网络信息资源的动态性强且极度分散与用户的信息需求相对集中的矛盾,建立重点学科导航系统成为各高校图书馆的普遍性选择。文章从建立重点学科导航系统的必要性、基础性工作以及应注意的问题几方面,作了初步的探讨。",DXTQ200905013
图书采购招标中的事前控制策略,葛园园:10670994|牛振恒:06155146|,3,事前控制;图书采购;采购合同;,"文章提出在图书采购招标中为提高图书馆采购的质量和效率,应对图书采购的决策进行事前控制,并总结了一些行之有效的方法。",DXTQ200905014
高职高专精品课程网络资源导航库建设刍议,伯琼:10040396|,5,高职高专;精品课程;网络资源;导航库;,"由于经费等原因高职高专购入的学术数据库资源普遍不足,而精品课程需要大量文献信息资源的支撑,只靠有限的数据库及馆藏纸质资源是无法满足课程信息资源的需求。如果能够有效地组织利用互联网的免费网络资源,针对特定有限的精品课程建立学科网络资源导航库是一个很好的资源补充途径,而且也是可行的。文章探讨了精品课程网络资源导航库建设的背景和意义,提出了具体的建设方案,以期提高高职高专图书馆的服务水平和服务内容",DXTQ200905016
对高职旅游院校图书馆构筑特色馆藏的思考,李青:23370796|,4,高职院校图书馆;旅游资源;特色馆藏;,"文章结合高职旅游院校办学现状,从高职旅游院校图书馆加快建设、提升服务功能的角度,阐明高职旅游院校图书馆依托旅游专业建设形成特色馆藏的必要性,强调树立正确馆藏理念——以满足旅游教育对馆藏特色文献的需求为宗旨。提出建设特色馆藏的一些措施:突显旅游专业特色,围绕""学科性""构筑特色馆藏;利用地方资源优势,围绕""地方性""构筑特色馆藏;完善图书馆网站,围绕""数字化""构筑特色馆藏。",DXTQ200905017
CALIS联合编目中文数据5XX字段的正确使用,王晓凡:23579544|,3,CALIS;中文编目;5xx字段;著录;,"结合工作,通过大量的实例,对CALIS联合编目中文图书5XX字段的正确使用进行阐述。",DXTQ200905018
CNMARC格式中330字段的著录,贾宇群:09155078|,3,CNMARC;330字段;内容提要;著录;,"330字段(内容提要)对读者查询所需文献和图书馆员开展专业工作有很大的帮助。文章在阐述330字段的类型和著录要求的基础上,针对不同文献的特征,介绍了在CNMARC格式中330字段的不同著录方法。",DXTQ200905019
光盘编目初探,鹿慧:43160697|,4,光盘;非书资料;著录;机读目录;,"随着光盘技术的成熟,图书馆馆藏光盘数量日益增多,对光盘的科学分编和合理利用已经成为图书馆所面临的一个重要问题。针对光盘的特点,文章根据《中国机读目录格式》的基本要求,结合工作实践,对光盘的著录规则和管理表达了一些看法和建议,提出了几种著录方法和管理模式。",DXTQ200905020
高校图书馆扩建中的绿色设计意识——以石家庄铁道学院图书馆扩建设计为例,袁丽琰:08703357|,3,高校图书馆;馆舍扩建;绿色生态;,"高校图书馆的扩建正成为一种普遍现象,文章结合石家庄铁道学院图书馆工程扩建,探讨高校现有图书馆建筑的绿色生态设计,以及新旧建筑衔接的相关问题,以期对高校老馆舍的改扩建设计提供参考。",DXTQ200905021
我国高校图书馆区域馆际互借的发展和改革,张惠君:09118990|雷震:09113839|,5,区域馆际互借;通用借书证;资源共享;,"分析目前我国高校图书馆区域馆际互借的几种典型模式及其特点,指出目前采用的手工操作服务模式存在的缺陷,对今后区域馆际互借的改革路向和内容进行了探讨。",DXTQ200905022
地区间高校图书馆合作数字参考咨询服务——以安徽省芜湖地区为例,李琛:06144939|郭红转:06144925|,4,高校图书馆;数字参考咨询;地区合作;,"文章对安徽省芜湖地区高校图书馆数字参考咨询服务现状进行调查和分析,认为合作是促进芜湖地区高校图书馆数字参考咨询服务发展的最好选择,提出建立协调管理机制,确立中心馆;构建合作咨询平台,采用适合的服务模式;探索合作服务项目,完善合作服务内容;制定咨询服务标准,建立质量评价体系等具体的实施策略。",DXTQ200905023
高职院校图书馆资源与服务定位辨析——以海口经济学院图书馆为例,温小明:44957318|,5,文献服务;服务定位;高职图书馆;,"文章通过对高职院校图书馆(简称高职馆)文献资源、读者服务两项要素的分析,探讨高职图书馆科学发展的定位问题,提出文献资源建设应遵循的基本原则,阐述基础服务在高职院校图书馆的重要性,用典型案例介绍开展针对性服务的一些具体思路和措施。",DXTQ200905024
服务质量与高校图书馆的发展,陈晓梅:22188688|,4,高校图书馆;服务质量;读者满意度;,"通过认知服务质量和服务质量评价的方法,分析服务质量对高校图书馆发展的重要作用,全面探讨服务质量管理,提出提高实际感知质量过程管理,控制期望质量过程管理的措施,来增加读者总体感知服务水平,提高图书馆的服务质量,促进高校图书馆的发展。",DXTQ200905025
高校图书馆电子阅览室的利用现状及发展对策,刘志芳:11388037|,3,高校图书馆;电子阅览室;电子阅览室利用;,"随着计算机网络技术的发展,高校电子阅览室的功能逐渐衰退,致使需要重新定位,并根据读者的需求提供多样化的服务,尤其要提高信息服务的深度和广度,形成自己的服务特色,才能立于不败之地。",DXTQ200905026
一本极其珍贵的文献——评抄本《新安理学先觉会言》,刘效梅:06142439|,3,安徽省图书馆;新安理学;《新安理学先觉会言》;,"自两宋以下直至清光绪下诏废止书院改设学校止,徽州设书院二百余所。明代中期王学盛行,""郡有郡会邑有邑会乃至一族一家也莫不有会"",当时很多的名家大儒在各书院承担教学,宣传学术思想,《新安理学先觉会言》就是新安理学学术活动在徽州六邑书院的集中反映,它不仅是研究新安理学发展态势的珍贵文献,而且也是有版本及考古价值。",DXTQ200905027
研治中国思想史的必备书籍——读《中国学案史》,王凤平:11286960|,4,中国思想史;《中国学案史》;求是学风;,"在中国历史编纂学漫长的演进过程中,学案体史籍在中国政治思想、学术文化方面占有极为重要的地位。陈祖武教授所著《中国学案史》无论是对中国学术思想主流的把握,还是对各个学案内容细致入微的分析考证,都提出了一系列具有创获意义的新见解,显示出卓越的识断,吸引研究者的注意,启迪人们在思想史、史学史和文献学诸方面以更多可以开拓的新领域。此外,该书表现出的尊重历史、实事求是的学风,对于今日的学风建设也有一定的影响。",DXTQ200905028
我国竞争情报研究进展的定量分析,陈淑平:14215748|,5,竞争情报;文献计量法;定量分析;,"文章统计了2000-2008年间CNKI收录的关于竞争情报研究的论文,采用文献计量方法从论文发表年代、所属学科、来源期刊、研究主题及著者情况等方面进行定量分析,揭示了我国竞争情报的研究现状、发展特点,以及存在的问题。",DXTQ200905029
阅读文化研究综述,孙颖:10874758|,3,阅读文化;网络阅读文化;视觉文化;,文章综述了我国近年来有关阅读文化研究的成果。梳理了阅读文化研究进程、阅读文化的内涵、网络阅读文化及视觉文化对阅读文化的冲击。,DXTQ200905030
省高校图工委文献资源建设专业委员会2009年学术研讨会在安庆召开,钟萍:06143413|,1,,"&lt;正&gt;2009年11月12日至14日,安徽省高校图工委文献资源建设专业委员会工作会议暨2009年学术研讨会在安庆市黄梅山庄隆重召开。此次会议由安徽大学图书馆主办,电子工程学院协办。专业委员会委员、论文作者共62人出席了会议。",DXTQ200906000
图书馆“藏”与“用”的互动效应分析,彭涌:07767200|,3,图书馆;文献建设;文献利用;,"图书馆""藏""与""用""的互动一直是图书馆人关注的焦点,也是图书馆的主要矛盾。文章从""藏""与""用""互动的矛盾性、局限性、有机性和使命性入手,对""藏""与""用""的互动效应进行分析,得到了几点有益的启示。",DXTQ200906003
科学发展观与现代图书馆制度建设,高文莉:09055604|韩璐璐:23935383|钱胜:23935384|,3,现代图书馆;制度建设;科学发展观;,"文章结合管理学理论,探讨了科学发展观对现代图书馆规章制度建设的影响。",DXTQ200906004
网络环境下图书馆与出版部门的关系探究,马静茹:22230622|刘子忠:09494262|黄坚:10318726|,3,网络环境;出版部门;图书馆;数字化;,"出版部门与图书馆的关系一向十分密切。随着网络时代的到来,图书馆和出版部门都发生了巨大的变化,新形势下共同的命运和使命使得两者更加紧密地结合在一起,两者的合作前景将更加广阔,也更加诱人。文章将探究网络环境下两者新的变化、新的关系及合作。",DXTQ200906005
"服务,图书馆永恒的主题——《图书馆服务宣言》读与思",姜陵陵:14341158|,4,《图书馆服务宣言》;图书馆服务;图书馆行业;,"《图书馆服务宣言》中所倡导的图书馆服务理念、原则、方法是图书馆界向社会的郑重承诺。文章论述了《宣言》的内涵和发布意义,并就如何贯彻落实《宣言》,做好图书馆服务工作提出了建设性意见。",DXTQ200906006
探析我国高校图书馆评估研究现状及存在的问题,刘晓波:10495711|,4,高校图书馆;图书馆评估;,"分析目前我国高校图书馆评估研究现状,对评估理论、评估指标选取、评估指标体系建立以及评估方法等研究现状进行了探讨。提出目前我国高校图书馆评估研究中存在的问题。",DXTQ200906008
“申本”工作与高校图书馆建设,张丽红:22673048|,3,申本;图书馆建设;发展策略;,"从""申本""工作的目的和程序,谈""申本""工作对图书馆建设的要求,并对""申本""后图书馆的发展策略提出几点建议。",DXTQ200906009
论高校图书馆对志愿者的培育和管理,夏国荃:07070935|,4,高校图书馆;志愿者;读者管理;,"高校图书馆,是大学生开展志愿服务的平台,是对大学生进行思想政治教育和志愿精神塑造和培养的基地。大学生志愿者在图书馆开展志愿服务所闪耀的和谐与人性的光辉,不仅有益于图书馆的和谐发展,而且会扩展到整个校园,并成为一种社会风尚。因此,高校图书馆要发挥管理育人、服务育人、文化育人的作用,重视并加强对大学生志愿服务者的培育和管理,以使更多的志愿者组织得到成长,更多的志愿精神得到传播。",DXTQ200906010
高校图书馆图书采购质量控制探讨,阮飞轮:10118156|周立:23935385|杨洋:23935386|,4,高校图书馆;图书采购;质量控制;,"加强高校图书馆图书采购质量控制,既是实现高校图书采购经费效益的最大化,满足高校师生教学和科研的迫切要求,又是提升图书馆自身形象和地位的有效途径。提高图书采购质量应建立严格规范的图书采购质量控制程序和相应的工作机制,重点加强三个环节的质量控制,即采购前期准备工作的质量控制,采购过程中图书的质量控制和图书到馆后验收图书的质量控制。",DXTQ200906011
民办高校图书馆文献资源现状调查与思考,许苗苗:23935389|刘伶俐:23935390|费业琨:23935391|,4,民办高校;高校图书馆;文献资源建设;,"文章通过问卷调查、实地考察等形式对全国具有代表性的14所民办高校图书馆文献资源进行了调查和研究,分析了民办高校图书馆文献资源建设的现状和存在的问题,提出了几点建议与整改措施。",DXTQ200906012
高校图书馆开辟教学用书循环利用服务工作,赵洪利:17486253|宫庆艳:15627495|,4,高校图书馆;教学用书;循环利用;,"高校图书馆在做好基础服务工作的同时,利用本馆人力资源和设备,开辟教学用书循环利用服务工作,使馆藏资源得到有效补充,为读者提供一个文献资源循环利用的平台,贯彻落实好发展循环经济政策,构建节约型高校图书馆。",DXTQ200906013
浙江省高校图书馆OPAC系统的现状调查与分析,赵兴官:23817588|翁畅平:17316622|,4,浙江省高校图书馆;联机公共检索目录;OPAC系统;,"OPAC是图书馆揭示馆藏的重要途径,是读者从图书馆获取信息的最基本、最直接的手段。文章从集成系统、检索策略、检索字段、检索结果的显示和输出、馆藏信息、系统友好性等6方面对浙江省20所本科高校图书馆的OPAC系统进行调查分析。总结了目前OPAC系统存在的不足,并提出相应的建议。",DXTQ200906014
信息检索课多媒体教学现状研究,夏亚云:07753147|,4,信息检索课;多媒体教学;多媒体课件;,"多媒体技术已越来越多地被运用于现代教育之中,文章分析了信息检索课多媒体教学的优势与存在的缺陷,并提出相应的措施。",DXTQ200906015
文献半衰期与普赖斯指数之间的关系研究,陈京莲:23497884|胡玮:15609180|,3,B-K方程;文献老化;文献半衰期;普赖斯指数;,"文献半衰期和普赖斯指数是用来测度文献老化速度的两个重要指标。文章从文献老化B-K方程出发,首次给出文献半衰期与普赖斯指数之间的关系式。用该关系式拟合了超导专业期刊的引文数据。计算结果表明:B-K方程的半衰期计算公式和莫蒂列夫修正式的半衰期计算公式对某些文献半衰期小于3年的学科(专业)是不适用的;新的计算引文半衰期公式所得到的结果与内插法得到的结果非常接近;并且该公式给出的半衰期范围要比B-K方程的半衰期和莫蒂列夫修正式的半衰期要大得多。因此,新的计算引文半衰期公式更具普适性。",DXTQ201001003
图书馆知识管理实现的促成因素及实践经验借鉴,生修雯:07853971|,4,知识管理;图书馆;国外知识管理;,"知识管理理论的研究成果在图书馆实际工作中的可操作性、实践性不强,原因是多方面的,终不外乎图书馆文化氛围、组织结构、资源系统、业务流程,以及技术基础等因素。立足图书馆实际情况,有必要借鉴国内外先进的知识管理实践经验,加快推进知识管理工作的实施。",DXTQ201001004
网络环境下高校图书馆信息资源建设研究回顾,黄德建:07407699|,6,高校图书馆;信息资源建设;网络环境;,"文章通过检索维普中文科技期刊全文数据库,(1999-2008年)十年间探讨、研究网络环境下高校图书馆信息资源建设的论文100余篇,通过对这些论文的阅读、整理,总结出这十年来我国高校图书馆网络环境下信息资源建设理论研究比较集中的十个问题。",DXTQ201001005
国外电子期刊管理模式对我国图书馆的启示,吴昌合:06137888|左亮亮:21833242|卢小莉:17384967|,4,电子期刊;图书馆;管理模式;,"在介绍电子期刊工作流程特点的基础上,通过研究国外电子期刊管理模式变革的实践案例,结合国内图书馆的实际情况,从重组工作流程、设置专门机构、改革图书馆岗位等几个方面,探讨我国图书馆电子期刊管理模式的建设。",DXTQ201001006
图书馆参与非物质文化遗产保护的职责与机遇,杨云芳:09454431|,4,图书馆;非物质文化遗产;文化遗产;,"非物质文化遗产作为被全世界和全人类所珍视的共同文化财富,理应受到人们的重视,社会知识服务机构尤应尽保护、传播之责。图书馆参与非物质文化遗产保护,既是其应尽的职责,也为其自身发展和工作创新带来难得的机遇。",DXTQ201001007
论大学图书馆文化环境的特色化建设,王连明:08965862|,4,大学图书馆;文化环境;优秀传统;,"文章分析和总结了大学文化环境建设现状和存在的问题,结合时事以及大学图书馆应有的功能,对建设特色化的大学图书馆文化环境的必要性进行了阐述,并对图书馆文化环境的建设方针和具体措施提出了合理化建议。",DXTQ201001008
浅析自助图书馆建设问题,齐铁臣:43106762|艾晶:43134096|,3,自助图书馆;图书馆建设;,"文章简单回顾了自助图书馆的发展历史,分析了建设自助图书馆面临的问题,并扼要给出了解决问题的途径。",DXTQ201001009
图书馆危机管理研究回顾与反思,朱翃:07762221|,4,危机;图书馆危机;危机管理;,"现代社会危机频繁发生,使危机管理成为重要的研究课题。图书馆作为社会公共服务部门之一,也需要重视危机管理。文章概述了图书馆危机管理研究的现状,理清了图书馆危机管理研究的整个发展脉络,指出其存在的有关问题,探讨了图书馆危机管理研究的发展方向。",DXTQ201001010
艺术书刊阅览室创新管理研究,钱红:11066150|,4,艺术类教学;艺术书刊阅览室;创新管理;学科服务;,"文章阐述了图书馆为艺术类专业设立艺术书刊阅览室对艺术类教学的重要性,分析浙江理工大学科艺学院图书馆设立艺术书刊阅览室管理中存在的问题,提出了创新艺术书刊阅览室管理须从制度建立、队伍建设、服务模式、深入调研等方面着手进行改革。",DXTQ201001011
