基于微信公众平台的数字参考咨询模式研究,尚奋宇:33675078|,6,高校图书馆;微信公众平台;数字参考咨询;参考咨询;个性化推送;,"文章分析了目前微信发展现状和高校图书馆数字参考咨询服务的现状,阐释了基于微信公众平台的数字参考咨询服务的可行性和必要性,设计了基于知识管理的微信平台数字参考咨询服务模式。该模式主要由咨询者、咨询专家、管理者、知识库几部分组成,以微信公众平台为前端,实现了咨询的智能答复与信息的个性化主动推送功能。",DXTQ201504015
从文献请求传递数据中科学挖掘读者需求,朱克亮:06154379|王一兵:06155635|汤雪唯:24154828|吴攀:06155645|陈巧莲:21806115|,4,知识发现平台;数字资源采购;需求分析;文献传递日志;数据挖掘;,"文章提出以读者在区域资源共享平台中请求文献传递的日志记录为基础,辅以页面信息采集程序,再将数据整理及统计分析,科学地获得读者真实需求,为采购数字资源提供科学的数据支撑。",DXTQ201504016
基于案例的高校图书馆服务创新分类研究,韦彤:00483755|,6,高校图书馆;图书馆服务;服务创新案例;,"通过对高校图书馆服务创新成功案例的分析,结合图书馆服务的特点和理论界关于服务创新的分类研究思路,致力于将高校图书馆服务创新的多样性和异质性形成一定次序的分类,并用实践中的创新案例加以证实。分类作为服务创新范式建立的基础,其确立有助于方法论的建立,对高校图书馆服务创新研究的深化和拓展有着深远的意义。",DXTQ201504017
服务接触对图书馆服务质量的影响实证,邓国勇:28668460|张正慧:10605855|,5,图书馆服务;服务接触;读者感知;服务质量测评;,"图书馆服务接触是读者感知图书馆服务质量的基础。论文从图书馆服务接触视角入手,对服务环境、服务人员、服务方式建立观测量表,并在问卷调查的基础上,通过交叉分析、相关性分析、回归分析等方法,分析了用户的部分个体特征、服务接触相关因素对用户感知服务质量的影响。",DXTQ201504018
图书馆历史文献展览活动刍议——写在抗战胜利70周年之际,刘安东:25004145|王兆辉:24346014|,4,图书馆;历史文献;展览活动;,"历史文献展览活动,是通过历史文献集中、艺术的展示进行文化信息交流的形式。文章指出目前图书馆历史文献展览存在展览活动数量多、品牌知名度较差,主题撞车现象多、特色影响力度低,内容形式一边倒、文化内涵挖掘少等问题,并就图书馆历史文献展览前景进行思考。",DXTQ201504019
图书馆阅读推广亟待研究的若干问题及思考,单元诚:27085726|,4,图书馆;阅读推广;阅读推广模型;读者服务;,"信息化、数字化的不断发展使人们的阅读行为发生改变。图书馆作为阅读的重要阵地,应不断努力,让书籍阅读回到人们的生活中。阅读推广是目前较活跃的一种方式,目的在于增强人们对书籍阅读的情感。但就目前的推广效果而言,尚存在一些亟待改进的不足之处。基于此,论文阐述了现代阅读现状,分析了目前推广活动存在的问题,并在此基础上就推广活动的构建要点展开研究,旨在优化推广方式,提升图书馆阅读推广的有效性。",DXTQ201504020
国外知识可视化研究的现状与启示——基于Citespace和Vosviewer的知识图谱分析,陈萱:28515967|黄春娟:08051885|,7,知识可视化;文献计量;知识图谱分析;知识服务;知识可视化心理认知;,"文章旨在探索国外知识可视化的研究现状,为国内研究提供参考借鉴。采用文献计量和知识图谱分析方法,通过Citespace和Pajek工具对WOS平台收录的外文相关文献进行分析。结果显示国外知识可视化研究涉及多个学科的理论与方法,形成了三个研究维度:技术实现维度、心理认知维度、知识管理维度;产生了四大研究前沿:知识库与知识服务平台的构建、知识可视化在教学中的应用、知识可视化的心理认知机制、知识管理与决策支持。可以预见,知识可视化在图书情报领域有广阔的应用前景,国内应加强知识可视化的心理认知机制研究。",DXTQ201504021
泛在知识环境下机构知识库服务的发展策略探析,郎庆华:08247858|孙丽波:26854998|,5,泛在知识环境;机构知识库;服务;,"文章通过分析泛在知识环境给机构知识库带来的挑战和机遇,分析其服务现状,提出发展策略。",DXTQ201504022
基于万方学位论文数据库统计的图书馆学硕博士学位论文主题分布统计与分析,丁洋:15523202|张雪梅:07007525|,7,图书馆学;学位论文;主题分布;,"文章以万方学位论文数据库中所收录的1991—2012年的图书馆学硕博士学位论文为研究样本,根据课题研究中所制定的""新时期图书馆学研究主题类目表"",以题名为切入点,结合摘要等信息对每篇论文的研究主题进行分析、归纳和总结,从而得出图书馆学硕博士学位论文研究主题的发展脉络、分布状态和关注热点,以期从一个方面反映图书馆学学科研究主题的分布特征和演变趋势。",DXTQ201504023
近十年南京地区高校图书馆科研产出的计量分析,陈万超:23694728|夏莹:24794358|,5,高校图书馆;科研产出;文献计量学;南京;,"文章运用文献计量学方法对南京地区高校图书馆2004-2013年发表的学术论文进行计量分析,选取发文总量、核心期刊发文量、核心期刊发文率以及基金论文量四项指标建立科研产出评价体系,得出南京地区高校图书馆的科研产出排名,从而揭示出南京地区25所本科院校图书馆的科学研究现状。",DXTQ201504024
理工科学生信息素养指标体系构建及教学改革研究,林建:24131670|,6,理工院校;信息素养标准;文献检索课;信息素养教育;教学改革;,"作者在对华南理工大学理工科学生信息素养水平进行调研的基础上,参考国内外信息素养评价标准,提出适合理工科院校的信息素养标准体系,并以该标准作指导,期以推动改革《信息检索与利用》课程、改善教学效果。",DXTQ201504025
《四库全书总目提要》校误二十则,贾中华:11278427|李坚怀:06151180|,8,《四库全书》;《四库全书总目提要》;文献学;目录学;古代目录学;传统目录学;校勘订误;,"编纂于清乾隆时期的《四库全书总目提要》,辨章学术,考镜源流,煌煌二百卷,是我国传统目录学的集大成之作,一向为研治传统学问者视作治学门径。然因其规模宏大,书成众手,错漏之处难免,前辈学者已多有订正。作者据平日翻检研读过程所见进行若干疏误辨正。",DXTQ201504026
从文献服务到文化建构:论图书馆既是职业也是事业,傅荣贤:10665667|李满花:10553821|王宏义:07282387|,6,图书馆;文献服务;文化建构;职业定位;事业定位;,"图书馆定位的职业取向和事业取向,分别对应于文献服务和文化建构,体现了图书馆存在的两种状态和二重境界,决定了图书馆对自身应有价值和内在动力的不同判断与要求,也影响到图书馆学研究的目标指向和方法系统的确立与选择。职业定位以文献服务为聚焦,充斥着功利竞逐。以文化为对象、以人为目标的图书馆既是一种职业,更是一种事业,责任重于事功应成为图书馆的精神勖勉。",DXTQ201505002
大数据时代高校图书馆核心用户服务策略研究,田宁:17389039|,5,大数据;核心用户;用户服务;用户需求;信息服务;服务策略;高校图书馆;,"核心用户是高校图书馆重要的服务对象。大数据时代高校图书馆的核心用户对图书馆服务提出了更高的要求。文章在分析大数据时代高校核心用户面临的问题和信息需求的基础上,提出大数据时代高校核心用户的服务策略。",DXTQ201505003
新环境下高校学科知识服务创新研究,王伟赟:08978376|,6,学科知识;知识服务;高等学校;学科服务;共享空间;用户需求;,"随着信息化、网络化的日益发展,高校身处的环境也在急剧变化。新的技术环境、资源环境和用户环境促使高校开展学科知识服务的方法与手段不断更新,高校既要坚守传统的学科知识服务方式,又要积极学习与利用新的知识服务技术与知识服务方式。文章提出从学科知识服务的整合化、泛在化、嵌入式、自助化、个性化、共享空间化等方面入手,创新高校学科知识服务,以期更好地满足高校用户的学科知识需求。",DXTQ201505004
图书馆员在MOOCs中的作为分析,田甜:24057517|,4,图书馆;图书馆员;MOOCs;慕课;学科服务;,"文章探讨了图书馆员对MOOCs发展的助力作用:加入MOOCs课程团队,为其提供材料支撑服务;协助老师制作多媒体课件,提供技术支持;协助解决开放版权问题;搜集开放存取期刊和网站,指导MOOCs老师和学生利用免费资源;为MOOCs学生提供在线参考咨询服务;确保残障人士对慕课相关资源的可访问性,完善MOOCs教育;帮助MOOCs学生提高信息素养;图书馆员创建MOOCs课程。图书馆员要提高自己的知识和能力,做信息时代的专家,推动MOOCs在中国的发展。",DXTQ201505005
高职高专院校图书馆协同管理评价体系的实践与探索,杨光武:08649408|郭向勇:08649090|,6,高职图书馆;协同管理;图书馆发展;图书馆建设;评价体系;,"旧的评价体系在指导高职高专院校图书馆科学发展方面存在不足,构建以《全国高职高专院校图书馆建设指南》为核心的评价体系是现实的迫切需求。新的评价体系注重引导图书馆的全面发展,可以实现持续、动态的评价并提供针对性的管理咨询,便于全国及省市管理部门监督与指导,是规范高职高专院校图书馆科学发展的有效机制。全国多省市高职高专图书馆界通过数年协同努力,对建立这一评价体系进行了卓有成效的实践探索。",DXTQ201505006
微博互动与读者信息素养能力的主动培育,隆茜:07538536|,5,微博;高校读者;信息素养;读者服务;信息素质;,"文章以华东师范大学图书馆宣传月活动为例,阐述了该馆利用微博主动培育读者信息素养能力的过程。提出图书馆利用微博有效培育读者信息素养能力的策略,并针对利用微博开展活动存在的问题提出若干建议。",DXTQ201505007
基于SPOC的高校图书馆信息服务新模式研究,公晓:33652130|田丽:07959600|,6,SPOC教育模式;高校图书馆;信息服务;信息素养;,"为使高校图书馆参与到SPOC课程的各环节,更好地发挥高校图书馆的作用,文章在简述SPOC课程特点的基础上,从课程过程和辅助支持两个方面提出高校图书馆在其中所扮演的角色、工作设想,以及提供这类服务所需具备的信息素养、信息平台、推广技术的条件,并就此总结出若干种信息服务模式。",DXTQ201505008
数字化校园建设背景下的MSNS设计与应用,赵嘉凌:09366882|,4,社交网络;移动社交;数字化校园;,"随着智能移动设备的普及以及4G网络时代的来临,人们的社交方式已经慢慢改变,移动社交开始成为生活中不可缺少的一部分。文章分析了现有公共社交网络在高校的应用现状,针对用户特征,结合实际情况,设计出面向高校用户的校园社交网络,希望以此为广大师生营造更便捷、健康的校园生活。",DXTQ201505009
自助服务模式下高校图书馆出纳台管理与服务创新——以中国矿业大学为例,党海霞:30990384|吴海侠:24809571|康宁:33652131|唐晓霞:33652132|,5,高校图书馆;自助服务;出纳台;服务创新;图书管理;,"自助服务系统的启用,使高校图书馆大厅出纳台面临着生存的挑战。变革后的出纳台实现了身份的转化,其工作重点以信息咨询和读者指导为主体,小到方位的咨询,大到数据库的查询和读者阅读指导,并兼任图书的安全管理,这不但提升了图书馆的窗口形象,还提升了图书馆的服务品质。",DXTQ201505010
高校图书馆QQ群嵌入式服务探讨,陈恩满:27323040|,5,嵌入式服务;QQ群;高校图书馆;用户服务;网络环境;,"文章以嵌入式理念为导向,通过嵌入或创建用户QQ群,如班级群、学生社团群、教师科研群及其他各种功能的读者群等,在QQ群中实现高校图书馆各种服务,包括信息发布、参考咨询、用户培训、阅读推广、学科服务等,以达到拓展高校图书馆服务空间、提高服务质量的目的,并就如何开展高校图书馆QQ群服务管理进行了探讨。",DXTQ201505011
高校图书馆科学数据信息资源管理与服务,李蓉:25232982|,4,高校图书馆;科学数据;管理与服务;开放获取;,"科学数据信息资源是一种重要的科研成果产出,也是科学研究不可或缺的重要组成部分。文章以科学数据的内涵为基础,分析了高校图书馆获取科学数据信息资源的开放途径及申请管理与服务的方法,从检索、获取管理与服务,关联、技术管理与服务,传递、存储管理与服务等方面,对高校图书馆开放获取科学数据信息资源的管理与服务进行了探讨。",DXTQ201505012
网络环境下基于反馈机理的高校图书馆采访业务优化研究,刘星星:22511520|王慧:28369854|,5,反馈控制;图书采访;微博;微信;读者决策采购;,"反馈是传播学的概念和范畴,图书馆信息服务具有大众传播的属性。文章运用信息反馈原理,从专业教师书目反馈、基于移动与网络环境的文献荐购等方面,论述了建立采访反馈机制对于文献采访中把握读者阅读兴趣和阅读行为所具有的重要意义。",DXTQ201505013
高职院校图书馆教学资源库的创建与共享——以安徽省高职教育数字文献服务中心建设为例,林莉:06145061|朱丽:31290657|胡悍东:33652133|左旦:25504991|,3,高等职业教育;教学资源库;高职高专图书馆;图书馆服务能力;,"安徽省高职教育数字文献服务中心建设的教学资源库,其目的是固化安徽省现代职业教育的教学成果,并在全省乃至全国高职院校数字图书馆平台进行共享。安徽省职业教育教学资源库建设的主要成果是以教学视频为载体,具体内容为岗位工作流程或产品工艺制作,其创新点可凝练为:职教岗位化、技能操作化、视频原创化、文化传承化、成果凝固化、资源共享化。",DXTQ201505014
高校图书馆读者投诉分析及应对策略,陈星星:27927711|,4,高校图书馆;读者投诉;图书馆服务;图书馆管理;应对策略;,"读者投诉是所有高校图书馆都会遇上的管理难题。文章选取笔者所在学校图书馆关于读者投诉的数据进行统计分析,提出了相应的管理办法和应对策略。",DXTQ201505015
高校图书馆促进阅读推广的制度建设研究,王洪波:31275498|赵莉:17138953|耿晓宁:25321668|,6,阅读推广;图书馆制度建设;图书馆管理;高校图书馆;,"高校图书馆作为全民阅读的重要保障单位,通常是以开展活动的方式进行阅读推广,但目前看来效果并不理想。文章建议高校图书馆在呼吁宏观层面尽快立法的同时,从图书馆自身的规章制度建设着手,建立健全推进阅读的长效机制。",DXTQ201505016
“Human Library”对图书馆知识服务的意义,谭翠:33283126|,3,真人图书馆;图书馆;知识服务;,"""Human Library""将""真人""作为""图书""进行借阅活动,是一种全新的图书馆知识服务理念与服务模式。文章论述了""Human Library""对图书馆知识服务的意义,具体表现在:开创性地实现了用户与""Human Book""的双向交流,创新了图书馆知识服务理念,深化了图书馆知识服务精神,拓展了图书馆知识服务内容,优化了图书馆知识服务方式,强化了图书馆知识服务功能。",DXTQ201505017
真人图书馆品牌构筑及实践探索——以济宁学院“子悦@Human library”为例,刘欣:45679457|陈琳:45671012|,6,真人图书馆;human library:living library;服务创新;服务品牌;,"文章选取部分国内具有一定品牌影响力的真人图书馆,分析其共同具有的核心要素,并结合济宁学院真人图书馆在发展和建设方面所做的实践探索与创新,提出真人图书馆品牌构筑和影响力提升的对策和建议。",DXTQ201505018
新环境下的图书馆服务变革研究——以湖北经济学院图书馆为例,刘金:10545501|,5,服务变革;图书馆;网络环境;图书馆服务;读者服务;用户服务;,"由于信息技术的发展和社会环境的变化等因素,图书馆面临着边缘化的危机。图书馆必须在服务标准、服务环境、服务模式、服务手段等方面进行变革,通过转变服务观念、提高人员素质、创新与读者的互动、加强技术与业务的融合等手段,来应对这些变革。",DXTQ201505019
安徽省文化共享工程培训的回顾与思考,侯勇:12128129|,4,文化共享工程;培训工作;安徽省;队伍建设;继续教育培训;,"文化共享工程是政府实施的一项文化惠民工程,人才队伍建设是保障该工程持续发展的重要基础。文章以安徽省分中心开展培训的经验为例,对文化共享工程培训的相关观念、体系、网络和内容,培训的组织形式、内容和取得的效果等方面进行探讨。",DXTQ201505020
高校图书馆查新人员职业倦怠现状、成因及对策——基于93位教育部查新人员的实证研究,任湘:10672797|屈正良:07432291|张柏秋:07679510|,6,高校图书馆;查新人员;职业倦怠;情绪管理;科技查新;,"通过Maslcah倦怠量表对93位教育部科技查新人员职业倦怠及情绪衰竭、成就感、人格解体分量表的调查了解可知:女性被试职业倦怠阳性检出率高于男性,中级职称和副高职称的职业倦怠阳性率均较高,分别为32.7%和34.4%,从事科技查新工作5—10年的被试职业倦怠阳性检出率最高,达到66.7%。综合分析职业倦怠的成因并从""修内在""与""强外围""两个方面缓解查新人员职业倦怠。",DXTQ201505021
基于CSSCI的高校图书馆研究知识图谱分析,孙掌印:27836472|,7,高校图书馆;CSSCI;知识图谱;学术研究;可视化分析;Citespace;,"文章根据知识图谱基本原理,运用Citespace软件对被中文社会科学引文索引(CSSCI)1998—2013年间收录的高校图书馆领域研究文献进行可视化分析,绘制出高校图书馆研究的关键词共现、文献共被引、作者共被引、期刊共被引的知识图谱,分析展示我国高校图书馆研究领域内的研究热点、知识基础、知识基础空间分布、学术代表人物、主要研究机构等,为高校图书馆研究者进一步深入研究提供借鉴。",DXTQ201505022
提升大学生信息素养能力的嵌入式教育模式实证研究,黄华美:07976471|,4,嵌入式教育;信息素养;历史学;大学生素养;高校图书馆;,"嵌入式教育是提升大学生信息素养能力的一种重要的教学方式,目前尚处于实践探索阶段。文章以历史学教育专业为框架,制定一个在具体专业教育体系下提升信息素养能力的实践方案,在此基础上,研究嵌入式教育的优势及其实践,探讨通识教育与嵌入式教育内容相结合、检索教师与专业教师相互协调以及学科馆员制度下的检索教师知识素养等问题。",DXTQ201505023
南阳市高校哲学社会科学生产力分布的文献情报学研究,左亮亮:28557527|,7,南阳市;高校;哲学社会科学;生产力分布;文献计量学;,"文章选取中国学术期刊网络出版总库为数据来源,采用传统的文献计量学方法,对河南省南阳市高校系统在2004-2013年间发表的10545篇哲学社会科学领域的科研论文进行计量统计。通过分析文献特征,了解南阳市四所高校十年来在哲学社会科学领域的科学研究状况,分别从论文年代及影响力分布、核心作者(群)、研究机构分布、期刊来源分布、研究热点分布、基金资助情况等方面,对南阳市高校的哲学社会科学生产力分布进行纵向与横向的定量研究,以期多角度、多层次、全面、客观、科学地反映该市高校系统哲学社会科学的研究态势。",DXTQ201505024
《本草备要》学术价值与版本探析,程新:|,6,汪昂;《本草备要》;版本;本草;中药学;,"《本草备要》是汪昂在《本草纲目》《本草经疏》诸书基础上删繁取要增订而成。作为一部流传甚广、影响深远的普及性本草名著,成书三百多年来,风行海内外,始终是中医入门的必读之书,至今仍为临床中药学的重要参考教材。其主要特点是既完备又精要,既实用又易用。其学术价值还体现在创新医药理论、保存古代文献、启蒙普及医药等方面。据不完全统计,该书现存1949年以前的版本215个,为历代本草著作之冠,文章即对其代表性版本作简要介绍。",DXTQ201505025
黄式三遗稿《音韵部略》流转考略,胡世文:17672630|,3,黄式三;《音韵部略》;古籍;流转;,"黄式三是晚清著名经史大家,他的遗稿《音韵部略》主要研究古韵分部问题,是其代表作之一,具有较高的收藏价值。该稿本曾被杭州丰华堂和萧山朱鼎煦收藏,最后辗转流入宁波天一阁,至今保存完好。",DXTQ201505026
信息时代档案工作应对挑战的新思路——读《社会转型期档案信息化与档案信息伦理建设研究》,曲春梅:08214667|,5,档案管理;档案信息化;档案信息伦理;国家档案资源;信息公开;,"档案信息化建设是信息时代档案工作的重要课题,《社会转型期档案信息化与档案信息伦理建设研究》一书对我国的档案信息化以及档案信息伦理建设过程中所面临的问题与挑战进行了有益的探索。文章针对书中提出的形成档案信息资源集中与自治相结合的新型管理机制、对档案开放期限和开放鉴定的重新认识和定位、对安徽省档案资源整合与管理模式改革的思考、实现档案信息伦理建设与档案信息立法同构等内容进行简要评述。",DXTQ201505027
图书馆法人治理结构中的公共关系构建,易向军:11339208|,4,公共图书馆;法人治理结构;公共关系;图书馆管理体制;图书馆法人;,"公共图书馆建立法人治理结构包括外部治理结构和内部治理结构两方面,其中由政府、社会(服务对象)、自律组织(行业协会)与图书馆之间形成的相互协调与相互制衡关系,构成了外部治理结构,也就是图书馆法人治理结构中的外部公共关系。构建法人治理结构的核心问题归根到底是要处理好公共图书馆法人与政府的关系问题,以及图书馆理事会与外部相关方的关系问题。",DXTQ201506002
图书馆服务视域下的信息弱势群体研究述评,丁明刚:06480022|,5,图书馆服务;信息弱势群体;信息服务;用户服务;,"信息弱势群体是图书馆学界和业界研究的热点。相关研究成果主要探讨了其涵义、类型、成因、社会影响及扶助措施,为图书馆服务发挥了较大的启发和借鉴作用,提升了服务质量和水平。同时,研究总体上还不够广泛和深入,对那些困扰和制约图书馆服务的重大问题的研究匮乏,具体服务策略的可操作性不强。因此,今后的研究还需加强、深化与突破。",DXTQ201506003
众包思维背后的图书馆人:存在或被替代,过言之:23108475|,4,众包;图书馆员;图情专员;众包专员;,"众包在商界开展得如火如荼,成功案例不胜枚举。自从学者将众包思维引入图书馆领域以来,已产生显著成效。然而,在以大众引导创新为本质的众包理念影响下,图书馆人职业前景更加堪忧。文章分析了众包思维对图书馆人的影响,认为在法律与制度保障图书馆人职业资格的前提下,图书馆人角色将呈现多样化的存在形式。",DXTQ201506004
试论高职院校图书馆层级活动体系的构建,覃珍:23243045|,5,高职院校图书馆;层级活动体系;读者服务;图书馆管理;,"在分析高职院校图书馆读者活动的现状及存在问题的基础上,提出建立层级读者活动体系的构想,并就如何建立图书馆层级活动体系进行阐述,以期为高职院校图书馆读者活动的科学管理提供借鉴。",DXTQ201506005
“211”高校图书馆微信公众平台自定义菜单调查及分析,曹红院:11167058|,4,高校图书馆;微信;自定义菜单;图书馆服务;微信公众平台;,"论文调查了""211""高校图书馆微信公众平台自定义菜单的基本情况及所提供的具体服务类型,发现这些高校图书馆微信自定义菜单基本涵盖了图书馆的基本服务和一些重要的、特色的服务,但服务基本类似,创新性服务较少。部分高校图书馆自定义菜单内容独特,如:重庆大学图书馆内容多样且极具特色,如二维码门禁、语音检索等;华东师范大学图书馆推出的家园国学不仅名称新颖且内容丰富。建议借助于现代化的技术对图书馆服务进行更多的尝试与创新。",DXTQ201506006
