篇名	作者	页数	关键词	摘要	filename
跨境B2C电子商务背景下文化价值观对顾客初始信任和购买动机的影响研究	颜慧:43739903|杜荣:09086803|张卫莉:11632345	14	跨境B2C电子商务; 文化价值观; 初始信任; 信任倾向; 购买动机;	"在跨境B2C电子商务背景下,不同国家的顾客在文化价值观上的差异会使其对同一平台产生不同的信任,从而影响购买动机。结合Hofstede文化维度理论和文化族群理论,本文构建了""文化价值观―信任―购买动机""模型,以远东族群和独立族群为例,探究文化价值观对顾客信任倾向的影响及其对顾客初始信任和购买动机之间关系的调节作用。结果表明:集体主义、刚性、权力距离对信任倾向有负向作用,而不确定性规避对其有正向作用;不确定性规避正向调节初始信任对购买动机的影响效果,而其他维度的调节效果并不完全显著。以上作用结果在两种族群中有显著差异。 "	XTIB201901003
降价式拍卖中消费者重复购买的影响因素研究	王星:10375181|杨波:09645997|马茜:45145482	15	降价式拍卖; 重复购买; 面板数据; 随机效应模型;	"如何促进消费者重复购买,是每个电商企业都很关注的问题。本文利用贡天下特产网""7天拍""和""15分钟拍""的大量真实拍卖数据,采用统计分析和面板数据回归结合的定量研究方法,研究降价式拍卖场景下消费者重复购买的影响因素。结果表明:拍卖形式、消费者绩效、竞拍结构三方面因素对消费者重复购买有显著影响,以此建立了消费者长期和短期重复购买率的随机效应回归模型。本文研究结论对现有拍卖研究和消费者重复购买行为研究具有理论补充和实践意义。 "	XTIB201901004
在线股票社区用户参与行为研究――基于股吧的实证分析	高娇娇:45145483|张仁杰:34082682	13	在线股票社区; 社会网络; 指数随机图模型; 发回帖行为;	"在线股票社区是股票投资者进行交流的重要渠道,他们通过发帖和回帖行为实现信息的传播,而信息的传播对投资者情绪有重要影响。本文以""股吧""论坛的""股市实战""版块为研究对象,研究了论坛用户发帖和回帖行为的特征。结果表明:用户多在股市开市期间进行发帖,且大多数用户是信息的""接收者""而非""发送者"";通过构建指数随机图模型发现互惠性在用户回帖行为中较为活跃;该回帖网络存在一定程度的小团体特征;高社会资本的用户是论坛中发回帖行为最积极的用户,他们的言论会对其他用户产生重要影响。 "	XTIB201901005
网络口碑发布平台对消费者好评意愿的影响研究――消费者自我意识的调节作用	于贞朋1:30908213|霍佳乐1:45145484|刘健西2:09790958|曾慧3:25771112|郝辽钢1:09159312	12	网络口碑发布平台; 社会交换理论; 好评奖励计划; 自我意识; 好评意愿;	"本文基于社会交换理论,探讨了在物质奖励情境下,不同网络口碑发布平台对消费者好评意愿的影响。结果表明:第一方平台比第三方平台带来更低的消费者感知社会成本、更高的感知价值和更高的好评意愿。同时,消费者自我意识在不同网络口碑发布平台对消费者反应的影响中起到调节作用。与此同时,研究结果还证实了感知社会成本是不同网络口碑发布平台对感知价值影响的中介变量;感知价值是不同网络口碑发布平台对好评意愿影响的中介变量;感知价值是感知社会成本对好评意愿的中介变量。 "	XTIB201901006
旅游网络舆情诱发机制与影响效应研究――基于雪乡宰客事件新浪微博评论的内容分析	刘嘉毅1:31761872|陈玉萍2:39681063|华丽1:26628447	13	旅游网络舆情; 雪乡; 内容分析法; 影响效应;	"以雪乡宰客事件的新浪微博评论文本为数据源,运用ROST内容挖掘系统和NLPIR平台进行内容分析,研究旅游网络舆情诱发机制及其影响效应。结果表明:旅游业主道德缺失与从业人员道德风险、旅游产品季节性等主客观因素,让当事人利益受损;制度失灵与市场失灵的认知偏见,改变了利益诉求行动的成本与收益预期,使得当事人采取利益诉求行动的激励缺失,引致调节阀失效而诱发舆情。雪乡旅游网络舆情的负面情感占比为56.21%,给雪乡带来强烈的负面形象冲击,并导致网民产生取消行程、转移旅游目的地等行动。研究结果也发现,雪乡旅游网络舆情的影响存在明显的空间溢出效应,导致东北地域污名化。 "	XTIB201901007
基于不同视觉对象结构的拟人化广告形象生动性对消费者产品态度影响研究	李伟:10576354|蒋玉石:09178689|苗苗:09161178|王钰灵:42182660	21	拟人化; 视觉对象结构; 认知流畅性; 感知信任; 心理距离;	"拟人是赋予产品具有生命体的语言、动作、思维和情绪,拟人化广告形象对消费者产品态度有重要影响。基于信息加工理论、社会临场感理论、精细加工可能性模型和S-O-R模型,通过情景实验,建立了结构方程模型,验证了拟人化广告形象生动性对消费者产品态度影响的内在机制。结果表明:拟人化广告形象生动性对消费者产品态度有正向作用;认知流畅性、感知信任和感知心理距离在拟人化广告形象生动性对消费者产品态度的影响中均起到中介作用;视觉对象结构在拟人化广告形象生动性和认知流畅性、感知信任、感知心理距离和产品态度的关系中起到调节作用。 "	XTIB201901008
新创企业知识资本与产品国际化――兼论互联网资本的调节作用	赖长青:43094501|王舒扬:38754480|吴蕊:38841957	18	新创企业; 知识资本; 互联网资本; 国际化;	"本文聚焦于新创企业的知识资本与产品国际化,并探讨互联网资本在二者关系中所扮演的角色。基于2010～2015年全球创业观察数据,研究发现:新创企业的知识资本对产品国际市场进入与产品高度国际化都具有正向影响;互联网资本对知识资本与产品高度国际化的正向关系具有负向调节作用。结果表明:对于知识资本缺乏的新创企业,在产品国际化时可考虑利用互联网资本来替代知识资本。 "	XTIB201901009
高科技初创企业融资成功关键因素分析	刘婕:45145485|余艳:27739266	15	高科技企业; 创业; 融资; 融资体系模型;	"随着技术进步,智能产业蓬勃发展,大众创业面临新的机遇,风险投资随之兴起。从投资人视角来看,某些关键因素会决定他们是否会给企业投资。本文在回顾以往创业要素模型的基础上提炼出适合于中国高科技创业企业的融资因素模型,通过对200家企业的实证分析,发现在不同阶段,高科技创业企业的某些特质会起到差异化的影响,以此构造出融资体系模型。本文的实证分析突显了高科技初创企业的创业能力,特别是技术创新力,是融资成功的第一关键要素。本文经实证分析所推演出的融资成功的阶段性要素模型将对创业者和融资者均有管理启示。 "	XTIB201901010
互联网营销领域的行为价格研究综述	"宋红娟1,2:42887125|杨强2:24065114|蒋玉石2:09178689"	28	行为价格; 信息处理; 文献计量分析; 文本挖掘;	"行为价格通过从心理学角度探索消费者对价格的反应来扩展传统的价格理论。随着这一研究领域的不断发展,本文回顾了消费者对价格信息的处理过程和消费行为的相关文献,着重分析普适性行为价格理论的同时突出了互联网时代行为价格的实证研究。以ISIWebofScience数据库为数据源,将传统文献综述和文献计量分析方法相结合,重点综述和讨论排名前20的营销期刊公开发表的有关行为价格的文献,对行为价格的研究进行概念化,确定研究主题网络,并讨论该领域多产的研究作者、研究机构和学术期刊。 "	XTIB201901011
内容简介		1	 	"<正>《信息系统学报》是我国信息系统科学研究领域的唯一专门学术出版物,被信息系统协会中国分会指定为会刊。《信息系统学报》倡导学术研究的科学精神和规范方法,鼓励对信息系统与信息管理领域中的理论和应用问题进行原创性探讨和研究,旨在发表信息系统研究领域中应用科学严谨的方法论、具有思想性与创新性的研究成果,并在国际学术 "	XTIB201901001
主编的话		1	 	"<正>本期是总《信息系统学报》第22辑,共收录8篇研究论文和1篇领域综述。此次所发表的8篇研究论文呈现了高度多样化的研究视角和方法。在跨境B2C电子商务背景下,颜慧等的论文构建了""文化价值观―信任―购买动机""模型,以远东族群和独立族群为例,探究文化价值观对顾客信任倾向的影响及其对顾客初始信任和购买动机之间关系的调节作用;在电商企业视角 "	XTIB201901002
社会化媒体中突发公共卫生事件舆情传播规律研究	丁学君:11156823|樊荣:37223354|苗蕊:26905242|王莹:06571509	14	社会化媒体; 突发公共卫生事件; 网络舆情; 社会网络分析; 信息空间模型;	"社会化媒体已经成为突发公共卫生事件舆情传播的重要渠道。因此,分析社会化媒体中突发公共卫生事件舆情传播规律,对于相关部门制定有效的舆情治理策略,具有十分重要的意义。本文以新浪微博为例,以不同类型的""关键节点""为中心所形成的舆情传播网络为研究对象,运用信息空间模型及社会网络分析方法,将节点特征与网络整体结构特征相结合,分析社会化媒体中突发公共卫生事件舆情传播规律,并进一步探究""反沉默螺旋""效应下网民情绪的演化过程,最后给出社会化媒体中突发公共卫生事件舆情治理建议。 "	XTIB201802002
基于心理防御视角的个体网络知识分享研究	李玉豪1:44331559|王刊良2:26077610	13	知识分享; 知识管理; 个体社交工具; 心理防御;	"企业内多团队背景下,员工基于个体社交工具的知识分享行为,对企业的创新和知识管理工作有着重要影响。基于心理防御视角,本文建立模型和提出相关假设,分析影响知识员工采用个体社交工具分享知识的因素。一项基于13个企业的455份问卷实证分析结果表明,知识员工个体的心理安全、归属感、自我完善、控制感、工作超负荷及角色冲突会显著影响知识员工运用个体社交工具进行的知识分享行为。本文探讨了结果的理论和实践意义。 "	XTIB201802003
项目描述的欺诈性与众筹投资意愿：基于文本分析的方法	沈倪1:44331179|王洪伟2:08965813|王伟3:07580587	10	众筹项目; 欺诈性; 文本分析; 投资意愿;	"以众筹市场为研究对象,采用文本分析与计量模型相结合的方法,检验项目描述的欺诈性对投资意愿的影响。采纳了内敛性、虚构性、分离性等指标进行文本欺诈性线索度量。采用线性和逻辑回归对数据进行分析,并实施鲁棒性检验。实验结果表明,描述项目的欺诈性线索与用户的在线投资意愿呈负相关。为此,投资者在选择项目时应当考虑项目描述暗含的欺诈信息,避免资产受损,而发起者在描述项目时也应当注意规避欺诈性的描述,以免造成误解,同时众筹平台应加强管理。 "	XTIB201802004
基于脑电技术的手机游戏用户体验评价研究	姜钧译1:37979378|郭伏1:06566732|吕伟1:36048289|王瑶1:24300644|肖扬2:40988467	15	手机游戏; 用户体验; 脑电; α; δ;	"为实现手机游戏用户体验的有效评价,利用脑电(electroencephalogram,EEG)技术记录不同用户体验水平的手机游戏引起的被试脑电活动变化,并利用所开发量表测量被试游戏体验后的主观评价。采用节律波能量值将各频段波形进行定量化分析,分析节律波能量值与主观评价的关系。实验结果表明,头皮后顶区和枕区的α节律波能量值、前部顶区和颞区的δ节律波能量值等脑电指标可以用于区分不同手机游戏的用户体验水平,EEG技术可能成为测量手机游戏用户体验水平的一种新的方法。 "	XTIB201802005
微信公众号内植入广告对用户持续使用公众号影响的研究	张光前:06508230|张席婷:40953385	14	微信公众号; 持续使用行为; 植入广告; 结构方程模型;	"本文的目的是研究社会影响、感知趣味、信息质量三类需求和广告担忧对用户公众号满意度与持续使用行为的影响。基于使用满足理论和信息系统的持续使用理论,本文建立微信公众号的持续使用模型。利用364份有效数据,发现感知趣味、社会影响对用户满意度有影响,信息质量对用户满意度没有显著影响;男性用户重视社会影响,女性用户重视感知趣味;广告担忧对满意度有影响,对持续使用行为的影响不显著;相对来说,女性用户对植入广告更加敏感。 "	XTIB201802006
在线医疗平台老年与非老年用户需求及满意度对比分析――以春雨医生为例	赵英1:09804569|李佳1:09789025|周良1:09805700|李芳菲2:44331180	14	在线医疗平台; 老年用户; 用户评价;	"我国医疗资源的有限性与医疗需求的快速增长已经导致较为严重的社会问题。随着老年人口的增加,医疗资源供需不平衡的矛盾进一步加剧。""互联网+""时代到来,在线医疗为医疗行业的供需不平衡带来了可能的解决方案。然而,当前在线医疗平台的活跃用户以非老年用户为主,老年用户参与度不高,这未能充分发挥在线医疗平台缓解医疗资源供需不平衡的作用。因此,本文在在线医疗平台广泛使用的背景之下,以春雨医生为研究对象,探索老年用户与非老年用户对在线医疗平台的需求差异及满意度差异,从而为完善在线医疗平台体系提出相关建议,以促进其在老年用户中的广泛应用,满足老年群体的医疗需求,缓解医疗资源不足的矛盾。 "	XTIB201802007
基于使用行为分析的共享单车管理优化研究	傅哲1:44331181|辛泓润2:44331182|余力1:09751886|徐冠宇3:44331183	14	共享单车; 管理优化; LSTM神经网络; 运输模型; 预测;	"近年来,共享单车作为一种典型的共享经济应用的代表,越来越受到大众的欢迎,如何基于用户的使用行为分析来对共享单车管理进行优化是未来共享单车发展的重要问题。本文以2016～2017年纽约市的Citi Bike共享单车的使用作为研究数据集,从时间和空间的维度详细分析全市各区域内共享单车的使用行为及特点;采用长短期记忆(long short-term memory,LSTM)神经网络预测分析各站点在高峰时段的共享单车存量和净流入量情况;在此基础上,针对共享单车时空的分布失衡问题,采用运筹学中的运输问题模型,研究高峰时段的调度策略,探索共享单车在各站点间调度的最小代价方案,以缓解共享单车时空分布失衡的问题。本文研究对优化共享单车管理具有一定借鉴意义。 "	XTIB201802008
基于PLSR-IBPSO的有约束组合优化问题求解方法研究――以人机交互界面设计为例	郭伏:06566732|屈庆星:29228027	14	组合优化; PLSR; 二进制粒子群算法; 约束优化; 产品设计优化;	"本文针对工程与管理领域中的有约束组合优化问题,考虑变量维数大且变量间存在多重相关性的因素,以及变量间有强约束关系的特点,建立新的符合实际问题的数学模型。运用偏最小二乘回归(partial least squares regression,PLSR)构建变量之间的回归模型,提出利用二进制粒子群算法优化变量m的n个水平,以期达到目标函数最优的要求,并依据求解问题的特殊性对该算法进行改进。制定新的初始种群产生策略,保证在可行解空间内进行寻优;引入动态惯性权重,保障算法具有更快的收敛性能;修改种群更新机制并加入判别函数,确保种群每次更新后都满足模型中的等式约束。通过算例和数值仿真分析,证实该算法是有效的,并能够得到较好的结果。 "	XTIB201802009
基于非线性特征提取和加权K最邻近元回归的预测模型	唐黎1:43104029|潘和平2:41263484|姚一永1:43070903	10	经验模态分解; PCA; K最邻近法; 特征提取; 预测;	"本文提出了一种智能的金融时间序列预测模型。该模型采用前向滚动经验模态分解(forward rolling empirical modedecomposition,FEMD)对金融时间序列进行信号分解,采用主成分分析(principalcomponentanalysis,PCA)对分解后产生的高维向量组进行降维,整个过程是一个复杂的非线性特征提取过程。再将提取的特征输入一种新的利用PCA输出的加权K最邻近法(K-nearestneighbor,KNN)进行回归预测。该模型在特征提取过程的构造和整体结构上都是具有创新性的,并提出了比简单的KNN预测更有效的改进算法。实证结果证实了该模型对中国股票指数的预测效果。 "	XTIB201802010
主编的话		1	 	"<正>本期《信息系统学报》是总第21辑,共收录9篇研究论文。这些论文呈现了高度多样化的研究视角和方法。在社会化媒体已经成为突发公共卫生事件舆情传播重要渠道的背景下,丁学君等的论文分析了社会化媒体中突发公共卫生事件舆情传播的规律,探究了""反沉默螺旋""效应下网民情绪的演化过程,提出了社会化媒体中突发公共卫生事件舆情治理建议;在组织行为的视角下,李玉豪和王刊良的论文基 "	XTIB201802001
支付宝持续使用行为形成机理：一个整合模型与实证研究	吴金南1:06147884|黄丽华2:06698133	14	网络外部性; 后悔; 习惯; 持续使用意图; 替代品吸引力;	"不同于以往文献基于期望确认理论将用户满意作为预测信息技术持续使用的关键因素,本文基于网络外部性理论、后悔理论和习惯理论,构建了一个以支付宝为研究情境的整合分析模型,用于理解移动支付用户持续使用行为的形成机理。实证结果表明,在控制替代品吸引力和用户信任影响的前提下,用户持续使用意图受到支付宝的用户规模、感知重要性和体验后悔的影响,并且这种影响是通过培养用户习惯实现的;体验后悔作为消极情绪体验可以直接降低用户持续使用意图。研究结论是对期望确认理论的补充和完善,为移动支付持续使用研究提供了新视角。 "	XTIB201801002
认知负荷视角下的中老年人数字阅读界面体验设计研究	"侯冠华1,2:35887667|宁维宁3:35887666|董华3:08959874"	12	用户体验; 认知负荷; 可用性; 数字阅读界面;	"为提升中老年人数字阅读体验,根据认知负荷与用户体验测量理论,采用正交实验设计方法,以及主观测量与眼动数据相结合的技术路线,以可用性、舒适度、阅读速度、认知负荷、眨眼率、瞳孔面积为评价指标,评价数字阅读文字设计。结果发现影响中老年人数字移动阅读的最优体验的因素重要性排序是字号、字间距和行间距。在字号是17像素,字间距加宽0.5磅,1.2倍行间距的实验条件下,获得了最优体验和较低的认知负荷,此外阅读体验的可用性与舒适性显著正相关,与认知负荷显著负相关。 "	XTIB201801003
行政区划名称变更对消费者品牌情绪的影响――基于在线用户生成内容的质性研究	张敏:09162746|蒋玉石:09178689|宋红娟:35508941	14	行政区划名称变更; 品牌情绪; 质性研究; 郫县豆瓣;	"以""郫县撤县设区引发的公众对郫县豆瓣热议事件""为研究对象,以公众在社会化媒体平台发布的内容作为数据源,共计收集11 000多条原始数据,最终有效数据923条,并遵循""开放编码―主轴编码―选择编码""的数据处理程序对这些数据进行质性分析。研究结果表明:在涉及品牌的行政区划变更条件下,消费者对""郫县豆瓣""品牌的情绪反应,可以从行为态度、主观规范和知觉行为控制三个方面得到解释。本文对于维护区域地理标志保护品牌的形象和价值提升具有重要的指导意义。 "	XTIB201801004
众包竞赛中加价延期机制是否有效？	"任延静1,2:30037547|林丽慧1:30037548"	17	开放式创新; 众包; 创新竞赛; 互联网平台;	"本文主要研究网络众包平台创新竞赛中的""加价延期""机制。通过对任务中国网站数据的实证分析,我们发现:如果任务发布者信用高、初始比赛天数短、比赛竞争激烈、受关注度高、任务难度低、已提交方案开放性高,则在""加价延期""期间会获得较多的方案数量;然而,该机制对于吸引更高水平的回答者参赛效果并不显著。本文在学术方面丰富了众包平台竞赛机制的理论研究,在实践方面对平台运营方和任务发布者制定策略有指导意义。 "	XTIB201801005
企业E-learning应用有效性的综合分析	马玲:11250004|黄忻怡:43094500|李嘉:25388259	17	企业E-learning应用; 有效性; 综合分析法; 内容分析法;	"有效性评估分析研究在企业E-learning应用领域中已有一定的积累,但企业E-learning应用是否有效,效果是否优于传统的学习模式,尚存在较大的争议。本文检索得到55篇定量研究论文,应用综合分析方法,归纳分析这些论文的企业E-learning应用有效性评估研究。将多样性的评估指标归纳为技能、知识、行为、满意度和绩效等5类指标,得出了总体上企业E-learning应用有效,但与传统学习模式相比,与预期效果还有较大距离的归纳结论,5类指标中仅技能显著更有效,其他指标的优势不显著。在归纳分析的基础上,本文还就企业E-learning应用实践策略、研究局限和未来议题做了讨论。 "	XTIB201801006
基于WOS信息检索平台的清华大学学术合作网络演变与产出研究	解峰1:08173452|赖长青1:43094501|窦天芳2:08226024|张蓓2:08243117|武小楠2:43094502	12	学术合作; 社会网络; 中国高校; 清华大学;	"近年来,我国科研机构学术合作网络不断拓展,研究该网络的演变具有学术和实践价值。本文基于Webof Science平台,以清华大学为例,使用网络分析和统计方法,研究其1981～2015年学术合作网络的演变和对产出的影响。研究发现清华在地区、机构、学者三个层次都出现了明显的学术合作网络规模增长效应,并出现了地区集群化、机构分散化、学者双融化等特征。研究还发现合作促进了论文规模增长和水平提升。本文结论对中国高校发展学术网络具有指导作用。 "	XTIB201801007
微指数、百度指数与上证综指收益率预测	陆慧玲1:37940860|魏宇2:37617320|王考考1:37940859	12	投资者情绪; 信息供求; 微指数; 百度指数; 上证综指;	"互联网数据记录了投资者的微观情绪信息和搜索关注,同时也为研究股票市场宏观运行规律提供了海量的数据基础和新的研究视角。本文利用新浪微博与百度搜索引擎两个不同类型的平台数据,分别构建了反映股票市场投资者情绪和关注的看涨指数。进一步从信息供求视角出发,结合行为金融学的相关知识,揭示其内在机理,并运用计量模型实证了微博看涨指数、百度看涨指数与上证综指收益率之间的相互影响关系。实证结果表明,微博看涨指数与百度看涨指数具有明显的领先―滞后关系;能够反映投资者情绪的微博看涨指数对下一期的上证综指收益率有显著的正向影响,而反映投资者关注的百度看涨指数却无法提供对上证综指收益率有用的预测信息。 "	XTIB201801008
信息系统领域中美科学合作的变迁	姚欣林1:43096786|张诚2:06711540	17	科学合作; 合作特征; 中美合作; 信息系统研究; 学术影响力;	"以1980～2010年信息系统领域86份主要期刊的91 751篇论文为基础,分析了中美学者在这30年间的合作特征演变,并对比了互联网技术发展前后合作特征的差异。结果表明,中国信息领域学者与美国的合作发文数量和所占比例在不断上升,并且中美合著论文的平均引证因子显著高于中国独立发表文章。中美合作类型前后15年的变化显示,信息技术的发展一方面降低了中美学者的沟通成本,使合作开展更为频繁,但同时也使我国学者和美国学者的错层合作显著增多。 "	XTIB201801009
信息系统专业审计研究与实践	穆勇1:13963096|赵莹1:24789746	10	信息系统专业审计; 研究; 实践;	"针对已建成或正在运行的大量信息系统中存在的系统与实际业务流程不匹配、数据不规范、信息共享难及系统与技术文档""两层皮""等方面的问题,首次引入了""信息系统专业审计""的概念,界定了其内涵和外延,创新性地提出了一套信息系统专业审计的定位、目标、对象、内容、依据、工具、方法、组织、策略、流程、成果及作用的体系框架,并对某市政府部门28个信息系统进行了专业审计,取得了良好效果。 "	XTIB201801010
