篇名	作者	页数	关键词	摘要	filename
大连理工大学管理科学与工程学院		1	 	"<正>为落实邓小平同志1979年春访美期间中美签署的《中美科学技术合作协定》,1980年4月中美双方正式确认在大连工学院(大连理工大学前身)成立中国工业科技管理大连培训中心,由此揭开了我国系统培训经济及企业管理干部的序幕。中国工业科技大连培训中心为我国现代教育管理的后续蓬勃发展奠定了坚实的基础,被誉为中国现代管理教育的发祥地。1980年8月,管理工程系成立。1985 "	XTIB201201015
ERP实施中关键用户的角色转变及其影响因素研究	王滢1:22410477|潘绵臻2:24661499|陆璐3:22314109|毛基业3:10374696	13	ERP实施; 关键用户; 角色转变; 组织变革认知;	"本文采用扎根理论取向的数据分析方法,通过一个探索性案例研究,揭示ERP实施中关键用户角色转变的内涵及影响这一转变的因素。主要研究发现是:ERP实施中关键用户的有效参与包括深度参与行为和高度心理投人两方面;成功实施ERP的基础条件包括关键用户良好的个人素质等四个方面;关键用户的角色转变内涵包括其在公司内地位的提升等七个方面,其角色转变受其有效参与和成功实施ERP的基础条件影响。 "	XTIB201201004
主编的话		1	 	"<正>2011年12月2―4日,国际信息系统协会中国分会(CNAIS)第四届全国大会(CNAIS2011)在上海召开。来自中国内地、中国香港和美国等国家与地区的科研院所、高校、企业的230余位专家学者参加了本届大会。大会的主题是""中国信息系统研究:新兴技术背景下的机遇与挑战"",议题包括:信息系统战略与管理、新兴技术采纳与吸收、电子商务与服务创新、社会网络与社交商务、信息产品市场 "	XTIB201201003
企业战略与知识管理战略动态演化路径案例研究	董小英1:06249108|张娜1:06272271|余艳2:27739266	9	知识管理战略; 竞争战略; 动态匹配; 共同演化;	"在动态复杂的竞争环境下,知识是企业最重要的战略资源,但究竟知识管理是如何给企业带来可持续的竞争优势依然是一个黑箱。本研究以李宁公司为案例研究对象,研究中国企业在成长过程中竞争战略与知识管理战略、知识管理能力建设之间的动态匹配与共同演化机制。本文以动态匹配演化理论为分析框架,以案例研究为核心方法,通过对李宁公司访谈等的一手资料,试图发现在过去20年中,李宁公司作为中国快速成长民营企业的典型案例,是如何通过环境的改变来调整自身的竞争战略,以及为了实现战略目标的发展,调整知识管理策略以实现对战略的支持,从而试图对中国民营企业的动态演化路径有更深入的理解。 "	XTIB201201005
基于供应链信息系统的质量改进策略研究	"程兆麟1,2:23485430|肖静华1:10173197|谢康1:10173220"	9	质量管理; 供应链信息系统; 抽样检验;	"本文运用委托-代理模型,分析抽样检验与信息系统控制对供应链质量管理的影响和作用。传统的抽样检验尽管能有效提升产品质量,控制供应商的机会主义行为,但是作为一种事后的控制,无法弥补机会成本的损失,基于供应链信息系统的质量控制能有效地补充传统抽样检验的不足,实现供应链整体收益的帕累托改进。 "	XTIB201201006
基于关系观的电子供应链IT价值形成研究	朱镇:24063974|赵晶:24063681|王菁:25902369	14	关系观; 电子供应链; 技术资产; 关系资产; 合作能力; IT价值;	"IT技术在传统供应链的应用催生了电子供应链,基于Web的信息交互和在线合作赋予了企业与合作伙伴新的商务管理机遇。从单个组织的IS单独应用拓展到多组织的联盟应用,IT价值产生的中间过程变得异常复杂,电子供应链IT价值如何形成是一个新兴的研究议题。本文根据关系观对于组织间关系租的论述,探索性地从技术资产和关系资产整合的视角研究电子供应链IT价值的形成。基于中国制造企业的调查数据,实证研究发现了电子供应链IT价值创造是由两个相互连接的推进阶段构成,技术资产和关系资产的单边整合机制以及电子供应链合作能力的价值驱动机制解释了供应链中IT投资价值的获取路径。 "	XTIB201201007
基于流量来源的网站黏性和购买转化率研究	李彤:27739541|叶强:07003655|李一军:00009369	8	电子商务; 黏性; 购买转化率; 网站流量;	"本文将电子商务访问流量按照来源分为直接访问和间接访问,从这两类访问本身以及不同类型网站这两个层面来探索访问流量来源与浏览黏性和购买转化率的关系。我们采用8万名用户在2008年1月份的网页浏览和在线购物记录进行实证分析,发现直接访客和间接访客的确拥有统计上显著不同的浏览逗留时间和购买转化率,并且进一步对不同类型的网站的访客流量和购买转化率进行了分析。研究结论为挖掘访客价值和网站制定营销策略提供了借鉴意义。 "	XTIB201201008
认知负荷视角下不同复杂度购物网站的眼动研究	"王求真1,2:09348046|曹仔科1,2:27739267|马庆国1,2:10280122"	10	网站复杂度; 任务复杂度; 认知负荷; 眼动;	"网上购物是在互联网上使用最多的应用。网站作为互联网最重要的交互界面之一,其质量对购物网站有至关重要的影响。本研究使用SMI Hi-speed眼动仪,以42名大学生为被试,记录他们浏览不同复杂度网站的眼动过程,以探讨网站复杂度和任务复杂度对用户认知负荷的影响。结果显示:网站复杂度和任务复杂度会影响用户的认知负荷,表现为用户在网站的完成任务时间、注视点数和注视时长,并且任务复杂度会调节网站复杂度对用户认知负荷的影响。 "	XTIB201201009
只逛不买的电子商务用户分析――以淘宝网为例	徐S:25121050|张盼:21642844|丁婕:17259049	12	电子商务; C2C; 用户行为;	"近年来,电子商务成为网络经济各行业中最受关注的行业。尽管电子商务网站注册用户数目巨大,但并不是每一个用户都会最后进行在线交易,很大一部分用户可能上来""闲逛""。对于这么一个巨大的潜在买家人群,了解这些用户的行为特征,并理解他们行为背后的原因成为电子商务服务商和相关研究人员关注的焦点。为了回答这些问题,本论文首先总结了以往电子商务文献的发现。接下来,我们利用淘宝网网站的实际数据,分析了只逛不买的电子商务用户行为。下一步,我们利用实地访谈的办法对闲逛用户背后的因素做出了分析与总结。最后,本文探讨了本研究的理论与实践价值。 "	XTIB201201010
中文网络评论的情感特征项选择研究	王洪伟:08965813|郑丽娟:17258329|刘仲英:00009379|霍佳震:10085688	11	网络评论; 情感分类; 特征项选择; 统计机器学习;	"本文采用统计机器学习方法,对面向情感分类的中文网络评论特征项的选择进行研究。选取词性、词性组合、N-gram作为情感文本的潜在特征项,利用文档频率法对特征项实施降维处理,采用布尔权重法构建特征向量,并采用SVM分类器进行网络评论的情感分类。最后,以手机网络评论为对象进行实验分析,并采用卡方检验测试实验结果的差异显著性。结果表明,中文网络评论的情感分类中,将形容词作为特征项可以获得较高的分类准确率和效率;选用N-gram作为特征项时,分类准确率随着阶数的增加而下降;选取训练语料和特征项的数量对分类效果也有显著影响,但并非数量越多准确率越高。 "	XTIB201201011
基于社会网络的病毒营销传播效率预测	余力:09751886|杨小平:09751479|陈明远:27739268	10	病毒营销; 网络营销; web 2.0; 传播效率; 社会商务;	"病毒营销是随着Web 2.0和社会网络发展起来的一种新型社会化网络营销模式,近年来被许多企业采用。但是,病毒营销的效果到底如何?在一定时间内,究竟会有多少客户被成功营销?本文采用概率统计分析和社会网络分析的方法,对病毒营销的传播效率进行了初步预测研究,试图回答:""假设有某病毒营销网络G（V,E）,对于给定的初始营销用户集合S0,经过一段时间t后,平均能影响的用户数Es0（t）是多少?""作者通过引入影响响应时间,先研究了简单的串联、并联影响传播网络图的传播效率情况,在此基础上研究了一般的社会网络图的病毒营销传播效率,最后用一个实例进行了展示。 "	XTIB201201012
手机银行用户满意度与忠诚度研究	林家宝1:24591271|鲁耀斌2:05970029|徐勇3:27635843	11	手机银行; 满意度; 忠诚度;	"手机银行用户采纳行为的研究比较多,但是,用户采纳手机银行后,关于用户满意度和忠诚度的研究较少。本文基于信息系统期望确认理论和关系营销的信任承诺理论,以手机银行为研究对象,构建了一个移动商务环境下的用户满意度和忠诚度模型,主要分析了确认和感知的有用性对手机银行满意度的影响,以及手机银行的满意度、信任和承诺对用户忠诚度的作用。通过问卷调查,收集了287份有效问卷,采用SPSS 18.0和PLS-Graph 3.0软件进行统计分析,实证结果表明,确认和感知的有用性正向影响用户对手机银行的满意度,满意度、信任和承诺正向影响用户对手机银行的忠诚度。最后,对手机银行的企业提出了对策建议并指出了进一步研究的方向。 "	XTIB201201013
学术动态		2	 	"<正>近期主要活动√2011年12月2―4日,信息系统协会中国分会第四届学术年会(CNAIS 2011)在上海成功召开。本届会议由信息系统协会中国分会(CNAIS)主办、同济大学承办,来自中国内地、香港 "	XTIB201201014
北京航空航天大学经济管理学院		1	 	"<正>北京航空航天大学经济管理学院起源于1956年成立的航空工程经济系,是我国理工科大学中最早成立的管理类院系之一。2007年,管理科学与工程学科被确认为国家一级学科重点学科,学科水平和建设成效全国排名第三。学院现有企业管理系、信息系统与信息管理系、管理科学与工程系、国际经济与贸易系、保险与风 "	XTIB201102014
IT基础设施、战略IT柔性能力与企业竞争优势关系研究	邹沁:27167019|田军:09116369|张海青:24453633	12	IT基础设施; 战略IT柔性能力; 企业竞争优势; 资源基础观;	"本文从基于资源的观点出发,建立了IT基础设施、战略IT柔性能力和企业竞争优势之间的概念模型,并在中国环境下进行了一次实证研究,分析结果显示该模型为企业如何从IT基础设施的角度来开发企业的战略IT柔性能力从而增强企业的竞争优势有明显的指导作用。 "	XTIB201102004
主编的话		1	 	"<正>时近2011年末,信息系统协会中国分会(CNAIS)第四届全国大会(CNAIS2011)即将于上海召开。CNAIS自成立以来,每两年举办一届全国大会,有效地推动了我国信息系统领域学术研究以及相关学科的建设与发展。此外,CNAIS还在各个年度主办了多次专题学术研讨会和培训活动,取得了良好的反响和广泛的肯定。CNAIS2011大会由同济大学承办,主题为""中国信息系统研究:新兴技 "	XTIB201102003
IT投资类型与企业盈利能力――中国上市公司的实证研究	李铧汶:27167020|郭迅华:08167780	8	信息技术; IT投资; IT价值; 企业盈利能力;	"本文从IT投资类型的角度考察信息系统建设对企业盈利能力的影响,将IT投资划分为""购买型""和""项目型""两类,考察1999―2004年沪市209家制造行业企业的IT投资情况,利用统计方法检验了两种IT投资类型其对企业盈利能力的影响。分析结果显示,不同IT投资类型对企业盈利能力的影响存在显著差异,实施""项目型""IT投资的企业,其投资当年和投资后的盈利能力均显著高于实施""购买型""IT投资的企业。 "	XTIB201102005
基于系统动力学的IS服务企业知识资本与服务能力的关系研究	陈智高:07527712|田燕:25925726|马玲:11250004	11	IS服务企业; 知识资本; 服务能力; 系统动力学;	"本文分析了IS服务企业知识资本构成和服务能力的转化过程,运用系统动力学方法描述IS服务企业知识资本与服务能力之间的因果关系,构建了系统动力学模型。设定一个可转化服务能力匮乏而试图加大人力资本开发投人来提高服务能力的IS服务企业,使用Vensim PLE软件进行系统仿真和检验。结果表明,该模型能够较好的解释知识资本与服务能力之间的因果关系,不同阶段的知识资本和服务能力变化趋势符合理论预期。在此基础上,本文给出了研究结论和有助于IS服务企业知识资本开发与服务能力提升的策略。 "	XTIB201102006
IT服务外包承接商能力识别与评价研究	何平:22129107|闵庆飞:06522345|王建军:06506699	13	IT服务外包; 承接商能力; 承接商外包流程; 评价;	"IT服务外包承接商能力研究是近年来服务外包领域学术界和产业界关注的热点问题。通过对已有研究成果的全面整理与分析,总结出IT服务外包承接商的19种能力,然后基于承接商IT服务外包流程将19种能力划分为全局能力和局部能力,并构建了IT服务外包承接商能力模型。以实证分析方法对承接商的全局能力和局部能力进行评价,结合我国IT服务外包产业发展现状对评价结果进行分析与讨论,指出承接商全局能力和局部能力中的关键能力,以期为我国IT服务外包承接企业核心能力的培养提供理论指导与实践参考。 "	XTIB201102007
多任务协调均衡下的IT外包激励机制研究	夏远强:06571189|孙艳:27167021	10	委托代理; 多任务协调; IT外包; 激励机制;	"以IT外包为背景,考虑IT外包多任务委托代理的特点,对Holmstrom和Milgrom的多任务委托代理模型进行扩展,建立了IT外包多任务目标协调均衡的激励机制模型。模型通过调节多任务的激励强度来引导IT服务商对各项任务的最优努力分配,并对激励强度与各变量之间的关系进行深入分析。论文指出由于任务之间的边际努力成本替代性存在,在激励降低IT投资成本方面需要谨慎,IT外包商必须根据各参数的变化科学地安排报酬激励在各个任务之间的分配,实现双方收益的帕累托改进。 "	XTIB201102008
网站使用中用户体验过程模型及实证研究	李皓:27167022|姜锦虎:10177788	12	用户体验; 过程模型; 网站使用; 情感;	"随着技术发展及用户需求提高,用户体验成为决定网站成功的关键因素。本文考虑到用户体验的动态性特征,从用户视角建立了网站使用中用户体验过程模型,并且以一家购物网站为例,通过结构方程模型分析进行了实证研究。研究以情绪/情感理论、认知评价理论和Stimulus-Organism-Response模型作为理论基础,关注网站实际使用过程中用户认知和情绪、情感两方面的反应。结果表明,用户体验的质量显著地影响用户再次使用意向,其中情感体验起着重要作用。 "	XTIB201102009
在线学习成效影响因素研究	李定:06565952|李晓霞:25363678|邵培基:06545515	10	在线学习; 学习成效; 影响因素;	"学习者对学习效果的疑虑是网络教育发展的最大障碍。本文研究在同步和异步学习方式并存的情况下,学习成效的影响因素及其影响程度。首先总结了在线学习成效的评价标准,并依据相关的文献建立了结构方程模型,通过实证对假设进行了检验,概括了在线学习成效的影响因素模型。 "	XTIB201102010
FD-CABOSFV区间变量高维数据聚类	武森:06331570|张文丽:27167023|黄慧敏:27167024|叶俞飞:26377415	11	CABOSFV算法; 属性组合; 模糊离散化; 区间变量;	"针对属性取值为区间变量的高维数据聚类问题,提出基于模糊离散化的CABOSFV改进算法――FD-CABOSFV。针对属性组合利用模糊C均值聚类的思想进行属性取值的离散化,并通过λ水平截取的方式确定各对象对离散化属性的归属,将其转换为二态变量后利用CABOSFV算法进行聚类。采用三组UCI基准数据集将FD-CABOSFV与著名的K-means聚类算法进行比较,实验结果表明FD-CABOSFV更有效。 "	XTIB201102011
学术动态		2	 	"<正>近期主要活动""信息管理与信息系统专业建设与课程(体系)建设研讨会""于2011年5月13―15日在北京中央财经大学举行,本次会议由教育部高等学校管理科学与工程类学科专业教学指导委员会、信息系统协会中国分会(CNAIS)和清华大学出版社主办,中央财经大学、北京信息科技大学承办,目的是研讨和推广信息系统特色专业建设的成果、交流精品课程建设和教学的经验, "	XTIB201102012
更正启事		1	 	"<正>《信息系统学报》第8辑《中国移动政务研究的现状及特征》一文中有一处错误,现更正如下:第64页,基金项目:国家自然科学基金海外合作基金(71028003)。特此说明。 "	XTIB201102013
近期主要活动		2	 	"<正>2010年5月29―31日,第九届武汉电子商务国际大会在武汉举行。本届大会由中国地质大学(武汉)电子商务国际合作中心、中国地质大学(武汉)管理学院、美国Alfred大学商学院、美国国际商务交流公司等联合主办,由国内外多个院所共同协办。信息系统协会中国分会(CNAIS)等作为支持单位。来自美国、德国、意大利、加拿大等8个国家23所高校的44位专家,以及清华大学、复旦大学、武汉大学等多所国内高校的学者参加了此次大会。第九届武汉 "	XTIB201002013
活动预告		1	 	"<正>第十届武汉电子商务国际大会将于2011年5月28-29日在武汉举行。本届大会由中国地质大学(武汉)电子商务国际合作中心、中国地质大学(武汉)管理学院、美国Alfred大学商学院、美国国际商务交流公司主办,信息系统协会中国分会、中国信息经济学会基础理论专业委员会、德国海登海姆市巴登―符腾堡州州立合作大学、美国伊利诺理工学斯图尔特商学院、华中科技大学管理学院、武汉大学商学院、武汉大学信息管理学院、武汉理工大学管理学院、《信 "	XTIB201002014
清华大学经济管理学院		2	 	"<正>正在发生迅速而深刻变化的中国呼唤着众多经济类、管理类英才。成立于1984年的清华大学经济管理学院,始终以""跻身世界一流经管学院之列,造就未来中国乃至世界范围的商业领袖,贡献学术新知,以推动民族经济的伟大复兴""为使命。历经26载的发展壮大,清华经管学院在学科水平、人才培养、科学研究和国际交流方面保持着国内领先水平,成为中国乃至亚洲地区最优秀的经济管理学院 "	XTIB201002015
基于企业能力观的企业IT应用水平研究	彭建平:10071352	10	制度能力; 控制能力; IT应用水平; 模型校验;	"本文在构建企业制度和控制能力对企业IT应用水平影响的理论模型基础上,通过调研和实证分析,检验了提出的假设理论模型,探讨了企业制度能力和控制能力要素间内在关系以及对企业IT应用水平产生影响的内在机理,分析了两种能力如何影响企业IT应用水平提升路径,从而提出了企业抓好制度和控制能力的培育和建设,是推动企业IT应用水平提升,实现企业信息化的关键所在。 "	XTIB201002004
主编的话		1	 	"<正>2009年5月30―31日,第八届武汉电子商务国际大会在武汉举行。本届大会由中国地质大学(武汉)电子商务国际合作中心、中国地质大学(武汉)管理学院、美国Alfred大学商学院等联合主办,由国内外多个院所共同协办。信息系统协会中国分会(CNAIS)等作为支持单位。本届会议包括大会主题发言和7个分会场论文宣读与交流,还举办了企业电子商务应用与高校专业人才培养论坛、研究 "	XTIB201002003
基于结构方程模型的信息系统关键成功因素和知识转移关系实证研究	饶李:21937515|陈智高:07527712	11	结构方程模型; 信息系统; 关键成功因素; 知识转移;	"本文基于理论分析,归纳出7个影响跨组织知识转移和信息系统成功的因素,提出了8条假设。使用主成分分析法,由7个因素的观测变量构造出3个因子变量,构建了描述这些因子、跨组织知识转移和信息系统成功等三类变量之间关系的结构方程模型。由此,通过实证分析,验证假设和结构方程模型,结果表明高层领导支持、项目管理、用户培训、外部支持、组织文化等5个因素对信息系统相关知识的跨组织转移存在正面的影响,知识转移因素对信息系统的成功有正向作用,并进一步得出组织与管理、跨组织知识转移是信息系统获得成功的两个最主要关键因素的结论。 "	XTIB201002005
知识转移机制的规范分析:过程、方式和治理	"左美云1,2:09647049|赵大丽2:25522544|刘雅丽1:25987800"	15	知识转移; 知识转移过程; 知识治理; 知识转移方式; 机制;	"要研究知识转移,就要研究知识转移发生的各种方式,即知识转移机制。学者们由于关注的视角不同,对知识转移机制的理解也不同,因而目前有关知识转移机制的研究显得很混乱。本文在文献分析的基础上,采用规范分析的方法建立了一个规范的知识转移机制模型。该模型将知识转移机制分为三个方面:一是知识转移的过程机制,即知识是如何一步步从一个主体转移到另一个主体的;二是知识转移的方式机制,即知识转移过程中具体采用什么样的转移方式,以及如何选择和组合这些转移方式;三是知识转移的治理机制,即知识转移过程中各步骤的事件是如何被激发或管理的。论文对知识转移的机制类型进行了清晰的梳理和规范化研究,使得不同的研究能够清晰地找到各自的位置,从而有助于知识转移研究在现有的基础上走向深入。 "	XTIB201002006
知识资产视角下电子商务企业价值评价研究	朴哲范:10276059|沈莉:09367824	9	电子商务企业; 知识资产; 资产细化; 贡献度;	"从知识资产理论、企业价值理论和企业经营机制理论出发,在Lev和Sougiannis(1996)、Feltham和Ohlson(1995)以及李鑫元(2002)等研究的基础上,导出知识资产评价模型和各资产对企业总价值的贡献程度。选取了""中国企业电子商务应用500强(2004)""中的53家上市公司为研究对象,时期是2005―2007年,并进行了实证研究。根据实证结果,技术资产对企业价值的贡献度不高;营销资产的投入加大,没能带来期待的收益和对企业价值的贡献。 "	XTIB201002007
技术接受模型研究的范式解析	赵昆:11285590	9	技术接受模型(TAM); 信息系统; 范式; 综述;	"本文应用托马斯・库恩关于科学革命的相关理论,对技术接受模型(TAM)的研究进行正反两方面的分析和思考。首先,简要介绍库恩提出的""范式""及关于科学革命的相关理论,对TAM研究的发展及现状进行必要的讨论;其次,根据范式的概念和判断标准,分析TAM研究作为一种研究范式的学科地位,并按照范式的体系架构对其理论体系进行必要的梳理;最后,针对研究中存在的主要问题作进一步思考。通过分析,有助于进一步探讨TAM研究的科学基础和理论体系,深入认识TAM研究的意义、价值及其今后的研究方向。 "	XTIB201002008
即时通讯产品的用户选择及继续使用行为研究	张千帆:07603492|汪敏:11567236	11	即时通讯; TAM; ECT; 继续使用意向; 结构方程模型;	"即时通讯市场的竞争日益激烈,对用户选择及继续使用行为的研究是制定有效的竞争策略、占有更多市场份额的必要前提。本文综合了技术接受模型(TAM)和期望确认模型(ECM),从期望差距、感知有用性、感知易用性、感知娱乐性、感知风险、感知费用、感知激励和网络外部性8个方面构建了用户选择和继续使用某种即时通讯产品的行为意向研究模型。通过问卷调查收集数据,利用统计软件SPSS对模型量表进行信度和效度分析,并采用结构方程模型的分析软件Lisrel对研究模型的假设进行了检验,最后对研究结果进行讨论,并提出了对策建议。 "	XTIB201002009
网格环境下虚拟企业信息系统中单点登录问题研究	林培旺:23240339|刘东苏:09061571|薛杰:23240338	7	网格; 安全; 虚拟企业; 单点登录;	"本文对网格环境下虚拟企业单点登录安全问题进行了分析,提出了一种基于安全断言标记语言(SAML)的单点登录模型。该模型具有与底层安全实现无关,可与现有安全系统无缝集成等特点,包括请求端、中心安全服务端和目标服务端三个主要功能模块,在设计模型工作流程时充分考虑了其安全性,并注意到网格环境下任务时长可能超出令牌生命周期的情况,给出了相应的解决办法。 "	XTIB201002010
