基于学术博客的个人知识管理研究——以科学网博客为例,郑伟伟:31361213|,4,学术博客;个人知识管理;知识组织;,"以学术博客为研究对象,从系统和用户两个角度,梳理了学术博客信息组织和用户间知识交流相关的研究。以科学网博客为例,对用户个人知识管理过程以及知识管理中的社交关系进行探讨,总结了学术博客中个人知识管理的意义。",CQTQ201404003
城市圈图书馆联盟建设框架与研究——以武汉城市圈公共图书馆为例,张汉强:10587494|姚迎东:10673242|,6,城市圈图书馆联盟;图书馆联盟;公共图书馆;,"文章就武汉城市圈图书馆联盟产生背景和形成过程,研究并探讨了图书馆联盟建设发展的现状以及取得的成绩和存在的问题。阐述了体系建设存在的问题,提出了建立城市圈图书馆联盟建设保障制度的配套措施和建议。",CQTQ201404004
"馆校结合,建立馆外流通点,推进少年儿童素质教育——以安宁市图书馆为例",杨丽萍:32336836|,3,馆校结合;馆外流通点;图书馆;,"图书馆作为少年儿童的第二课堂,倡导他们读好书、好读书,为他们提供优质的阅读服务是图书馆的职责所在。但是由于城市范围的逐渐扩大,居民住宅小区开始远离图书馆,给到馆阅读的少年儿童带来了不便;同时,受条件的限制,农村孩子的课外阅读基本成为空白。为改变这一状况,图书馆应考虑通过在区域内的中小学校建立馆外流通点,以保证少儿读者的借阅方便,让所有孩子都能享受到丰富优质的公共图书馆服务。",CQTQ201404005
借力全国宣传思想工作会议精神  推动图书馆思想宣传工作新发展,李佳根:32336837|修士博:32336838|,4,图书馆职能;思想宣传工作;,"当前习近平总书记在全国宣传思想工作会议上发表的重要讲话,进一步明确了宣传思想工作的方向目标、重点任务和基本遵循。图书馆作为社会公共服务机构,在公民获取社会信息与进行思想的交流的过程中担当着""载体""与""中介""的角色。本文就图书馆应该如何利用自身特点加强与推进当前思想宣传工作进行了讨论。",CQTQ201404006
老子的和谐观对高校图书馆人本管理的启示,黄洪基:10275801|,5,老子;和谐观;高校图书馆;人本管理;,"老子的和谐观对于消解矛盾,实现和谐,有着重要的借鉴意义。以老子的和谐观作为出发点,探讨老子思想与高校图书馆人本管理的关系及影响,提出""以人为本""的高校图书馆人本管理模式。",CQTQ201404007
公共图书馆服务性人才建设,郑强:26742270|,3,公共图书馆;人才建设;,"文章阐述了公共图书馆人才队伍建设重要意义,讨论了公共图书馆服务性人才建设面临的问题以及公共图书馆的服务性人才应具备的特点,提出了从政策环境、人才管理、人才培养与吸收等方面建立人才建设保障机制的思路。",CQTQ201404008
互联网资源在图书馆中的具体应用,胡红:21638164|周易君:32346400|,3,公共图书馆;互联网;资源共享;,"本文阐述了互联网资源的基本概况,主要互联网资源工具在公共图书馆中的应用,利用互联网资源满足读者个性化需求及主动推送服务,通过VPN技术实现图书馆网络互联,达到资源共享,共同探讨图书馆的自动化、网络化、数字化建设。",CQTQ201404009
城乡图书馆资源一体化建设的分析与思考,吴兵文:16785774|,3,城乡图书馆;公共图书馆;资源共享;,"本文通过分析城乡图书馆资源一体化建设的内涵,阐述了实现城乡文化信息资源共享在城乡文化协调发展,实现社会主义文化大发展大繁荣、促进社会和谐中的重要意义和作用。提出了城乡统一规划、市级图书馆指导、提供流动服务车等措施,促进城乡图书馆资源一体化建设。",CQTQ201404010
浅析高职院校的读者服务工作,王燕:27753123|刘智慧:27753124|,4,高职院校;图书馆;读者服务;,"文章阐述了高职馆读者服务工作的重要性以及读者服务工作的现状,指出了高职院校读者服务工作的意义和目的,从开展网上借阅、导读咨询、网络宣传、专题讲座、技能培训服务,以及强化馆员内涵素质、规范规章制度等七个方面,结合本馆的服务工作实践,论述了改变服务工作现状的方法。",CQTQ201404011
图书馆多元化服务与核心竞争力,杨若冰:|,3,图书馆;多元化服务;核心竞争力;,"图书馆的多元化服务,是指和文献信息服务相关但又不同于传统服务形式的服务,大力开展图书馆多元化服务,不仅是学习型社会视域下公共图书馆应当担负起的社会职责,也是在市场竞争日趋激烈和国家投入不足的情况下,提高其核心竞争力的有效途径。本文对图书馆多元化服务与核心竞争力进行了详细探讨,以期提高我国公共图书馆的服务水平。",CQTQ201404012
RFID引发的图书馆服务及管理模式的改变研究,伍力:24266059|,3,RFID;图书馆服务;管理;,"RFID依托于当前快速发展的电子信息技术和集成电路技术,以其无需直接接触、无需光学可视、无需人工干预即可完成信息输入和处理,且操作方便快捷的特点,受到信息技术界人士的极大推崇。本文通过分析RFID在图书馆领域的应用,分析其对图书馆服务及管理模式的改变及其存在的不足。",CQTQ201404013
高校图书馆如何通过RFID实现智能图书馆——以重庆理工大学中山图书馆为例,胡钦文:22447719|,3,RFID技术;高校图书馆;RFID智能图书馆;RFID管理系统;,"文章主要阐述重庆理工大学中山图书馆以新馆建成为契机,全面引入RFID技术。对实施RFID技术的工作流程进行详细的说明,并分析整理使用RFID后本馆遇到的技术问题。根据这些问题作出了RFID技术运用的理性思考,并给出高校图书馆推广普及需要解决的建议。",CQTQ201404014
浅谈公共图书馆的数字图书馆建设,邓玉兰:13879072|胡涛:28984575|胡红:21638164|,3,公共图书馆;数字化;建设;,"本文简述了数字图书馆的概念,通过区县图书馆工作实践,探讨了公共图书馆数字化建设的保障机制、业务流程管理以及提高信息服务能力的措施。",CQTQ201404015
免费开放时代公共图书馆延伸服务的实践与思考,华娜:32336839|,3,免费开放;公共图书馆;延伸服务;,"本文立足于南岸区图书馆延伸服务的实践经验,从延伸服务内容、服务时间、服务空间及服务群体方面,分析了公共图书馆如何有效开展延伸服务,对存在的问题和解决对策进行了思考,期望公共图书馆服务的广度和深度得以提升。",CQTQ201404016
论“本事·纪事”类著述的体例,李成晴:31233664|,6,《本事诗》;《唐诗纪事》;著述体例;,"《本事诗》《唐诗纪事》以及其后的一系列仿效的著作,形成了一类著述的体例。倘对其著作体式进行分析比较,可以厘清涉及到的正名、体式、源流、通变等相关问题。",CQTQ201404017
来自国外的秘书监:晁衡,晁霞:25034903|,4,晁衡;遣唐使;秘书监;文化交流;,"晁衡(日名阿倍仲麻吕,698—770年)是日本著名遣唐使,在唐历任校书郎、左拾遗(从八品上)、左补阙(从七品上)、秘书监兼卫尉卿等职,历经玄宗、肃宗、代宗三朝。唐代的秘书监犹如今天的国家图书馆和档案馆馆长,既要有渊博的知识,又是一种很高的荣誉,一般都由学界名流出任。晁衡凭借自己的正直和渊博学识,以一个外国人升任秘书监,实属罕见。晁衡担任秘书监期间,不仅积极进行唐朝馆库的藏书建设,而且引领遣唐使密集接触唐朝的国库文献和汉籍佛经,有力促进了日本文化的发展。鉴真大师得以成功东渡日本,晁衡也起了重要的桥梁纽带作用。今天,回顾这位友好使者及其为中日文化交流所作出的杰出贡献,不仅可以看到唐代中国对外交往的开放和博大胸怀,而且对今后中日关系的健康发展仍具有深层的现实意义。",CQTQ201404018
