我的学术生涯——学术思想的自我剖析,刘植惠:13613948|,10,情报学理论;分析总结;学术生涯;,"本文回顾了作者从事情报工作和情报学理论研究的历程,并对作者的学术思想进行了初步剖析和总结。附:刘植惠主要著作目录,部分专家、学者对刘植惠同志学术思想的评析。",CQTQ201401002
《情报科学》1980—2012年高频被引论文分析,仲华:10504486|,5,《情报科学》;情报学期刊;高频被引论文;,"以《中国引文数据库》为统计源,统计了《情报科学》1980-2012年被引30次以上(含30次)的论文,将这些论文界定为高频被引论文。从年代、地区、机构、基金论文、合作情况、经典论文和高频被引论文作者等方面,对高频被引论文进行分析,从而揭示了《情报科学》1980-2012年的研究现状。",CQTQ201401003
信息社会潮流中图书、档案、情报一体化管理研究与实践在欧美,潘伟德:12792206|昭质:24355448|夏文君:31001565|,5,图书;档案;情报;一体化;欧美;,"信息时代图书、档案、情报一体化管理是信息资源管理的新趋势,文章介绍了欧美发达国家在政府管理、国际专业协会、教学、保护技术、检索服务等方面,图书、档案与情报一体化的具体做法和尝试,同时也为我国信息资源的开发利用提供一些有益的借鉴和参考。",CQTQ201401004
苏州图书馆总分馆体系运营情况分析,蒋蕾静:13313102|,3,总分馆体系;苏州图书馆;,"为真正实现""普遍、均等、全覆盖""的图书馆服务理念,苏州图书馆进行总分馆体系构建。本文就苏州图书馆总分馆体系的建设方式、合作模式、管理机制等情况进行分析,对总分馆体系运营取得的成效进行总结。",CQTQ201401005
公共图书馆服务新生代农民工实现市民化路径研究,刘杰民:10707706|张汉强:10587494|,5,公共图书馆;农民工;市民化;,"随着经济和社会的发展,农民工文化权益问题日益成为政府和社会关注的重要问题。本文从我国农民工存在的现实背景和面临的问题入手,提出发挥公共图书馆的公益性、社会教育职能和资源优势,在为农民工提供服务的必要性和可操作性基础上,提出了公共图书馆应该为农民工实现市民化提供全面服务。",CQTQ201401006
关于图书馆参与非物质文化遗产保护工作的几点思考——以德宏傣族景颇族自治州为例,杨建玲:30501875|,4,图书馆;非物质文化遗产;德宏州;,"非物质文化遗产保护工作在云南桥头堡建设中具有举足轻重的作用。德宏州地处桥头堡建设前沿,是云南民族文化之窗。本文以德宏州为例,详细介绍了近年来德宏州非物质文化遗产保护面临的新机遇及保护现状,重点分析了图书馆参与非物质文化遗产保护的必要性,最后探讨了图书馆发挥自身优势参与非物质文化遗产保护工作的一些建议和对策。",CQTQ201401007
浅谈微博在我馆对外开放过程中的作用,胡杨:31001566|,3,微博建设;图书馆;,"随着互联网技术和现代通讯技术的快速发展,人际交流的工具也在发生着变化,微博呈现出爆发性增长的趋势。本文拟就搞好""湖北省图书馆""微博这一平台的重要意义进行阐述,分析""湖北省图书馆""微博建设存在的主要问题,提出下一步从信息内容、特色、连锁体系、职能分工、活动等方面建设发展的设想。",CQTQ201401008
军队院校图书馆图书文献改编的几点思考,赵欣:23580066|贺光霞:20566183|,3,军队院校;图书馆;改编工作;,"近年,军队院校调整改革的变化,引起军校图书馆馆藏文献的变化,特别是《中国图书馆图书分类法》(以下简称《中图法》)第五版的推出,军校图书馆图书文献改编工作日趋迫切。本文作者试从图书文献改编的动因、策略方法与方法步骤等方面谈一谈对军校图书馆图书文献改编工作的认识。",CQTQ201401009
浅析期刊合订本加工技术的应用,袁森:27448293|,3,期刊合订本;加工技术;,"期刊合订本是期刊的一种延伸,是期刊重复利用的一种表现形式。如何才能将现刊阅览室内的期刊加工成规范的期刊合订本,本文以重庆科创职业学院图书馆的期刊合订本加工为例,从技术层面剖析期刊合订本的加工,实现期刊合订本的加工规范化、成本最低化,并提高期刊合订本的利用率。",CQTQ201401010
发挥地方文献作用  促进地方经济发展,吴建中:23191146|,3,地方文献;经济发展;服务;,"本文阐述了地方文献资料的作用,探讨了开展地方文献征集工作的途径和方法,提出地方文献的搜集、整理要尽可能为现时服务,为经济建设服务,为未来着想。",CQTQ201401011
大学生搜集和利用时政信息能力的调查研究——以云南师范大学为例,蒋金和:11262991|张蓉:31001567|夏薇:31001568|张昱:27182836|,4,信息素养;时政信息;大学生;,"本文通过问卷调查和访谈等形式,就云南师范大学大学生搜集和利用时政信息能力进行了调查,并就其信息感知度、信息获取渠道、对图书馆时政信息利用情况等进行了分析。最后,提出了一些关于时政信息教育的建设性意见和建议。",CQTQ201401012
全民阅读背景下公共图书馆的导读职能作用,李仲元:29842174|,5,公共图书馆;公共文化;全民阅读;阅读引导;阅读习惯;,"阅读是人自身发展和人类文明延续的主要途径,成为人类生活的重要组成部分。新时期全民阅读背景下公共图书馆应充分利用馆藏文献信息资源、公共文化设施、专业馆员服务、阅读推广指导等资源优势,发挥公共图书馆阅读引导主体作用,促进全民阅读健康发展,为走进阅读社会、构建书香中国承担起社会责任。",CQTQ201401013
大众阅读推广与阅读馆员服务——公共图书馆阅读服务体系创新,周铭蓉:10746630|,4,大众阅读;阅读馆员;阅读服务体系;,"本文结合我国大众阅读推广的需要,提出建立公共图书馆阅读服务体系,实施阅读馆员制度,开展阅读创新服务,优化阅读服务理念,提升馆员阅读职业素养,在大众阅读的推广与发展中,发挥图书馆文化阅读主阵地作用,以引领和推动全民阅读的持续发展。",CQTQ201401014
高职院校图书馆大学生阅读服务实践活动探索——以重庆科创职业学院图书馆为例,韦宁:24646294|,4,阅读服务;大学生;图书馆;高职院校;,"文章论述了高职院校图书馆开展大学生阅读服务实践活动的意义,并从建立学生社团,招募社团学生实践者、开展服务实践培训、推广系列读书活动、书评实践活动等方面对高职院校图书馆开展大学生阅读服务实践活动进行了探讨。",CQTQ201401015
新媒体时代图书馆员的角色转型,杨伟:29411059|,3,图书馆员;新媒体时代;角色转型;,"随着新媒体技术及环境的发展完善,图书馆的工作环境、工作重心、管理手段以及服务理念等都发生了深刻的变化,给图书馆带来了一系列新的挑战。在这样的大环境下,作为图书馆最基本、最活跃、最核心的图书馆员,应顺应时代发展的趋势,自觉地转变角色,积极通过各种方式提高综合素质,不断胜任变化的工作环境。",CQTQ201401016
关于区县级公共图书馆电子阅览室免费开放的思考——以重庆市沙坪坝区图书馆为例,霍量:31001569|杨红:16918717|,4,区县级公共图书馆;电子阅览室;免费开放;,"公共图书馆实行免费开放是实施民生工程的重要内容,是保障广大人民群众基本文化权益、提高公民鉴赏能力的重要举措。电子阅览室是免费开放工作中的重要场所。本文简述区县级公共图书馆电子阅览室在免费开放服务中工作人员、读者、管理和技术等方面存在的问题,提出通过完善制度、拓展服务、强化技术、培训等方法解决相关问题。",CQTQ201401017
从文献计量学视角探讨丝绸之路经济研究,蒋金和:11262991|陈晶:30222325|,5,丝绸之路;经济带;文献计量;,"本文以CNKI数字出版平台数据库为统计源,从文献计量学视角对丝绸之路经济进行计量统计分析,探讨丝绸之路经济带发展。研究表明,丝绸之路经济带尚未得到全面研究,建议积极创造条件,加大政策支持,成立新丝绸之路经济带研究机构,为丝绸之路经济发展提供理论支持。",CQTQ201402002
现代情报学新的研究动向:开展科技实验室情报分析研究和组建情报学实验室,刘凌松:31216562|,3,情报学实验室;情报分析研究;必要性;,"本文指出了开展科技实验室的情报分析研究的必要性及其内容,叙述了作为发展方向之一的情报学实验室的组建和构成。",CQTQ201402003
中国高校教师信息素质教育研究综述,赵冬湘:30448439|,4,信息素质;信息素质教育;用户教育;高校教师;,"根据中国高校教师信息素质教育研究的相关文献,对信息素质的内涵、信息素质教育的构成、高校教师进行信息素质教育的必要性和方法进行了总结,分析了中国高校教师信息素质教育研究的不足,以期为国内的高校教师信息素质教育研究提供参考。",CQTQ201402004
贵州省图情机构学者学术水平值测定,何德兵:22416785|仲华:10504486|,4,图情机构;学术水平值;贵州省;,"通过CNKI的《中国学术文献网络出版总库》和《中国引文数据库》统计了贵州省图情机构获得正高职称并且发文在10篇以上专业人员的论文及被引情况(统计时间为2013年7月31日),在此基础上,通过计算得出了每名学者学术水平分值。",CQTQ201402005
图书馆法律体系初探,张妤:25560273|徐恩元:08758193|,5,图书馆法;图书馆法律体系;,"法律保障机制是图书馆事业繁荣发展的原动力,图书馆法律体系是图书馆法律保障机制的重要组成部分。笔者探讨了我国现有的图书馆法律体系,明确了图书馆法律关系的主体、客体,在对原有体系进行梳理和思考的基础上提出了新的观点,认为新型的图书馆法律体系应该是由图书馆法、相关法、图书馆行业自律规范三个相互联系、相互配套、相辅相成的要素构成,辅以宪法、基本法、相关国际法及条约作指导和指南的综合保障体系。",CQTQ201402006
刍议公共图书馆的生态文明建设,尹玉学:22935062|,4,图书馆;生态文明;生态文化;,"党的十八大报告提出大力推进生态文明建设,以独立篇章系统提出了今后5年大力推进生态文明建设的总体要求,并把生态文明建设放在事关全面建成小康社会更加突出的战略地位,纳入社会主义现代化建设总体布局,本文分析了公共图书馆充分认识生态文明建设历史意义和现实意义,提出了公共图书馆生态文明建设的内涵和实现途径。",CQTQ201402007
论地方文献与图书馆核心竞争能力,马丽:10813440|,4,图书馆;地方文献;核心能力;,"地方文献作为图书馆的特色馆藏,在提升图书馆核心服务能力方面起着至关重要的作用,是图书馆在瞬息万变的数字化、信息化、网络化时代得以持续发展的重要保证,本文拟对此加以探讨,愿与同行商榷。",CQTQ201402008
"以评促建,推动县级图书馆事业的发展——以麒麟区图书馆评估达标工作为例",付敬华:|,4,以评促建;县级图书馆;麒麟区图书馆;,"为提高图书馆服务质量和办馆水平,充分发挥公共图书馆的功能作用,着力加强公共文化服务体系建设,保障群众基本文化需求。根据《文化部办公厅关于开展县以上图书馆第五次评估定级工作的通知》文件要求,麒麟区图书馆认真对照文化部确定的县级图书馆评估定级标准进行了评估,凭借在全市县级图书馆中率先实现集藏、借、阅、电子检索一体化服务,综合评分位居全市第一,成功晋升为国家县级一级图书馆。",CQTQ201402009
对公共图书馆拓展社会职能的实践与思考——以安宁市图书馆为例,阎琼英:23891471|,4,公共图书馆;社会职能;安宁市;,"在信息飞速发展的今天,拓展公共图书馆的社会职能是建设学习型社会的需要,也是现代图书馆发展改革的需求。本文以安宁市图书馆拓展社会职能的实践为例,阐述了公共图书馆拓展社会职能的意义,提出了拓展社会职能应采取的对策。",CQTQ201402010
从书商主导图书采访的角度谈图书采访工作,刘孝容:27160722|,4,图书馆;图书采访;图书采购;书商;,"在既定的采访模式下,图书馆在与书商的合作过程中,不自觉的陷入了一种极端境地,即书商主导了图书馆的采访工作。本文通过对平时工作的回顾与总结,找出了现有的主要采访模式下呈现的问题,并提出了相应的解决方法,希望为同行及自己在今后的采访工作提供参考。",CQTQ201402011
“全纳”理念下的公共图书馆残疾人阅读服务,王莉美:22648839|陈天伦:10734137|邱慧芳:26076105|,3,全纳;公共图书馆;阅读服务;残疾人服务;,"相对而言,公共图书馆针对残疾人的专门服务还很少,残疾人读者依然是被忽略和被边缘化的弱势群体。当认识到""残疾""与""障碍""是两个不应混淆的概念后,看到的是残疾不是阅读的必然障碍。消除对残疾人阅读的歧视,并采取措施,以促进图书馆阅读机会与待遇的平等,公共图书馆需要接纳""全纳""的理念。",CQTQ201402012
论国外标准文献的查询服务,韦宁:24646294|,6,查询服务;国外标准;标准文献;,"本文对国外标准文献的概况,标准文献的特点、结构、类型作了介绍,并从国外标准文献的手工检索、网络检索、工具书的利用、咨询式查询这四个方面对国外标准文献的查询服务进行了论述。",CQTQ201402013
高校领导推荐经典学习书目工作研究,张亚军:06944926|,3,高校领导;经典图书;推荐书目;,"以贵州大学党委书记姚小泉给大学生开经典学习推荐书目的事例,讲述高校领导对大学生的影响,倡导高校领导开推荐书目,并对图书馆做好经典阅读指导工作提出建议。",CQTQ201402014
自媒体时代的高校图书馆服务面临的机遇与挑战,李禾:14049940|,4,自媒体;体验性;便利性;高校图书馆;,"21世纪是娱乐的时代,自媒体的产生标志着全民传播和网络大众生产的方式出现。而徘徊在低谷的高校图书馆,只有接纳并善用这种媒体形式,才能使服务满足读者对体验性和便利性的需求,从而树立高校图书馆的新的品牌形象。本文通过分析自媒体的特点,论述高校图书馆如何正确地面对这一机遇和挑战,并试图给正在进行自媒体资源服务研究的图书馆人提供一点可供参考的资料。",CQTQ201402015
基于Agent的个性化信息服务,廖大蓉:23413227|,3,Agent;搜索引擎;个性化信息服务;,"传统的网络信息服务技术难以满足用户个性化需求,将人工智能的Agent技术引入信息服务研究中,提出了基于Agent的个性化信息服务系统。并详细阐述了系统的设计思想和系统体系结构,设计了一个Agent的个性化信息服务摸型系统。",CQTQ201402016
浅析公共图书馆未成年读者的网络服务模式,李丹:26126559|,3,公共图书馆;网络信息;未成年读者;绿色上网;,"互联网的应用改变了人们的生活方式,给我们的商务办公以及日常生活都带来了革命性的进步。然而,每一项科学技术的突破都证明了科技是一把双刃剑。本文简述并分析了网络以及网络信息对未成年读者所造成的消极影响,提出了改善公共图书馆电子阅览室网络信息的绿色化建设和对未成年读者管理的措施。",CQTQ201402017
《编辑学报》学术影响力的动态分析,杜朝东:10504592|胡军:10122808|,6,《编辑学报》;学术影响力;适应性检验;,"按照文献计量学有关方法,对2000年以来《编辑学报》的学术影响力进行分析,并采取秩和检验、Spearman(或Kendall)和K-S等方法(检验水准α=0.05)对该刊论文第一作者与论文数量之间的关系进行洛特卡定律的适应性检验。结果:第一作者人数与理论作者人数无差异(Z=1.107,P=0.172),存在相关性(rs=0.914,P&lt;0.001(或rK=0.843,P&lt;0.001))和一致性(Z=1.171,P=0.129)。说明该刊论文第一作者与论文数量之间的关系与洛特卡定律基本符合。",CQTQ201403002
情报学在中国——SWOT分析法的应用,刘凌松:31216562|,4,情报学;态势分析法;SWOT分析方法;中国;,本文利用态势分析法(SWOT分析方法)剖析了情报学在中国的发展现状。详述了情报学在我国固有的优势、发展中的劣势、面临的机遇和外部的威胁与挑战。,CQTQ201403003
多元合作是数字图书馆服务提升的引擎,严新玲:27043716|,4,数字图书馆;地方文献;多元化合作;,"伴随信息化的深入影响,图书馆正处于传统向现代转型的重要时期,多元合作是数字图书馆应对信息增长与需求多元化、信息服务市场化、扩展优质服务和保持特色化的必然选择。数字图书馆建设要树立特色意识、服务合作意识,通过与地方各部门的合作,利用其丰富的地方文献资源优势,提供特色文献信息服务,发挥图书馆在新时期的重要作用。",CQTQ201403004
回顾历史  展望未来——合川区图书馆事业五十年回顾与展望,刘格:|,4,图书馆事业;合川区图书馆;重庆市;,"通过对重庆市合川区馆50多年来从手工操作方式到现代化设备运用,从200平方米的陋室到5000平方米的馆舍,从馆藏1万册到20多万册的发展历程回顾,不仅看到了本馆的步步艰辛、步步发展,更是看到了图书馆事业的步步飞跃、看到了明天的希望。",CQTQ201403005
对图书馆激发员工活力的思考,金晓冬:30854094|,2,图书馆;员工;活力激发;,"针对目前图书馆员工中存在的倦怠现象,指出图书馆可以通过加强业务培训、提倡创新思维、运用激励机制和参与各种活动来激发员工的活力,使员工能够实现自己的人生价值,激发其工作的积极性和创造性,从而使图书馆更好地服务社会。",CQTQ201403006
从农村个人办家庭图书室看农村基层图书室的发展前景,吴建中:23191146|,3,家庭图书室;基层图书室;农村图书室;,"随着物质文化生活条件的不断改善,农村人民群众对精神生活需求更加强烈。以长阳县火烧坪乡农村个人创办家庭图书馆为例,分析其与经营性书店和村组办图书室的区别、优势,并从政策、社会、人才三方面提出相应的建议。",CQTQ201403007
浅析高校图书馆特色数据库建设,李佳聪:31844770|,3,特色数据库;图书馆;资源整合;,"本文在对CALIS已有特色资源数据库运行情况以及高校数字图书馆特色数据库相关研究成果进行分析的基础上,提出高校库建设中所存在的不足之处,并提出提升高校特色库建设水平的相关建议。",CQTQ201403008
浅议独立学院图书馆资源共享——以华中科技大学文华学院图书馆为例,蒋文汇:26656669|,4,独立学院;资源共享;,"通过分析独立学院在文献资源共享建设中,由于自身在馆藏结构、文献资源建设、经费限制等方面的特点,在共享方式、共享手段、共享内容等方面出现的困难和难以实现资源共享的种种原因,并提出了解决这些困难的措施和方法。",CQTQ201403009
新时代公共图书馆馆藏资源建设——在数字出版物崛起的背景下探讨,刘孝容:27160722|,3,公共图书馆;资源建设;特色馆藏;数字出版;,"本文分析了公共图书馆的文献资源建设在采购资金与基藏书库、藏书的广泛性与特色化、图书复本量控制方面存在的诸多问题,就新时代公共图书馆数字出版物的特点,提出了文献资源建设的新思路:满足读者需求为重点,收藏具有史料价值的印刷型文献,加强图书馆数字资源的建设。",CQTQ201403010
公共图书馆服务城乡创新机制研究——以湖北省地区为例,姚迎东:10673242|刘星:31844771|陈方权:15807320|孙振雄:30855520|,5,公共图书馆;城乡居民;服务机制;,"构建普遍均等的公共图书馆城乡服务机制是我国当代公共文化服务体系建设的重要内容,本文通过分析现有的公共文化城乡服务现状,探索公共图书馆服务城乡创新发展思路,逐步实现公共文化服务均等化,为广大城乡居民特别是农村居民提供优质、免费、全覆盖的文化服务。",CQTQ201403011
论坛虚拟学习社区的知识交流模式——以“小木虫论坛”为例,郑璐:30576411|,4,虚拟学习社区;知识交流;论坛;,"现代网络信息技术的发展,为虚拟社区的发展创造了条件。虚拟学习社区作为未来学习型社会中一种很有价值潜力的网络学习方式,是依托网络技术,将知识资源优势与虚拟技术平台强强结合的产物。本文以虚拟学习社区和知识交流模型为基础,以""小木虫论坛""为例,剖析虚拟学习社区中知识交流主体、知识交流课题和知识交流方式,并提出针对当前论坛的知识交流模式的建议。",CQTQ201403013
让亲子阅读充满幸福的味道——论家庭开展0-3岁亲子阅读的重要性,蒋蕾静:13313102|,4,家庭;亲子阅读;重要性;,"亲子阅读是儿童终身学习的基础,是早期教育的灵魂。本文从家庭开展亲子阅读的必要性,父母在亲子阅读中发挥的作用等方面进行了探讨,并提出了从阅读环境、阅读材料及阅读过程等方面开展亲子阅读。",CQTQ201403014
公共图书馆少儿阅读服务与管理工作新探——以重庆图书馆少儿阅读服务管理工作为例,周铭蓉:10746630|,4,公共图书馆服务;少儿阅读;阅读服务;阅读管理;,"本文针对少儿阅读主阵地的服务管理现状与突出问题,总结重庆图书馆少儿阅读服务与管理工作的创新与实践探索经验,为促进公共图书馆未成年人服务与管理工作的发展,从加强馆员服务意识培养,转变传统服务观念;注重馆员阅读服务能力培养,调整服务方式;强调馆员的阅读服务态度,提升阅读服务品质三方面提出思考与建议。",CQTQ201403015
县级图书馆免费开放资金管理与使用的思考——以安宁市图书馆为例,刘红:16325560|,4,县级图书馆;免费资金;管理使用;,"本文根据文化部、财政部《关于推进全国美术馆、公共图书馆、文化馆(站)免费开放工作的实施意见》,结合安宁市图书馆在实施免费开放服务工作中活动的开展情况及资金管理使用的实践体会,就免费开放专项补助资金的使用提出自己的思考意见。",CQTQ201403016
中国古籍文献数字化研究综述,石光莲:31361212|郑伟伟:31361213|,4,中国古籍;古籍文献;古籍数字化;,"随着信息技术快速发展,互联网技术普及,数字化成为古籍保护和利用的重要途径。本文在对中外古籍数字化的研究概况论述的基础上,探讨了古籍数字化标准、人才培养以及数字化古籍的检索利用在实践中存在的问题,并提出了对古籍数字化的展望。",CQTQ201403017
关于古籍数字化建设的思考和建议,梁斌:26373524|,4,古籍数字化;古籍保护;,"古籍保护方式有原生性保护和再生性保护两种。在原生性保护状况不佳的情况下,古籍数字化顺应社会趋势,成为再生性保护的重要手段之一,在古籍保护中起到越来越重要的作用。古籍数字化建设在规划、从业人员、版权等方面存在一些问题,提出从加强规划、产业扶植、数据安全、国际合作等方面对古籍数字化工作进行改善和提高,使古籍数字化建设翻开新篇章。",CQTQ201403018
古籍数字化的现状及建议,胡红:21638164|,3,古籍数字化;现状;建议;,"本文从我国古籍数字化的现状,分析了古籍数字化在规划、标准和发布平台等方面存在的问题,并提出了统筹规划、统一标准、联合开发三方面建议,促使古籍数字化工作向特色化、持续化和资源共享化方向发展。",CQTQ201403019
论古籍修复知识交流的促进,李腾达:31216563|,3,古籍修复;知识交流;交流障碍;促进方法;,"近年来古籍修复事业蓬勃发展,国家培养了大量的古籍修复人员,修复界人才辈出。但当我们的修复队伍不断壮大的同时,修复人员间的知识交流却没有扩大。本文分析了修复知识交流的益处和障碍,也给出了促进交流的方法。希望能够帮助修复人员理解知识交流的过程与益处,扫除修复人员间知识交流的障碍,加快修复知识在修复界的流动与转移,给更多修复人员提供知识交流的机会,从而使我们古籍修复队伍的整体水平得到提高。",CQTQ201403020
关于知识经济几个问题的思考,刘凌松:31216562|,4,人类社会形态;知识经济;涵义;运作机制;发展前景;,"本文基于科学技术演化和预测的趋势,提出了人类社会形态的重新划分,并指出知识经济诞生于信息化社会的末期,是信息化社会与知识化社会交替之间出现的一种引领型经济形态,起着引领和奠基知识化社会的作用。此外,还探讨了知识经济的运作机制及其发展前景。",CQTQ201404002
