篇名	作者	页数	关键词	摘要	filename
第五届“知网杯”上海高校信息资源发现大赛决赛在华东理工大学图书馆举办	孙晓凤:31810013	2	 	"<正>2019年11月22日下午,由上海市高等学校图书情报工作委员会与同方知网(北京)技术有限公司上海分公司联合主办、华东理工大学图书馆承办的第五届""知网杯""上海高校信息资源发现大赛决赛在华东理工大学图书馆成功举办。""知网杯""信息资源发现大赛首办于2015年9月,至今已经连续举办五届,旨在用丰富多彩的的比赛形式激发上海地区高校师生对信息检索、数据分析的兴趣,锻炼高校师生的信息获取和信息处理能力,推广科学的信息检索方法,提升师生信息素养。本届上海高校信息资源发现大赛共分为初赛和决赛两个阶段,自2019年9月份初赛举办以来,共吸引了4637人参与,答题人次达到7057人次之多。 "	SHGT201904001
2019图书馆阅读推广及服务创新案例交流分享会举办	段晓林:28234424	3	 	"<正>2019年阅读推广及服务创新案例交流分享会于11月6-7日在上海市奉贤区会议中心举行。会议由上海市图书馆学会、上海市奉贤区精神文明建设委员会办公室、上海市奉贤区文化和旅游局、国家图书馆出版社联合主办,奉贤区图书馆承办。上海市图书馆学会理事长、上海图书馆副馆长周德明,中共奉贤区委常委、宣传部部长徐卫分别在开幕式上致辞。周德明在致辞中提到,本次交流会,将把阅读推广及服务创新方面的最新理念、最新观点传 "	SHGT201904002
2019长三角地区高校图书馆联盟学科馆员研讨会成功举办	陈幼华:09591353	1	 	"<正>11月20-21日,在""双一流""建设、长三角一体化发展国家战略的驱动下,由长三角地区高校图书馆联盟、上海市高等学校图书情报工作委员会主办、上海交通大学图书馆承办的""长三角地区高校图书馆联盟学科馆员研讨会""在上海交通大学召开。会议由主题报告、上机实习与答疑、分组研讨与汇报、专家打分点评等主体环节组成。上海交通大学图书馆馆长陈进主讲《学科服务有效支撑大学发展》,拉开了主题报告的序幕。他的报告由""立志:新时代规划新征程""""启航:泛学科化服务初心""""案例:凝练经验谋划长远""""寄语:带着梦想扬帆远航""5大部分组成,揭示了图书馆的发展历程与当前面临的新形势及相应的新使命,详述了 "	SHGT201904003
酒香也怕巷子深，宣传就是生产力 记上海理工大学图书馆宣传工作小组的成长	徐梦琪:32876028	1	 	"<正>""哇,太好了,大一新生爱了爱了,USST""""都是我去年备考时经历过的啊!图书馆真的用心了,都是学生实实在在需要的,学弟学妹们太幸福啦""""现在还可以加入图书馆之友协会吗?错过了呢""......一条条微信公众号中的留言互动,彰显了广大师生对图书馆工作的认可,也温暖了全馆工作人员的心。上海理工大学图书馆在广大师生中具有良好口碑,连续多年在校职能部处评比中名列前茅。但是由于长期以来宣传工作力度不足,面临图书馆资源利用不均衡,受众面窄,主题活动师生参与积极性不高等问题。基于此,2019年暑假伊始,由图书馆陈世平馆长、卢小虎和王副馆长牵头,信息部主任王细荣老师、办 "	SHGT201904004
不忘初心 牢记使命――上海工商职业技术学院图书馆开展的建国70周年知识挑战赛圆满落幕		1	 	"<正>为了进一步推进""不忘初心牢记使命""主题教育活动的深入开展,激发新时代大学生民族自豪感和爱国主义情怀,进一步推动校园文化建设,上海工商职业技术学院图书馆特承办的""建国70周年知识挑战赛""。本次知识挑战赛活动由上海市高等学校图书情报工作委员会牵头组织。上海工商职业技术学院92名师生在为期十天(10月21日到31日)的线上挑战赛中,最终会计192班杨佳琪、会计181王娜、旅游管理181蒋叶童、餐饮管理192毛文杰、餐饮管理191获李晓党、酒店管理192李照鑫等六名同学脱颖而出荣获""挑战达人""的光荣称号。近日,上海工商职业技术学院图书馆也在该校的教工之家为此六名学生举行了颁奖仪式。此次活动的举办,旨在鼓励广大师生积极参与图书馆文化活动。此次活动更是上海工商职业技术学院图书馆在开展""不忘初心,牢记使命""主题教育活动中切实提升服务品质、更好吸引学生入馆学习的重要举措,希望通过这样的活动,切实提高广大学生读者利用图书馆的积极性。 "	SHGT201904011
上海对外经贸大学图书馆举行学术讲座与业务案例专题会暨“第六届科研活动月”系列活动		1	 	"<正>11月18日,上海对外经贸大学图书馆举行学术讲座与业务案例专题会暨""第六届科研活动月""系列活动。来自东华大学、华东政法大学、上海工程技术大学、上海政法学院等高校图书馆同仁及图书馆全体馆员参加了专题会,专题会由图书馆副馆长谢蓉和信息服务部主任赵珊珊主持。上海对外经贸大学图书馆特邀华东师范大学范并思教授来我馆作学术讲座,图书馆赵勇书记为范并思教授颁发馆员学术发展中心顾问特聘证书。范并思教授在主题为""高效图书馆阅读推广理论与实践""的讲座中,从阅读与阅读推广概念的界定引出自己对何为阅读推广的思考,并进一步提出中国图书馆阅读推广的发展背景动因;他认为阅读推广的发展需要社会推动、创新驱动和理论引领;强调在当今时代图书馆在全民阅读中肩负重任,必须以""新常态""的思维方式结合科学精神和专业主义推动高校图书馆的发展。报告结束后,谢蓉副馆长与阅读推广部的馆员就阅读推广工作实践问题与范教授进行了进一步的讨论交流。在业务案例分享环节,来自图书馆各业务部门的董岳珂、艾致、郭昕霞、刘敏及韦薇等五位同 "	SHGT201904016
上海海事大学图书馆2019年度电子资源宣传推广活动成功举办		1	 	"<正>为使读者更加深入地了解图书馆电子资源,10月16日中午,上海海事大学图书馆在二楼大厅举办""2019年度电子资源宣传推广活动""。本次活动特邀同方(CNKI),超星(超星电子书、超星期刊、百链、超星学术视频),Elsevier(ScienceDirect、EI),IEEE(IEL),科睿唯安(SCI、SSCI、DII、ESI)等15家中外文数据供应商来馆摆摊宣传,与师生读者现场交流、答疑解惑。同时,该馆学科服务部和科技情报部也对相关学科和情报服务进行宣传和推广,详细解答读者咨询。活动中,数据商们通过易拉宝,现场发放宣传册等形式宣传推广其电子资源,培训师面对面解答电子资源利用的方法、技巧和疑问等,并准备了精美小礼品与读者进行互动。现场气氛热烈,人气火爆,读者们通过微信扫码、现场咨询等方式积极参与其中,体验电子资源发展带来的服务与便利。本次活动的成功举办,有利于读者全面直观地了解图书馆订购的各类电子资源,进一步掌握使用方法和技巧,提高电子资源利用率。同时为图书馆了解读者使用需求、探索和创新服务方式提供 "	SHGT201904026
《中国大百科全书》（第三版）博物馆学科编辑工作会议在上海大学召开		2	 	"<正>2019年11月17日,《中国大百科全书》(第三版)博物馆学科编辑工作会议在上海大学召开。国家文物局副局长关强,国际博物馆协会副主席、中国博物馆协会副理事长兼秘书长,《中国大百科全书》(第三版)博物馆学科主编安来顺,上海大学党委副书记、纪委书记段勇,中国大百科全书出版社副总编辑刘杭,中国大百科全书出版社三版内容中心主任徐世新,国家文物局博物馆与社会文物司科技与信息处副处长(主持工作)吴寒,中国博物馆协会副秘书长艾静芳,湖南省博物馆馆长段晓明,湖南省博物馆原馆长陈建明,上海博物馆馆长杨志刚,上海大学图书馆馆长潘守永、博物馆馆长李明斌,《中国大百科全书》(第三版)博物馆学科分支主编/副主编韩永、黄春雨、郭青生、张文立、李文昌、郑奕、信木祥等专家学者及分支联络人,湖南省博物馆与中国大百科全书出版社相关代表近30人出席本次会议。会议由潘守永主持。国家文物局副局长关强就《中国大百科全书》(三版)博物馆学科卷发表讲话,指出博物馆学第一次单独成卷列入《中国大百科全书》第三版,意义重大而深远。国家文物局对此非常重视, "	SHGT201904028
新时代，新使命，新作为 同济大学图书馆学术报告会圆满举行	陈飒飒:28016317	1	 	"<正>为了提高馆员在新时代的信息服务能力和科研水平、增强创新意识,同济大学图书馆特邀北京大学情报学专业博士生导师赖茂生教授、中国人民大学信息资源管理学院博士生导师周晓英教授、南开大学商学院信息资源管理系博士生导师王芳教授来馆作学术报告。学术报告会于11月18日上午在四平路校区图书馆一楼报告厅顺利举行。报告会由图书馆副馆长何青芳主持。图书馆党委书记慎金花、馆长陈欣等党政领导、各部门馆员以及来自上海各高校的同仁50余人到场聆听了报告。 "	SHGT201904029
2019“图书馆学术论坛”在上海师范大学图书馆举行	段晓林:28234424	2	 	"<正>11月8日,由上海市高等学校图书情报工作委员会、中国索引学会主办,上海师范大学图书馆承办的2019""图书馆学术论坛""在上海师范大学举行。来自上海地区乃至全国各地的图书馆馆员近100人与会。上海师范大学图书馆党总支书记段鸿致欢迎辞,并提到:论坛从2014年至今已举办6届,通过专家通讯评审、论文作者现场交流、主编现场点评、优秀论文推荐发表等形式,为图书馆业界营造科研氛围、涵育学术成果、扶持学界新人起到积极作用。开幕式上,还为本次论坛优秀论文作者颁发了获奖证书。开幕式由上海师范大学图书馆党总支副书记赵龙主持。 "	SHGT201904030
上海财经大学 学术数据总库、学术展示・共享空间启用仪式暨千村调查展、世界500强企业展开幕式在图书馆举办	石琳琳:40875069|周丽:08480203	2	 	"<正>11月8日下午,上海财经大学学术数据总库、上海财经大学学术展示・共享空间启用仪式暨千村调查展与世界500强企业展开幕式在上海财经大学英贤图书馆举办。活动由上海财经大学副校长刘兰娟主持,上海财经大学党委书记许涛,上海市图书馆学会理事长、上海市图书馆副馆长周德明,中国科学院兰州情报研究所研究员祝忠明,上海凤凰自行车(集团)有限公司副总裁张雅明等校企领导、业界专家出席并致辞。学校科研处、人事处、宣传部、发展规划处、基本建设处、合作发展处、信息化办公室、学生工作处、档案馆、教育基金会、三农研究院、创业学院等职能部处、学院的主要负责人一同出席本次活动。 "	SHGT201904031
复旦大学“印谱虚拟图书馆”（一期）启用	马步青:43726878	1	 	"<正>2019年11月15日,复旦大学""印谱虚拟图书馆""(一期)正式启用。复旦大学党委副书记尹冬梅、香港著名印谱收藏家林章松先生、复旦大学图书馆馆长陈思和以及来自校内外的专家学者代表出席启用仪式。尹冬梅代表学校对林章松先生的慷慨捐赠表示衷心感谢。她表示,复旦大学图书馆将整合相关资源,集中发力,进一步推动印谱文献数据库的建设和利用,为复旦大学的资源建设、文献服务和文化影响添薪续力。林章松、尹冬梅、陈思和共同启动了复旦大学""印谱虚拟图书馆""(一期)。林章松在仪式上致辞, "	SHGT201904032
华东理工大学图书馆 “明德书房・党建共享空间”启用仪式暨“龙之华初之心”主题党课举行	秦婷玉:43726877	1	 	"<正>为庆祝新中国成立70周年,扎实开展""不忘初心、牢记使命""主题教育,落实立德树人根本使命,传承发扬校园文化精神,10月10日下午,华东理工大学图书馆举行""明德书房・党建共享空间""启用仪式,并携手上海市龙华烈士纪念馆开展""龙之华初之心""主题党课。校党委副书记陈麒出席了启用仪式并讲话,会议由图书馆党委副书记、副馆长武亚珍主持。勤奋求实扎根时代沃土,励志明德逐梦星火燎原。在一片热烈掌声中,1986届校友代表王力、校党委组织部常务副部长沈悦萍、图书馆馆长林嘉平3位嘉宾为明德书房正式揭牌。""明德书房・党建共享空间"" "	SHGT201904033
一身黄河水，两度珞珈山――怀念武汉大学信息管理学院的流金岁月		10	 	"<正>我在武汉大学学习、工作近13年。第一段是从1985年到1988年,在武汉大学图书情报学院读硕士,第二段是从1996年到2006年春,先在武汉大学信息管理学院读博士,后留校任教。这是我人生中最美好的两段经历,它不仅铺垫出我学术生涯的底色,也是我取得学术成果的丰获阶段,还是我工作、生活最为心情舒畅的时期,那些铭心刻骨的人和事,经常梦牵魂绕,难以忘怀。 "	SHGT201904005
高校图书馆新馆建设的理念、功能及空间布局DD复旦大学图书馆陈思和、应峻访谈		5	 	"<正>陈思和,1954年生于上海,复旦大学资深教授、博士生导师。2005年教育部聘为人文学科长江学者特聘教授,2007年获教育部高等学校国家名师奖,现任复旦大学图书馆馆长,复旦大学校务委员会委员,复旦大学学术委员会委员等,兼任上海市作家协会副主席,中国现代文学学会副会长,中国当代文学学会副会长等。主要研究方向:中国现当代文学史、中外文学比较和当代文学批评等。 "	SHGT201904006
智慧服务背景下图书馆馆员服务创新能力提升的一些思考		3	 	"<正>一、智慧服务背景下图书馆面临的新挑战王世伟先生在《论智慧图书馆的三大特点》一文中提出何为智慧图书馆?并作如下定义:智慧图书馆是以数字化、网络化、智能化的信息技术为基础,以互联、高效、便利为主要特征,以绿色发展和数字惠民为本质追求,是现代图书馆科学发展的理念与实践。智慧图书馆作为未来图书馆的新模式,将成为图书馆创新发展、 "	SHGT201904007
图书馆阅读推广及服务创新案例交流分享会		1	 	"<正>编者按2019年11月6-7日,图书馆阅读推广及服务创新案例交流分享会于上海奉贤区会议中心举行。会议由上海市图书馆学会、上海市奉贤区精神文明建设委员会办公室、上海市奉贤区文化和旅游局、国家图书馆出版社联合主办,奉贤区图书馆承办。会议主题报告部分邀请到中国图书馆学会阅读推广委员会主任、东莞图书馆馆长李东来,上海市图书馆学会秘书长、博士生导师、《图书馆杂志》常务副主编金晓明,深圳宝安区图书馆展览活动中心主任、青少年服务部主任赵艺超,北京大学图 "	SHGT201904008
全民阅读与图书馆阅读推广		3	 	"<正>当今图书馆界的阅读推广热情高涨,图书馆阅读推广和全民阅读的结合越来越紧密。全民阅读是全社会都在做的事情,图书馆界应该如何认识全民阅读,以及如何进行颇有成效的阅读推广,值得每个图书馆人深思。作者从环境、使命、组织、活动、服务、产品、专业等七个方面详细阐述了全民阅读与图书馆阅读推广之间的关系。 "	SHGT201904009
高校图书馆决策支持服务――要点、难点和发展策略		3	 	"<正>一、背景概况与公共图书馆不同的是,为大学提供服务和管理支撑,是高校图书馆本身存在价值的基础。以上海交通大学为例,全面振兴本科教育攻坚战,全面推进新工科、新文科、新农科、新医科""四新建设""等,是本科教育回归初心的重要举措。科研方面,面向国家重大战略需求,要实现从0到1基础研究原创性的重大突破。面对高校内外部环境的诸多变革,图书馆在服务和管理方面,需要作出相应的跟进和调整。 "	SHGT201904010
“领读者”立体阅读推广项目		3	 	"<正>项目负责人:郭晶一、总体思路为弘扬立德树人,价值引领,营造校园阅读氛围,支撑新时代高素质人才培养,助力校区联动、文化交流,上海交通大学图书馆联合校内外相关单位,构建""领读者""立体阅读推广项目,通过系列举措:创设育人平台""领读者""学生阅读推广社团,以阅读促成长;邀请交大名师担任""名师领读者"",以阅读助育人; "	SHGT201904012
中国图书馆学会“2018年阅读推广优秀项目”		1	 	"<正>2019年8月3日,中国图书馆学会公布2018年全民阅读工作有关名单,上海交通大学图书馆《""领读者""立体阅读推广项目》、上海师范大学图书馆《海尚悦读寻梦上海――海派文化阅读推广》、上海交通大学图书馆和安泰经济与管理学院《""交C・安泰书道计划""――融合创新型大学新生阅读培育项目》三个项目获评""2018年阅读推广优秀项目""。本次评选出的优秀项目,均是在2018年度全民阅读工作中,理念新颖、内容丰富、品牌效应较好的阅读推广活动,对全国各级各类图书馆开展全民阅读活动起到了较好的示范作用。中国图书馆 "	SHGT201904013
海尚悦读 寻梦上海DD海派文化阅读推广		3	 	"<正>项目负责人:蔡迎春一、总体思路项目是以""海尚悦读寻梦上海""为主题的系列活动,主要以倡导""深阅读""为目的,围绕""海派文化""开展,让大学生读者通过参与各种阅读活动,体验、理解和感受海派文化的巨大魅力,让海派精神浸融到大学生的行为和举止中。项目在实施过程中,充分利用多种媒介的传播 "	SHGT201904014
交C・安泰书道计划――融合创新型大学新生阅读培育项目		3	 	"<正>项目负责人:陈幼华一、总体思路在国家和政府倡导的""全民阅读""""立德树人""""一流本科建设""精神的指导下,以高校学科院系育人需求为牵引,基于图书馆阅读推广、信息素养教育工作之优势,借鉴国外高校综合性新生教育计划First-Year Experience(简称FYE)和Common Reading项目将新生教育 "	SHGT201904015
日本一桥大学图书馆阅读推广活动实践及启示	徐璐:43726873	5	 	"<正>一、引言阅读是人类获取知识的主要途径,也是一个国家发展的精神命脉,在知识经济时代,国民阅读能力直接关系到国家竞争力[1]。2014年以来的国务院政府工作报告均提到了""全民阅读"",而2017年的工作报告在表述上将""倡导""变为了""大力推动""[2]。高校图书馆凭借其丰富的文献资源和优越的馆舍环境,成为了推动全民阅读的中坚力量。日本作为亚洲图书馆事 "	SHGT201904017
中国政法大学图书馆阅读推广模式的构建与实践	陈蕊:23226840	5	 	"<正>一、图书馆阅读推广背景1995年,联合国教科文卫组织将每年4月23日命名为""世界阅读日""。2003年,中国图书馆学会将全民阅读工作提上日程并列入年度计划,拉开了中国图书馆界阅读推广序幕。党的十八大以来,政府工作报告和《国家""十二五""时期文化改革发展规划纲要》《国家基本公共服务体系""十二五""规划》等系列报告和规划中多次倡导和开展全民阅读活动。 "	SHGT201904018
多元主体合作视角下图书馆阅读推广案例研究与模型构建	郑敏1:10956608|梁茹2:07521164|俞楠3:32401204	6	 	"<正>一、引言近年来,随着社会各界对阅读推广工作的重视和推动,涌现出不少优秀的实践案例,阅读推广的相关理论也有了进一步发展。从实践层面上看,有研究者借助丰富的案例,对合作开展阅读推广的模式进行了探讨;从理论层面上看,有研究者对阅读推广主体进行了探讨。对合作开展阅读推广模式的研究和对阅读推广主体的研究成为阅读推广领域的两个重要议题。 "	SHGT201904019
高校图书馆中国传统文化阅读推广的实践和思考――以上海高校图书馆为例	张韵:43726872|赵丽辉:07548673	5	 	"<正>在""倡导全民阅读,建设书香社会""的时代潮流下,全面有效地开展阅读推广活动,激发大学生阅读兴趣,营造良好的阅读氛围,已成为高校图书馆工作的核心内容。高校图书馆纷纷推出主题活动类、读者组织类(如读书会、书友会等)、出版物类(如图书推介、书展等)、新媒体推广类(微信、微博、APP等)等各色阅读推广活动,呈现出百花齐放之态势,这其中也包括丰富多彩的中国传统文化阅读推广。 "	SHGT201904020
公共图书馆空间再造成效初探――以上海市徐汇区图书馆为例	张越:43726871	5	 	"<正>在社会转型发展的时代大背景下,作为公共空间的图书馆已不仅仅是一个存储和借阅各种资料的地方,更是一个社交互动、充满灵感和惊喜的场所。图书馆空间再造逐渐受到了越来越多学者的关注,但国内的研究大部分集中在空间再造的相关理论研究以及案例分享,对于空间再造后的空间利用效果、成效评估方面的文章比较少。本文将以上海市徐汇区图书馆为例,对该馆空间再造后的影响和成效进行研究,总结经验,发现问题,为提升公共图书馆空间再造水平,推动图书馆服务创新、功能升 "	SHGT201904021
高校图书馆中文计算机类图书采访质量控制研究	蒋鸿标:10620426	7	 	"<正>计算机类图书属于应用技术类图书,主要包括操作系统、办公应用软件、编程等方面,在学科分类上包括""TP1自动化基础理论""""TP2自动化技术及设备""""TP3计算技术、计算机技术""""TP6射流技术(流控技术)""""TP7遥感技术""""TP8远动技术""等8个一级类目。我国每年出版的计算机类图书品种繁多,如2015、2016、2017年分别为5825、5251、4878种,合计15954种(数据来源于北京人天和广东新华两家书商提供的征订书目,不代表实际出版数量,其中""著""或""编著""类合计8187种; "	SHGT201904022
基于GRA和AHP的学科服务绩效评估模型及其应用――以黑龙江东方学院图书馆为例	郭春阳:22150115|张贤淑:38578469|王欢:33846983	8	 	"<正>高校图书馆学科服务绩效评估是改进图书馆学科服务的基本依据,有利于高校图书馆构建面向在校学生的服务体系。学科服务绩效评估是指利用定性和定量分析的方法,通过建立合理的评估指标体系,利用恰当的评估方法来评估学科服务的效果[1]。高校图书馆学科服务绩效评估的目的是使学科服务满足广大本科学生日益增长的情报服务需求,有力地促进高校图书馆面向本科生的服务体系建设。论文利用层次分析法(Analytic hierarchy process,简称AHP)建立了学科服务绩效 "	SHGT201904023
《中华人民共和国公共图书馆法》对高校图书馆适用性问题研究	董艳洋:43726874	7	 	"<正>2018年1月1日,对于图书馆界来说是极不平凡的一天,历时17年之余的图书馆立法工作终于在这一天迎来了""大丰收""――《中华人民共和国公共图书馆法》(以下简称《公共图书馆法》)即日起开始施行[1]。图书馆的立法工作漫长而艰巨。2001年,文化部在天津召开《图书馆法》专家论坛,图书馆的立法工作正式开启。两年后,《图书馆法(送审稿)》递交给国务院法制办申请审批,却遭遇""停摆"",原因是国务院法制办认为《图书馆法(送审稿)》所包含的图书馆类型较多,覆盖的面比较广, "	SHGT201904024
“互联网+”环境下高校图书馆研究热点分析	成志强:43726875	7	 	"<正>李克强总理在2015年政府工作报告中,首次提出""互联网+""行动计划,以推动新兴产业创新发展,加强各个领域的深度融合[1]。图书馆界应时而上,积极主动地将""互联网+""融入到图书馆事业的理论与实践中。2015年至今,以""互联网+""和""图书馆""为主题的研究已逐渐成为图书馆学界新的热点领域。同时,作为科研服务机构的高校图书馆,也跻身""互联网+""行列。一方面,充分利用自身的优势特点,整合""互联网+""的技术优势,不断改造和升级物理空间,为在校师生提供智慧型学 "	SHGT201904025
精心打造名校“积极学习中心”――普渡大学图书馆运营的新思路	吉久明:07521009	4	 	"<正>初识普渡大学图书馆今年7月初,我决定拜访普渡大学图书馆。普渡大学在全美工科大学的排名非常靠前,登月第一人阿姆斯特朗系该校校友,距离我访学所在的伊利诺伊州立大学香槟分校仅一个半小时的车程。我通过普渡大学图书馆主页上的Ask us联系到设施部主管Nanette Andersson,她推荐我们参观Wilmeth积极学习中心(WALC),并安排了Vicki教授接待我们。通过普渡大学图书馆主页上该中心的介绍, "	SHGT201904027
唯有书香伴芳华		2	 	 	SHGT201804001
