篇名	作者	页数	关键词	摘要	filename
Web数据挖掘技术在图书馆工作中的应用	杜国芳:08702978|焦立辉:08702939	3	数据挖掘; Web搜索引擎; 信息服务;	"Web数据挖掘技术是近年来的一个新的研究课题,其应用领域在迅速扩展。此项技术也必将为图书馆的资源建设、信息服务等工作开拓出广阔的发展空间。 "	SHGT200404011
图书馆网络信息的采集与组织策略	金雪梅:12128132	4	互联网; 信息资源; 信息资源采集;	"从网络信息资源分布、图书馆采集网络信息资源的范围与方式、组织管理以及利用这些资源为读者提供服务的模式等诸多方面,探讨公共图书馆的网络免费信息资源的采集与组织策略,探讨图书馆通过开发网络信息资源、减轻购书经费紧缺压力的可行性。 "	SHGT200404012
改进博菲特典藏管理子系统功能的几点建议	冯浩然:21241104	2	博菲特; 典藏; 编目管理;	"介绍大连博菲特集成管理系统中中文典藏管理子系统6.0增强版的功能。阐述作者在实践中对一些问题的看法,以便今后该软件升级时作为参考。 "	SHGT200404013
高校图书馆办公室工作中人际关系的处理	夏知平:06701516	3	高校图书馆; 图书馆管理; 办公室工作; 人际关系;	"从处理好办公室主任与图书馆领导的关系、办公室与图书馆各部门的关系、办公室主任与办公室职工之间的关系、办公室与读者的关系等多维角度,探讨图书馆办公室工作中人际关系处理的一些理念与体会,并指出建立良好人际关系需要具有助人为乐、先人后己的品质。 "	SHGT200404014
对高校图书馆实行岗位津贴的分析	鲍尚贵:09538200	3	高校图书馆; 图书馆管理; 岗位津贴;	"分析高校图书馆岗位津贴制度的作用及其存在的不足,并提出改进设想与建议。 "	SHGT200404015
教育部在华东师大图书馆设立部级科技查新站		1	 	"<正>继在北京大学、清华大学等高校设立第一批""部级科技查新工作站""后,教育部又于今年6月批准在北京师范大学等14所直属高校设立第二批""部级科技查新工作站"",华东师大被批准设立理工类部级科技查新工作站,查新站具体业务工作由图书馆支持。6月3日,教育部科技发展中心对华东师大成立部级科技查新工作站进行了认定审查。华东师大校长王建磐、副校长叶建农等领导在图书馆会见了中心领导和专家组成员。华东师大图书馆的查新质量和设站条件得到了专家组的一致好评。""教育部科技查新工作站""是教育部授权批准的直属的、具有部委级查新职能的认证机构。目前,上海高校中已有复旦大学、上海交通大学、同济大学、华东理工大学和华东师范大学设立了部级科技查新工作站。(胡文华) "	SHGT200404016
高校图书馆人性化管理问题探讨	袁红军:09440648	2	高校图书馆; 人性化管理; 图书馆管理;	"分析人性化管理的内涵,并结合目前高校图书馆管理中存在问题,提出相应的措施。 "	SHGT200404017
USMARC中440字段与490字段的异同	宋金涛:06704096	3	西文编目; USMARC; 440字段; 490字段;	"根据西文编目中USMARC下的丛编说明,首先引出440字段定义与490字段定义,接着举例说明,最后通过讨论进一步加深理解。 "	SHGT200404018
教育部CASHL区域中心服务启动大会纪要		1	 	"<正>2004年10月15日,""教育部CASHL区域中心服务启动大会""在复旦大学逸夫楼报告厅举行。复旦大学图书馆秦曾後馆长主持会议。教育部社政司袁振国副司长代表教育部向大会表示祝贺并作热情洋溢的讲话。复旦大学副校长徐忠代表复旦大学欢迎来自全国60所大学的上百名代表。上海图书馆吴建中馆长等特邀嘉宾到会致贺。 "	SHGT200404019
高校图书馆艺术特藏资料工作探讨	黄红:17391296	2	高校图书馆; 艺术资料; 特藏文献;	就艺术特藏的收藏、利用、保管等方面工作作一些初浅的探讨。 	SHGT200404020
电子阅览室火灾隐患预防对策	徐洪升:07259046	2	电子阅览室; 火灾; 消防安全;	"电子阅览室电脑设备复杂,耗电量大,人员数量多,是图书馆消防安全工作的重要阵地。文章介绍电子阅览室火灾的危险性并提出相应的对策。 "	SHGT200404021
从厦门大学图书馆主任到哈佛燕京图书馆馆长――谈裘开明博士对中外图书馆事业的贡献	朱立文:09232758	3	裘开明; 厦门大学图书馆; 哈佛燕京图书馆;	"著名图书馆学家裘开明博士先后担任厦门大学和美国哈佛燕京图书馆馆长,为中外图书馆事业的发展作出了重要贡献,获得了图书馆界的高度评价。 "	SHGT200404022
四大中文电子图书数据库的特色分析	王芸:07522069|汪人山:07529349	4	数字图书馆; 电子图书; 特色检索; 浏览器;	"介绍四大网上中文图书数据库--超星数字图书馆、书生之家数字图书馆、方正Apabi数字图书馆和中国数字图书馆,并针对它们在校园网上的应用情况及其特色进行了比较和分析。 "	SHGT200404023
访美国图书馆见闻	陈惠兰:06598807	3	美国; 图书馆; 介绍;	介绍美国大学图书馆、国会图书馆和典型的社区图书馆的基本情况。 	SHGT200404024
《清人别集总目》补遗	黄明:07530534	5	 	"<正>南京师范大学古文献研究所李灵年、北京大学中文系杨忠等先生历经十余年编成的《清人别集总目》,收录清代作者近2万人,著作约4万种。全面反映了现存清人著作的种类,版本,以及收藏情况,嘉惠学林,垂泽后世,其功厥伟。 "	SHGT200404025
信息之窗		5	 	"<正>上海民办高等院校图书馆名录经过约十年的发展,上海现共有民办高等院校图书馆11所,它们是:上海杉达学院图书馆、上海工商外国语学院图书馆、上海托普信息技术职业学院图书馆、上海新侨职业技术学院图书馆、上海东海职业技术学院图书馆、上海济光职业技术学院图书馆、上海建桥职业技术学院图书馆、上海邦德职业技术学院图书馆、上海中侨职业技术学院图书馆、上海民远职业技术学院图书馆、上海立达职业技术学院图书馆。 "	SHGT200403003
关于民办高校图书馆建设的若干思考	李慧娟:08543130	3	民办高校; 图书馆建设;	"针对民办高校图书馆面临的问题,分析其产生原因,并对如何加强民办高校图书馆的建设提出几点看法。 "	SHGT200403002
同济大学图书馆新貌		1	 	"<正>同济大学图书馆老楼建于20世纪60年代中期,80年代中期经过扩建,面积达2225平方米。2003年夏,为适应学校教学科研快速发展的需要,同济大学图书馆启动了改建工程。改建工程历时15个月,总投入资金3300万元,于2004年2月正式竣工开放。 "	SHGT200403001
发展中的民办高职院校图书馆	吴国兴:09581333|张息珍:08506769	2	民办高职院校; 图书馆; 文献资源; 人员素质; 服务;	"简述目前民办高职院校图书馆呈现的""一高一新三弱""的特点,分析形成""三弱""的原因,并提出若干改变现状的对策。 "	SHGT200403004
民办高校图书馆建设面临的问题及对策	江毅:16124869	3	民办高校图书馆; 图书馆建设; 馆藏建设; 自动化; 职业素质;	"就目前民办高校图书馆在创建和发展过程中出现的问题,并根据民办高校自身的特点,在图书馆软硬件建设和管理方面,提出一些建设性的切实可行的意见。 "	SHGT200403005
上海民办高等职业技术院校图书馆建设之我见	金宝汀:09590357|赵黎旦:08516206	3	高职院校图书馆; 馆舍建筑; 馆藏建设; 技术支撑;	"结合建桥学院图书馆的建设和发展,就新建民办高等职业技术院校图书馆的馆舍建设、馆藏建设和计算机应用及网站建设中技术支撑等问题,谈一些经验教训和体会。 "	SHGT200403006
基于德尔菲测评的图书馆学史研究	范并思:07530184	4	图书馆学基础理论; 图书馆学史; 德尔菲测评;	20世纪的图书馆学留下了极为丰富的理论遗产。《20世纪西方与中国的图书馆学--基于德尔菲测评的理论史纲》一书系统地研究与清理了20世纪的图书馆学史。本文介绍该书的研究过程与方法。 	SHGT200403007
图书馆学理论必须接受图书馆实践检验	于鸣镝:05964335	3	图书馆学; 学术研究; 理论; 实践;	"依据辩证唯物主义哲学的观点,指出主体与客体都不是检验真理的标准,只有实践才是检验真理的唯一标准。 "	SHGT200403008
图书馆员的职业观念与社会职责	徐学珍:09645433	3	职业观念; 社会职责; 图书馆员;	"从图书馆员职业属性入手,论述图书馆员必须树立正确的职业观念以及必须履行的社会职责。 "	SHGT200403009
以人为本与高校图书馆管理	李艳:08840175	4	高校图书馆; 人本管理; 人才资源管理;	"探讨高校图书馆人才资源管理的现状及存在的一些问题,并根据管理学中的人本管理原理,结合高校图书馆管理工作实际,对高校图书馆人才资源管理提出一些可行性措施。 "	SHGT200403010
对新编制下军队院校图书馆推行岗位聘任制的设想	温敬朋:20253897	3	军队院校图书馆; 编制体制调整; 岗位聘任制; 激励;	"针对新编制下军队院校图书馆推行何种运行机制的问题,提出在军队院校图书馆推行岗位聘任制的设想。分析实行岗位聘任制的必要性和可行性,并探讨推行的具体办法。 "	SHGT200403011
随书光盘网络化管理法刍议	谭榕:08209819|孙姝:08855412	2	随书光盘; 电子阅览室; 电子资源; 网络管理; 音频光盘;	"介绍山东大学图书馆管理随书光盘的一些体会。探讨对磁盘存档的随书光盘进行网络管理,以及对其更新与维护的问题,并介绍音频光盘的特别处理方式。 "	SHGT200403012
图书馆光盘资源的网络化管理	骆永成:06604455	3	光盘; 电子资源; 网络化;	"光盘资源作为图书馆的新型馆藏,亟需进行规范化管理。本文提出的一种光盘资源网络化管理方案--虚拟镜像光盘塔系统,有利于提高图书馆光盘资源的利用率。 "	SHGT200403013
关于复旦大学图书馆利用情况的调查与分析	赵睿杰:07548682	3	复旦大学; 图书馆利用; 调查; 问卷;	"通过设计调查问卷,对读者进行图书馆利用情况的调查,并对调查结果进行分析,为复旦大学图书馆馆藏发展及图书馆网站建设的决策提供依据。 "	SHGT200403014
建设有高职特色的图书馆馆藏资源体系	王晓凤:15159392	3	高职院校图书馆; 馆藏资源; 文献资源建设;	"论述高职院校图书馆藏书资源建设的现状与特征,并结合本院馆藏资源建设的做法,提出建设有高职特色馆藏资源体系的具体见解。 "	SHGT200403015
军队院校数字图书馆信息资源建设新理念	曾媚:20735055	3	军队院校图书馆; 数字图书馆; 信息资源建设;	"结合军队院校数字图书馆的建设项目和开展的数字资源建设实践,对军队院校数字图书馆信息资源建设的新理念和新意识进行深入探讨。 "	SHGT200403016
弘扬复旦精神――关于复旦大学图书馆开展人文教育与科学教育的设想	茅文华:06706742	3	复旦精神; 人文教育; 科学教育;	"复旦精神是一代又一代复旦人在长期奋斗中铸就而成的,有着深厚的人文和科学的精神底蕴。复旦大学图书馆在配合学校加强学生的人文教育和科学教育、弘扬复旦精神过程中具有重要的作用和地位。本文探讨图书馆在人文教育、科学教育中的优势,并提出建议与设想。 "	SHGT200403017
对《中图法》第四版TP类的修改意见	李志:07368810|周良华:07372528	2	中图法; 图书分类; 计算机类目;	对《中图法》第四版TP类存在的问题进行探讨并提出修改意见。 	SHGT200403018
高校图书馆个性化信息服务初探	潘芹:08571868	2	图书馆; 信息需求; 个性化; 信息服务;	"网络技术和信息技术的发展,使得高校图书馆的服务模式发生了变化,个性化信息服务成为图书馆信息服务发展的方向。本文就开展个性化信息服务的若干问题进行探讨。 "	SHGT200403019
图书馆流通工作中的网络预约服务	李莉:06705580	2	读者服务; 流通工作; 网上预约;	"复旦大学图书馆医科馆为更好地为读者服务,开展网上图书预约服务多年。本文论述网上预约的概念及实现方法。 "	SHGT200403020
图书馆文献检索中心的标志设计	李英:07521151	1	 	"归纳标志的概念,针对高校存在的问题,提出标志设计的重要性及标志设计的流程,并试为华东理工大学图书馆文献检索中心进行了标志设计。 "	SHGT200403021
论ORI服务	何燕:09573509	4	ORI服务; 信息研究; 信息产品; 信息市场;	"论述国内外ORI服务的起源、现状和趋势,通过对我国ORI服务历史的回顾,总结我国ORI服务的特点、存在的问题及在知识经济条件下的机遇和挑战,并提出相应的对策。 "	SHGT200403022
中国财经报刊数据库与中国经济信息网资源比较	田文夫:08505376	3	网络信息资源; 中国财经报刊数据库; 中国经济信息网; 比较;	"通过中国财经报刊数据库与中国经济信息网资源的比较研究,为科学地进行信息资源采集及制定或修正网络信息资源的搜索方针提供依据。 "	SHGT200403023
访钱存训教授谈中国书籍史之研究及治学方法	张宝三:21141311	7	 	"<正>钱存训教授,1910年出生于江苏省泰县,南京金陵大学文学士,美国芝加哥大学硕士、博士。曾任南京金陵女子大学图书馆代理馆长,上海交通大学图书馆副馆长,国立北平图书馆南京及上海办事处主任,美国芝加哥大学东亚语言文明学系及图书馆学研究院教授、东亚图书馆馆长,夏威夷大学客座教授。现任芝加哥大学东亚语言文明学系荣誉教授、东亚图书馆荣誉馆长,英国李约瑟东亚科技史研究所终身研究员。著有中、英、日、韩文本《书于竹帛》、《中国之科学与文明:造纸与印刷》,中文本《中国书籍、纸墨及印刷史论文集》、《中美书缘》,英文本《中国书目解题汇编》、《古代中国论文集》、《区域研究与图书馆》等专著及论文百余篇,为腾声国际之著名学者。 "	SHGT200403024
英国的报纸图书馆	张岚:09547967	2	 	"<正>每年一到年底,成堆的当年报纸便让报刊管理人员犯了难。处理吧,实在可惜,留着呢,谁又会把心思放在这不起眼的过期报纸上呢?真是鸡肋,食之无味,弃之可惜啊!然而,大英图书馆却在这不起眼的过期报纸上做出了大文章。传统方法与现代技术相结合,保留过期报纸和杂志中有价值的部分,以备今后查阅,这便是英国报纸图书馆的工作基本原则。以下就是对英国报纸图书馆的大概介绍。 "	SHGT200403025
关于高校图书馆办公室主任素质与能力要求的思考	杨培菊:09751470	4	高校图书馆; 办公室; 主任; 素质;	"随着高校图书馆体制的改革和现代化技术的应用,图书馆各项工作都发生了很大变化,信息交流也日益频繁,这些对图书馆办公室工作产生了很大的影响,因而对办公室主任这个岗位提出了更高的要求。本文从创新意识与科学管理能力、信息意识与调研能力、服务意识与协调能力、学习意识与自身修养几方面, 阐述新时期对办公室主任素质与能力的要求。 "	SHGT200402002
上海外国语大学图书馆松江校区馆		1	 	"<正>上海外国语大学图书馆松江校区馆于2001年秋开始动工建设,2003年秋正式投入使用。学校领导对松江校区图书馆的建设十分重视,本着把松江校区建成现代化校园的宗旨,努力把上海外国语大学松江校区图文信息大楼中的新馆建设成一座以人为本、设施先进、服务周到的现代化图书馆。 "	SHGT200402001
图书馆部主任能力的培养	戴文:06590091	3	图书馆; 部主任; 能力; 培养;	"图书馆部主任作为图书馆的中层干部,在图书馆管理工作中具有重要的地位和作用。本文根据图书馆部主任的责任和角色定位,从管理能力和业务能力两方面论述部主任能力的全方位培养。 "	SHGT200402003
第七届亚洲数字图书馆国际会议各委员会组成名单		1	 	 	SHGT200402004
第七届亚洲数字图书馆国际会议筹备工作进展		1	 	"<正>第七届亚洲数字图书馆会议筹备工作在上海交通大学和上海图书馆领导关心、指导下进展顺利。2004 年2月已将征文通知发往国内外相关单位;3月会议指导委员会、学术委员会、组织委员会、秘书处等名单相继在会议网站上公布;4月征展通知顺利向有关单位发出,网上""论文送交系统""也正式启用。各项筹备工作 "	SHGT200402005
论读者非道德行为的防范和规避	赵伯兴:08485065	4	读者管理; 道德风险; 失德行为;	"通过对读者管理中各种非道德现象的分析,揭示各种失德行为产生的原因,并在此基础上研究优化信息环境、强化诚信通识教育等防范和规避读者非道德行为的方法和措施。 "	SHGT200402006
哈佛燕京图书馆邱玉芬女士在上海图书馆作学术报告		1	 	"<正>2004年4月27日下午,美国哈佛大学哈佛燕京图书馆编目专家邱玉芬女士应邀在上海图书馆报告厅作了题为""MARC21及其在哈佛燕京图书馆的使用""的学术报告。MARC21是在 USMARC的基础上发展起来的新一代MARC格式,在北美得到成功应用后,目前有向其他地区 "	SHGT200402007
图书馆新模式下版权人、图书馆和读者的关系	杜守先:20164696	5	图书馆; 发展模式; 信息资源建设;	"从分析21世纪图书馆发展趋势及其特点入手,提出一种新的发展模式并论述其主要关系。 "	SHGT200402008
我国IT产业结构存在的问题与调整对策	尚志明:09628416	3	IT产业结构; 问题; 调整对策; 中国;	"分析我国IT产业的现状与问题,并提出一系列对策:明确产业结构调整的目标,增强技术创新能力,重视质量认证,深化产权制度改革,调整企业结构,加大市场开拓力度,培养一流企业家队伍。 "	SHGT200402009
关于建立高校图书馆学科馆员和项目馆员制度的思考	刘青芬:00076637	3	高校图书馆; 文献信息服务; 学科馆员; 项目馆员;	"从高等院校的学科建设、教学科研工作的现状和广大教师的迫切需要、图书馆自身发展等诸多方面,阐述建立学科馆员和项目馆员制度的必要性,以及学科馆员和项目馆员的素质要求,并介绍一些成功经验,最后提出一些具体的措施与建议。 "	SHGT200402010
浅谈学士学位论文资源建设	闫江:06605571	2	学位论文; 学士; 资源建设;	"从学士学位论文的特点及价值出发,探讨合理收藏和建设学士学位论文数据库的现实意义。 "	SHGT200402011
高校图书馆在大学生人文精神塑造中的作用	萧林:20668708	3	高校图书馆; 人文精神; 人文教育; 大学生;	"当代的高等教育面临着严重的人文危机,在大学生群体中重塑人文精神时不我待。本文从图书馆人和图书馆的角度出发,论述了高校图书馆人文教育的特点以及开展人文教育的具体措施。 "	SHGT200402012
数字图书馆中基于向量空间模型的文档分类系统	成奋华:02180663|吴家强:06473979	5	信息检索; 文档分类; 向量空间模型;	"介绍一个建立在向量空间模型上的文档分类系统。该系统着重解决向量维数压缩和中文专有词汇获取等问题。在特征项的选取上,我们并不采用文档中出现的全部词汇,而是利用语料库统计信息生成的关键词汇。实验结果表明,较之以采用全体词汇作为特征项进行分类的方法,本方法能有效地进行向量维数压缩,同时也提高了分类准确率。 "	SHGT200402013
同济大学改建一新的图书馆开放		1	 	"<正>2月26日,同济大学图书馆改建竣工开馆仪式举行,校党委书记周家伦、副校长万钢出席开馆仪式并致辞。图书馆改建工作历时15个月,总投入资金3300万元,改建面积达2万多平方米。图书馆首次在正门口设置了门禁系统,师生一律刷卡入馆。为方便读者,阅览区域主要集中在一、二层楼,开放时间和服务面积都大大增加。在馆内一楼新建有60个座位的电子阅览室、120个 "	SHGT200402014
上海市中心图书馆同济大学分馆挂牌		1	 	"<正>4月27日上午,""上海市中心图书馆同济大学分馆""揭牌。同济大学领导和上海图书馆领导以及本市各兄弟高校图书馆负责人出席了在同济大学图书馆中央大厅举行的揭牌仪式。仪式上,中科院院士、同济大学图书馆馆长马在田致辞欢迎各位领导和来宾,校党委书记周家伦与上海图书馆党委书记廖国琴共同为""上海市中心图书馆同济大学分馆""揭牌,上海图 "	SHGT200402015
"对""汇文""系统功能的补充――""荐购""功能的开发"	张琪:08955879	3	荐购; 查重; 流程图;	"介绍计算机系统""荐购""功能的开发,详细讲解""荐购""的各个流程及其功能的实现方法,以及使用的语言和过程。 "	SHGT200402016
从用户角度对图书馆自动化管理软件测试的设计	黄长伟:07004978|关绍云:07004997	4	图书馆自动化; 软件测试; 用户;	"以软件工程理论为指导思想,从用户角度阐述如何对图书馆自动化集成管理系统软件进行测试,包括制定测试计划、功能测试的步骤、系统测试的方法和测试功能的划分等。 "	SHGT200402017
谈谈部分中医药类图书的分类问题	彭永勤:08653636	2	中医院校图书馆; 中医药学; 中图法; 分类;	"围绕中医院校图书馆如何对部分中医药类图书进行分类问题,阐述根据专业性质,把一切有关中医药学内容的图书分入中国医学类中这一分类原则,并介绍部分中医药类图书的分类方法。 "	SHGT200402018
简讯		1	 	"<正>上海交通大学图书馆金毅和黄敏近日收到《The Electronic Library》(电子图书馆)杂志社的确认信,被告知他们撰写的论文""Melody-Based Retrieval of Music""(基于旋律的音乐检索)将发表 "	SHGT200402019
《中图法》第四版计算机软件类目设置与注释的完善	王冠华:10090820	2	中图法; 计算机软件; 类目设置;	"对《中图法》第四版计算机软件类目设置与注释中出现的问题作了分析,并提出相应的修改意见,使图书分类更为科学和客观。 "	SHGT200402020
随书光盘与书目信息一体化网络管理	许方英:07056922	4	随书光盘; 光盘管理; 资源整合;	"根据各图书馆目前对随书光盘的管理方法以及本馆的实际情况,结合已有的图书馆管理系统, 提出利用随书光盘发布系统,对随书光盘和书目信息进行一体化网络管理。 "	SHGT200402021
第七届亚洲数字图书馆国际会议征展通知		1	 	"<正>第七届亚洲数字图书馆国际会议定于2004年12月13日至17日在上海召开。自1998年香港举办首届会议以来,广受各国图书情报界、IT业、电子出版领域众多专家、学者、公司、企业的重视。大会旨在促进IT技术在图书情报、电子出版领域的开发、推广和交流以及各国数字图书馆建设与合作、服务和管理。历届大会上,欧美各国均有著名院士、学科权威教授、专家学者与会作主题报告、开展专题讨论,世界著名的计算机企业、软件企业和国际出版业巨擘也纷纷参与襄助和技术演示,使大会成为名副其实的国际性盛会。 "	SHGT200402022
高校图书馆电子阅览室服务探讨	刘绍荣:06698885|郁志一:06717208	3	电子阅览室; 网络; 服务;	"通过对高校图书馆电子阅览室利用情况的统计与分析,进一步了解高校大学生对电子阅览室的需求,了解电子阅览室管理过程中的弊端,提出一些合理的管理方法,使电子阅览室的功能得到充分发挥。 "	SHGT200402023
入世后外文期刊订购对策	唐依人:07732025|赵炜霞:00129829	3	图书馆; 馆际互借; 外文期刊; 期刊订购;	从行政管理、技术手段和业务方法三方面阐述入世后外文期刊的订购对策。 	SHGT200402024
高校图书馆的赠刊管理措施探讨	查旭东:07525243	2	高校图书馆; 赠刊; 管理; 措施;	"分析高校图书馆赠刊的作用和管理难度,论述对其加大管理力度的必要性,并根据管理实践和体会,探索一套较为可行的管理措施。 "	SHGT200402025
网上信息检索工具研究	曾福兴:08588950	3	搜索引擎; 主题目录; 元搜索引擎; 因特网; 浏览器; 搜索工具;	"对因特网检索工具机器人搜索引擎、主题目录、元搜索引擎、浏览器等进行介绍和探讨,并对网上检索工具的现状进行分析和对未来发展趋势进行展望。 "	SHGT200402026
