篇名	作者	页数	关键词	摘要	filename
仓廪实而服务实――上海对外经贸大学图书馆的国际经济贸易信息港项目建设	王群:33257826	2	 	"<正>作为学校的文献信息集散中心,图书馆资源积累的宽度与厚度,决定着为学校教学科研服务的基础与保障。2012年,在学校大力加强内涵建设的过程中,上海对外经贸大学图书馆抓住此次机遇,成功向学校申报了""国际经济贸易信息港""项目。该项目属于学校重点学科专业建设""国际贸易学科群建设""的子项目,获批项目经费290万元,主要用于建立较为完备的国际经济贸易学科群学术资源体系。 "	SHGT201401005
创新服务模式 数据引领未来――参加华东政法大学图书馆“085”工程项目建设体会	倪咏佳:30927233	2	 	"<正>我来自华东政法大学图书馆现代技术部,平时主要从事图书馆资源建设等相关工作。在我校内涵建设""085""工程项目工作中,作为图书馆的""085""工程项目联络人,我的任务就是协助馆领导做好""085""工程的每一项工作。感谢上海市高校图工委授予我先进个人这个荣誉,这是对我工作的肯定,也是对我今后工作的一种激励。这份荣誉不仅属于我个人,也属于我馆所有为""085""工程项目付出努力 "	SHGT201401007
上海音乐学院图书馆内涵建设的思考与实践	钱仁平:08650927	2	 	"<正>2009年11月,我在天津音乐学院举办的""第五届全国音乐艺术院校图书馆馆长工作会议""做了一个发言,不久这个发言以《音乐图书馆:及其博物馆、信息馆、咖啡馆式变奏》为题在《图书馆报》发表,引起了音乐界与图书馆界的关注,《音乐周报》也转载了这篇文章。言为心声,这篇文章中的观点都是我到任图书馆后的观察与理解,音乐图书馆如何办好、办出特 "	SHGT201401009
2011-2012年度上海高校“085”工程图书馆项目建设表彰名单		 	 	 	SHGT201401010
第二军医大学图书馆荣获校集体三等功		1	 	"<正>根据学校的整体部署与安排,第二军医大学图书馆于2013年年初启动了基于IC理念的改建工作,经过一年的建设,已圆满完成了各项年度既定任务,取得了阶段性成果,改建成效也日益显现。经学校研究决定,授予第二军医大学图书馆2013年度学校""基层建设标兵单位"" "	SHGT201401006
上海建桥学院图书馆馆员赴上海市及周边图书馆考察调研		1	 	"<正>2013年10月-12月,上海建桥学院图书馆馆员赴上海市及周边图书馆参观学习。根据临港新校舍、新馆规划要求,上海建桥学院图书馆开展对标杆高校图书馆考察调研,为吸取经验、开拓思路,细化新馆功能布局,本学期有30多位馆员先后赴上海图书馆、浦东新区图书馆、嘉定图书馆、苏州独墅湖图书馆、上海大学图书馆、上海师范大学图书馆(奉贤校区)、华东理工大学图书馆(奉贤校区)、杉达学院图书馆、同济大学图书馆(嘉定校区)、上海交 "	SHGT201401008
上海海事大学图书馆举办第四届勤工助学学生及志愿者“送老迎新”联欢晚会		1	 	"<正>2013年12月6日晚,海大图书馆在中远报告厅隆重举办了第四届勤工助学学生及志愿者""送老迎新""联欢晚会。本次活动是由图书馆勤工助学学生、志愿者以及图书馆学生管理委员会会员们自行策划、编排,围绕图书馆实际工作场景展开的精彩演出。节目类型丰富,内容精彩,有舞蹈、情景剧、小品、合唱、诗歌串烧、话剧、歌曲、英文剧、葫芦丝演奏、诗朗诵、配音表演等。 "	SHGT201401014
"华东师范大学图书馆举办“妙手参造化,人人写春联”活动"		1	 	"<正>经过精心部署和细心准备,""妙手参造化,人人写春联""活动的开幕式于2013年12月13日上午在华东师范大学闵行校区图书馆二楼大厅举行。开幕式由图书馆常务副馆长张静波主持。复旦大学中国文人书法研究中心主任唐金海教授,华东师大中国书法教育与心理研究中心主任、传播学院教授周斌,华师大古籍所刘永翔教授等14名专家教授出席了开幕式。开幕式上,胡晓明馆长对本次活动的意义作了细致分析,阐述了中国传统文化的优雅与博大精深。 "	SHGT201401016
上海大学图书馆前往南京大学、东南大学、河海大学三校图书馆学习调研		1	 	"<正>2013年12月12-13日,上海大学图书馆党总支书记兼常务副馆长陆铭、副馆长刘华率领由馆办公室、督察室、读者服务中心、资源建设中心、信息服务中心等部门人员组成的上海大学图书馆考察团一行,先后前往河海大学图书馆、南京大学仙林校区杜厦图书馆、东南大学李文正图书馆进行实地调研和业务交流,调研、学习教育部直属""985""、""211""工程重点建设高校图书馆先进经验,进一步推动校图书馆转型发展,提升图书馆服务能力,满足学校师生对图书 "	SHGT201401020
浦东新区图书馆学会高校专业委员会学术研讨会在上海海事大学图书馆召开		1	 	"<正>2013年11月22日,浦东新区图书馆学会高校专业委员会学术研讨会在上海海事大学图书馆成功召开。上海海洋大学、上海第二工业大学、上海电机学院、上海电力学院、上海海关学院、上海公安高等专科学校、上海建桥学院等十多所高校图书馆的馆长和代表出席了研讨会。海大图书馆郑苏馆长对出席本次会议的来宾表示欢迎并预祝会议取得成功。与会代表们分别就建立图书馆学习共享空间、RFID技术在图书馆的应用实践、虚拟技术在图书馆信息导 "	SHGT201401025
《思源籍府书香致远――上海交通大学图书馆馆史》正式出版		1	 	"<正>2013年12月,上海交通大学出版社正式出版《思源籍府书香致远―――上海交通大学图书馆馆史》(ISBN:978-7-313-10665-0)一书,并于上海交通大学图书馆主馆开馆5周年庆典之际发布,这是上海交通大学图书馆有史以来编撰的第一部馆史。上海交通大学图书馆有着117年的悠久历史,有着辉煌的过往与业绩,开创了中国高校图书馆发展史上的多项""第一"",为上海交通大学的发展和中国高校图书馆事业做出了卓越贡 "	SHGT201401027
上海市图书馆学会大学生阅读推广委员会召开2013年第二次工作会议		1	 	"<正>2013年12月23日上午,上海市图书馆学会大学生阅读推广委员会2013年度第二次工作会议在同济大学召开,30余位来自上海地区13所大学图书馆的同仁齐聚同济大学图书馆闻学堂,共同回顾和交流本年度上海市高校图书馆的阅读推广工作。同济大学图书馆馆长慎金花代表主办方致辞,向来自沪上高校图书馆的同仁表示热烈欢迎,并指出,阅读推广是图书馆的社会使命,关注并培养大学生阅读行为和阅读素养,也越来越 "	SHGT201401028
推进服务创优 铸造文化品牌――同济大学图书馆服务型党组织建设初探	李园园:17364114|刘悦如:17458346|曾小娟:17603526|陈欣:08947891	4	同济大学图书馆; 文化传承; 优质服务; 服务型党组织;	"本文从三个方面研究如何推进图书馆服务型基层党组织建设,即服务、文化、创优。依次从服务教学科研,创优助推服务;激扬文化传承,创立文化品牌;开展创优活动,提升服务质量三个方面进行调查研究,探索基层服务型党组织建设的思路、途径及成效。 "	SHGT201401011
步入衰退还是重拾增长?――我国文献传递服务当前面临的挑战与对策	王庆浩:28417539	4	文献传递; 调整; 发展;	"我国文献传递服务已从高速增长的阶段步入缓增长的调整期。本文从实际工作经历出发,通过对工作经验的总结和思考寻找我国文献传递业务新的增长点。 "	SHGT201401012
高被引论文视角下的东华大学学术影响力探析	周晓鸥:15132928|陈惠兰:06598807|刘建平:06607944	6	高被引论文; 引文分析; SCIE; 东华大学;	"本文以Science Citation Index Expanded(SCIE)为依据,以东华大学为例,对其被SCIE收录的论文以及高被引用的论文进行多角度的统计和分析。将全部相关文献套录下来,截取被引频次大于100次和50次的论文视为高频引论文,并进行多角度的统计和分析,客观评价其研究状况、学科研究特点和学术影响力,力图展现东华大学的优势学科及论文科研成果的影响力,以期对学校的学科建设规划以及人才引进提供借鉴。 "	SHGT201401013
艺术院校的信息素质教育研究初探	李歆:26397853	4	艺术院校; 文献检索课; 信息素养教育;	"本文从艺术院校信息素质教育的现状和文献检索课革新的必要性入手,结合上海戏剧学院文献检索课工作实践的经验与问题,探讨艺术院校文献检索课如何向信息素质教育转变和发展。 "	SHGT201401015
E时代高校图书馆流通馆员的压力及应对策略	柳丽花1:28752573|刘金S2:11214037	3	压力管理; 图书馆员; 流通馆员;	"文章深入揭示了当前图书馆流通馆员所面临的压力:资源数字化的压力、来自服务对象的压力、图书馆内部压力以及自我实现的压力,并分别从管理层和馆员层提出了不同的应对策略。图书馆管理层的策略有角色体验、人员合理配置、政策倾斜、适度授权、奖罚分明、专业培训以及鼓励多方面发展;馆员层面的应对策略有培养幽默感、保持良好的精神状态以及规划自己的职业生涯。 "	SHGT201401017
论高校图书馆服务工作的信任关系	蔡屏:22550389	4	信任; 馆员; 读者; 高校图书馆;	"高校图书馆服务质量得以保证的基础在于图书馆与读者之间、馆员与图书馆之间需具备良好的情感纽带。良好情感纽带的维系关键在于彼此之间具备信任。有了信任,读者才有更多的包容与理解;有了信任,馆员才有更大的服务热情与动力;有了信任,图书馆才会有较高的服务满意度。本文在分析高校图书馆信任流失原因的基础上,提出高校图书馆需采取一系列措施建立与加强信任。 "	SHGT201401018
关于我国古籍保护工作的几点建议	董绍杰:12642179|胡光耀:23935387	4	古籍; 古籍普查; 古籍保护; 古籍培训;	"本文针对我国古籍普查和古籍保护工作提出了有益的建议,在古籍普查方面重点阐述了古籍普查成果的具体内容,在古籍保护方面提出了一些建议,包括进一步完善全国珍贵古籍名录申报标准和评选善后工作,创新培训方式,全方位立体式地推进古籍保护工作,既要搞好顶层设计又要发挥基层的首创精神等。 "	SHGT201401019
基于RSS的图书馆立体阅读服务系统研究	黄:30927239	3	RSS; 立体阅读; 服务系统;	"本文分析了立体阅读的概念、发展状态和存在问题,提出充分利用RSS等互联网技术来开展图书馆立体阅读服务,并分析了RSS技术发展现状,提出了三种可利用于立体阅读的RSS技术方案。 "	SHGT201401021
高校图书馆为留学生服务的思考和建议――复旦大学外国留学生阅读情况调研分析	戴行德:06695010	4	高校留学生; 问卷调查; 图书馆服务;	"随着我国""文化强国""战略目标的推进,留学生教育事业迎来了空前的大发展。在通过问卷形式调查复旦大学外国留学生阅读情况的基础上,文章分析了留学生的阅读行为和利用图书馆情况。根据留学生的阅读需求与特点,提出了图书馆应从增加馆藏资源、改进沟通渠道、丰富图书馆网站、设置专职岗位等方面做好留学生服务工作的建议。 "	SHGT201401022
民国时期的文化危机与图书馆转型研究	夏梦杰:30602172|傅荣贤:10665667	5	图书馆转型; 文化危机; 民国时期;	"民国时期的中国处于严重的文化危机之中,文化危机带来了图书馆危机,迫使图书馆改变原有的模式以应对文化危机的挑战,从而推动了图书馆理论研究的创新、近代分类法的变革以及""藏用一体""的图书馆出现,图书馆成为具有社会教育意义的机构。 "	SHGT201401023
微信在图书馆信息服务中的应用	张莹:06711937	4	微信; 图书馆; 信息服务; 数据模型;	"随着智能手机的普及,微信的应用越来越广泛。本文对微信在图书馆信息服务中的应用进行SWTO分析,并选择十家具有代表性的图书馆进行微信应用状况调查,分析微信在图书馆应用中的可行性与用户特征,同时,提出微信在图书馆信息服务应用中的改进措施。 "	SHGT201401024
上海中医药大学图书信息中心藏明赵开美本《仲景全书》述略	王枫:25905530	4	赵开美; 《仲景全书》; 宋本《伤寒论》;	"明代赵开美本《仲景全书》,因其汇编入北宋元v三年(1088年)刊行的小字本《伤寒论》而受到重视,此版本是研究伤寒学不可替代的文献资料。赵开美本人精于校雠,使本书兼具了极高的学术价值与艺术价值,该书入选第二批《国家珍贵古籍名录》。 "	SHGT201401026
大数据驱动图书馆业务应用与服务创新	张计龙:06708025	6	大数据; 图书馆; 采访辅助决策支持; 学科服务; 电子资源使用统计; 监控;	"文章首先分析大数据环境下图书馆面临的挑战和压力:馆藏资源量优势减少,采访经费压力增大,读者对教学和科研活动资源服务提出新要求。随后提出利用大数据相关技术驱动图书馆业务应用和服务创新,建立图书采访辅助决策支持、学科服务支持、电子资源使用统一统计分析和恶意下载监控、图书馆网络与应用系统运行服务监控的新服务模式。最后以复旦大学图书馆为例进行实证研究。 "	SHGT201303002
华东师范大学图书馆藏唐写经卷书影选登		2	 	 	SHGT201303001
华东师大图书馆藏唐写本《妙法莲华经》《大般涅经》介绍	周保明:07548216	2	 	"<正>中古时代,大量的写本经卷系由专职抄经手手写而成,字迹端庄工美,北朝写本书法颇具隶韵,南朝及隋唐写本为楷书间有行草。写经的辨别与鉴定可从纸质、尺幅、书法、题记、内容等方面进行。本文对华东师范大学图书馆藏唐写本《大般涅经》(卷六至七)、《妙法莲华经》(卷三)两份残卷的收藏与鉴定情况略作介绍。《妙法莲华经》,简称《法华经》(梵语:SaddharmaPun d arīkaSūtra),后秦鸠摩罗什译, "	SHGT201303022
基于期刊引文分析的公安图书馆资源建设策略研究	郎文君:23555907|庄敏:29762496	4	公安; 图书馆; 引文分析; 资源建设;	"本文以2011年《中国人民公安大学学报》《上海公安高等专科学校学报》《贵州警察职业学院学报》所刊载的论文为研究对象,从引文量、引文语种、引文类型、引文来源、引文时间及论文作者6个角度进行统计分析,了解公安学术研究类读者的需求,提出公安图书馆资源建设的策略,为公安院校图书馆建设提供参考。 "	SHGT201303003
东海学院图书馆未来建设目标	周肇光:29762497|胡明明:29762498	3	 	"<正>上海东海职业技术学院(以下简称东海学院)创建于1993年,已经走过了20年风雨历程。20年来,校董事会和校领导班子成员,认真贯彻落实党的教育方针,把握市场需求,摆正学校办学方向,树立正确的教育理念,根据国家经济建设和社会发展的需要,提出了""品质+能力""的人才培养模式,为社会培养了大量的具有技能特色的应用型人才,赢得社会赞誉和教育主管部门的充分肯定与鼎力支持。 "	SHGT201303004
提升民办高职院校年轻馆员业务素质的途径探索	韩甬生1:29763430|张骏2:21542838	3	图书馆管理; 能本管理; 馆员素质;	"民办高校办学模式是现近高等教育的一支新奇葩,本文着重探讨如何提升该类院校图书馆年轻馆员业务素质的几个途径,采用能本管理这种新型人力资源管理理念,通过对能力人的管理完成对图书馆的有序管理,从而提升民办高职院校图书馆的整体业务水准和在行业领域内的学术地位。 "	SHGT201303005
图书馆藏书价值初探	开蓉嫣:08554242	3	图书馆藏书; 藏书价值; 图书质量;	"本文通过对影响图书价值各因素的分析探讨,试图给出一份图书价值清单。提出在图书馆采访工作中,应结合图书价值清单与本馆的目标读者需求,从图书的内容价值、读者的阅读体验及图书的个性特征三方面判断藏书价值,建设一个拥有较高价值的图书馆藏书体系。 "	SHGT201303006
图书馆参考咨询馆员语言交流能力问题探讨	周思繁:10558134	3	语言交流能力; 参考咨询; 服务质量;	"参考咨询馆员在服务过程中的语言素养是提高服务质量的重要因素之一。本文基于语言交流这个角度,从语言交流在参考咨询服务中的作用、语言交流在参考咨询服务中的具体应用、如何培养参考咨询馆员语言交流能力三个方面展开论述。 "	SHGT201303007
机构库建设过程中教师抵制心理研究	庞红:07731957|阮小芳:07731974	4	机构库; 抵制心理; 教师;	"机构库的内容获取问题始终是困扰机构库发展的一大难题。由于各种原因,教师可能采取不合作的态度,抵制向机构库提交研究成果。为了减少教师向机构库提交研究成果的阻力,需有效采取措施减少或削弱教师的抵制心理。 "	SHGT201303008
高校图书馆志愿服务研究述评	曹福勇:45692546|黄文洁:27377631	5	志愿服务; 高校图书馆; 述评;	"高校图书馆志愿服务开展20年来,于2009年起进入快速发展阶段。本文透过20年来积累的83篇文献,总结志愿服务在高校图书馆开展的成功经验和存在的问题,探索高校志愿服务发展的创新突破口。 "	SHGT201303010
云计算技术的关键问题及在图书馆的应用	景红霞:28957611	4	云计算; 关键问题; 图书馆; 应用;	"云计算技术以其强大的功能在全世界商业领域得到了初步的应用,也引起了图书馆界的广泛关注。本文介绍云计算的关键问题及在图书馆的应用情况。 "	SHGT201303012
上海大学图书馆举办首届读书月活动		1	 	"<正>为了营造积极向上、清新高雅的校园文化氛围,更好地引导和鼓励大家养成良好的阅读习惯,提高审美修养、人文底蕴和阅读品味,上海大学图书馆举办了以""‘阅’读越精彩――阅读与中国梦""为主题的首届读书月活动,时间从2013年5月2日至2013年5月31日。活动主要包括图书馆讲座:""走进超星电子书""、""信息如烟海,搜索览新知――搜索引擎123""、""因为 "	SHGT201303009
美国辛辛那提大学图书馆王雪茅馆长访问上海交通大学图书馆		1	 	"<正>2013年6月14日,美国辛辛那提大学(University of Cincinnati)图书馆馆长王雪茅访问上海交通大学图书馆,并举行了近两个小时的交流座谈会,上海交通大学图书馆馆长陈进,副馆长林皓明、郭晶,各部室主任、业务骨干及青年馆员等30余人参加了会议。交流会上,王馆长首先展示了辛辛那提大学作为全美最美大学校园之一的风貌,以及该校 "	SHGT201303011
2013年上海高校“085”工程院校图书馆馆长会议召开		1	 	"5月17日下午,2013年""085""工程院校图书馆馆长会议在无锡新区图书馆10楼会议室召开,来自上海23所市属本科院校图书馆馆长出席会议。会议由华东政法大学图书馆常永平馆长主持。上海高校图书情报工作委员会庄琦秘书长作了关于本市""085""项目图书馆进展的报告。上海师范大学图书馆庄雷副馆长作了题为""智慧图书馆:‘085’项目建设的新使命""的主题发言;上海政法大学图书馆毕秀水馆长作了""构建 "	SHGT201303013
上海财经大学图书馆与西弗吉尼亚大学图书馆互派馆员交流访学		1	 	"<正>2013年5月13日下午,美国西弗尼吉亚大学(WVU)图书馆的馆员Martha Yancey女士和邱晶女士抵达上海,开始在上海财大图书馆为期两周的交流学习。期间,两位馆员不仅深入到图书馆的具体业务部门开展工作交流,并在财大图书馆的协调下,到上海市其他高校及公共图书馆参观学习。交流期间,两位馆员举办了两场精心准备的主题讲座,向财大图书馆馆员介绍WVU图书 "	SHGT201303019
《上海市志・图书馆事业卷(1978-2010)》(高校部分)编纂工作启动及实施方案馆长会议召开		1	 	"<正>2013年6月25日下午,""《上海市志・图书馆事业卷(1978-2010)》(高校部分)编纂工作启动及实施方案馆长会议""在同济大学图书馆闻学堂召开。来自本市59所高校图书馆(包括驻沪军事院校)的馆长、书记及相关人员共63位出席会议。上海高校图工委秘书长庄琦介绍编纂启动情况,结合秘书处收集的相关资料对《〈图书馆事业卷〉篇目》(征求意见稿)逐篇 "	SHGT201303021
2013年上海市高职高专及民办高校图书馆馆长会议圆满落幕		1	 	"<正>5月17日,在上海市高等学校图书情报工作委员会秘书处和高职高专分委员会的支持下,""2013年上海市高职高专及民办高校图书馆馆长会议暨数字阅读推广研讨会""在上海医疗器械高等专科学校成功召开。学校主管校长丁岳伟教授、市高校图书工作委员会秘书处成员出席了会议,图文信息中心主任唐坚刚主持会议。丁岳伟副校长在致辞中介绍了上海医疗器械高等专科学校进入骨干院 "	SHGT201303023
“海大人文”助推海事大学建设人才新高地――记上海海事大学图书馆“海大人文”特色教育系列活动	李晓赤:10634703|姜饶君:29762502	5	上海海事大学图书馆; “海大人文”; 素质教育;	"图书是人类智慧的结晶,高校图书馆是学生汲取知识、提高修养的重要场所。本文介绍上海海事大学图书馆以让学生放飞心灵、感悟人生为目的而打造的""海大人文""品牌。该活动不仅引导学生与好书经典作友,更为学生搭起学以致用的平台,实现在实践中学习,弥补课堂教育的不足,充分发挥素质教育的职能。 "	SHGT201303014
高校图书馆占座管理中的柔性管理和刚性管理	夏知平:06701516|徐一新:00023948	4	占座行为; 高校图书馆; 阅览室管理; 读者服务;	"在图书馆内以物占座是一种浪费资源和自私的行为。本文列举国内高校图书馆常见的占座管理方式及优缺点,重点介绍复旦大学医科图书馆以宣传、劝离和偶尔清理占座物品的柔性管理法,建议在柔性管理效果差时采用经常性清理占座物品的刚性管理,并提出刚性管理中需要注意的事项。文章还讨论分析了占座管理中的柔性管理和刚性管理的特点和两者间的关系。 "	SHGT201303015
南京大学图书馆读者服务工作的创新实践与思考	袁晓园:22159756	5	读者服务; 智慧图书馆; OPAC系统;	"南京大学图书馆的读者服务工作经过数年发展,已经初步形成了独特的服务模式,本文从文化营造、服务手段和技术支撑、馆员素质的培养和提升、服务改进的思考等多角度、多层面来阐述读者服务工作的变革与发展,以期为其他高校图书馆同仁提供有益的参考和借鉴。 "	SHGT201303016
《汉语大词典》首例书证提前拾补	马智忠:29762506	6	汉语大词典; 书证; 时代;	"本文继《〈汉语大词典〉拾补》《〈汉语大词典〉商补》及相关论文之后,举《汉语大词典》书证首例滞后六十三条,以期对该书将来的修订略有补益。 "	SHGT201303017
图书情报专业教育全球化动态	李农:08785966	5	图书情报专业教育; 学位资格; 国际认证; 教育计划; 课程;	"在欧美,为了保证图书情报专业的教育质量和提高专业资格的跨国流动性,已建立起支持专业培养课程的等价性与互换性的机制,教育机构的名称,从library school变成information school,同时,课程内容也发生了很大的变化。文章就目前国外的图书情报专业教育的全球化动态进行了论述,以供我国的图书情报专业教育借鉴。 "	SHGT201303018
美国大学图书馆OA资源的利用与建设――对美国100所大学图书馆OA资源的调查与分析	孙淑凤:27771056|刘华:09541428	4	OA资源; 文献资源建设; 大学图书馆; 美国;	"按照《美国新闻周刊》公布的数据,对美国排名前100的大学图书馆OA资源的利用和建设情况进行了相关调查,系统总结了美国大学图书馆在OA资源建设和利用方面的现状,分析了其存在的问题。与之相比,国内大学图书馆在OA资源的建设和利用方面还存在一定差距,如何将国外的经验运用到国内大学图书馆OA资源建设中,本文具有借鉴意义。 "	SHGT201303020
阅读推广:高校图书馆服务“新常态”	范并思:07530184	4	 	"<正>1图书馆的新常态2002年11月,中国图书馆年会在广东东莞召开。开幕式上,上海图书馆吴建中馆长作了唯一一个学术报告,标题是《新常态新指标新方向》。这个标题中的新词汇是""新常态"",按建中馆长的说法,""新常态,new normal,大概意思是,高增长的时代 "	SHGT201302004
复旦大学图书馆藏朝鲜活字印本书影选登		1	 	 	SHGT201302003
