篇名	作者	页数	关键词	摘要	filename
连续出版物编目与利用若干问题分析	Loanne Snavely:06440004|Katie Clark:07531006|刘明裕:06445280	 	 	"<正> 图书馆管理者通常认为读者具有起码的连续出版物查找能力,但涉足咨询服务第一线后就会发现读者在查找所需刊物时所遇问题与困难之多足以令人惊诧不已。事实上来馆的学生,尤其是新生在查找连续出版物方面普遍感到神秘与陌生,他们对一些基本问题不了解,习 "	SHGT199802026
俄罗斯知识界与大众阅读现状	姚育德:08613104	 	 	"<正> 始于戈尔巴乔夫当政时期的前苏联和俄罗斯实施的社会政治、经济体制改革,引发了其本国意识形态、思想文化和价值观念的嬗变,给知识界和大众阅读事业带来巨大而深远的影响。作为大众阅读组成部分的读书、书刊杂志出版与发行以及读者和图书馆的交往,不仅因其本身重要性,更因其在显示社会思想和价值观念变革过程中,成为社会动态和力量配置的标尺,而受到俄罗斯社会学家们的极大关注。全俄社会舆论研究中 "	SHGT199802027
近代特种文献开发研究的战略思考	祝均宙:22977864	 	 	"<正> 传统意义上的图书馆,历来将三大文献载体――图书、期刊、报纸作为馆藏文献的主体对象。事实上,作为人类一切文化载体的知识宝库,当今许多国内外著名大图书馆,早已突破三大文献范畴。本文主要从近代特种文献在采访、市场拓展、开发研究三个角度谈些看法。 "	SHGT199802028
简讯		 	 	"<正> 1998年1月9日下午,上海大学图书馆在嘉定校区联合图书馆新源报告厅举行1997年度精神文明建设表彰交流会。来自上大文荟、联合、徐汇校区、嘉定东校区的图书馆员及上大其他校区图书馆领导共200余人参加了会议。会上,对荣获1997年度校与馆文明窗口的部门、 "	SHGT199801017
多媒体技术及其在图书馆的应用	刘青芬:00076637|万燕清:20631717|胡吉兵:21032364	 	 	"<正> 关于多媒体,可以认为是以计算机为中心,利用文字、图形、影像、动画、声音、视频等不同的信息媒体,在不同的界面上组合及流通,使这些信息可以在计算机中存取、转换、同步化等,达到计算机与用户交互式及多样化的操作环境。这种将声、图、文等综合在一起的计算机处理的信息,称之为""多媒体""(Multimedia)。 "	SHGT199801000
从可接近性谈图书馆集成检索系统的优化	王海蓉:08554982	 	 	"<正> 在我国图书馆自动化系统中,主流是集成化系统的开发,以实现采访、编目、流通、公共检索、连续出版物管理等功能,其中以公共检索系统与读者关系最为密切,是整个集成系统功能的综合体现。在图书馆模式由以收藏为主向以检索为主转变的今天,集成系统中的公共检索系统正在向实用和面向读者的方向发展。作为一个开放的系统,检索系统的功能在于接受用户输入的某一特定需求的有关信息,然后以各种方式输出信息资料,为这些用户提供 "	SHGT199801001
上海市图书馆学会召开第五次会员大会		 	 	"<正> 上海市图书馆学会第五次会员大会于1月22日在上海图书馆举行。上海市副市长龚学平发来贺信,市委宣传部副部长方全林到会祝贺。400多位会员参加了大会。大会通过了修改后的《上海市图书馆学会章程》和干树海同志所做的第四届理事会工作报告,并投票选出了 "	SHGT199801002
浅谈图书馆自动化网络管理中的几个问题	吴雄兴:08572048|宋爱武:09620866	 	 	"<正> 我馆于1996年初选购了北京息洋公司的GLIS网络版的图书馆自动化管理系统。经过一个阶段的安装、调试,各子系统(除期刊管理外)先后投入了运行,目前系统运行状况较好。现就工作遇到的几个问题,提出来与同仁讨论。1 安装方式的选择 GLIS系统由编目、采访、流通、检索等子系统组成,每个子系统主要由系统运行文件(.EXE.BAT)、配制文件(CFGS)、数据文件(DBF)、日志文件(BACKUP)构成。系统的安装主要有以下 "	SHGT199801003
FoxPro在图书馆工作月报表上的应用	徐莹:08572055	 	 	"<正> 我馆每月读者借阅流量的统计,是件较繁琐的事情。每月上旬收到各部室送来的借阅统计数据后,要进行数据核对、整理及计算,再做出报表。在运算过程中,为了报表的准确性,计算完毕还要复算数遍。制作一张月报表,总共化费时间125分钟。本文采用FoxPro循环语句编程,用计算机处理月报表,这样从操作上讲,统计员只需输入原始数据并执行程序;从时间上讲,化费仅是输入原始 "	SHGT199801004
读《论“双不”方针与图书馆的服务与管理》一文有感	刘柏秋:09521280	 	 	"<正> 我是80年代初参加图书馆工作的。刚进馆时老同志总是对我们讲:""图书馆工作看似简单,但真要做好并不容易。我们应当做到‘为人找书’,‘为书找人’。""话语虽然简短,但内涵却很丰富。图书馆工作人员要想为读者找到急需的文献资料,就要熟悉馆藏,熟悉图书馆的业务;要想为文献资源找到它的""真正主人"",就要熟悉你所从事的专业,熟悉每一位读者,同时必须具有敏锐的信息意识和信息加工、信息传递能力。图书馆工作人员若没有广博的知识,没有良好的心理素质和敬业精神是不可能成为""情报中介人""和""信息导航员""的,更不可能在读者 "	SHGT199801005
图书馆自动化对图书馆员角色的影响	宾锋:08572025|沈海云:07535555	 	 	"<正> 图书馆自动化管理系统的建立,使得图书馆传统意义上的日常工作发生了较大的变化,尤其是较大程度上改变了以前繁琐的图书编目、流通、数据统计等工作。对此,众多的业内人士有较多的论述。但对于因此而带来的另一个变化――即图书馆员角色和功能的改变以及由此带来的影响,却少见论及。在笔者看来,就目前及未来的图书馆工作而言,这是一个很值得探讨的问题。 "	SHGT199801006
计算机网络与图书馆现代化建设	郑燕华:08554597	 	 	"<正> 当前,Internet已经进入我国高等院校、科研机构、商业团体等机构,甚至进入家庭。研究计算机网络技术对图书馆的影响以及图书馆如何顺应新的信息时代的要求,采取适当的对策,这是摆在我们面前的一个重要课题。我们应重视图书馆的现代化建设,提高利用计算机网络技术的能力,充分发挥联机数据库、光盘数据库等文献信息资源,更好地为读者服务。 "	SHGT199801007
迈向21世纪的中国图书馆事业	王伊:13224725	 	 	"<正> 图书馆事业是国家为了满足知识交流的社会需要,而组织各类图书馆从事文献搜集、处理、存储和利用的一项大规模的社会活动。始于20世纪初的我国近现代图书馆事业经过近一个世纪的曲折发展,终于获得了举世瞩目的成就。到1995年底,我国已有各类型图书馆约26万个(不包括儿童图书馆及中小学图书馆、军队图书馆)。其中包括公共图书馆2619个,藏书3亿多册;高校图书馆1054个,藏书4亿多册;科研图书馆8000多个,藏书10亿多册。古代图书馆的主要社会职能是保存人类文化典籍,近代图书馆又担负起了社会教育的职能,而现代图书馆则更主要地具备传递科学情报、开发智力资源等职能。在世纪之末的今天,中国图书馆事业既面临机遇又面临着许多挑战。图书馆如何改进与更新自己的传统业务,从容应对新世纪的挑战, "	SHGT199801008
网络环境下的高校图书馆信息服务探讨	谢慧芬:08966607	 	 	"<正> 近年来我国网络建设进程明显加快,众多的信息网络已开通,并且进行了互联。联网范围的进一步扩大,特别是与INTERNET网相连接,使得获取信息的渠道和利用信息的方式发生了很大的变化。加强网络环境下信息服务的研究,这是高校图书馆当前的一个重要课题。1 网络环境下的信息资源开发是信息服务的基础目前,INTERNET遍及世界各地,网上浩如烟海的信息资源异常的丰富,令人耳目一新,目不暇接。INTER-NET的信息涉及人们的生活、教育、经济、文化、宗教、军事等各个领域,并且具有广泛的公众服务性,如:文化 "	SHGT199801009
生产力信息化趋势下的高校图书馆信息服务	张曙光:07954167	 	 	"<正> 1 关于生产力信息化趋势第三次科技革命将我们带入了信息时代,人类进入了信息生产力阶段。当代生产力信息化主要表现在:1.1 产业信息化。各种产业发展的主要动力和战略资源、从材料、能源等物质资源转变为科技、知识、文献等信息资源。依靠信息资源,提高物质资源的作用效率,发挥其巨大潜力;节省人力、物力、财力等物质资源的使用,开发各种新材料、新能源;在产业所创造的巨大价值中,信息资源的附加值和含量超过了各种物质资源的比重。 "	SHGT199801010
国际信息交流者若干问题初探	袁红:08992619	 	 	"<正> 信息是一种战略资源。二次大战后,信息技术飞速发展,打开了人类认识的另一扇窗口。地球日益""缩小"",不同文化背景的人们的交流日益频繁,其中尤其以全球信息的跨国流动,即国际信息交流发展最为迅速。为了在国际间进行有效的交流,最大限度地共享信息资源,增进国际间的理解与合作,维护人类的和平与发展,有必要对国际信息交流的渠道、内容、特点、原则等相关问题有所了解。 "	SHGT199801011
走出中文图书采购的困境	毛一波:09411244|周文芳:10290176	 	 	"<正> 图书馆藏书是图书馆工作赖以生存和发展的基础,而图书采购工作则是图书馆藏书建设的一个重要组成环节,是图书馆藏书补充的主要手段和来源,对图书馆开展工作和完成其职能关系甚大。但是,近年来图书价格猛涨而购书经费短缺,严重地困扰着采购工作的顺利进行。下面以浙江农大图书馆为例,就中文采购面临的问题及其对策谈几点看法。1 中文图书采购所面临的困境 "	SHGT199801012
中美图书馆计算机编目工作的比较研究	管蔚华:07536552	 	 	"<正> 在图书馆自动化的潮流之中,计算机编目处于最核心、最能反映时代特点的地位。美国是计算机编目开展最早,进展最快,领导着世界计算机编目潮流的国家。因此,考察美国计算机编目工作先进成果和成功经验,对开阔眼界,迅速提高我国计算机编目工作水平是很有必要的。1 中美计算机编目发展概况图书馆现代化的发展历史是和人们对计算机的认识紧密联系的。由于文献信息的激增,迫切需要对文献编目工作的操作方式进行实质性的改革。图书馆顺应了电子计算机问世的历史机遇,以机编目录为突破口,开始了图书馆现代化事业的研究。1965年,美国国会图书馆开 "	SHGT199801013
图书标引应采取互见分类和分析分类方法的几种情况	王宇菁:08522078	 	 	"<正> 在我国大多数图书馆,分类号不但起组织分类目录的作用,还用来组织分类排架。因此,同类图书的集中归类、一书一号不但是图书分类的原则,还是图书分类排架的要求。然而,当今社会,科学技术发展日新月异,学科之间相互交叉、相互渗透,产生了边缘学科、交叉学科;社会科学与自然科学的溶汇,产生了综合性学科;而一门学科的原理和方法又常常被另一学科所运用。反映这些学术成果的图书文献比比皆是。由于列举式分类法体系本身的局限,又考虑到图书分类排架的要求,这类文献往往只归入一个类目。对未被揭示的学科内容可采用互见 "	SHGT199801014
外文期刊联合目录――通向资源共享的门径	胡丹芬:06698035	 	 	"<正> 1 编制外文期刊联合目录的必要性目前,全世界每年出版报刊在12万种以上,世界各国图书馆都面临着不同程度的经费短缺与报刊价格逐年上涨的矛盾。就国内而言,外文期刊的价格上涨速度、上涨幅度远远超过了投入经费的增长速度与增长幅度。如何解决这一矛盾?外文期刊文献资源的共建共享已成共识,而真正要实现资源的共享还需要切合实际的检索工具方便读者利用。对外文期刊而言,编制外文期刊联合目录就不失为一种行之有效的途径。2 我国外文期刊联合目录编制的现状 "	SHGT199801015
中国化学工业类期刊调查统计与分析	王丽芳:07535179|周维德:07529302	 	 	"<正> 中国是世界上化工技术发展较早的国家之一。随着人类文明的发展,化工技术已越来越成为人们日常生活必不可少的部分。经过建国以来40多年的建设,我国化学工业由小到大逐步发展,初步建立起门类大体齐全的体系。与之相关的记载、论述化学工业研究成果的中国化学工业类期刊也得到了很大的发展,本文对这些期刊进行了大量统计与分析,力图探寻、反映中国化学工业类期刊的历史沿革以及化学工业研究者文献利用的特点与规律,以便更好地进行期刊管理与开发。 "	SHGT199801016
传统阅览室“硬件”环境的优化	陆彩凤:08518911	 	 	"<正> 根据馆藏文献资料形式的不同,我国高校图书馆的阅览环境可分成两种类型:一种是馆藏以印刷型文献资料为主的传统阅览环境;另一种是馆藏以包括电子出版物等在内的各种文献形式,外加""虚拟""馆藏文献资料的阅览环境。关于后一种阅览环境所涉及的问题,诸如电子阅览室、多媒体阅览室、光盘检索室等的创建与优化,已有许多学者撰文论及,兹不赘述。本文所要讨论的是馆藏以印刷型文献资料为主的传统阅览室""硬件""环境的优化问题。 "	SHGT199801018
"提高读者获取信息能力,有效利用图书馆――记华东师大’97图书馆利用宣传周活动"	杭瑞勋:07536617	 	 	"<正> 作为校园文化节系列活动之一,我馆于1997年5月举办了为期一周、题为""掌握金钥匙""的图书馆利用宣传活动。本届宣传周活动的宣传口号为:""学会有效利用图书馆,等于掌握了一把开启知识宝库的金钥匙。""我们紧紧围绕""提高获取信息能力,有效利用图书馆""这个主题,向读者作广泛的宣传。 "	SHGT199801019
同读者交谈是做好报刊阅览工作的好方法	黄之侬:08610761	 	 	"<正> 报刊阅览室的特点是流通量大,流通过程短,信息内容多而丰富,是当今信息社会在图书馆的一个缩影。我在报刊阅览室工作多年,感到经常同读者交谈在整个读者服务工作中有其重要的作用。通过同读者交谈可以缩短管理人员与读者之间的距离,密切与读者的关系,这是做好读者工作的重要条件。有的读者对工作人员缺乏信任,在查阅期刊、报纸时,碰到没有查到的资料便怀疑工作人员把期刊借给了熟人或是认为工作人员业务不熟悉、工作不细心等,就托熟人来查,这些做法和想法不免影响了工作人员做好读者服务工作的积极性。要解决这类问题,工作 "	SHGT199801020
读者参与图书馆管理的意义	潘育谊:07521392	 	 	"<正> 为迎接211评估,华东理工大学图书馆和校团委于1995年12月成立了由各系品学兼优又热爱图书馆事业的20位学生组成的""图书馆学生管理委员会""(简称""图管会"")。""图管会""持续至今,已经三届。我们在实践中深深体会到,读者参与图书馆管理,对于促进图书馆服务工作、增强馆员和读者的感情交流和促进两个文明建设有着十分重要的意义。1 读者参与图书馆管理,促进了图书馆服务水平和服务质量的提高。图书馆实行开架借阅,设立咨询服务台、计算机查询等等,是对传统的跑库借阅方式的改革。如今,学生读者以主人翁的身份,出谋划策,以丰富多采的形式,积极参与图书馆建设,使馆员和读者在文献的开发和利用中都克服了盲目性,变被动为主动。""图 "	SHGT199801021
高校系资料室赠书管理浅识	汪海波:09030669	 	 	"<正> 改革开放以来,许多高校都接受了校内外大量的赠书,赠书已成为高校图书馆丰富馆藏的一个重要来源。作为校图书馆二级单位的系资料室,我们也采取各种措施积极争取赠书,加强赠书管理工作,取得了一些经验。1 系资料室赠书管理的特点1.1 种类繁多。包括各种公开出版和未公开出版的专著、译著、教材、期刊、报纸、会议 "	SHGT199801022
作者检索及其效果研究	王云:09473555	 	 	"<正> 1 多产作者类型1.1 多产作者的三种类型如果在所有关于某个专题的切题文献中有2篇或2篇以上为同一作者所写,则称此作者为特定专题文献的多产作者。对专题文献作者进行调查,可以了解科学工作者对该专门领域的贡献大小。我们以""‘计算机情报检索’用户切题文献案例材料""来作分析(该案例以""计算机情报检索的理论与实践""为题对中文期刊数据库进行系统检索并从中获选出300多篇由用户判断为有价值的切题文献,这些文献被用作为总结检索经验的案例材料)。分析表明,专题文献的多产者有三种类型:(1)质量型(A型)作者:致力于创新和开拓,所发表的多 "	SHGT199801023
北美高校图书馆的管理:过去的做法与革新方法的结合	Rita A.Scherrei:22703582|爱米:22704603	 	 	"<正> 北美高校图书馆的编制与管理一直都是因袭着层次非常分明的方式。无论是教育机构、政府机构,甚至于商业机构,多数大机构的模式就是将策划、编制、人事安排、指挥以及控制资源的责任都掌握在少数几个行政人员以及主管的手中。你可以摹想以这种方式管理的图书馆就像一个三角形,它的行政首长,也就是图书馆馆长,在三角形的尖端。当你从三角形的尖端往下滑,你或许可以想像到副馆长们就在馆长的正 "	SHGT199801024
国际图书馆联合会网络概述	曾福兴:08588950	 	 	"<正> 1 背景国际图联网(IFLANET)是在1993年提出的,其目的是想改善国际图联总部及其地区办公室、会员和全世界图书馆界之间的通信状况。1994年建立了IFLA-L。1995年开发了国际图联万维网服务。整个1996年,由于开展了电子服务,国际图联在改善通信方面进一步取得了丰硕成果。 ""虚拟国际图联""已经建成并在不断壮大,正以为图书馆界提供情报服务的面目出现在Intermet上。现在,国际图联网正处在一个引人注目的发展阶段。许多分部、圆桌会议已开始向国际图联网提供文献、报告和计划等情报。国际图联总部通过国际图联网和Internet上其他的邮寄名单定期与其成员通信。随着人 "	SHGT199801025
OCLC促进人类知识资源的共享(下)	张海燕:21019012	 	 	"<正> 3.2 参考服务3.2.1 OCLC FirstSearch FirstSearch服务是OCLC提供读者自行操作检索的一项综合参考、馆际互借、线上全文资料供应和文献传递等四种功能的服务。FirstSearch提供60多种线上资料库供检索,其中WorldCat及NetFirst是OCLC自己研究开发的产品。其余则大多系OCLC与各家资讯供应商与发行者洽商好合作方式条件,由OCLC透过FirstSearch代理经销资讯产品或服务。据称此项服务在世界各国推展成效颇佳,惟在台湾尚未臻理想。 "	SHGT199801026
《天一阁藏明代方志选刊人物资料人名索引》简评	吕志毅:07075261	 	 	"<正> 由华东师范大学图书馆古籍部主任郑麦教授主持编写的《天一阁藏明代方志选刊人物资料人名索引》一书,已由上海书店出版社出版了。它的问世,对于加快寻检、研究旧志人物资料的步伐,具有极大的推动作用。自是我国古籍整理出版领域百花园中的一支奇葩。在我国历史上素有编纂地方志的优良传统。历代所修的志书,其种类多,数量大。然损失也相当可观。民国以前的旧志存于今者仍不少于8700余种,是我国传统文化宝库中的珍贵财富,是微观研究各个不同历史时期地方社会综合性的地情书。从旧志内容看,人物部类几占全部旧志之半,这是读志、用志者所熟知的事。 "	SHGT199801027
《中美书缘论丛》前言	钱存训:10313964	 	 	"旅美学者钱存训教授为蜚声中外的中国印刷史专家,年届耄耋,著述不辍,新近将历年有关论文结集为《中美书缘论丛》,以纪念中美文化交往一百年。承先生雅意,先将该书前言在本刊先为发表。谨此致谢,并祝先生人笔两健,著作日新。 "	SHGT199801028
《上海高校图书情报学刊》1997年总目次		 	 	 	SHGT199801029
简讯		3	 	"<正> 1997年8月30日至9月6日,上海大学图书馆馆长魏光普教授在丹麦首都哥本哈根参加了国际图联第63届年会。与会期间,他代表上海大学图书馆办理了参加国际图联的手续。这样,上海大学图书馆继交大、复旦、同济、华东师大之后,成为上海第5个加入国际图联的大学图书馆。(鲍国海) "	SHGT199704017
上海交通大学数字图书馆原型的体系结构	郑巧英:00022469|杨宗英:09606413|王榕榕:09601165	4	 	"<正> 1 建设目标至2000年,上海交通大学将创建一个数字图书馆原型。届时,上海交通大学数字图书馆将拥有数字化馆藏300GB以上,它们将包括联机目录和电子参考书,如:索引、摘要、辞典、百科全书、电子全文杂志、会议录、多媒体读物、影视片、动画片和计算机软件等,约占当时实际使用的馆藏文献的30%以上。该数字图书馆原型的建成,不仅可以以先进的电子技术与优 "	SHGT199704000
“图书馆自动化信息管理系统联合招标第二轮评标会”在复旦举行		1	 	"<正> 由中国高等教育文献保障系统(CALIS)管理中心组织、复旦大学和西安交通大学牵头、北京大学协办的""图书馆自动化信息系统联合招标第二轮评标会""于1997年11月14日至25日在复旦大学举行。从第一轮评标会九家投标的软件中选出的三家软件公司分别进行了Horizon "	SHGT199704001
“’97中国电子图书馆技术研讨会”在复旦举行		1	 	"<正> 由国家教委图书馆工作委员会主办、SUN公司发起并资助、复旦大学图书馆承办的""’97中国电子图书馆技术研讨会""于1997年11月11日至12日在上海复旦大学逸夫楼举行。来自北京大学、清华大学等75所大学和北京图书馆、中科院文献信息中心、上海图书馆的180位图书馆馆 "	SHGT199704002
客户/服务器技术在中小型图书馆管理系统中的应用	余粟:09581268|徐子远:08609010	3	 	"<正> 1 前言目前,我国不少大型图书馆实现了图书馆管理的计算机化。同时,市场上涌现了一批功能优异的应用于图书馆的自动化系统集成软件。它们有的是从国外引进的,也有自行开发的。这些系统软件都有一共同的特点:都比较适用于大型的图书馆,而且必须从软件和硬件上配套引进。这些硬件都是专用机,只能用于图书馆管理工作,而不能进行其他的各项工作,如文字处理、科学计算等。对于一些学校、机构、工厂、研究所 "	SHGT199704003
我馆自动化网络系统的设计思想及特点	黄长伟:07280884	2	 	"<正> 在学校领导和有关部门的大力支持下,经过图书馆全体同志的共同努力,历时近两年的时间,我馆自动化网络系统一期工程已经建成并正式运行。该系统在省内专科学校图书馆中是比较先进的。 "	SHGT199704004
上海高校图书馆评估指标的修订及其实施	金善勤:08561175	3	 	"<正> 1992年到1994年,上海市高校图书馆进行了评估,作为评估依据的《上海市普通高等学校图书馆评估指标体系及评估标准》,为评估的成功起到了应有的作用。但在实践后回顾似又有改进的必要,尤其是随着图书馆事业的发展,指标体系也必须作相应的改进。上海市高校图书馆评估指标体系可以从下述几个方面考虑修订。 "	SHGT199704005
关于加强数据库建设的几点建议	李振钱:06696792	2	 	"<正> 1994年底,中国教育科研网(CERNET)正式启动,进入了实质性建设的阶段。在此之前人们比较多地只能在文章中或口头上谈论Internet,似乎这还是比较遥远的事情,但一年后的1995年底,CERNET网就在全国开通了。许多高校都建起了校园网,并与CERNET联网。人们开始在计算机屏幕前漫游Internet。这是一个了不起的转变,这一转变促使图书馆界必须实实在在地为网络提供数字化的文献信息资源。信息 "	SHGT199704006
图书馆自动化系统商品化标准化初探	王海蓉:08554982	2	 	"<正> 1 图书馆自动化系统的现状和问题随着计算机技术的推广和应用,我国图书馆自动化建设发展很快,已开发出数以百计的自动化专用软件。图书馆实行计算机管理,大大改善了图书馆的服务手段和服务质量。随着""中国教育科研网""(CERNET)工程的实施,我国图书馆的自动化逐步向网络化发展。但是, "	SHGT199704007
