篇名,作者,页数,关键词,摘要,filename
工笔细描中国智库全家福——评《中国智库索引》,黄静:40820756|徐路:33453007,5,中国智库; 权威总目; CTTI系统; 工具书; 书评;,"[目的/意义]为更好了解国内智库现状及收录情况。[方法/过程]本文从工具书的使用和特点等多方面分析比较南京大学出版社2018年出版的《中国智库索引》及CTTI系统。[结果/结论]该书收录国内598家智库,全书共69.3万字,是一部较为权威的全国性智库总目,是一本收录完备、信息精准、检索方便、质量优良的机构指南类工具书,兼具历史性和时代性、独立性和延伸性、实用性和学术性,较为全面地反映了国内智库的整体情况,为中国智库描绘了一幅全面准确、生动细致的""全家福"",对于中国智库研究具有重要意义。 ",ZKSL201904017
第五届中国特色新型智库建设学术研讨会（西安）及征文通知,,1, ,"<正>我国智库经过几年的发展,已步入一个新的阶段。智库建设应树立""智库+""思想,将学术研究思想进一步凝练、发展、凝集到智库的政策和措施上。为此,西安电子科技大学与中国科学院文献情报中心联合主办第五届中国特色新型智库建设学术研讨会。本次会议主题为""数据驱动的新型智库建设""。论坛将分析智库建设的数据驱动问题,突破智库发展面临的数据方法与应用,研讨智库如何将数据驱动作为一种发展驱动力,从数据中挖掘知识、情报,并汇聚形成智库决策的智慧, ",ZKSL201904018
中国特色新型智库影响力的生成逻辑、作用机制与提升路径——基于多维理论视角的学理分析,钱再见:08082101|高晓霞:33907513,11,新型智库; 影响力; 治理; 知识运用; 政策网络; 政策话语;,"[目的/意义]影响力是智库的生命力和价值之所在。中国特色新型智库影响力的核心是其作为政策研究与咨询机构的政策研究洞察力、政策设计的创造力和政策咨询竞争力。[方法 /过程]本文通过文献研究和系统分析认为,中国特色新型智库影响力的生成离不开国家治理中的需求拉动,知识运用过程中的内在驱动,以及政策网络中不同主体的协同联动。中国特色新型智库影响力的生成还需要在政策研究、政策咨询和政策制定过程中逐步落地,形成政策话语的传播力、说服力和影响力。[结果 /结论 ]在中国特色社会主义新时代,新型智库要在治理进程中催生影响力,同时,要通过知识运用提升影响力,此外,还要在政策网络中不断扩大影响力。 ",ZKSL201903001
智库在中国特色知识体系建设中的作用,曾志敏:37323948|李婧:23736901,6,中国特色知识体系; 智库政策; 思想市场机制;,"[目的/意义]智库肩负着促进知识创新的重要使命,在中国特色知识体系建设中发挥着重要作用。[方法 /过程]本文讨论了构建中国特色知识体系的时代需求,并从政策思想市场的角度分析了智库对于中国特色知识体系建设的重要价值。[结果 /结论 ]需要增强政策思想市场机制的运行效率,围绕实践需求,引导知识生产的方向;通过价值信号,激发知识创新的活力;通过实践检验,增强知识发展的动力。 ",ZKSL201903002
2015年以来国内科技智库研究热点主题分析,王铮:21863090|刘心锐:42135795|黄子洛:42323430,10,科技智库; 主题分析; 智库功能; 智库影响力; 智库服务;,"[目的/意义]科技智库是我国新型智库体系的重要组成部分,2015年以来国内科技智库实践与研究进入活跃期,并产生了大量论文成果。对于这些研究成果进行系统梳理与综述,有助于把握我国科技智库发展现状与趋势,为下一步的研究打下基础。[方法 /过程]对2015年以来国内关于科技智库的论文等研究成果进行主题分析。[结果 /结论]分析了国内科技智库论文的学科分布情况,划分了智库内涵与功能、现状与问题、影响力与传播力、产品与服务、地区案例、理论与方法等研究主题,并对已取得成果和研究中存在的局限与问题进行分析。 ",ZKSL201903003
《智库DIIS理论方法》书讯,,1, ,<正>智库建设的目的是什么?智库的问题是什么?与一般意义的学术研究有何异同?智库研究的规律是什么?怎样开展智库研究?遵循什么样的原则?如何评价智库研究成果?中国科学院科技战略咨询研究院院长、国务院研究室与中国科学院共建的中国创新战略和政策研究中心共同主任、中国发展战略学研究会理事长、博士研究生导师潘教峰研究 ,ZKSL201903004
《国家智囊:兰德公司如何影响世界》书讯,,1, ,"<正>中国国防科技信息中心研究员、原总工程师真溱所著的《国家智囊:兰德公司如何影响世界》一书,2019年6月由电子工业出版社正式出版。这是一本以学术论文的严谨标准来撰写的非虚构读物。作者以兰德公司的酝酿起步和建设发展为主线,精心挑选了若干充满细节的曲折故事作为载体,生动再现了""美国面临重大危机和挑战时 ",ZKSL201903013
《智库DIIS理论方法》发布暨研讨会在中国科学院科技战略咨询研究院举行,,1, ,"<正>6月27日,中国科学院科技战略咨询研究院(以下简称战略咨询院)在京举办《智库DIIS理论方法》发布暨研讨会。会上发布了战略咨询院关于中国特色新型智库建设规律和理论方法研究的重要成果——《智库DIIS理论方法》,来自国家高端智库理事会和中央党校、新华社、国务院发展研究中心、国家发展与改革委员会宏观经济 ",ZKSL201903014
2019第四届智库能力与新型智库建设高级研修班在南开大学成功举办,,1, ,"<正>为加强中国特色新型智库核心能力建设,推进国家治理体系和治理能力现代化,解决新型智库建设理论与实践发展中面临的新问题,""2019第四届智库能力与新型智库建设高级研修班""于6月27-29日在南开大学商学院举办。研修班由中国科学院文献情报中心主办,《智库理论与实践》编辑部承办,南开大学商学院协办。来自研究机构、高校和企业等领域 ",ZKSL201903015
第五届中国特色新型智库建设学术研讨会(西安)及征文通知,,1, ,"<正>我国智库经过几年的发展,已步入一个新的阶段。智库建设应树立""智库+""思想,将学术研究思想进一步凝练、发展、凝集到智库的政策和措施上。为此,西安电子科技大学与中国科学院文献情报中心联合主办第五届中国特色新型智库建设学术研讨会。本次会议主题为""数据驱动的新型智库建设""。论坛将分析智库建设的数据驱动问题, ",ZKSL201903016
《智库理论与实践》2019年选题指南,,1, ,"<正>本刊是由中国科学院主管、中国科学院文献情报中心与南京大学共同主办的智库领域重要的学术期刊(双月刊),致力于推动智库理论、方法与实践的创新。欢迎任何有思想见地、有理论建树、有方法突破、有实践创新的投稿。经编委和专家建议,编辑部整理,2019年,本刊重点关注的主题包括(但不限于):1.习近平新时代中国特色社会主义思想与中国特色新型智库建设研究2.中国特色社会主义新型智库深化改革研究 ",ZKSL201903017
关于科技企业智库建设的思考与建议,贺德方:33502572|周华东:40970924,4,科技企业; 智库; 决策;,"[目的/意义]改革开放以来,伴随我国科技产业竞争日益激烈,越来越多科技领军企业建立了专门智库。[方法 /过程]本文概要分析了我国科技企业决策模式的演变历程及科技企业智库的诞生背景,探讨了科技企业建设智库的内在需要和责任担当,对比分析了科技企业智库的独特优势。[结果 /结论 ]本文就科技企业智库提升咨询研究能力和加强机构建设提出若干的思考问题与建议。 ",ZKSL201903005
中国智库国际传播实践发展现状及改进建议——以智库英文网站建设为例,杨云涛:42323431,9,智库建设; 国际传播实践; 话语权; 传播网络;,"[目的/意义]话语权博弈是国家间博弈的一种重要形式。随着中国综合国力的不断增强,中国前所未有地靠近世界舞台中心,迫切需要与大国实力相匹配的国际话语权和影响力。智库作为国际话语权构建的重要推动力量,研究如何提升其思想产品的国际传播能力,具有重要的时代意义。[方法 /过程]本文首先阐明了智库在国际传播方面的重要性,并以智库英文网站建设为例对中国智库国际传播实践中的进展和不足进行了分析,最后对未来智库国际化传播提出思考和建议。[结果 /结论 ]互联网+时代,智库国际传播需创新思想、革新技术,构建多元化平台和全球传播网络,增强话语传播力,追求国际传播的最大化和最优化配置。 ",ZKSL201903006
中国特色新型智库网络传播现状及改进建议——以智库网站建设为例,王敏:09645015,8,智库; 网络传播; 网站建设;,"[目的/意义]智库建设正步入""黄金时代"",实现智库研究和智库传播的两翼齐飞迫在眉睫,研究中国智库网站传播现状,对提升中国智库的社会影响力,提高国际话语权具有重要意义。[方法 /过程]本文从网络传播对智库建设的推动和促进谈起,重点分析国内外几家领先智库的网站建设和传播现状,给出智库网站提升传播能力的几点思考。[结果 /结论 ]智库网站建设是一个长期系统性工程,要给予充分的重视,智库工作者要将传播作为重要抓手,扩展智库的传播路径和传播渠道,促进智库产业健康发展。 ",ZKSL201903007
地方社会智库健康发展策略研究——以黑龙江省为例,张广汇:42323432,9,社会智库; 政治责任; 社会责任; 社科联; 规范扶持; 地方特色; 健康发展;,"[目的/意义]构建完善的地方社会智库体系,是增强地方软实力,推动地方社会治理体系和治理能力现代化的新生力量,也是我国社会智库健康发展不竭的内生动力和源泉。[方法 /过程]黑龙江省社会智库是黑龙江省新型智库领域里的新生力量,正处在起步发展阶段,存在着数量少、规模小、经费匮乏,生存能力较弱、内部管理不规范、与政府沟通机制不健全、社会影响力不足、作用得不到有效发挥等诸多问题。发挥社科联对社会智库的管理与服务作用,在社会智库起步发展阶段,用好相关政策,采取有效举措,搭好制度框架,规范扶持其健康发展实乃当务之急。[结果 /结论 ]本文主旨是以黑龙江省社会智库创新发展为例,探究地方社会智库健康发展的新路径,为推动地方社会智库健康发展,提出有价值的政策建议。 ",ZKSL201903008
中国智库国际化人才培养的路径探析,刘思妗:40957247,9,智库; 国际化人才; 人才培养;,"[目的/意义]探索我国智库国际化人才培养的科学路径,推进中国智库国际化人才培养。[方法 /过程]分析我国智库国际化人才培养面临的形势、现状和存在的问题,借鉴国外一流智库在培养国际化人才方面的有益经验。[结果 /结论 ]建议从制定国际化人才培养计划、多渠道打造国际化人才培养体系、深度开展国际化人才培养模式等几个方面探索我国智库国际化人才培养的路径。 ",ZKSL201903009
我国高校智库服务军民融合战略发展的路径探究,王艳霞:34757478|周中林:10224741,8,高校智库; 军民融合; 协同服务; 服务路径;,"[目的/意义]我国军民融合战略发展的范畴迅速扩大,而高校智库作为国家的""智力源头"",应为军民融合提供全方位智力支持。[方法 /过程]结合高校智库服务军民融合战略发展的不可替代性、以问题为导向、开放协同服务等特点,明确了高校智库的功能定位,搭建了包括服务主体、云平台、需求主体的""三足鼎立""服务模型,创建了涵盖""线上""""线下""的服务路径。[结果 /结论 ]在此基础上提出了从智库""生态环境""建设、服务团队建设、精细化发展以及评估反馈4个方面实现服务路径。 ",ZKSL201903010
论“旋转门”机制在新型公安智库人才流动机制建设中的应用,曹略耕:40618478,7,旋转门; 人才流动; 公安决策; 公安新型智库;,"[目的/意义]在党和国家大力推进中国新型智库建设、人才强国战略的大背景下,新型公安智库相比于传统的警务智库,应更加注重人才在智库研究中的战略性定位。人才作为新型公安智库的软实力,其流动机制是保证智库""鲜活""的关键,是保障公安决策科学性、战略性的重要举措。[方法 /过程]本文通过学习美国""旋转门""机制在促进其体制内外人才流动方面的先进经验,以及对中美两国国情的深入分析,发掘出其中可以提升新型公安智库人才流动水平的指导理念和可行做法,并对我国新型公安智库人才流动机制的发展提出一些建议。[结果 /结论 ]经过分析论证,本文认为实现美国""旋转门""的体制内外人才流动较为困难,而实现新型公安智库、公安一线实战部门、公安院校、公安决策部门等体制内的人才流动较为可行,所以本文的人才流动机制建设也是针对新型公安智库""体制内""的人才流动。基于中国本土与实践建设的""旋转门""机制会深入推进新型公安智库人才流动,保障人才之间的交流合作,也必将展现人才资源在提升新型公安智库服务公安决策时的实战性功效、战略性定位等方面的能力。 ",ZKSL201903011
创新驱动发展战略背景下全球四大湾区发展模式的比较研究,李楠:35192635|王周谊:10610001|杨阳:27614776,14,创新驱动; 影响因素; 典型案例; 四大湾区; 发展模式;,"[目的/意义]研究分析总结湾区经济带发展的特征,为湾区经济带建设提供可借鉴的发展路径。[方法 /过程]以区域创新驱动发展关键影响因素为分析框架,运用案例回溯和归纳演绎的研究方法系统分析了全球四大湾区的共性与差异性特征,并归纳了全球四大湾区的发展类型、发展特点以及发展模式。[结果 /结论 ]粤港澳大湾区的发展模式为政策驱动模式,东京湾区的发展模式为市场拉动模式,旧金山湾区的发展模式为技术推动模式,纽约湾区的发展模式为金融驱动模式。湾区经济带的建设供给侧一般是以政府为主导,通过整合创投资源和营造科学文化氛围来实现科教资源的持续溢出效应,以此带动地区传统产业的转型升级并向战略产业逐步演化;湾区经济带的需求侧一般是以市场为主导,通过技术转移平台实现市场资源与企业资源的有效对接,带动科教资源持续扩散与辐射,最终形成区域技术型新兴产业(未来产业)不断涌现与崛起的局面。 ",ZKSL201903012
智库嵌入式决策咨询服务模式,李刚:08038856|郭婷婷:26471551,6,智库; 嵌入式决策咨询; 智库服务模式;,"[目的/意义]引入""嵌入式""概念解释智库在决策咨询服务既保持相对独立性,又深入政府决策咨询全过程的服务模式。[方法 /过程]分析嵌入式决策咨询服务的4种模式:政策过程嵌入、决策咨询流程嵌入、决策咨询场景嵌入、政策共同体圈层嵌入,寻求智库发挥""外脑""作用,与政府""内脑""协同研究的模式。[结果 /结论 ]智库做好嵌入式决策咨询服务要注重品牌宣传、准确定位自身服务层次,将重心下移,产生多样化的智库产品及传播渠道,并重视质量控制和文档管控,增强自身实力的同时注重提高服务意识,解决好政策研究与对策咨询服务的衔接问题,发挥新型智库在治国理政中的作用。 ",ZKSL201902001
社会组织视域下的社会智库:身份定位与发展特征,里昕:26952338,7,社会智库; 社会组织; 身份定位; 智库特征;,"[目的/意义]作为社会组织的一员,我国的社会智库有着与之相近的组织特征和行事逻辑。将社会智库放置在社会组织的大背景下,可以更深刻地认识社会智库与国家的关系。[方法 /过程]通过社会组织理论分析并结合近年来社会智库典型案例,对社会智库的身份定位进行了深入剖析,对社会智库的发展特征进行了总结和概括。[结果 /结论 ]社会智库数量偏小,在综合影响力上尚难以撼动体制内智库的地位,但社会智库自主性强,专注特色议题研究,国际交流活跃,在推动智库行业发展方面积极有为。本文在此基础上对其未来发展提出了建议。 ",ZKSL201902002
基于间断均衡理论视角的中国竞争政策变迁研究,熊励:14186379|钟美芝:40047059|许肇然:38515997,12,竞争政策; 间断均衡; 文本挖掘; 共词分析; 智库研究;,"[目的/意义]竞争是市场经济的本质特征,竞争政策是市场公平竞争的法治保障。中国政府不断强调要把竞争政策作为我国的基础经济政策,推动产业政策的竞争化发展,打造统一开放、竞争有序的市场经济。随着机构整合后的统一执法,中国竞争政策的基础性地位将进一步强化。而我国竞争政策正面临着供给侧结构性改革和经济高质量发展等带来的考验,需要持续完善。因此,很有必要对中国竞争政策变迁过程进行梳理与分析,以便进一步探索智库理论与实践的新思路、新模式和新工具。[方法 /过程]本文以1980至2017年中国竞争政策文本为研究对象,运用文本挖掘的方法,对我国竞争政策的发展脉络与阶段性特征进行系统的梳理和解读。并基于竞争政策文本的量化分析结果,运用间断均衡理论对中国竞争政策的变迁进行解释。[结果 /结论 ]研究发现,改革开放以来我国竞争政策呈现出由均衡到间断再到均衡的发展脉络,是新型智库建设的创新点。 ",ZKSL201902003
从稷下学宫看智库的独立性,张霄:41791155,6,稷下学宫; 智库; 独立性;,"[目的/意义]稷下学宫建于齐桓公时,是战国时期的最高学府和资政询议的重要平台。在稷下学宫长达150多年的发展历程中,形成了其独特的办学风格和特色。其中,稷下模式的独立性在当时历史环境下是具有超前意识的,也是稷下学宫能成为战国时期最高学府的重要原因之一。[方法/过程]本文对稷下学宫独立性在其运营和管理方面的体现做了简要的梳理和介绍。[结果 /结论 ]通过对稷下模式独立性具体表现的列举,总结稷下学宫作为初代古代思想库的优秀管理经验,这些对现代智库建设具有重要的参考价值和实践意义。 ",ZKSL201902004
关于智库高质量建设的几个问题,白仲尧:27539798,5,服务行业; 文化服务; 智力产品; 优质服务; 服务监管;,"[目的/意义]智库是为社会提供智力服务的服务行业。智库产品具有唯一性,应力争优质高效。[方法 /过程]对智库进行经济学分析,正确认识智库产品的生产和流通规律,是促进智库产业发展的根本问题。[结果 /结论 ]智库优质服务的主要因素是,重视人才、加强调研、紧跟国家战略、关注发展动向。促进智库高质量建设,必须加强党的领导,重视服务监管。 ",ZKSL201902005
“一带一路”高校智库:发展策略研究,陆洋:08231323|史志钦:08235565,7,一带一路; 高校智库; 智库建设;,"[目的/意义]""一带一路""倡议自2013年提出以来,相关研究也随之逐步发展,国家与各类社会团体对于政策咨询的需求加大,不少高校积极响应国家的大战略,成立了许多以""一带一路""倡议相关问题为主要研究方向的智库。[方法 /过程]本文以这些""一带一路""高校智库作为研究对象,运用文献研究、调查、统计和归纳的方法,对""一带一路""高校智库建设中出现的问题进行分析。[结果 /结论 ]从智库的定位、人员和机构配置,以及研究领域和考核机制3个方面探索""一带一路""高校智库如何结合自身优势服务国家与社会的需要,并对其未来的发展方向提出对策和建议。 ",ZKSL201902006
在稷下学宫思考人类智库之路——长城企业战略研究所的25年求索,刘志光:06254973,5,智库建设; 稷下学宫; 软科学; 文化自觉; 改革开放;,"[目的/意义]探讨中国智库的地位和作用,要联系中国改革开放40年的历史进程,而改革开放的起点和问题构成中国智库的特征和使命,即推动中国社会发展、促进决策科学化和民主化。这是中国智库真正的历史、实践和逻辑起点,也是今天研究和推进智库建设的基本依据。[方法/过程]本文以历史与逻辑相一致的方法,以长城企业战略研究所为案例,梳理中国改革开放进程中决策科学化民主化的战略与智库发展之间的内在联系;同时揭示当代智库发展与传统文化资源之间联系的必要性。[结果 /结论 ]中国智库的当代发展,要与中国改革开放的新要求相一致,也要进一步开掘历史和文化资源,要有文化自觉和价值选择。 ",ZKSL201902007
从盘古智库建设看湖南高质量发展,,4,智库建设; 湖南; 高质量发展;,"[目的/意义]本文对地方高质量发展的路径进行了创新性的阐释。[方法 /过程]从智库建设与地方发展之间存在着共通的方法论规律出发,结合盘古智库建设过程中的实践经验进行归纳总结,以实证研究为基础,探讨湖南省高质量发展的可行路径。[结果 /结论 ]湖南高质量发展需要""天地人和、经世致用""的理念支撑,具体遵循四个原则:创造价值、跨界融合、聚焦重点、国际化发展。 ",ZKSL201902008
吉林省智库信息资源保障体系建设研究,史琳:28206115|宋微:25419733|张舒逸:38951118,7,智库; 信息资源保障; 模块化流程; 信息服务机构; 信息共享; 反馈评价;,"[目的/意义]科技创新智库能够为国家和地区提供决策和战略支持,智库信息资源保障体系是智库良好运行的基础。吉林省积极响应国家号召,打造特色智库以及智库联盟,但是当前仍面临着信息资源配置不合理等一系列问题,制约了吉林省智库的发展。[方法 /过程]本文引入模块化流程的理论,将科技创新智库信息资源保障体系建设按照不同流程分为3个子模块:信息资源获取、信息处理及信息推广和应用。各子模块通过政府进行宏观调控和政策指引,彼此独立工作又紧密结合,建立健全信息资源保障体系。[结果 /结论 ]本文提出信息资源保障体系的建设举措,以期为吉林省智库建设提供建设性的意见。 ",ZKSL201902009
环境法学专业特色高校智库的探索,李爱年:07486804|周圣佑:39157681,6,中国特色新型智库; 生态环境保护; 地方专业特色高校智库;,"[目的/意义]在中国特色新型智库创新与发展时期,高校智库应该具有专业特色来适应新形势。生态环境保护法治研究中心作为地方专业特色化高校智库,从定位、创新、建言、管理4个方面探索专业特色高校智库建设的有效路径。[方法 /过程]采用文献分析法、数据统计法、经验总结法等方法对我国高校智库的政策及现状进行分析,并对研究中心的经验进行归纳总结。[结果/结论 ]通过本文分析,总结归纳了研究中心建设管理的主要做法、显著成效和经验启示,提出了今后建设发展的思路意见。希望本文对省专业特色智库特别是类型相近的高校智库建设有一定的借鉴作用。 ",ZKSL201902010
德国弗里德里希·艾伯特基金会的运行机制与发展态势,孙杰:08684064,10,弗里德里希·艾伯特基金会; 智库; 运行机制; 发展态势;,"[目的/意义]通过深入剖析德国弗里德里希·艾伯特基金会的运行机制和发展态势,为我国智库建设和发展提供参考借鉴。[方法 /过程]采用文献调研法和网络调研法,对弗里德里希·艾伯特基金会的发展历史、价值理念和运行机制等进行归纳总结。同时基于国际权威的全球智库排名报告,分析弗里德里希·艾伯特基金会的运行机制和发展态势。[结果 /结论 ]弗里德里希·艾伯特基金会作为德国最优秀的政治智库之一,在政治教育、科学研究、国际合作方面所取得的成绩,与其特殊的组织结构、运行机制和发展理念关系密切,对我国现阶段智库发展尤其是党政智库发展具有十分重要的参考价值。 ",ZKSL201902011
