篇名,作者,页数,关键词,摘要,filename
《到人大重阳听名教授讲座》书讯,,1, ,"<正>《到人大重阳听名教授讲座》一书是由中国人民大学重阳金融研究院""对话人大名教授""系列讲座的精彩演讲编辑、整理、辑录而成,是人大重阳学术成果转化的作品。""对话人大名教授""系列讲座的的主讲人全部来自中国人民大学,自2015年举办以来,深受社会各界的欢迎。讲座内容高端前沿、深入浅出,既有引人入胜的深厚学理又有催人奋进的思想智慧。为了与读者分享更多独家内容,本书将每场讲座都做了细致的编辑、整理,内容翔实,第一辑包括三大篇,分别是财政 ",ZKSL201805010
南大智库文丛/李刚 主编,,3, ,"<正>《思想产业:悲观主义者、党派分子及财阀如何改变思想市场》[美]丹尼尔·W.德雷兹内著李刚邹婧雅谢馥兰等译定价:75.00元ISBN 978-7-305-21059-4出版时间:2019.1内容简介:公共知识分子的发展有着悠久的历史,他们总是在一些拥有极高话语权的政治评论杂志上,围绕各种类型的话题发表意见。但近年来,公共知识分子却被另一类思想家所取代,这一新晋群体被称为思想领袖。与公共知识分子不同的是,思想领袖通常在那些与公众联系 ",ZKSL201805014
基于SECI模型的高校智库知识管理问题分析及路径选择,凌宏发:40047057|杨阳:08552193|解志韬:15358293,7,SECI模型; 高校智库; 知识管理; 共享; 转化;,"[目的/意义]高校智库作为知识管理型研究机构,知识管理水平影响智库的发展,知识管理能力是智库竞争力的核心,提升高校智库知识能力管理能力对于中国特色新型智库建设、国家治理体系与治理能力现代化建设具有重要意义。[方法 /过程]针对高校智库目前""选择性管理""趋势明显、组织内生环境欠稳定、个体参与智库研究""冷漠化""以及智库研究成果""悬浮化""等问题,本文将知识管理理论中的SECI模型引入问题分析中,分阶段探讨高校智库知识管理中存在的问题。[结果 /结论 ]本文发现共同化阶段与表出化阶段知识转化率较低,联结化与内在化阶段尚未进行知识转化。应重塑共同化阶段与表出化阶段组织环境,通过加强知识体系整合、为培养者提供项目等推动联结化阶段与内在化阶段的知识积累、消化与吸收。 ",ZKSL201804001
政府智库成果的社会化传播问题研究,赵恒煜:38457525,8,政府智库; 成果转化; 社会化传播;,"[目的/意义]智库的社会化传播能力与国家软实力息息相关,是构建世界话语体系的重要组成部分。作为中国智库体系最为重要的组成部分,政府智库除了为党委和政府提供决策支持外,还应将调查研究、分析问题、解决问题过程中所产生的知识精华向社会传播,让人民共同分享实践探索中的新思想、新观点、新知识,增进公众对党和政府决策的理解,增强社会凝聚力。[方法 /过程]本文对政府智库成果社会化传播现状与问题进行了分析研究。[结果 /结论 ]论文在借鉴国内外智库实践经验的基础之上,提出了若干政府智库成果传播的对策建议,认为政府智库应体现作为党和人民思想高地的社会责任。 ",ZKSL201804002
大数据可视化分析在支撑智库研究中的应用与创新,熊励:14186379|王锟:40047058|钟美芝:40047059,10,智库; 大数据; 可视化; 研究方法;,"[目的/意义]大数据环境下的智库研究旨在对海量的信息进行有效采集、处理、分析,挖掘信息中蕴含的逻辑规律,并将大量的无规则数据可视化表示,这是当今智库研究的热点。[方法/过程]文章通过分析国内外智库和大数据可视化的研究现状,整理了目前运用大数据可视化进行智库研究的相关理论,剖析大数据可视化方法在智库研究中的应用与创新。[结果 /结论 ]结果表明:我国目前对智库研究的方法还比较单一,大数据可视化的智库研究方法发展迅速,包括支持智库大数据可视化分析的海量数据处理、可视化算法、图形可视化、人机交互、分布式处理等技术。大数据可视化分析在智库研究中的应用有助于智库数据信息直观展示、动态图形可视化对比分析、支持可视化分析的用户交互、智库数据资源集聚共享、提升智库作用和影响力。 ",ZKSL201804003
国外智库研究人才组织与流动模式研究,"杨文慧1,2:39920696|李宏3,2:36574917|孔媛4:24969730",8,国外智库; 研究人才; 组织模式; 流动模式;,"[目的/意义]智库的研究人才为智库提供了核心竞争力,研究人才的组织和流动模式对人才研究能力的发挥有重要影响。[方法 /过程]本文从影响智库人才组织与流动形式的基本要素入手,得出3种不同的人才组织与流动模式。通过3种模式的代表性智库的案例分析,总结先进做法、国外智库建设经验,并得到相应启示。[结果 /结论 ]智库应根据自身发展阶段等现实情况,选择或融合不同的人才组织与流动模式,从而保持智库的研究活力与能力。 ",ZKSL201804004
国外高校图书馆支撑智库建设的启示,"刘敬仪1,2:39811074|廖宇3,2:39811072|江洪1,2:21281117",6,高校图书馆; 智库; 智库建设; 智库服务;,"[目的/意义]为国内高校图书馆开展智库支撑服务提供借鉴,并结合国内智库发展特点提出相应的发展建议。[方法 /过程]本文通过调研选取国外为智库建设提供支撑服务较好的部分高校图书馆,发现调研对象在专业的资源支撑、网络平台构建和智库馆员配备方面的特点。[结果 /结论 ]得到如下启示:深入以智库服务为核心的高校图书馆研究;充分利用高校图书馆的学科智库资源;继续完善网络平台建设;开展馆员嵌入智库服务等建议。 ",ZKSL201804005
"发挥党校图书馆作用,助力新型智库建设",魏秀玲:11067047,5,党校图书馆; 智库; 服务;,"[目的/意义]党校图书馆作为党校智库建设的重要组成部分,服务于新型智库成为其新的发展方向,从而满足图书馆服务转型需求。[方法 /过程]对党校图书馆在智库建设中发挥多元咨询服务进行探讨。[结果 /结论 ]本文提出对接智库需求,夯实服务保障及参与智库推广等措施,充分发挥图书馆在党校智库建设中的应有作用,不断提升党校智库的影响力。 ",ZKSL201804006
新时代新型智库建设与中国特色大国外交,关照宇:45674378|张婷婷:45674392,8,中国新型智库; 中国特色大国外交; 伐谋;,"[目的/意义]新中国成立至今,中国外交已经经历了""生存与革命外交""和""发展外交""两个发展阶段,目前进入了第3个阶段——""中国特色大国外交""阶段。与前两个发展阶段相比,中国特色大国外交更加注重发挥智库的作用。本文旨在研究中国特色新型智库与中国特色大国外交之间的关系。[方法 /过程]本文结合智库发展的实践经验,通过智库学者的实地调研,并结合以往的研究成果和文献资料,剖析中国特色新型智库与中国特色大国外交之间的紧密关联,希望能够为中国新型智库建设提供宝贵经验。[结果 /结论 ]本文指出,中国特色新型智库应围绕""资政""""启民""""伐谋""""育才""4个主要职能服务于中国特色大国外交,为发展中国特色大国外交提供理论基础与战略咨询。 ",ZKSL201804007
行业智库建设及其社会服务研究——以陶瓷行业智库为例,吴玉灵:33049516,7,行业智库建设; 陶瓷行业智库; 社会服务;,"[目的/意义]中国智库是我国新时期现代文明与社会进步必不可少的重要标志,也是新时期国家""软实力""和""话语权""的重要组成部分。研究与其相关的陶瓷行业智库个例,一定程度上能够对整个行业智库的建设和发展起到促进作用。[方法 /过程]从陶瓷行业智库的基本概念和建设背景入手,对现存的陶瓷行业智库发展存在的问题进行剖析和思考,以陶瓷行业智库为例系统阐述如何构建新时代中国特色的行业型智库。[结果 /结论 ]对构建陶瓷行业智库的经验进行了初步总结和探索,并就其智库建设的价值、意义和对社会服务的贡献提出深度思考,为中国行业智库的建设和发展提供了科学指南。 ",ZKSL201804008
透明国际智库的工作理念、运行机制及发展动态,高春玲:07946340,11,透明国际; 智库; 核心价值; 运行机制;,"[目的/意义]深入剖析世界反腐智库透明国际智库的工作理念、运行机制以及发展动态,旨在为我国当前大力推行新型智库建设和严厉惩治腐败提供借鉴与参考。[方法 /过程]运用历史研究法和案例分析法,结合文献和网站调研展开研究。同时援引国际权威的智库排名报告,对透明国际智库的工作理念、发展动态和社会贡献进行考察。[结果 /结论 ]透明国际智库是西欧乃至全球著名的反腐智库,在透明度和善政智库、最佳独立智库等全球智库排名中荣登榜首,这得益于其多年来一直秉承的高质量、独立性、透明度、问责制以及诚信度的核心价值、运行机制以及顶层设计理念。 ",ZKSL201804009
TED智库运行机制及其对中国智库建设的启示,姜杰1:35744734|瞿丛艺2:36915557,7,智库; TED; 组织模式;,"[目的/意义]中共中央办公厅、国务院办公厅印发的《关于加强中国特色新型智库建设的意见》指出,中国特色新型智库需要加强对外传播能力,要运用大众媒体等多种手段传播主流思想价值,集聚社会正能量。研究中国特色新型智库传播方法、传播途径具有重要的意义。[方法 /过程]本文从智库的角度,分析了TED的起源、发展、传播,特别是其组织模式创新带来的飞速发展,进而提出中国智库可以借鉴的方面。[结果 /结论 ]新时代下,中国特色新型智库在组织创新、选题、质量、传播渠道方面应加强思考,以确保其可持续发展,与中国特色大国地位相匹配。 ",ZKSL201804010
美国防务智库对华军事研究人员的背景分析及启示——以2049计划研究所、战略与预算评估中心、海军分析中心为例,罗祖基:37378666,7,美国; 防务智库; 研究人员; 背景分析;,"[目的/意义]美国防务智库汇集了防务领域最顶尖的专家学者和军队政府人才,其对华研究人员的背景信息对我国建设具有中国特色的防务智库具有极大的借鉴意义。[方法 /过程]通过公开情报来源途径,搜集2049计划研究所、海军分析中心、战略与预算评估中心3家防务智库21名对华军事研究人员的背景资料,并对其军事、学术、在华经历、任职经历等背景进行综合分析。[结果 /结论]发现美国防务智库对华军事研究人员军事背景深厚,学术素养较高,在华经历丰富,跨智库和军队政府部门交叉任职经验丰富,同时对华态度普遍比较强硬。鉴于此,在建设具有中国特色的新型防务智库人才队伍时,应重视吸纳高素质转业军官群体,建立流畅的人才交叉任职机制,重视智库人员的对外交流工作,培养一批智库领军人才队伍,打造一流的中国特色防务智库,为建设世界一流军队提供有力的智力支撑。 ",ZKSL201804011
在上海论坛2018科技创新子论坛开幕式上的致辞,赵克斌:40052808,1, ,"<正>各位领导、各位来宾:下午好!由中国科学院文献情报中心与中国社会科学院-上海市人民政府上海研究院联合承办的""上海论坛2018科技创新子论坛""顺利开幕了,本次论坛的主题是""科技创新中心建设的国际比较与借鉴"",各位专家、各位来宾在百忙之中,从世界各地、四面八方来到上海参加此次论坛,我代表论坛主办方、承办 ",ZKSL201804012
世界科创中心建设的经验与启示,刘清:35825509|李宏:36574917,5,科创中心; 创新聚集区; 经验;,"[目的/意义]深入比较分析国际创新聚集区域建设发展的经验,对我国科创中心建设具有重要的参考价值。[方法 /过程]本文对国际知名的创新聚集区域美国硅谷、北卡三角科学园、日本筑波科学城、慕尼黑高科技工业园、英国伦敦东区科技城等典型区域作分析,总结科创中心的共性特征。[结果 /结论 ]本文得到的建设启示有:通过章程与制度来支持和规范科创中心的建设;构建友好环境、面向全球吸引优秀人才;引导新兴产业的发展,形成创新集群的辐射效应;支持创业,有效推进技术转移和创新商业化;设立各方参与的理事会机制,避免政府过多干预。 ",ZKSL201804014
世界级科技创新城市群:长三角一体化与上海科创中心的共同抉择,李万:08605406|周小玲:08580064|胡曙虹:40047061|张仁开:09653981,7,科技创新; 城市群; 长三角; 一体化; 上海; 世界级;,"[目的/意义]作为世界第6大都市群,长三角率先建设世界级科技创新城市群,对于我国实施创新驱动发展战略、转变发展方式、迎接新科技革命与产业变革具有重大意义。[方法 /过程]本文通过分析现状问题、展望未来愿景,特别是将科技创新功能与城市(群)空间布局结合起来思考和推演,提出了发展思路。[结果 /结论 ]以上海科创中心形成和发展以及长三角协同创新为重要战略抓手,未来长三角城市群将能够发展成为世界级科技创新城市群。 ",ZKSL201804015
智库能力与新型智库建设——2018第三届新型智库核心能力建设高级研修班通知(第二轮),,2, ,"<正>2018年11月29日-12月2日海口为贯彻党的十九大关于加强中国特色新型智库建设的指示精神,加强中国特色新型智库核心能力建设,推进科学决策、民主决策,推进国家治理体系和治理能力现代化,增强国家软实力,解决新型智库建设理论与实践发展中所面临的新问题,加强智库实践界、学术界与决策部门间的 ",ZKSL201804016
《智库理论与实践》2018年选题指南,,1, ,"<正>《智库理论与实践》(双月刊)是我国智库界专注于智库理论研究与智库实践创新相结合的高端专业学术期刊,2016年2月28日创刊,由中国科学院文献情报中心与南京大学联合主办。创刊两年来得到学界业界的鼎力支持与热切关注。新的一年,本刊将继续邀请智库专家对热点政策问题进行解读,报道有关智库领域的好观点、好思想、好报告等,继续跟踪智库领域热切关注的重要问题,鼓励和推动学术争鸣与学术创新,致力于通过新型智库研究推动国家相关政策的制定与完善,推动国家各个相关领域的创新与发展。 ",ZKSL201804017
我国科技社团智库的建设路径研究,西桂权:37898956|丛琳:25206159|付宏:26189200,7,智库; 科技社团; 建设路径; SWOT分析;,"[目的/意义]科技社团具有建设智库的优势,研究科技社团智库建设对于完善智库建设相关理论,促进我国智库发展具有一定意义。[方法 /过程]通过对科技社团和智库相关资料的整理、分析和研究,找出了二者之间的共性,总结了科技社团智库的重要作用。运用SWOT矩阵分析模型对建设科技社团智库的内外部环境进行了分析。[结果 /结论 ]通过分析发现,科技社团向智库方向转型是必然趋势,既是完善国家创新体系、承接政府转移职能的需要,也是提高自身竞争力的需要。在此基础上,提出了科技社团智库建设的路径模式。 ",ZKSL201803001
论科学决策和国家治理现代化——从智囊、软科学到智库的理论与实践,李忠尚:09690467,9,科学决策; 国家治理; 现代化;,"[目的/意义]进入新时代,为了事业成功而正确决策,必须坚持科学决策和民主决策。而中央提出国家治理体系和治理能力的现代化,正是对实现正确决策这一目标的制度建设和干部培养的配套措施。其中科学决策,包括决策者、执行者和智库等要素构成的现代决策体系的建设及其运行,对国家治理体系和治理能力的现代化就起着十分重要的作用。[方法 /过程]本文结合新时代新征程,回顾了我国在决策上的经验教训,梳理了我国智囊、软科学到智库的实践和发展,论述了科学决策需要知识分子和决策科学的智力支持,需要现代科技,特别是现代决策体系的建设和完善;而科学决策作为正确决策的两大支柱之一,是建设现代化的国家治理体系和培养现代化的国家治理能力的智力支持和必需的工具及方法。[结果 /结论 ]总之,建设和运用智库,构建和发展现代决策科学,实现科学决策和国家治理体系和治理能力的现代化,就是为了正确决策,少走弯路错路,就是坚持和完善中国特色社会主义制度,就是更好地走中国特色社会主义道路,从而实现""两个一百年""奋斗目标。 ",ZKSL201803002
基于文献计量分析与内容分析法的国内外智库研究进展综述,"裴瑞敏1,2:38546892|刘慧晖1,2:38471868|杨国梁1,2:36024365",10,智库; 影响力; 运行机制; 情报; 文献计量分析;,"[目的/意义]智库作为独立运作且相对稳定的政策研究和咨询机构,为政府、企业及社会公众提供决策参考,对实现我国决策的科学化和民主化具有重要作用。然而,与国外相比,我国智库研究起步较晚,且智库发展过程中也存在诸多问题亟待研究。因此,综述分析国内外相关智库研究,识别研究发展趋势和重要研究主题,为我国高端智库建设提供理论依据,具有重要意义。[方法 /过程]本文基于文献计量分析和内容分析法对国内外智库研究现状进行分析,总结国内外智库的发展趋势,识别智库研究的重要主题。[结果 /结论 ]通过对智库影响力研究、智库建设与运行机制研究、智库信息管理与情报支撑研究3个重要主题进行深入分析,探寻智库研究发展的研究趋势和重点,以期推进中国特色新型智库的建设进程。 ",ZKSL201803003
智库研究成果的落地困境与质量提升路径,"温志强1,2:08918713|朱晨迪2:37247521|高静2:10007182",6,行政决策; 智库研究; 决策服务; 提升路径;,"[目的/意义]智库是国家的""大脑"",是辅助政府决策的""军师团"",在国家的长远发展中扮演着重要的角色。社会改革深水期,政府面临的决策情境日益复杂多变,这对智库研究提出新的要求,为此需要引导智库研究成果质量不断提升。[方法 /过程]本文主要采用文献研究法和实证研究法,提出政府决策情境的变化和对智库研究的需求,阐述为满足这些需求智库研究应该把握时机、转变身份、转型风格。现实中,临机决策与智库滞后的矛盾,有效信息渴求与无效信息供给的矛盾,选好站位与""矮化错位""的矛盾,实战决策与""纸上谈兵""的矛盾大大限制了智库功能的发挥。[结果 /结论 ]要从端正智库成果研究态度、提升智库成果站位高度,紧盯智库成果选题热度、提高智库成果报送速度,拓宽智库成果涉及广度、注重智库成果思想深度,确保情报信息的可信度、夯实智库成果内容精度等方面提升智库研究成果质量。 ",ZKSL201803004
京沪地区智库的发展经验及借鉴,里昕:26952338,7,京沪地区智库; 研究能力建设; 人才培养; 智库运营; 智库传播;,"[目的/意义]北京和上海是我国智库分布最密集、发展层次最高的地区,研究京沪地区智库的发展规律与特征,对于推动中国特色现代智库建设有重要借鉴意义。[方法 /过程]通过对部分京沪典型智库的实地走访、座谈,本文对智库管理架构、研究能力建设、人才引进和培养、运营能力、对外交流与传播等方面进行了分析。[结果 /结论 ]不同类型的京沪地区优秀智库的管理架构各具特色,对研究质量有较强的把控能力,人才培养和智库运营的思路广阔、手段丰富,对外传播能力强,京沪地区智库的发展经验可以为我国智库提高其产品质量和运营水平提供有益的借鉴。 ",ZKSL201803005
我国企业智库发展现状、特点及趋势,牛溪1:29139490,7,企业智库; 典型行业; 主要特点; 发展趋势;,"[目的/意义]随着国家对智库建设越来越重视,企业智库作为智库体系的重要组成部分,也迎来加快发展的重要机遇。智库引领已经逐渐成为共识,但需在企业的全力支持下才能加快发展,从而能在立足服务好企业本身的同时扩大外部影响力,为企业带来效益,实现自身价值。[方法 /过程]采用案例分析法,对我国典型企业智库进行分析,包括国有企业智库、互联网企业智库、金融企业智库以及房地产企业智库。[结果 /结论 ]总结当前我国企业智库发展现状和特点,发现企业智库发展的特殊性,并对未来我国企业智库发展趋势进行判断。 ",ZKSL201803007
服务智库视阈下党校图书馆的转型发展思考,姜晓婷:25753251,7,党校图书馆; 智库建设; 转型发展;,"[目的/意义]党的十八大以来,建设中国特色新型智库成为党和国家重要战略。作为党校职能部门的图书馆在服务于新型智库建设中具有重要作用。[方法 /过程]本文对党校图书馆服务智库建设理论研究现状和实践探索情况进行了文献与网络调查。[结果 /结论 ]本文提出当前党校图书馆服务智库建设还存在资金投入不均衡、方式方法落后、专业人才紧缺等主要问题,从更新服务观念、拓宽经费渠道、注重资源整合、完善数字网络、健全学科馆员制度和培养人才队伍等方面探讨党校图书馆服务智库建设的转型发展策略。 ",ZKSL201803008
加拿大弗雷泽研究所现状、运行机制与发展态势,孙杰:08684064,12,弗雷泽研究所; 智库; 运行机制; 发展态势;,"[目的/意义]通过深入剖析加拿大弗雷泽研究所的运行机制和发展态势,为我国智库的建设和发展提供参考借鉴。[方法 /过程]采用文献调研法和网络调研法,对加拿大弗雷泽研究所的发展历史、价值理念和运行机制等进行归纳总结。同时基于国际权威的全球智库排名报告,分析弗雷泽研究所的关注重点和发展态势。[结果 /结论 ]加拿大弗雷泽研究所作为加拿大首屈一指的智库机构,在教育、医疗、税收、环境、能源、经济等众多领域所取得的成绩,与其特殊的组织结构、运营机制和发展理念关系密切。 ",ZKSL201803009
基于复杂系统视角的粤港澳大湾区战略系统研究,张小娟:37853552|贾海薇:07568893,8,战略系统; 粤港澳大湾区; 复杂系统;,"[目的/意义]随着粤港澳大湾区建设成为我国区域发展的重大战略,如何拟定和设计粤港澳大湾区的发展战略成为当前面对的重要问题。[方法 /过程]本文以复杂系统的相关理论为依据,结合技术路线图工具,分析和描绘了粤港澳大湾区战略系统的要素、结构及其运行机制。[结果/结论 ]战略系统是城市系统中的一个子系统,粤港澳大湾区的战略系统包括战略愿景、战略目标、战略任务、战略重点和战略执行五大要素,它们之间相互衔接、环环相扣、逐步递进。粤港澳大湾区的战略系统是粤港澳大湾区整体系统中发挥着重要""他组织""作用的子系统,它对粤港澳大湾区整体系统中社会系统、经济系统、支撑系统和空间系统的运行和发展进行有目的的规划、组织、引导、控制和协调,推动粤港澳大湾区世界级城市群、世界经济湾区美好愿景的实现。 ",ZKSL201803010
粤港澳大湾区的创新网络与大学角色:网络视角的分析,曾志敏:37323948|杨泽森:38288392,11,科技创新; 区域创新网络; 粤港澳大湾区;,"[目的/意义]粤港澳大湾区科教资源丰富,正在向建设国际科技创新中心的目标努力。对大湾区科技创新供给情况进行充分考察,是完善政策举措的第一步。[方法 /过程]基于2012年到2016年间的科技论文和专利数据,本文对粤港澳大湾区地区的知识创新网络(KIN)和技术创新网络(TIN)进行了可视化和结构分析,同时以华南理工大学为案例,评估内地研究型大学在大湾区区域创新网络中的地位、角色和绩效,探究大学在参与区域创新过程中的难点和问题,并提出针对性的政策建议。[结果 /结论 ]研究表明:(1)粤港澳大湾区知识创新网络结构成熟,总体呈中心—边缘的分布形态;(2)内地高校论文数量领先湾区,但创新网络搭建和引领的能力不足;(3)湾区知识创新前沿趋向新型工科发展,地区间存在明显的梯度效应;(4)高科技企业主导大湾区技术创新网络,广深两地技术合作开发模式不同。 ",ZKSL201803011
