篇名,作者,页数,关键词,摘要,filename
世界百年未有之大变局与智库使命和智库建设,张志强:34550201,12,世界; 百年未有之大变局; 智库使命; 智库建设; 智库核心能力;,"[目的/意义]深入分析世界正经历的百年未有之大变局的主要变局构成及其变化特点和趋势走向、大变局的关键变量及其内涵和影响因素等,观察变局下世界格局结构与国际秩序规则调整重塑提出的战略研究需求,分析我国特色新型智库发展面临的新环境与使命任务,提出我国智库核心能力体系与业务发展体系建设的思考与出路。[方法/过程]主要采用文献调研法收集相关资料,通过文献阅读和大量深度思考和思维创新,归纳总结出关键的认识与观点。[结果/结论]提出了世界百年未有之大变局的6个方面的变局构成及其特点,分析了推动大变局的关键变量及其内容和影响。分析了我国新型智库建设面临的新环境与新使命任务,提出了智库核心能力体系与业务发展体系的建设模式。研究认识对我国特色新型智库建设和发展有重要启示价值。 ",ZKSL202004001
政策可执行度对智库影响力提升的贡献研究,文彦杰1:40955854|阎林胤2:45462181,6,新兴智库; 智库研究; 政策实用性; DIIS方法; 定位;,"[目的/意义]党的十八大以来,在党和国家的高度重视下,中国智库迎来了巨大的发展机遇,也面临非常具体的挑战。本文聚焦政策可执行度这一提升智库研究成果影响力的有效抓手,提出并深入分析了提升智库科研影响力的关键策略。[方法/过程]从""智库研究的政策实用性""""专业协作能力""和""影响力累积程度""3个方面,研究提升智库影响力的策略。在提升智库研究的政策实用性方面,智库应当充分重视:智库研究的课题所对应的具体政策体系中的各个要素与机构;政策体系中的各个要素与机构和群体的立场与工作诉求;政策体系中的各个要素与机构和群体的立场与工作诉求之间的逻辑关系,以及它们与国家层面的大政方针有什么内在逻辑关系。提升智库的专业协作能力方面,智库应当同时加深研究深度,并加强成果推广能力。DIIS方法与多样的媒介拓展是有效途径。而且立足中国特色的角色定位,是中国智库协作能力提升的保证。智库建设不是短跑冲刺,在影响力的积累上,智库应该注意保障长期影响力。[结果/结论]从上述3点出发,新兴智库影响力提升""最后一公里""的模糊问题将有清晰的检验标准。 ",ZKSL202004002
云智库服务内容、能力与模式研究,石森昌:13906085,7,云智库; 服务能力; 服务模式;,"[目的/意义]着眼于解决智库服务过程中存在的问题,文章提出,传统智库应依托""互联网+智库""网络服务平台,实现决策咨询服务创新,提升服务能力。[方法/过程]借鉴把单个计算能力有限的服务器汇集成超级系统的云计算思想,提出用互联网把众多专家学者和海量信息数据汇集起来建设超级智库系统云智库。依托云智库,将实现决策咨询服务模式创新和拓展决策咨询服务内容。[结果/结论]云智库应加强决策咨询组织管理、数据信息服务和专家服务管理3种能力建设;智库可以选择传统方式、云智库参与者方式和云智库运营管理者方式3种不同的应用模式。 ",ZKSL202004003
基于投入—产出视角的高校智库满意度评价研究——来自72份安徽省高校智库的问卷调查,王宁:43729333,14,投入—产出; 满意度; 评价; 高校智库; 研究人员;,"[目的/意义]对高校智库进行满意度评价有助于揭示高校智库建设和发展的内在规律和特征。[方法/过程]文章以安徽高校智库的发展现状为基础,从用户(智库研究人员)满意度的微观视角出发,对投入和产出满意度进行定量分析。[结果/结论]结果显示,高校智库研究人员的满意度评价指标包含资源配置、机构建设、设施及管理等投入因素;学术研究能力、政策应用能力、社会价值、传播影响能力等产出因素。最后针对实证分析中满意度偏低的评价指标,提出针对性改善措施,有助于实现高校智库用户满意的战略目标和评价结果,更有助于提升高校智库的服务效能,促进高校智库的供需平衡发展。 ",ZKSL202004004
迈向成熟的现代智库——省级重点智库建设的政策、体系和网络分析,马雪雯:45462182|李刚:08038856,10,重点智库; 智库政策; 智库体系; 智库网络;,"[目的/意义]完备的政策体系是省级重点智库向现代智库转型的制度前提,合理的体系布局是其适应党和政府多元决策需求的关键,智库网络是其充分发挥各项职能的有效形式。[方法/过程]文章从政策、体系、网络3个角度分析当前我国各省重点智库建设状况。[结果/结论]当前省级重点智库建设过程中存在以下共性问题:重点智库体系相对固化、治理体制中存在""三明治瓶颈""、智库难以实现资金独立、智库服务决策的针对性有待提高、考核评价机制不健全。 ",ZKSL202004005
新时代地方新型智库治理:使命、困境与路径——2019年国家治理体系和治理能力现代化背景下新型智库新使命会议综述,杨中艳:43379483,7,国家治理现代化; 智库新使命; 智库建设现状; 智库高质量发展;,"[目的/意义]学习研究宣传贯彻党的十九届四中全会精神,探讨国家制度和国家治理现代化背景下地方新型智库建设的使命机遇,以及省域新型智库建设的具体实践与发展路径。[方法/过程]2019年11月29日,湖北省社会科学院召开国家治理体系和治理能力现代化背景下新型智库新使命理论座谈会。[结果/结论]来自党政部门、社科院、党校以及高校等多家智库专家学者,围绕""国家治理体系和治理能力现代化背景下新型智库新使命""主题,就四中全会背景下新型智库建设的新使命机遇,国家治理现代化与新型智库建设关系、湖北省域新型智库建设现状,以及如何推动新型智库协同创新与高质量发展等议题进行深入交流,在一定程度上,为区域新型智库建设交流经验,开展智库协作交流提供了平台。 ",ZKSL202004006
“国际著名智库网信领域研究观察”专栏按语,张志强:34550201,1, ,"<正>智库作为专业性战略与政策研究咨询机构,被誉为一个国家的立法、行政、司法、媒体之后的""第五种力量"",盖因为其主要致力于影响政策制定的机构属性和使命,智库已经成为现代国家和社会治理体系的重要组成部分。现代国家和社会发展的治理体系的复杂性程度日益提高,国家和社会治理的各种战略与政策问题林林总总、错综复杂,都需要智库机构进行超前洞察、问题预判、前瞻研究、预见预警、政策设计、决策咨询等。智库是政策价值链的前端机构,对政策有着极大影响。随着信息 ",ZKSL202004007
兰德公司发展态势及其在网信领域的战略政策研究,"陈秀娟1:41306414|张志强2,3:34550201|唐川2,3:11437501",12,兰德公司; 智库; 网络安全和信息化领域; 战略研究; 政策咨询;,"[目的/意义]深度剖析国际著名智库美国兰德公司的最新发展现状及其对网络安全和信息化领域的研究情况,为我国新型智库的建设、尤其是网络安全和信息化领域专业智库的建设提供参考和借鉴。[方法/过程]采用网络调查和文献调研的方法,梳理兰德公司的组织架构、研究团队、财务情况、全球影响力及主要的研究领域和取得的成就,结合兰德公司近些年发布的网络安全和信息化领域代表性研究成果,揭示其研究进展与核心内容。[结果/结论]兰德公司在管理模式上保持着其专业性和独立性,智库人才建设方面聚集了世界级多元化的智囊人物,研究选题方面开展多学科领域的研究并确保选题的前瞻性,为我国建设高端、新型、特色智库乃至网络安全和信息化领域的专业智库提供了多方面参考,包括建立科学规范的智库管理模式、建立强大的思想型人才队伍、进行超前的研究选题和议题设置。 ",ZKSL202004008
美国国会研究服务部发展现状及其在网信领域的研究态势,"郭进京1:37287336|张志强2,3:34550201|陈秀娟4:41306414|徐婧2,3:32192633",10,美国国会研究服务部; 智库; 网络安全和信息化; 互联网治理;,"[目的/意义]以美国国会研究服务部为例,剖析其发展现状及在网络安全和信息化领域的研究态势,为国内智库在开展网信领域研究时提供经验借鉴。[方法/过程]采用文献调研法和网络调研法收集整理相关资料,梳理其发展历程、组织架构及人员构成、资助来源、主要研究领域及成就,并结合对国会研究服务部所发布的网信领域研究成果的分析,总结其在网信领域的主要研究主题和智库建设经验。[结果/结论]美国国会研究服务部关于网信领域的研究主要集中于互联网治理、网络与国家安全、新兴技术及其应用、网络基础设施。国内智库在发展过程中,可借鉴以下经验:明确定位,紧密结合用户需求,提供专属服务;严格规划研究领域和团队体系建设,提供精准服务;建立完善评价体系,保证服务质量。 ",ZKSL202004009
加拿大国际治理创新中心及其在网信领域的研究,"郭进京1:37287336|张志强2,3:34550201|陈秀娟4:41306414|唐川2,3:11437501",10,加拿大国际治理创新中心; 智库; 网络安全和信息化; 互联网治理;,"[目的/意义]网络安全和信息化是事关国家安全和发展的重大科技领域和非传统安全领域,受到国际智库的高度关注。相比较而言,国内智库对该领域的研究重视程度明显不够,应该借鉴国际智库在网信领域的研究经验。[方法/过程]以加拿大国际治理创新中心为例,采用文献调研法和网络调研法收集整理相关资料,结合对该智库所发布的网信领域研究成果的分析,总结其在网信领域的研究主题和经验。[结果/结论]加拿大国际治理创新中心关于网信领域的研究主要集中于互联网治理,网络安全,大数据,人工智能、物联网、区块链等新兴技术,互联网与人权,互联网与非洲等主题。从加拿大国际治理创新中心相关发展经验来看,国内新兴智库在发展过程中必须规划业务发展领域并着力形成研究影响力,围绕新兴挑战性问题领域开展研究,通过打造系列品牌产品来提高品牌影响力,充分利用社交媒体和网络来提高社会影响力。 ",ZKSL202004010
澳大利亚战略政策研究所网络安全领域研究及对中国智库的启示,"朱敏1:45462183|张志强2,3:34550201|陈秀娟4:41306414|唐川2,3:11437501",8,澳大利亚战略政策研究所; 智库; 网络安全;,"[目的/意义]自《关于加强中国特色新型智库建设的意见》发布以来,国内学者对西方知名智库进行了全面、深度的研究,取长补短,积极发展中国特色新型智库,但对除欧美之外的智库研究较少。因此笔者以澳大利亚权威智库澳大利亚战略政策研究所(ASPI)为研究对象,介绍了ASPI在网络安全与信息化领域的研究成果,为我国智库的发展提供借鉴。[方法/过程]本文主要使用了文献调研和网络调研的研究方法,介绍了ASPI的发展历程,梳理了近年来其在新兴科技领域的研究成果。[结果/结论]ASPI共有7大研究领域,主要包括国防战略与国家安全、反恐、国际网络政策、国际计划、风险与应变、北部与澳大利亚安全以及战略警务和执法计划。在新兴科技领域,ASPI极为关注与中国的合作和竞争关系研究。ASPI在人员流动与合作机制、国际交流与合作、社交媒体利用等方面的经验值得国内智库学习和借鉴。 ",ZKSL202004011
哈佛大学贝尔弗科学与国际事务研究中心:全球一流高校智库,"徐婧1,2:32192633|张志强1,2:34550201|唐川1,2:11437501",8,贝尔弗科学与国际事务研究中心; 智库; 高校智库; 政策影响力;,"[目的/意义]深入分析美国哈佛大学贝尔弗科学与国际事务研究中心,为我国高校智库发展与建设提供借鉴与思考。在""智库与公民社会项目""发布的《全球智库报告》中,该中心连续6年位居高校智库首位,在很多关键性问题上对美国国内和国际政策决策产生了重要影响。[方法/过程]主要采用文献调研法和网络调研法采集资料和数据,分析中心发布的部分成果,剖析该中心的决策影响力和专家队伍特点、主要研究领域和关注问题,以及研究成果特点等。结合贝尔弗中心发展经验,针对国内高校智库存在问题提出相关建议。[结果/结论]该中心作为高校智库,汇集了多背景、多学科、多行业的专家人才,其研究领域聚焦外交与国际事务、环境与自然资源、国家安全、科技与公共政策等国计民生问题,其研究成果形式多样、传播广泛、影响力大,对我国高校智库的建设有重要的参考借鉴意义。 ",ZKSL202004012
《智库理论与实践》2020年选题指南,,1, ,"为更好地体现本刊定位与特点,有效传播智库研究成果,本刊每年度发布选题指南,并动态更新。本选题指南是在向编委和专家们征集2020年选题建议的基础上整理而成的,也是本刊2020年度侧重关注和报道的内容,供智库研究人员研究和作者撰写文章参考(包括但不限于这些选题,往年的选题仍然可用)。 ",ZKSL202004013
“防务智库建设”专栏按语,卢胜军:45682130,1, ,"<正>无论古今中外,智库的起源离不开战争和军事。早在春秋战国时期,为应对诸侯间的战争,我国""食客""""谋士""""智囊""以智辅政、名垂青史,千百年来""幕府""""参谋""""军师""等幕僚性职业和机构更是兴盛不绝,鲜明体现了我国智库的历史本源和中国特色。即使在当代,虽然智库的起源众说纷纭、莫衷一是,但西方意义上的智库""think tank"",源于""二战""时期美国军事专家和参谋讨论作战计划与方案的保密室,类似于军队的参谋咨询机构。战后用于指代相关研究与发展部门 ",ZKSL202003001
中国特色新型防务智库发展态势与政策建议,卢胜军1:45682130|杨燕南2:28542405|赵超阳1:38916382,8,军事智库; 决策咨询; 战略管理; 军民融合; 发展态势; 政策分析;,"[目的/意义]防务智库是国防和军队建设科学民主依法决策的重要支撑,是实现国防和军队""四个现代化""、增强军事软实力的重要力量。[方法/过程]界定了防务智库、军事智库相关概念范畴,分析了当前新型防务智库得到党和军队高层重视、力量迅速增长、研究工作全面推进、活动与成果丰富、咨政作用明显、国际话语权提升等基本情况,总结出国防和军队改革急需、军事战略特色突显、管理体制变革、""3+X+Y""格局重塑、品牌体系形成、理技结合、军地旋转门加速7个重要特征。[结果/结论]围绕当前中国特色新型防务智库建设发展存在的诸多问题,提出了建立健全防务智库规范性制度、制定顶层智库专项规划计划、强化体系化力量格局、培育防务思想市场、融合大数据智能技术、实施""走出去""战略6方面政策建议。 ",ZKSL202003002
对新时代国防科技智库建设的思考与建议,刘书雷:20475628|屈婷婷:21190230,6,国防科技智库; 建设要求; 思考建议;,"[目的/意义]国防科技智库是中国特色新型智库的重要组成部分,建设国防科技智库对于推动国防科技创新、强化国防科技战略管理具有重要意义。[方法/过程]分析了国防科技智库建设的重大意义,探讨了国防科技智库建设应该把握的基本要求,提出了推进国防科技智库建设的有效路径。[结果/结论]国防科技智库建设要突出科技特色、坚持需求导向、强化未来牵引、注重方法创新,并从确立建智用智理念、构建智库体系、发挥综合性科研机构引领作用、健全机制环境等4个方面提出了思考建议。 ",ZKSL202003003
关于新时代国防科技工业智库建设的思考,李斌1:22207188|雷贺功1:25371729|曹琪2:43418370|何艺佳1:44874873,5,智库建设; 国防科技; 国防工业; 决策咨询;,"[目的/意义]国防科技工业智库是中国特色新型智库体系和国防科技创新体系的重要组成部分,理清国防科技工业智库定位和发展思路,对国防科技工业智库建设具有重要指导作用。[方法/过程]结合国防科技工业深化改革面临的形势,概述国外从事国防工业研究与咨询的智库性质和分类,分析了国内国防科技工业智库的发展现状和问题,提出了新时代国防科技工业智库的定位任务和总体构想。[结果/结论]国防科技工业智库建设应重点关注咨询体系建设、顶层政策指导、高端力量建设、稳定支持机制、考核评价机制、智库联盟组建等方面。 ",ZKSL202003004
中国特色独立防务智库的建立与发展,李健1:44680384|卢胜军2:45682130,6,独立; 防务智库; 建设; 发展; 产品;,"[目的/意义]独立防务智库是对中国人民解放军""军事智力""建设有益的补充,也是必要的协同,进行国防信息与战略研究领域的军民融合,也是必然的发展之路。[方法/过程]对独立防务智库本质的认知、体系建设的原则、研究的方法论、思想产品线的体系架构、如何进行战略传播等几个方面进行探讨。[结果/结论]根据中国特色有所取舍,建立专业化、独立性的防务智库,进而缩小与发达国家的""军事智力""差距。 ",ZKSL202003005
新型防务智库政策制度的理论分析与设计,卢胜军:45682130|张代平:38916381|赵超阳:38916382,7,军事智库; 立法研究; 政策分析; 政策制度改革;,"[目的/意义]当前,在推进国家治理体系和治理能力现代化、深化军事政策制度改革的背景下,新型防务智库政策制度建设已成为国防和军队""四个现代化""建设的重要法治保障。[方法/过程]简要介绍了国内外智库政策制度发展现状,以学术研究视角分析了新型防务智库政策制度建设的必要性及应解决的瓶颈问题,设计提出了新型防务智库政策制度的总体思路、框架体系及主要内容。[结果/结论]尝试探索新型防务智库政策制度的3方面创新:从学理上实现学术研究的理论创新、从法理上实现论证设计的立法创新、从管理上实现改革突破的实践创新,为新型防务智库政策制度建设论证和学术研究提供参考。 ",ZKSL202003006
学科协同对高校智库效能的影响机制研究,张利江:10814285|蒋天云:44874874,9,高校智库; 学科协同; 智库效能; 学科服务; 回归分析;,"[目的/意义]建设和完善高校智库机制,提升高校智库效能亟待加强。本文结合高校的智库建设现状及实践经验,探索高校智库效能的影响因素。[方法/过程]本文以高校智库为研究对象,以高校智库的相关工作人员及高校教职工为调研对象,对201份调查问卷用SPSS18.0进行数据分析,通过相关分析和回归分析探究学科协同对学科服务绩效及高校智库效能的影响;学科服务绩效对高校智库效能的影响以及学科服务绩效的中介作用。[结果/结论]研究表明学科协同视域下,知识共享和团队结构均对学科服务绩效中的吸收能力、创新能力和科研能力有显著的正向影响,同时对高校智库效能也有正向影响;学科服务绩效中部分维度对智库效能有显著影响;吸收能力和创新能力在学科协同与高校智库效能之间具有中介作用。数据分析显示加入吸收能力和创新能力后知识共享和团队结构对高校智库效能的影响比其直接影响更加显著,因此本文从知识共享、团队组建、个体和团队的学习能力3个方面提出促进高校智库发展的建议。 ",ZKSL202003007
智库法律地位与主体准入制度的比较研究,张旭:37091976,6,智库准入; 法律地位; 一元登记; 双重管理; 三级准入;,"[目的/意义]智库准入形式决定了智库法律地位和制度空间,建设中国特色新型智库,首要任务就要厘清智库的机构属性与业务属性。[方法/过程]通过比较国外智库一元登记的主流模式与国内智库准入的现实选择,探讨了双重管理模式的学理逻辑和实践困境,分析了智库准入监管体制发展趋势。[结果/结论]借鉴国外智库一元登记主流模式的同时,要立足中国政治文化特色,在智库合法性确认和政策配套的前提下,逐步实行包括备案查询、法人登记和公益认定的三级准入制度。 ",ZKSL202003008
我国智库政策文献的计量可视化分析,黄晓斌:10069512|邓宝赛:44874875,11,新型智库; 政策文献计量; 政策趋势; 政策参照;,"[目的/意义]智库的建设离不开政策的支持和保障。总结近年来我国智库相关政策的特点和演变规律,可为智库建设、智库政策的制定和发展规划提供依据。[方法/过程]利用文献计量、知识图谱、聚类分析、可视化分析等方法,对我国智库政策文献进行收集、元数据抽取、聚类与计量可视化分析。[结果/结论]目前我国智库政策得到了一定的重视,但在系统性、连续性和可操作性方面还需要进一步改进。建议进一步完善智库政策的内容体系,细化相关政策内容;提高智库政策的针对性和可操作性,建立健全智库的组织章程;注意智库政策的可持续性,不断更新和完善;加强部门合作,为智库政策制定提供保障机制;不断反馈,重视对智库政策应用效果的评估。 ",ZKSL202003009
面向智库评价的数据资源中心建设研究,张鑫:39008727|文奕:10340703,10,智库研究; 知识资源中心; 多源数据融合;,"[目的/意义]智库建设是目前社会科学界热议的话题,如何科学合理地研究和评价智库也成为日益受关注的问题,高质量的智库研究报告需要高质量的数据平台支撑。[方法/过程]本文从智库研究与评价的需求出发,总结了目前智库知识资源体系的主要类型和建设现状,提出了大数据环境下面向智库研究的知识资源平台建设困难和挑战,介绍平台建设的原则思路和主要技术。[结果/结论]以中华智库研究网为实例,介绍面向智库研究的知识资源中心的建设,以及资源中心支撑智库研究的实践。 ",ZKSL202003010
我国出版行业智库知识服务现状研究,廉强:40598408,7,出版行业智库; 知识服务; 发展现状;,"[目的/意义] 2018年3月20日,国家新闻出版广电总局印发《关于加快新闻出版智库建设的指导意见》,意见提出要提高专业智库服务能力,要在知识服务上下功夫。基于这一背景,本文通过调查我国出版行业智库知识服务现状,总结出版行业智库知识服务存在的问题,并提出针对性措施来解决存在问题。[方法/过程]本文通过文献调研方法获取出版行业智库知识服务的相关研究资料,并通过网络调研方法调查总结我国出版行业智库知识服务的发展现状与存在问题。[结果/结论]通过调研分析发现,我国出版行业智库已经形成多种类型的知识服务主体,以出版行业智库为核心的研究团体开始出现,出版智库提供的知识服务内容和产品逐渐丰富;但是,同时也存在知识服务平台建设较差、个人知识服务水平不高、智库间合作不足等问题,并针对这些问题提出可行性解决办法与对策。 ",ZKSL202003011
高校图书馆新型智库协同创新平台构建研究,王雨:33953960,8,高校图书馆; 新型智库; 协同创新平台;,"[目的/意义]高校智库是中国特色智库的重要组成部分,高校对于新型智库建设的重视程度不断提升,高校图书馆加大了对新型智库协同创新平台的构建力度,致力于提高高校科研水平、政府决策的质量以及与企业产学研合作的效率。[方法/过程]以高校图书馆新型智库协同创新平台构建为研究对象,应用结构方程模型对高校图书馆新型智库协同创新平台核心能力进行实证分析。[结果/结论]探讨新型智库协同创新平台的构建机理及模式,有针对性地提出发展对策和建议,以期为今后新型智库建设的相关研究提供借鉴。 ",ZKSL202003012
