篇名,作者,页数,关键词,摘要,filename
试论领军人物对于中国特色新型智库建设的重要性,胡海滨:30338802,6,中国特色新型智库; 领军人物; 使命感; 人力资本;,"[目的 /意义]自""中国特色新型智库""这一概念被提出到现在,智库建设在中国大热,如何提升智库的整体质量,是后期智库建设的重点。本文试图从智库领军人物对智库建设的作用方面提出新思路。[方法 /过程]本文围绕领军人物应具有的综合能力,结合对国内外典型案例的分析,发现智库领军人物是影响智库发展的决定性因素之一。[结果 /结论 ]具有使命感和责任感、有大局意识、有运营能力的智库领军人物能够带领智库快速发展、实现突破、取得佳绩、做出贡献。中国特色新型智库领军人物的选拔、培养,以及建立完善促使其充分发挥创造力、生产力、组织力的制度保障,充分释放领军人物的人力资本,是现阶段中国特色新型智库建设的一个关键内容。 ",ZKSL201703007
新型智库领军人才的队伍建设问题及建议,夏宇1:35566176|马岩1:35334352|沈进建2:42677332,7,领军人才; 队伍建设; 激励机制; 新型智库; 智库建设;,"[目的 /意义]领军人才是智库的灵魂,加强领军人才的队伍建设对中国特色新型智库建设的意义重大。[方法 /过程]文章通过归纳、总结和分析新型智库建设中领军人才队伍建设中存在的问题,梳理新型智库领军人才队伍建设的经验,提出加强领军人才队伍建设的建议。[结果 /结论 ]文章认为,领军人才的队伍建设应从建立选拔和吸引领军人才的机制入手,加大有利于领军人才队伍建设的激励机制,内部治理,评价机制和投入机制的改革和创新。 ",ZKSL201703008
智库与政府关系的调整与探索——以日本、韩国和新加坡智库为例,张骏:35264655,7,智库; 政府关系; 日本; 韩国; 新加坡;,"[目的 /意义]分析、解读智库与政府关系根源,将有助于进一步优化我国正在高速发展的智库行业与政府间的关系。[方法 /过程]通过观察分析日本、韩国和新加坡的智库如何调整和探索与政府的关系,本文分析了与政府""再结合"",""剥离""与""统合""并行及""政府布局""与""高官参与""兼备等举措背后的行为逻辑。[结果 /结论]日本、韩国和新加坡智库普遍呈现的特征,一方面是因为这一地区的政府普遍保持着对包括智库在内的社会组织更为积极和直接的介入,另一方面这些智库本身对于知识与权力的关系有着也不同于西方的理解。 ",ZKSL201703009
智库图书推介,,1, ,"<正>书名:大国背后的""第四力量""作者:王辉耀苗绿出版社:中信出版社出版时间:2017年1月内容简介《大国背后的""第四力量""》是继《大国智库》之后,王辉耀和苗绿博士的又一力作,作为中国特色新型智库的探索者与实践者,他们将九年运营中国社会智库的经验与实践心得总结出来,在书中将智库的创新运营总结升华为""思想创新力、研究支撑力、社会传播力、国际输出力和政策影响力""五种力量相互作用的结果,称之为智库创新运营""五力模型""。 ",ZKSL201703010
浦江创新论坛——2017科技创新智库国际研讨会专家观点集萃,,4, ,"<正>2017年6月16—17日""浦江创新论坛——2017科技创新智库国际研讨会""在上海召开。本次国际研讨会由上海市科学学研究所主办,以""创新全球化与城市功能再造""为主题,邀请来自全球的21位科技创新智库专家围绕""创新全球化的特征与趋势""""推进创新全球化实现共赢""""城市创新功能的演化与塑造""以及""如何建设全球创新中心城市""等议题进行研讨,分享远见卓识。以下 ",ZKSL201703014
“G20、全球治理与中国发展”研讨会暨G20研究系列成果发布会在中国人民大学顺利召开,,1, ,"<正>2017年7月7—8日,G20领导人峰会在德国汉堡举行。为更好筹备G20峰会,2017年7月2日下午,中国人民大学主办、中国人民大学重阳金融研究院(人大重阳)与中国人民大学全球治理研究中心承办的""G20、全球治理与中国发展""研讨会暨G20研究系列成果发布会在中国人民大学逸夫会议中心成功召开,《智库理论与实践》作为支持媒体,近200位各界专家、学者与媒体 ",ZKSL201703015
第三届中国新型智库建设学术研讨会暨第三届上海竞争生态论坛征文及会议通知(第一轮),,1, ,"<正>一、会议背景与主题为推进中国新型智库建设,贯彻落实党中央、国务院关于在市场体系建设中建立公平竞争审查制度的决策部署,深化供给侧结构性改革,促进智库与政界、学界和媒界等多领域之间的交流互动,""第三届中国新型智库建设学术研讨会暨第三届上海竞争生态论坛""将于2017年11月11日(周六)在上海大学召开。公平竞争是创新的重要动力,本次会议主题为""中国新型智库建设与竞争政策创新"",共同研讨在大数据背景下,智 ",ZKSL201703016
智库能力与新型智库建设——2017第二届新型智库核心能力建设高级研修班通知(第一轮),,2, ,"<正>为加强中国特色新型智库核心能力建设,推进科学决策、民主决策,推进国家治理体系和治理能力现代化,增强国家软实力,解决新型智库理论与实践发展中所面临新问题,加强智库实践界、学术界与决策部门间的研讨交流,促进新型智库发展,中国科学院文献情报中心《智库理论与实践》编辑部将于2017年11月24-27日在北京举办""2017第二届新型智库核心能力建设高级研修班""。研修班将邀请国家高端智库代表、知名智库 ",ZKSL201703017
上海社会科学院智库研究中心举办“中国新型智库建设研讨班”,,1, ,"<正>2017年6月23日,由上海社会科学院智库研究中心主办、上海科技管理干部学院协办的""中国新型智库建设研讨班""在上海文化发祥地之一——嘉定举行。来自全国各地决策部门、科研院所智库、高校智库和社会智库的30余位专业人员参加了会议,共同围绕""中国特色新型智库的建设经验、问题瓶颈和发展趋势""以及""2017年中国智库评价调查问卷设计""等内容开展交流。上海科技管理干部学院院长王建平致辞,会议由上海社会科学院智库中心执行主任杨亚琴主持。 ",ZKSL201703018
知识视角下美国外交关系协会的智库功能探究,王铮:21863090,9,美国外交关系协会; 智库; 知识产品; 国际政治; 全球智库报告;,"[目的 /意义]通过考察美国外交关系协会的智库功能,分析国际顶级智库的知识产品及服务,总结智库通过知识产品发挥影响力的途径,为中国新型智库建设提供借鉴。[方法 /过程]采用案例研究方法,主要通过文献调研和网站调研收集数据,同时参考了国际权威的智库排名报告,对外交关系协会的知识产品及其影响力进行考察。[结果 /结论 ]智库知识产品是智库影响力的基础性来源,知识生产、知识出版、知识服务是智库功能的重要组成部分。 ",ZKSL201703011
地方智库服务科学决策的问题与对策研究——以山东省为例,"李钊1,2:26723200|李海波1,2:26439222|马羽3:37406248|汝绪伟1:21964094|陈娜1:27542410",6,地方智库; 科学决策; 山东省; 管理机制; 评价与激励;,"[目的 /意义]随着建设新型智库服务科学决策成为社会新热点,当前地方智库由于缺乏组织引导、缺乏上报通道、缺乏处理反馈机制和缺乏评价激励制度,制约了地方智库有效发挥建言献策、参政议政的作用。[方法 /过程]课题组以山东省为例,对新型智库建设问题进行了专项调查,并与省直有关部门和部分高校、科研院所、企业、社会组织负责人进行了座谈研讨。[结果 /结论]针对上述问题,提出了建设地方新型智库体系、构建党政部门智库圈、完善智库人才评价与激励制度、健全智库经费管理机制、探索建立决策咨询委员会等对策建议。 ",ZKSL201703012
2017印度洋地区蓝皮书观点综述,朱翠萍:17615961,4, ,"<正>自""一带一路""倡议提出以来,在南亚,虽然中巴经济走廊建设进展良好,但这一旗舰项目对整个南亚地区的拉动效应并不大,对周边的辐射效应也不明显。孟中印缅经济走廊建设虽然取得了一定进展,但是实质性推进的步伐依然缓慢。为了解答""一带一路""在南亚方向的现状、难点与应对举措,由汪戎教授和朱翠萍教授主编的《印度洋地区发展报告(2017)》(蓝皮书)尝试从南亚地缘政治格局、南亚安全局势、莫迪对华心态、印度难点、中尼印经济走廊等多个角度予以 ",ZKSL201703013
战略驱动发展的实践探索,,1, ,"<正>智库的价值和使命在于推动政策和战略的制订,更在于推动政策与战略的实施。智库需要落地,需要在实践上做出不断的探索,将智库思想、理念、规划、设想等转化为实际行动,产生具有实际价值和效果的成效。本期作为一种尝试,以中国发展战略学研究会的研究成果作为案例,试图从实践层面展示智库的实际研究成果,展示该领域一年来的相关研究进展和有代表性的研究成果,检验智库专家在理论与实践相结合上所进行的宝贵探索。中国发展战略学研究会(以下简称研究会)是以中国科学院为业务主管单位的国家一级 ",ZKSL201606001
从智库研究理论到科技智库建设——专访中国科学院科技战略咨询研究院潘教峰院长,,4, ,"<正>中国科学院作为首批国家高端智库建设试点单位,凝聚整合全院研究力量,组建成立了具有法人地位的中国科学院科技战略咨询研究院(以下简称""战略咨询院"")。在首批国家高端智库建设试点工作开展一周年之际,我刊就战略咨询院如何立足科技特色开展智库研究、进行战略布局等问题对战略咨询院院长、中国发展战略学研究会理事长潘教峰进行了访谈。潘院长以其战略视野和宽广的思维,结合长期从事战略研究和重大规划的实践经验,创造性地提出了DIIS智库研究方法,并向读者分享了他对智库 ",ZKSL201606002
战略高技术发展趋势,张凤1:35825508,4,战略高技术; 世界发展趋势; 科技发展路线图; “十三五”规划;,"[目的 /意义]战略高技术是国家经济社会发展的重要驱动力,是国家科技创新能力的综合体现。辨识战略高技术发展方向,培育和发展战略性新兴产业,对促进新经济、壮大新动能、抢占制高点都具有重要意义。[方法 /过程]在中国科学院组织的至2050年科技发展路线图战略研究基础上,利用专家研判和文献情报分析相结合的方式,选择信息、生物和医药、新材料、先进制造、先进能源、生态环境、空间、海洋、现代农业、资源等10个战略高技术领域,组织100多位专家开展发展态势研究,形成的研究报告又以专家研讨会的方式广泛征求了意见。[结果 /结论 ]本文阐释了世界战略高技术发展的总体趋势和10个领域的发展趋势。 ",ZKSL201606003
科研组织一般战略研究——兼论中国科学院研究所分类改革,霍国庆1:33234174|李慧聪2:36165161,7,科研组织; 战略管理; 一般战略; 竞争优势; 分类改革;,"[目的 /意义]本文旨在应用波特一般竞争战略理论解析和提出科研组织的竞争优势与一般战略,这对于提升我国科研组织的核心竞争力具有重要指导价值。[方法 /过程]本文首先分析并把科研组织的基本功能概括为知识发现与知识应用,据此提出科研组织的竞争优势主要表现为系统和持续积累的数据/样本库、持续解决重大战略问题的能力、持续转化知识技术为现实生产力的能力,然后通过竞争优势的组合分析提出科研组织的一般战略模型,推演出科研组织的一般战略,即突破战略、引领战略、协同战略,并对3种战略进行了系统阐述。[结果 /结论 ]本文应用该模型对中国科学院研究所分类改革方案进行了分析,发现研究所分类改革基本符合科研组织一般战略模型的研究结论,但又存在不一致性,主要原因在于研究所分类改革的依据是经验主导的标杆管理原理而非理性主导的科研组织战略管理理论,基于此,本文提出了改进和深化研究所分类改革的对策建议。 ",ZKSL201606004
步入大科学时代的诺贝尔奖,潘龙飞:33533520|周程:11139477,9,大科学; 诺贝尔奖; 影响;,"[目的 /意义]要营造能够培育诺贝尔奖的科技环境,我国需要明确大科学时代对诺贝尔奖产生的巨大影响,从而有针对性地进行政策倾斜。[方法 /过程]笔者梳理了相关理论案例和数据,探讨大科学时代对诺贝尔奖产生的影响。[结果 /结论]影响主要有3方面:第一,科学研究组织愈发复杂和庞大,使得科学家的获奖争议越来越多;第二,科学已经不再只是科学家的兴趣研究,更加依赖社会支持,政府在科学家获奖过程中扮演了重要角色;第三,科学与技术已经密不可分,大量获奖者通过应用研究获奖。屠呦呦等科学家的获奖争议、日本政府的诺贝尔奖振兴计划、20世纪半导体研究大量获奖分别有力说明了以上三大影响。 ",ZKSL201606005
中国教育改革的回顾与展望,王元丰:06323683|李克平:10679079,7,中国教育; 综合改革; 教育现代化;,"[目的 /意义]教育是民族振兴和社会进步的基础,是落实国家""创新、协调、绿色、开放、共享""五大发展理念的保障。中国作为拥有世界上最多人口的国家,政府一直将发展教育放在首位,建立起了世界上最为庞大的教育系统,中国教育的改革一直备受关注。[方法 /过程]本文回顾了改革开放以来中国教育改革的目标和发展历程,分析了其中存在的问题,并对未来的教育改革与发展进行了展望。[结果 /结论 ]分析表明,中国的教育改革虽然在扩大受教育范围方面取得了显著的成就,在提高教育质量和促进教育公平上也有较大进展;但面向未来,一些问题依然突出,还需要深化改革,促进教育公平,提高教育质量和改革教育管理体制,应对全球化和新技术革命给教育带来的挑战。 ",ZKSL201606006
新世纪我国生态安全面临的新态势与对策,欧阳志云:05964935|徐卫华:09589127|肖燚:09632359|郑华:09632388|张路:24123764,9,生态安全; 生态问题; 土地退化; 生境丧失; 流域生态功能退化; 城市人居环境恶化;,"[目的 /意义]自进入新世纪以来,持续高速经济增长、快速城镇化、资源高强度开发,以及汶川特大地震等自然灾害对生态系统带来巨大冲击和影响,这一时期也是我国生态保护与建设力度最大的时期,先后实施一系列生态保护政策与建设工程,促进了生态系统恢复,研究新时期生态问题特征及变化趋势,分析生态保护面临的问题,对完善生态保护政策与措施具有重要意义。[方法 /过程]分析我国2000—2010年主要生态问题及其变化趋势。[结果 /结论]研究发现,新世纪以来,我国生态问题开始进入转型期,农业导致的生态问题仍然严重,但开始好转;城市化导致的生态问题加剧,主要表现为:生态系统质量和服务功能低下,水土流失、土地沙化、石漠化等问题仍然严重,但面积减少与程度下降。城镇化、工业化与资源开发导致的流域生态破坏、城镇人居环境恶化、自然海岸线丧失、野生动植物自然栖息地减少等问题加剧。全国生态安全形势仍然严峻,发展与生态保护的矛盾还尖锐。为了应对生态问题的转型,保障国家生态安全,应该坚持自然恢复,提高生态系统质量与生物多样性保护,积极推进绿色城市化道路,降低城市化对区域环境的影响,加强流域生态保护与修复,提高流域生态服务功能... ",ZKSL201606007
建设世界性城市的三个关键点,何传启:09651719,3,世界城市; 创新驱动; 双擎驱动; 城镇化; 中国;,"[目的 /意义]建设世界性城市和国家中心城市,是我国新型城镇化建设的重要组成部分。[方法 /过程]采用国际比较和模型分析方法。根据世界现代化的历史经验,世界性城市应该是具有国际影响的创新驱动型城市。[结果 /结论 ]本文借鉴国际经验,提出建设世界性和国家中心城市的3个关键点和目标,即坚持创新驱动的发展战略,坚持科技创新和制度创新的双擎驱动,坚持创新文化和创新人才的先导作用,建成有世界影响的创新城市和创新高地。 ",ZKSL201606008
“立体土地”:我国城市推广长寿命住宅的政策模式探讨,"高晓路1,2:11574950|陈蔚3:36165163",7,立体土地; 百年住宅; 土地产权制度; 客户价值; 住宅建设;,"[目的 /意义]当前,我国城市的住宅需求开始由数量增长转向质量提升、由短期重建转向长期保有和经营。在此背景下,急需推动以长寿命、高质量为政策导向的住宅供给模式的转型。然而,长寿命住宅的推广存在与土地产权制度的矛盾以及初期成本过高等问题。[方法 /过程]本文在分析和借鉴国外经验的基础上,提出了依托于SI住宅体系(即结构主体和填充部分分离)的技术政策新模式,即""立体土地""。该模式将长寿命住宅的结构部分与填充部分区分开来,并将结构部分视为城市基础设施的一部分,即立体化的土地。""立体土地""作为由地方政府或社会团体管理的公共资源,以少于70年的合同期出让给开发商或居民。[结果 /结论 ]这种理念是对城市土地资源的拓展,这种模式不但可以大幅增加空间资源的总量,还有助于地方政府对空间资源进行集约化管理,有助于解决土地管理中卖地生财问题,有助于形成高质量的城市资产和景观环境,有利于推动我国房地产开发和住宅生产模式的转型。 ",ZKSL201606009
一带一路水务科技合作机遇与挑战,肖峰1:25833259|马晓敏2:31398737|杨敏1:19001259,8,一带一路; 水科技; 水资源; 合作;,"[目的 /意义]一带一路的倡议带动了我国与沿线国家多方位的合作与交流。针对沿线国家在水务科技方面的迫切需求,以我国近年来在相关领域积累的雄厚实力为基础,以科技为平台,探索政产学研合作机制,在帮助沿线国家应对水安全挑战的同时,带动我国水务科技产业走出去,建立双赢的合作模式。[方法 /过程]本文分析了一带一路沿线国家的基本情况,明确了其在水科技领域面临的挑战,分享了中国科学院—发展中国家科学院水与环境卓越中心(CAS-TWAS CEWE)在与一带一路国家交流合作中的相关进展成果。[结果 /结论 ]CAS-TWAS CEWE积极探索政产学研合作机制,创建了""人才培养—科技援助—企业跟进""三位一体的科技援助模式,在帮助沿线国家提升水科技创新能力的过程中,积极为我国水科技企业走出去创造条件和机会,初步形成""科技援助与经济回报""相互促进的良好局面,提升了我国绿色外交的国际形象。 ",ZKSL201606011
“新型智库及领军人才绩效评估高层论坛”在济南大学召开,,1, ,"<正>2016年11月26日至27日,""新型智库及领军人才绩效评估高层论坛""在济南大学召开。本次论坛由中国科协提供支持,由济南市科学技术协会、济南大学软实力研究中心、山东省应用统计学会、济南数量经济与技术经济学会、《智库理论与实践》编辑部等单位联合举办。参加本次论坛的代表大部分是高校和科研单位专门从事决策 ",ZKSL201606010
中国大学智库论坛2016年年会举行,,1, ,"<正>2016年12月3日至4日,第三届中国大学智库论坛年会在上海举行,本届论坛年会的主题是""创新中的中国:战略·制度·文化""。论坛由教育部和上海市政府指导,复旦大学和中国大学智库论坛秘书处主办。教育部党组副书记、副部长沈晓明,上海市副市长翁铁慧,复旦大学党委书记焦扬等在开幕式致辞;全国政协教科文卫 ",ZKSL201606012
2016科技智库核心能力建设高级研修班在沪开班,,1, ,"<正>为贯彻习近平总书记在全国科技创新大会上的重要讲话精神,落实中办、国办《关于加强中国特色新型智库建设的意见》的要求,提高研究人员的核心能力,推进我国高水平科技智库的建设,中国科学学与科技政策研究会区域创新专业委员会、科技日报社新闻研究所、上海科技管理干部学院以及上海科学技术政策研 ",ZKSL201606018
治国理政与智库创新暨“中国新型智库建设”第二届学术研讨会在宁召开,,4, ,"<正>2016年11月11日,由南京大学紫金传媒智库和中国科学院文献情报中心联合主办、《智库理论与实践》编辑部协办的治国理政与智库创新暨""中国新型智库建设""第二届学术研讨会在南京大学举行。来自全国各地80家智库近150位智库负责人、专家学者齐聚金陵,共商智库大计。各位专家主要观点摘要如下:朱庆葆(南京大学党委副书记):高校智库是中国特色新型智库一个重要组成部分,办好中国特色新型高校智库是推进高校学 ",ZKSL201606019
2016中国智库治理论坛在南京举行,,1, ,"<正>为推动中国智库治理现代化、专业化和科学化,2016年12月17日,由南京大学、光明日报社主办,南京大学中国智库研究与评价中心、光明日报智库研究与发布中心承办的2016中国智库治理论坛在南京大学举行,《智库理论与实践》编辑部作为媒体支持单位。来自中央及各省市智库管理部门、中国智库索引(CTTI)首批来源智库、智库研究界的专家学者等近700人参加会议。会上发布了我国首个智库垂直搜索引擎和数据管 ",ZKSL201606020
智库图书推介,,1, ,"<正>《大国背后的第四力量》(Think Tank Power)作者:王辉耀苗绿出版社:中信出版社内容简介:几乎每个大国崛起的背后,都有智库在发挥无形的思想力量。正在崛起中的中国,同样需要有与之相匹配的智库,需要一大批具有独立性、专业性、国际性和公信力、影响力的强大智库提供智力支持,这是中国提高国家软实力的战略需求,也是中国应对日益复杂 ",ZKSL201606021
《智库理论与实践》关于推荐2016年度智库研究优秀论文的通知,,1, ,"<正>《智库理论与实践》是中国科学院文献情报中心和南京大学于2016年2月28日正式创刊(创刊号发布)的中国智库界唯一的专注于智库领域理论与实践研究的学术期刊。创刊近一年来得到智库界及相关领域的专家和同仁的鼎力支持。为推动我国智库领域的学术研究与创新实践,展示我国智库理论界的学术研究成果,鼓励发表更多的具有较高学术价值和实践价值的智库研究论文,本刊面向智库界和相关领域发起推荐2016年度智库研究优秀论文活动。有关要求如下: ",ZKSL201606022
中国经济转型的路径分析,刘霞辉:45667831,8,十三五; 经济转型; 新卡尔多事实; 创新;,"[目的 /意义]十三五期间及未来十五年是中国经济发展的关键时期,在内外需不振,经济转型的压力下,经济出现了明显的下行压力。在此背景下,要保持中国经济的较快增长,经济转型是关键。[方法 /过程]本文在回顾经济转型理论与事实的基础上,通过分析中国目前经济增长遇到的困境,在借鉴新卡尔多事实的基础上,提出要使中国再上新台阶,从十三五开始必须进行经济转型。[结果/结论 ]转型的基本路径是,首先要合理确定政府的定位,使其从经济增长的带领者转化为发动者,从台前走向幕后;再者是进行财税制度改革,适应中国经济增长新阶段,使税制由工业化阶段的间接税制逐步过渡到城市化阶段所要求的直接税制;三是进一步完善市场竞争环境,通过价格制度改革、事业单位改革等形成新的经济增长点,真正使创新和人力资本在增长中发挥更大作用。 ",ZKSL201606013
中国金融战略选择,邹平座:10799830,13,金融; 科技; 供应链; 区块链; 货币锚;,"[目的 /意义]针对当前我国科技、金融与产业发展相脱节,金融发展与实体经济、人民币价格与价值、房价与居民收入之间存在的""三大断崖""等问题,探索出一套系统性的有效的金融战略选择,能够有效促进经济金融发展,推动建立以中国为主导的全球金融贸易体系。[方法 /过程]在大数据、云技术、区块链等现代化信息技术基础上,融合供应链金融、资产银行、数字货币等,开发现代化金融科技,建立科技银行体系,推动以人的价值为基础的数字货币。[结果 /结论 ]研究证明,环球供应链金融联盟、国家科技银行及力波币等金融战略选择,对于解决当今国家经济金融发展中存在的问题及推动全球性的经济贸易发展具有重要的现实意义和深远的战略性意义。 ",ZKSL201606014
