"“互联网+基层治理”:基层整体性治理的数字化实现路径	门理想:40043212|王丛虎:09750521	10	整体性治理; 数字治理; 基层治理创新; 碎片化;	""权力体系、利益诉求及空间结构等方面的碎片化是目前困扰我国基层治理的重要问题",而整体性治理为破解这一难题提供了一种缝合机制。作为整体性治理的实现路径之一,机构改革的周期、成本和底限决定其在应对碎片化问题时存在短板,"而""""互联网+基层治理""""则能很好地充当一种弥补机制。整体性治理于数字时代的背景下诞生",其实现也有赖于数字化手段的应用。采用比较案例研究的方法,通过对绍兴市杨汛桥镇与北京市平谷区基层治理创新经验的对比,"发现""""互联网+""""对于整合基层治理中的权力体系和利益诉求具有重要作用",但要推动基层进一步走向整体性治理,"还需借助数字化手段实现基层治理中的渠道疏解、主体扩充、关系重构和观念扭转。 ""	DZZW201904006",,,,,,,,,,,,
"论我国网络直播监管体制的完善	王新鹏:41371429	11	网络直播; 监管权限; 监管对象; 监管模式; 直播监管; 互联网监管;	""""""互联网+""""政策的实施为网络直播注入了新活力",在网络直播蓬勃发展的背后,由于监管体制不完善导致的各种行业乱象严重阻碍着网络直播行业的健康发展。通过梳理我国网络直播监管体制的变迁脉络,发现我国网络直播监管体制存在顶层制度设计不足、监管权限分散、监管对象不明、监管模式落后和监管程序不完善等问题。当前,国家机构改革为完善网络直播监管体制提供了新的历史契机,从优化顶层制度设计、明确监管对象、构建网络直播合作治理模式、完善网络直播监管程序、建立网络直播监管配套机制等方面入手,形成科学合理的网络直播监管体制,"这是促进网络直播行业健康发展的必经之路。 ""	DZZW201904007",,,,,,,,,,,,,
"基于区块链的政务信息资源共享模型研究	余益民1:35035350|陈韬伟2:23378255|段正泰2:41371820|赵昆2:11285590	10	政务信息资源; 资源共享; 区块链; 智能合约; 共识机制; 信息交换;	""针对政务信息资源共享实践中存在的跨部门相互信任困难、数据隐私保护薄弱、交换不及时、数据不一致、业务协同困难、数据可溯性差及信息共享和公开范围不广等诸多亟待解决的问题",通过深入分析当前政府信息资源共享及公开的关键因素和运行机制,结合P2P网络、密码学以及人工智能理论,提出去中心化政务信息资源共享及公开的解决思路,并给出基于区块链技术的模型总体架构,从而构建政务信息资源共享与交换的网络体系、政务信息资源共享及交换区块链目录体系、去中心化数字证书及信任体系以及信息资源共享安全智能交换体系。该模型对有效解决政务信息资源共享应用中信任孤岛、数据所有权、对等管理、标准一致性和非实时交换等方面的问题具有较好的理论和实际应用价值,使政务信息资源共享及公开在政府及公众多元主体参与的背景下具有较强适应性,"对促进政府管理和公共服务的科学化、民主化、智能化和高效化具有积极意义。 ""	DZZW201904008",,,,,,,,,,,,,
"“最多跑一次”:互联网时代的数据驱动型政府创新――基于杭州市不动产登记领域改革的实地调研	赵玉林:32337629	8	最多跑一次; 数字治理; 数据驱动; 政府创新; 不动产登记;	""有别于常见的一般性描述和总体式分析","为凸显""""最多跑一次""""改革在操作和理念层面的具体特征",以杭州不动产登记领域的政府创新实践为案例,主要采用深度访谈、体验式观察与文献检索获取信息,"首先通过微观分析梳理了""""最多跑一次""""改革的外显变革与内在调整",而后通过与整体性治理和政绩驱动型政府创新的对比分析,进一步突显出此次改革的理念革新:数字治理与数据驱动。最后,"从""""内修""""与""""外联""""两个维度","提出了持续推进""""最多跑一次""""改革的政策建议。 ""	DZZW201904009",,,,,,,,,,,,
"陕西省市级政府电子政务回应性测度研究	杨立波:38604354|董新宇:09073334	8	电子政务; 政民互动; 回应性; 回应率; 回应速度; 回应质量;	""随着我国电子政务不断发展",公众利用互联网参与政府治理的需求也在逐渐增加,政府能否有效回应公众诉求成为衡量其治理能力的重要指标,也是学术界研究的重要问题之一。采用试验法,对陕西省十个地级市政府部门的电子政务回应渠道、回应率、回应速度和回应质量进行测度并分析。研究发现,陕西省市级政府电子政务的总体回应率不高,存在大量无回应的现象。在已回应的结果中,政府的回应速度较快,但回应质量一般,且各地级市之间的差异较大。为提升陕西省电子政务回应性,政府应注重顶层设计,完善电子政务回应的制度建设,并且要切实转变政府工作人员的观念,在改善电子政务回应系统质量的同时,"充分发挥政务新媒体的互动交流功能。 ""	DZZW201904011",,,,,,
"大数据背景下社会治理现代化:解读、困境与路径	 	9	大数据; 社会治理; 协同治理; 数据共享; 技术创新;	""大数据技术带来了全面而深刻的社会影响",为社会治理现代化提供了重要契机。大数据背景下社会治理现代化的结构性需求根植于治理环境的高度复杂性、治理主体的多元化、治理过程的动态化和治理结果的不确定性之中。社会治理现代化应具有清晰有序的治理模式、动态调适的规则体系、精准高效的治理机制、包容共享的治理格局等多维目标指向。而大数据时代社会治理现代化还面临着协作困境与信息孤岛、技术理性与制度滞后、技术风险与治理危机、工具理性与价值迷失的多重实践困境。研究认为,"应从协同治理与数据共享并进、制度建设与技术创新同步、技术应用与风险防控并举、价值引领与技术治理融合等方面推进社会治理现代化。 ""	DZZW201904012",,,,,,,,,,,,,,,,,,
"智能机器人的刑事责任主体论	朱静洁:32505847	8	人工智能; 智能机器人; 刑事责任主体; 刑事责任能力;	""随着智能机器人在人类社会中应用范围的不断拓展",智能机器人致人损害事件时有发生,为了明确智能机器人从事严重危害社会行为的刑事责任,"有必要首先确认其刑事责任主体地位。""""理性""""是区别法律主体(人)与法律客体(物)的根本依据",通过对智能机器人的认知理性及行为理性进行深入分析,可以确认智能机器人应当享有刑事责任主体地位。智能机器人刑事责任能力的具体划分可参照自然人刑事责任能力的划分标准,将理性程度作为基本尺度。具体而言,"可将""""理性""""具化为智能机器人的智能化程度与理性指数","将智能机器人划分为无刑事责任能力机器人、相对有刑事责任能力机器人、完全刑事责任能力机器人三种基本类型。 ""	DZZW201904013",,,,,,,,,,,,
"行政法视角下政府数据开放研究述评	张亚楠:23582909	8	政府数据开放; 行政法; 法治社会; 社会治理; 立法制度;	""政府数据开放研究已在信息管理学界、公共管理学界引起广泛关注并产生诸多成果",但从法学角度进行研究还尚处在起步阶段。从行政法学角度发掘政府数据开放的内在行为逻辑与问题,有助于厘清政府数据开放主客体双方的权利义务关系,促进政府数据开放顺利进行。通过文献分析法、比较法对国内外政府数据开放的主体概念、基本原则、基础理论与价值、困境与挑战进行了现有法学文献的总结与评析。政府数据开放作为一种行政法律行为,必然有许多法律问题无法通过管理手段解决,因此如何通过法律进行规制,"将政府数据开放进程中的公私主体权利义务关系纳入到法治化路径中是重中之重。 ""	DZZW201904014",,,,,,,,,,,,,,
"地方政府数据开放平台发展模式及影响因素分析	张廷君:25375319|曹慧琴:41371430	13	地方政府; 政府数据; 数据开放; 政府数据开放; 数据开放平台;	""为了推动地方政府数据开放平台建设与完善",分析各地方政府数据开放平台的建设现状与发展特点,总结并归纳其发展模式。研究选取截至2018年5月10日已建立的相对规范的45个地方政府数据开放平台作为分析单位,建立基于平台层、数据层两个维度的比较分析框架。归纳出当前地方政府数据开放平台发展的四类模式:平衡发展型、平台优先发展型、数据优先发展型、渐进发展型,同时探讨不同发展模式背后可能的影响因素,"提出进一步完善地方政府数据开放平台的相关建议。 ""	DZZW201904015",,,,,,,,,,,,,,,
"中国社科院法学所发布《中国法治发展报告(2019)》和2018年中国政府透明度指数排名		1	 	""<正>2019年3月28日","由中国社会科学院法学研究所、社会科学文献出版社联合主办的《中国法治发展报告(2019)》(下称""""法治蓝皮书"""")发布暨中国法治发展研讨会在北京举行","新华社、中央人民广播电台、中新社、人民网、《新京报》《新民晚报》等30余家重量级媒体出席发布会。 ""	DZZW201904010",,,,,,,,,,,,,,,,,,
"卷首语		1	 	""<正>伴随着人工智能、大数据、物联网、云计算等新技术的不断发展和应用",人类社会在政治、经济、文化等各个领域的数字化、网络化、智能化水平不断提升,"智慧社会也被视为继农业社会、工业社会和信息社会后的一种新型社会形态。本期""""专题研究""""聚焦""""智慧社会建设""""",试图揭示智慧社会的内涵与特征,借鉴西方发达国家智慧社会建设的有益经验,考察中国建设智慧社会的现实基础和路径选择,"预测并防范智慧社会建设中可能的风险。 ""	DZZW201904001",,,,,,,,,,,,,,
"人工智能概念的再界定与政府的治理回应:基于技术、市场和政治视角的分析	李晓方:38135459	7	人工智能; 政府治理; 公共政策; 后信息社会;	""从技术、市场和政治性的视角出发对人工智能的概念和治理机制进行分析。对于人工智能的治理而言",应该关注到作为知识形态的人工智能、作为产品形态的人工智能以及作为社会后果形态的人工智能在生产机制和运作逻辑方面的不同。后现代化社会的发展使知识生产呈现出开放、多元、多学科和异质性的特征,市场化竞争逻辑渗透到人工智能的方方面面。因此,人工智能的治理应该充分回应这些变化,在考虑不同社会后果及其影响的基础上,"建立基于伦理的透明、开放、包容和适应的治理体制。 ""	DZZW201903002",,,,,,,,,,,,,,,
"人工智能全球治理的现状:基于主体与实践的分析	俞晗之:41172458|王晗晔:41172459	9	人工智能; 全球治理; 治理主体;	""随着人工智能技术发展逐渐迈向应用阶段",其可能引发的诸多社会挑战和潜在风险亟需全球共同应对。当前,对于如何建构合理有效的全球治理体系应对人工智能发展仍然是一项方兴未艾的研究议题。通过对人工智能全球治理的现状进行梳理与分析,较为全面地呈现出当前该领域的主要治理主体及其实践进展,并且进一步总结了当前治理现状的两个特点:其一,治理主体百家争鸣,但是主体仍然缺乏多样性;其二,治理实践搭台热闹,"但是治理成果落地少。基于研究结论对中国下一步参与人工智能全球治理的战略路径提供了一些政策建议。 ""	DZZW201903003",,,,,,,,,,,,
"人工智能同经济社会发展融合中的潜在风险研判与应对研究	毛子骏1:22068421|黄膺旭2:31681745	9	人工智能; 智慧社会; 经济社会发展; 风险研判; 风险应对;	""人工智能的迅速发展将促进经济社会各领域从数字化、网络化向智能化快速跃升",带来巨大的变革。党中央提出促进人工智能同经济社会发展深度融合,加强人工智能发展的潜在风险研判和防范,推动我国新一代人工智能健康发展。该研究从人工智能的技术特点、应用方式和发展趋势入手,就其同经济社会发展融合中的潜在风险开展前瞻性研究,并从思想、组织、技术、管理和经济等五个方面提出对策建议,"以期为我国人工智能安全、可控、健康发展提供决策参考。 ""	DZZW201903004",,,,,,,,,,,,,,
"人工智能时代的政府治理:适应与转变	陈鹏:27875623	8	人工智能; 政府治理; 智慧社会; 社会治理;	""人工智能技术嵌入政府治理进程后",有利于有效控制政府规模、提高行政决策质量、优化行政运行流程、推动政府治理精细化、增进政府与公众的互动。但同时,科层制的行政组织体制难以有效适应智能化治理的需求、数据壁垒的存在导致数据共享和互联互通存在困难、政府面临人工智能技术开发和应用等方面的瓶颈以及技术导向的人工智能治理引发的行政伦理等问题也日渐凸显,政府面临去中心化的危险。对此,应该积极变革现有政府组织模式和运行流程、推动数据整合和共享、加大人工智能技术研发和人才储备力度、化解人工智能引发的行政伦理问题,"以实现推动政府治理流程不断优化、治理成本不断降低和治理绩效不断提升的目标。 ""	DZZW201903005",,,,,,,,,,,,,,,
"卷首语		1	 	""<正>从六十余年前人工智能被确立为一门学科",经历了多轮波浪式发展,"以""""深度学习""""为引擎",人工智能迎来了新一轮发展浪潮。智能翻译、无人机、无人驾驶汽车等等人工智能产品不断刷新着人们的认知和想象空间。人工智能产品全面渗入社会生活,对现有社会治理体系提出了全方位的严峻挑战,因而亟需弄清人工智能的本质属性," ""	DZZW201903001",,,,,,,,,,,,,,
"网络社会安全风险评估指标体系研究	 	10	网络社会; 网络安全; 风险社会; 网络社会治理; 指标体系;	""网络社会高速发展的同时也潜藏着众多风险与威胁",正确认识与评估这些风险是提升网络社会治理能力的基础。基于我国网络社会的发展状况及其存在的安全问题,研究了建立网络社会安全风险评估体系的迫切性和必要性,从政治安全风险、经济安全风险、文化安全风险、社会安全风险、生态安全风险等五个方面构建了评估指标体系的理论框架;提出了网络社会安全风险评估指标体系,力求能够引导各级政府关注网络社会安全风险问题,"有效提升其网络社会安全风险应对能力。 ""	DZZW201903006",,,,,,,,,,,,,,,
"政府主体在互联网平台经济治理中的功能转型	魏小雨:39577093	11	互联网; 平台经济; 网络经济; 合作治理; 公众参与;	""在互联网平台经济的治理中",政府应针对其特点利用不同主体的优势创新治理模式、完成功能转型。通过实证及规范分析发现,目前政府在认定监管对象合法性、划分监管机构职能、选择监管规制工具等方面存在困难。为此,政府应转变行政理念,利用市场方法完成公共目标。以行政任务为导向设置行政组织,并赋予其主动和弹性活动的空间。面向行政过程强化公众参与,"选择成本收益率较高的规制工具并加强法律控制。政府主体实现治理功能以达成行业发展与公共利益保护之间的平衡。 ""	DZZW201903007",,,,,,,,,,,,,,
"我国省级政府数据开放平台元数据质量评估研究	张晓娟:09016101|谭婧:39846196	14	政府数据; 开放数据; 数据开放; 元数据; 质量评估; 省级政府;	""元数据是描述开放平台数据资源出处、背景等信息的重要属性",元数据质量的优劣直接影响到开放平台的开放质量和效果。通过建立不同元数据标准的元数据属性与DCAT词汇表之间的映射关系,采用AHP方法构建了政府数据开放平台元数据质量评估指标体系,以已建成的12个省级政府数据开放网站为评估对象,对我国省级政府数据开放平台的元数据质量水平进行测量。评估结果表明,我国省级政府数据开放平台元数据总体质量不佳,"存在资源描述不精准、运营维护不及时和权限管理不重视等问题。 ""	DZZW201903008",,,,,,,,,,,,,,
"数字政府治理的回应性陷阱――基于东三省“地方领导留言板”的考察	李慧龙:31568722|于君博:28479288	16	数字政府治理; 政府回应; 网络问政; 留言板;	""对于数字政府治理的回应性内涵与现状",已有研究仍存在模糊之处。通过回归基本概念,"从事实与价值兼顾的双重维度对""""回应性""""进行了新的辨识:既包括事实维度的有回应、快回应和照章办事地解决问题",也要注重价值维度的释因、补偿与协商。借此考察作为数字政府治理重要形式的留言板类型的网络问政的回应性,"在事实回应层面进一步证实了政府存在的""""选择性回应""""痼疾","并发现其呈现出回应率的波动性、回应速度的随意性以及维稳导向下的""""条件性解决""""特征;在价值回应层面发现政府在公众诉求的解决或未解决方式上裁断性强于对话性、有释因而少疏解",缺乏对公众认知与情感的顾及。最后,"反思了数字政府治理亟需走出的两个回应性陷阱:""""裁断型""""回应的思维桎梏与""""粗放型""""回应的行为惯性。 ""	DZZW201903009",,,,,,,,,,,,,
"网络反腐的权利演绎、冲突及调适:基于权利政治的视角	祁雪春:41172460	9	网络反腐; 反腐倡廉; 权利政治; 权利演绎; 权利调适; 廉政建设;	""网络反腐赋予了权利政治新的话语语境。网络反腐依从权利政治的话语表达",为反腐败斗争提供了全新的治理范式。事实上,网络反腐中的公民权利与公共权力,以及公民权利之间经常性地发生碰撞与冲突,从而演绎着网络反腐权利出轨与权力滥用的法律风险和政治危机。其根本原因在于网络反腐权利边界的模糊。因此,构建网络反腐的合理秩序在于明确权利位阶、构建权利均衡、保障权利救济的法律路径,"以及完善权利沟通、制定权利规范、实现权利培育的的政治路径。 ""	DZZW201903010",,,,,,,,,,,,,,
"美国移动政务建设及其对我国的启示	易兰丽1:38197968|黄梅银2:37165394|田红红1:32504093	11	移动政务; 电子政务; 互联网+; 公共服务;	""移动政务是电子政务发展的必然趋势",通过研究美国移动政务发展战略及在战略框架指导下建立的移动政务建设管理机制,为我国移动政务快速健康发展提供借鉴。利用文献调研法和案例分析法,深入探讨了美国政府在移动政务的组织机构设置、服务内容归档管理、个人隐私保护、绩效考核等方面的具体做法,"并结合我国的实际情况提出了有针对性的建议。我国可以从建立权责明晰的组织机构、分级分类制定建设使用指南、加快推动个人隐私保护立法、日常监测与综合考核相结合等四个方面来促进移动政务发展。 ""	DZZW201903012",,,,,,,,,,,,,,,,
"适应障碍、同质游戏与互动承诺的异化――基于社会网络分析的政务微博互动质量研究	刘江:38962855	14	政务微博; 社会网络分析; 政民互动; 公共服务;	""选取典型个案""""B发布""""为研究对象",运用社会网络分析的方法与理论,对其评论区展开互动质量的验证性分析。研究发现,"B发布""""的官方身份有助于激发互动网络的规模优势",但互动网络的质量更有赖于网络节点结构、互动品质、节点活跃程度、节点间的距离与关系;习惯于单向信息传播的政务微博常置网络舆情于不顾,对社交媒体互动场域存在适应障碍,其互动桥梁角色有名无实;文宣系统委托经营、强关系主导的网络结构,易强化政务微博互动网络的同质性和群间区隔,受畸形评价机制的诱导,"可能营造出便于玩弄""""数字游戏""""的关系网络","让互动承诺异化为""""表演型政治""""","错失弱关系公众提供的政策检视机会。研究提出凸显互动服务特色、强化职能部门在互动网络中的功能发挥、建立公众参与的多元评价机制等改进建议。 ""	DZZW201903013",,,,,,,,,
"新一代人工智能发展规划推进办公室召开2019年工作会议		1	 	""<正>2019年2月15日","新一代人工智能发展规划推进办公室召开2019年工作会议。会议由科技部党组书记、部长王志刚主持。新一代人工智能发展规划推进办公室成员单位负责人、战略咨询委员会专家、部分企业代表参加了会议。 ""	DZZW201903011",,,,,,,,,,,,,,,,,,,
"政府大数据治理体系构成要素研究――基于贵州省的案例分析	安小米1:09745655|白献阳2:07074748|洪学海3:11039177	15	数据治理; 政府大数据; 大数据; 治理体系; 数据治理要素;	""政府大数据治理有助于实现政府大数据资产价值最大化。在借鉴国内外大数据治理研究成果的基础上",构建了由治理目标、治理主体、治理对象、治理活动、治理工具等要素组成的政府大数据治理体系;并采用内容分析方法,对贵州省政府大数据治理体系利益相关方访谈文本和政府大数据治理相关政策文本进行主题编码;最后,把政府大数据治理体系通用构成要素与编码进行映射,编码在每个要素上支持和解释了要素内容,"验证了其提出的合理性。 ""	DZZW201902002",,,,,,,,,,,,,,,
"试论基层政府数据治理模式的选择:吴中模式的建构与启示	夏义:09012023	10	政府数据治理; 数字政府; 数据开放; 政府数据共享; 基层政府;	""基层政府数据治理模式的选择对于政府数据价值实现具有不可替代的重要作用。通过文本研究、归纳演绎、案例比较以及实证分析",运用信息生态理论总结基层政府数据治理特点与要求,进而从数据文化、驱动力、数据治理架构、组织体制和数据能力等角度详细探讨了基层数据治理模式的结构性要素及其影响。在此基础上,以江苏省苏州市吴中区数据治理模式为例,"进一步阐明我国基层政府数据治理的创新路径与方法。 ""	DZZW201902003",,,,,,,,,,,,,,,,
"面向数据开放的地方政府数据治理:问题与路径	王翔:06701217|郑磊:06712094	7	数据开放; 政府数据; 数据治理; 地方政府;	""政府数据开放对政府数据治理提出了更高的要求。面向数据开放的地方政府数据治理面临着诸多挑战",涉及到各类利益相关方。通过对我国地方政府面向数据开放的政府数据治理的案例研究,发现了地方政府数据治理在法规政策层、管理层、数据层和利用层面临的一系列阻碍和难点。基于以上研究发现,提出了推进我国政府数据治理的实践路径,即推进数据治理法律法规建设,健全数据治理组织架构,强化数据资源管理体系,"加快数据共享开放步伐等。 ""	DZZW201902004",,,,,,,,,,,,,
"智慧政务框架下大数据共享的实现与应用研究	""李军1","2:40113943|乔立民2:31909001|王加强2:25772383|高杰3:08170702""	11	大数据; 数据共享; 社会治理; 信息系统;	""发展智慧政务已成为提升政府科学管理水平和社会治理能力的重要手段。根据当前政务信息化发展的趋势和大数据环境的需求",立足中国社会服务中网格化管理理念和以房管人思想,设计出一种基于政务大数据共享、适用于多级政府的社会治理系统框架;在此框架下系统包括大数据分析应用和政务服务功能,能与各地方、各业务部门现有的管理系统进行对接,实现政务大数据应用和业务工作的融合,为政策制定和居民服务提供技术支撑。同时,研究探讨了相关的框架设计和关键技术方法,通过多地政府部门的应用实践,"论证了该系统的有效性和先进性。 ""	DZZW201902005",,,,,,,,,,,
"政务大数据环境下的数据治理框架设计	""吴善鹏1","2:37236356|李萍1:37236357|张志飞1:36734301""	7	大数据; 政务大数据; 数据治理; 数据治理框架;	""数据治理能力不足是当前政务大数据建设应用中的突出难题之一。针对政务大数据治理中存在的问题",分析了政务大数据治理的特点、目标和需求,在此基础上,结合数据治理技术理论和政务大数据治理实际场景,提出了一个政务大数据环境下的数据治理框架设计,"以期对组织开展政务大数据治理工作和构建政务大数据治理体系提供实践参考。 ""	DZZW201902006",,,,,,,,,,,,,,
