"分享经济监管的误区及下一步监管的思路对策	郝凯:35060589	5	分享经济; 共享经济; 数字经济; 协同监管;	""《关于促进分享经济发展的指导性意见》(以下简称《意见》)中涉及分享经济监管部分的思想和做法为有关部门和地方提供了借鉴思路。通过回顾《意见》出台过程",分析了中国分享经济发展的顶层设计思路,进而廓清在《意见》出台之前存在的过度审批、过高门槛及过时手段等监管误区,提出转变监管思路,秉持鼓励创新、包容审慎、协同监管的理念,落实宽松准入、事中事后监管、协同合作的审慎监管做法,"为促进中国分享经济健康有序发展保驾护航。 ""	DZZW201708005",,,,,,,,,,,,,,
"网络空间全球治理问题刍议	李传军1:09689991|李怀阳2:32929363	8	网络空间; 全球治理; 网络治理; 信息边疆; 数据主权; 网络主权; 电子政务;	""从国际范围来看",网络空间治理处于一种无序、失衡状态,加剧了国际上自冷战开始以来的紧张关系。如何从网络空间治理的角度,厘清纷繁复杂的国际关系,值得我们深入探究。在全球网络空间中,由于信息技术发展水平和信息基础设施建设水平的差异,不同国家之间存在着数据资源和拥有能力的差异,与此相应,可供选择的网络空间治理战略也各不相同。为了破解网络空间全球治理的困境,"中国提出了尊重网络主权、维护和平安全、促进开放合作、构建良好秩序的""""互联网治理四项原则""""。 ""	DZZW201708006",,,,,,,,,,,
"美国网络安全事件响应预案制度研究	李明:23255623	9	网络安全事件; 网络治理; 应急响应; 应急预案; 应急管理; 网络安全;	""随着重大网络事件影响范围、损害程度扩大",美国等发达国家日益将网络安全事件治理纳入国土安全、国家安全、公共安全治理的重要组成部分,突发事件应急管理工具也越来越多地应用到网络事件治理中。美国联邦政府网络事件响应预案制度及其响应行动就是最典型的范例。美国联邦政府于2016年底颁布了《国家网络事件响应预案》及其相关的制度性规定,这个预案是动员和组织国家级力量应对网络安全事件的一个重要制度建设举措。梳理了预案中对联邦政府、州和地方政府在联合应对网络事件中的分工原则,以及事件分级、分工协调、核心能力等预案要素;同时,研究了美国联邦政府在重大网络事件中的资产响应、威胁响应、情报支持和受影响对象响应等主要响应行动类型,总结了美国网络事件响应预案制度及其响应行动的特点;结合最新颁布出台的我国《国家网络安全事件应急预案》的相关规定,为今后如何进一步借鉴美国的网络事件响应预案制度和做法,完善中国网络安全事件应急预案制度体系,"提出了建设性意见和建议。 ""	DZZW201708008",,,,,,,,,,,
"维稳与网络时代律师庭外言论的治理	朱兵强:31885794|丰楠:37540176	9	网络舆情; 维稳; 网络公共空间; 律师庭外言论; 网络治理;	""法庭之外",律师借助自媒体社交软件积极发声。网络公共空间拓展了律师庭外言论的边界、扩大了律师庭外言论的影响,也给网络公共空间的言论治理带来了挑战。为强化对律师庭外言论的规制,国家使用了立法、司法与行政等多种措施。在这些措施中贯彻的是一种维稳的思维,在维稳思维的作用下,我国律师庭外言论的规制出现了治理刑法化、行政化以及过度限制与侵权的偏误。为了矫正这些偏误,"需要实现由维稳到法治的理性回归。 ""	DZZW201708009",,,,,,,,,,,,,,
"2017中国互联网治理研究论坛举办		1	 	""<正>2017年7月11日",由工业和信息化部、国家互联网信息办公室等部门指导,"中国互联网协会主办的2017(第十六届)中国互联网大会在北京国家会议中心开幕。大会以""""广连接・新活力・融实业""""为主题。工业和信息化部部长苗圩",全国政协常委、经济委员会副主任、中国工业经济联合会会长李毅中,国家互联网信息办公室副主任杨小伟,中国科学技术协会党组成员、书记处书记吴海鹰等出席开幕式。中国互联网协会理事长邬贺铨院士在开幕式上致欢迎辞,"向参会的政府主 ""	DZZW201708007",,,,,,,,,,,,,,
"“国家治理现代化及政府治理创新”学术研讨会在东北大学举办		1	 	""<正>2017年7月8日至9日","东北大学文法学院第三届""""国家治理现代化及政府治理创新""""学术研讨会举办",来自全国60多所院校的专家学者出席了本次会议。会议开幕式由东北大学文法学院副院长杜宝贵教授主持,"原东北大学副校长娄成武教授和东北大学文法学院院长孙萍教授致辞。国家级教学名师、教育部""""长江学者""""特聘教授、国务院特殊津贴获得者、教育部跨世纪优秀人才、吉林大学行政学 ""	DZZW201708018",,,,,,,,,,,,,,,,,
"大数据在税收领域应用展望及对策研究	 	7	税收; 大数据; 数据瓶颈; 税收治理; 税收管理;	""税务部门强化大数据应用",既可在微观上提升税收管理服务水平,又可在宏观上服务经济研判和政策制定,前景广、范围宽、价值高。大数据的应用应该契合当前税收管理、税收服务、组织体系和宏观经济发展的重点难点稳步开展。而大数据具有自身技术特性,对应用环境有着特殊要求。对照大数据技术要求,目前我国税收数据环境存在着数据未能全面生成、数据获取使用成本高、数据实时分析能力不足等瓶颈。因此,"提高数据质量、促进数据全面产生、建立数据公开体系、拓展数据分析方法和优化数据系统架构应成为完善税务大数据基础环境、促进税务""""大数据""""发展的理想策略。 ""	DZZW201708010",,,,,,,,,,,,,,
"政府信息资源元数据语义互操作模式研究	董克:11305601|谢芳芳:31916221|张晓娟:09016101	7	政府信息资源; 元数据; 语义互操作; 互操作模式;	""针对现有政府信息资源元数据语义互操作中存在的问题",从制定统一的元数据数据结构出发,构建政府信息资源领域元数据语义互操作模式。该模式首先将单个或者多个不同元数据标准在同一个元数据注册库中进行注册,从而形成单个领域的本体,解决不同元数据标准的互异问题,实现单个领域内的元数据语义互操作;其次,通过在元数据注册元模型之上构建统一的元元模型,使得由多个元数据注册库构成的多个领域之间能够语义互操作,解决不同元数据注册库之间的差异问题,"从而实现政府信息资源多个领域的元数据语义互操作。 ""	DZZW201708011",,,,,,,,,,,
"基于SOA的电子公共服务体系架构建模研究	朱锐勋:09304290	10	SOA; 面向服务的体系架构; 电子公共服务; 电子政务; 公共服务;	""电子公共服务是电子政务深化发展的方向。在""""互联网+政务服务""""应用方兴未艾的背景下",阐述了电子公共服务体系架构的设计原则和分析方法,提出了基于面向服务的体系架构(SOA)的电子公共服务四层参考模型,认为渠道视窗、业务流程、服务内容、应用技术和安全信任各子系统是构成该四层模型的关键,"可以全面支撑电子政务的信息公开和数据开放、在线办理和服务定制、电子咨询和电子参与的基本任务要求。 ""	DZZW201708012",,,,,,,,,,,,,,,,
"电子村务:超越X镇村务公开模式的探讨	""周敏1",2:37540177|张锐昕3,"4:35072661""	9	电子村务; 村务公开; 信息技术; 信息管理服务; 电子民主; 乡村治理;	""电子村务是信息技术成果应用于乡村治理实践的创新探索。因其具有开放性、交互性、集成性、规范性而成为谋求乡村治理现代化与民主化的理想模式",也因其效益发挥受制于信息基础设施,资源投入,平台(或系统)的功能、内容、质量、信用,以及使用者的信息素养等的水平,而令这些掣肘因素成为制约电子村务准备度以及农民接受度进而可能令其已建成网站沦为僵尸网站的致因。基于对X镇电子村务建设成果特别是其村务公开模式的跟踪研究,在分析其建设的背景、探索、价值、问题与原因的基础上,"探讨现行电子村务超越X镇村务公开模式的可行对策。 ""	DZZW201708013",,,,,,,,,,,
"大数据驱动的旅游突发事件应急管理体系研究	""叶鹏1",2:36859419|丁鼎3:37540178|张雪英1,"2:36859416""	8	大数据; 旅游突发事件; 应急管理; 公共危机管理;	""频发的旅游突发事件严重影响了旅游业的平稳发展","亟需构建高效合理的应急管理体系以应对复杂的旅游安全形势。大数据的引入非常符合当今""""情景―应对型""""应急管理的需求",从分析大数据背景下旅游突发事件应急管理的变化出发,构建了涵盖大数据处理与突发事件应急全流程的大数据驱动的旅游突发事件应急管理体系,"并从预警理念、技术支持和个人隐私保护三个方面探讨了保障大数据应急管理体系高效运行的措施。 ""	DZZW201708014",,,,,,,,,,,,,,
"地方政府健康城市建设研究――基于完善电子政务的视角	奚源:35606936	7	智慧城市; 健康城市; 电子政务; 治理路径; 卫生健康服务;	""中国经济与城市化自改革开放以来取得了长足的发展",但是随着社会发展的深化,各种环境、健康卫生和安全管理等问题也日益增多。为实现推进健康中国建设的战略规划,地方政府则需要进一步加强健康城市建设。完善电子政务系统能为地方政府建设健康城市提供有效的治理路径,可分析完善电子政务之于地方政府健康城市建设的契合性,列举地方政府加强健康城市建设的必要性,并通过完善卫生健康服务电子化、提升地方政府信息化辅助决策系统、在健康城市建设中完善首席信息主管制度的治理路径来提升健康城市建设能力,"实现经济增长、区域扩张与城市健康的平衡发展。 ""	DZZW201708015",,,,,,,,,,,,,
"2000-2016年国内外电子政务公众信任研究述评	汤志伟1:06570033|钟宗炬1:33695455|侯艳君2:35700747|涂文琴1:35074803	13	互联网+; 电子政务; 公众信任; 初始信任; 持续信任; 微政务;	""信任影响电子政务公众采纳和参与",在一定程度上关乎着电子政务的成败兴衰。以Web of Science和CNKI两大数据库中关于电子政务公众信任研究的核心文献作为对象,运用信息计量学和文献归纳法予以系统分析。通过信息计量学分析,把握电子政务公众信任的研究现状;结合文献归纳分析,发现在信任理论、技术接受模型、初始信任模型、风险模型等理论模型的指导下,研究主要围绕信任的基础概念、影响因素、演化过程、作用结果四大主题而展开,方法则以实证分析为主。在此基础上,指出当前研究存在概念梳理与研究持续性不足、研究对象不够具体、因素分析不够系统、演化过程分析相对薄弱、研究范式与信任测量方法单一等局限,"并提出相应的改进建议。 ""	DZZW201708016",,,,,,,,,,,,
"PPP模式在电子政务建设中的应用研究	宋魏巍1:30918745|孙文瑾2:37540179	10	电子政务; 公私伙伴关系; 项目管理; PPP;	""通过对已有研究以及国内外电子政务建设实践中典型案例的比较分析",从国家与区域层面、行业层面、组织层面等三个层次上分析并总结了影响电子政务PPP模式应用的关键性因素。在国家与区域层面,包括政府职能转变与制度建设、基础设施投资方向与力度、政府治理理念变革、科学技术水平的进步等方面;在行业层面,包括电子政务发展规划、规范建设与风险控制、绩效评估制度与执行水平等方面;在组织层面,包括政府部门的领导、协调与管理能力、供应商资金与技术能力、公私双方互动程度等。基于以上影响因素,"提出转变政府职能和治理观念、完善电子政务PPP模式制度建设、提高行业管理水平、加强政府部门工作人员项目管理和技能培训等方面的对策建议。 ""	DZZW201708017",,,,,,,,,,,,,,,
"卷首语		1	 	""<正>分享经济的出现是信息技术革命与人类社会发展需求相适应而产生的必然结果。近年来",我国分享经济异军突起,发展快速、创新活跃、应用广泛,在一些领域走到了世界前列,并培育了一批创新创业型企业。分享经济的快速发展对现有的理论研究、产业发展及市场监管产生了前所未有的冲击,引起了社会各界的广泛关注和热烈讨论。2017年7月3日,国家发展改革委等八部门联合印发《关于促进分享经济发展的指导性意见》,"围绕市场准入、行业发展、优化环境、加强保障等方面进行了全面部署。本期专题研究约请国家信息中心分享经济研究中 ""	DZZW201708001",,,,,,,,,,,,,
"中国分享经济热背后的原因、现状和趋势	张新红:10670910	5	分享经济; 共享经济; 网络社会; 互联网+; 协同治理;	""从共享单车成为2017年度现象级事件引发人们对分享经济的思考切入",指出更深刻的影响还在不断酝酿发酵中,分享经济必将全面爆发。从全球实践看,中国分享经济发展具备网民规模大、政策利好、创新点多、融合社会生活影响深等基础条件,未来必将涉及制造业、农业、教育、医疗、养老等更多的领域。研究认为,分享经济在中国的发展不仅源于其切合了中国转型发展的需要,"还因为中国具备一些发展分享经济的独特优势。 ""	DZZW201708002",,,,,,,,,,,,,,
"网络舆情治理的基本理论问题辨析	殷辂:20302359	6	网络舆情; 舆情治理; 网络治理; 互联网治理;	""研究认为",舆情治理的理念、主体、目的、方法不明晰,一些地方和部门的管控、灌输、搞定思维没有消除,因而舆情的正面作用不能发挥。提出了舆情治理是社会治理的一部分,其主体是政府与民众组成的共同体,前提是相信人的良知和理性。主体之间协同共治,去除壅塞、还原真相、彰显公道,才是舆情治理的本质,"也是释放社会风险的唯一可行之路。 ""	DZZW201707003",,,,,,,,,,,,
"微信场域中的舆论表达	薛深:45680569	7	微信场域; 舆论表达; 舆论引导; 微信舆论;	""研究认为",作为一种移动新媒体的微信场域中的舆论表达呈现出议题参与的自主性、议程设置的离散性、舆论观点的相似性、观点表达的极化性、信息指涉的遮蔽性等特点。政府及有关部门要坚持开放心态,建构平等理性的舆论生态环境,切实保障人民群众的话语表达权利;坚持创新驱动,建构灵动自信的传播资源模式,全面增强主流媒体的舆论引导力;坚持依法治理,建构安全有序的微信空间,切实保障微信场域的空气清朗;坚持人民主体,建构和谐共享的舆论生态环境,"全面增强微信场域的自我净化能力。 ""	DZZW201707005",,,,,,,,,,,
"回归网络虚拟空间意见领袖健康状态的途径探讨	张玉亮:25138282|刁寒诺:34577511	8	网络社会; 网络虚拟空间; 网络意见领袖; 网络治理;	""网络虚拟空间意见领袖的队伍日益壮大",造成的影响也不容忽视,因此如何能使其回归健康状态,引领社会风尚,发挥社会正能量已成为当务之急。网络意见领袖回归健康状态主要应通过以下几个途径来实现:完善网络意见领袖的行为引导主体参与机制,完善网络意见领袖的立法与监管制度,创新与网络意见领袖的沟通对话机制,"建立网络意见领袖的成长与发展机制。 ""	DZZW201707006",,,,,,,,,,,,,
"指尖上的社会治理:基于苏州“寒山闻钟”网络问政的实证研究	杨国兵:34346452	13	苏州“寒山闻钟”; 网络问政; 论坛问政; 社会治理; SWOT分析; 行政管理;	""网络问政为政府提供了一种全新的社会治理视角","逐渐改变着行政管理的政治生态环境。苏州""""寒山闻钟""""通过政民实时互动的模式畅通民意表达、强化社会监督、提高行政效能",促进公权力抢占网络阵地、引导舆论走向、解决民生问题,促进社会和谐稳定,"推动社会治理理论与实践的新发展。在对苏州""""寒山闻钟""""运作模式充分把握的前提下",尝试着用SWOT模型对其进行态势分析,明确其生存语境,提出其优化路径,"并从经济技术、社会认同、政策稳定性、运作模式和人才队伍等方面进行经验启示解读。 ""	DZZW201707007",,,,,,,,,,,,
"发展改革委等八部门联合印发《关于促进分享经济发展的指导性意见》		1	 	""<正>2017年7月3日",国家发展改革委等八部门联合印发《关于促进分享经济发展的指导性意见》(以下简称《意见》),就如何进一步营造公平规范市场环境、促进分享经济更好更快发展等进行了部署。近年来,我国分享经济创新创业活跃、发展迅速,"已成为推动大众创业万众创新向更广范围、更深程度发展的重要抓手和经济社会发展的""""生力军""""。同时","分享经济发展也面临着认识不统一、制度不适应、保障不健全等问题和挑战。 ""	DZZW201707004",,,,,,,,,,,,,,,
"《中华人民共和国政府信息公开条例》首次修订		1	 	""<正>政府信息公开直接关系人民群众参与公共决策、维护自身权益",但随着改革深入和信息化发展,现行的《中华人民共和国政府信息公开条例》(以下简称《条例》)规定已难以满足公众不断增长的政府信息公开需求。2017年6月6日,由国务院办公厅、法制办起草的《中华人民共和国政府信息公开条例(修订草案征求意见稿)》(以下简称《征求意见稿》),在中国政府法制信息网全文公布,广泛征求社会各界的意见。《征求意见稿》对政府信息公开放宽范围,明确各级政府信息公开的职责和标准,"力 ""	DZZW201707016",,,,,,,,,,,,,
"开放政府数据战略的国际比较与中国的对策选择	夏义:09012023	12	开放政府数据; 信息再利用; 信息战略; 信息政策; 开放数据战略; 数据开放;	""开放政府数据战略的国际比较可以为我国数据开放战略的实施提供可资借鉴的方法和启示。通过大量的政策分析、案例比较以及文献调研",揭示了发达国家、发展中国家在开放数据战略制定、战略实施中的共性特征与差异,并从开放数据战略制定背景与过程、内容框架以及战略实施的法规制度、政府组织结构、条件保障、社会支持以及检查评估等方面总结开放政府数据战略的共性规律和围绕国情差异化发展的普遍特征;进而分析中国开放政府数据战略的实施背景,"并基于国情提出针对性对策建议。 ""	DZZW201707008",,,,,,,,,,,,,,,,,
"国外智慧治理研究述评	李云新:27794497|韩伊静:37429163	10	智慧治理; 智慧城市; 电子治理; 城市管理; 技术创新; 大数据;	""智慧城市发展是一个涉及政治、经济、社会、制度、技术等复杂要素的系统",智慧治理是智慧技术发展和社会多元治理的动态结合。基于对国外相关研究文献的梳理,从城市管理、政府角色智慧化、民主参与等三个视角阐释了智慧治理的内涵和特征,从智慧型政府、参与型社会、创新型人才与企业、智能基础设施与ICT技术、大数据资源等五个方面解析了智慧治理的核心要素,并进一步阐述了智慧治理的过程与效果,为国内智慧治理理论研究的完善和发展提供借鉴,"为国内智慧城市实践探索提供理论指引。 ""	DZZW201707009",,,,,,,,,,,,,,
"中国政府信息公开目录体系建设研究――基于省级和部委政府网站的调查与分析	""张晓娟1",2:09016101|刘亚茹1,"2:36996616""	10	政府信息公开目录; 目录体系; 政府信息公开; 电子政务; 政务公开; 政府网站;	""""""建立健全主动公开目录""""已成为中国全面推进政务公开的一项重要的基础工作。自2007年以来",中国的政府信息公开目录建设已经取得了一定的成就,但仍存在一些无法忽视的问题。立足于对中国省级和部委级政府网站的政府信息公开目录的全面调查,从分类方式、主题分类、页面表现和元数据项等四个方面量化分析了当前省级和部委政府网站政府信息公开目录建设的现状,从分类不够准确和规范、核心元数据项缺乏、类目划分精度和深度不够、缺乏面向服务对象的分类方式、目录载体单一且功能不一致等五个方面剖析了政府信息公开目录中共同存在的问题,"并探讨了如何建立全国性的政府信息公开目录体系。 ""	DZZW201707010",,,,,,,,,,,,,
"从武汉的实践看我国政务大数据建设的现状、问题和建议	王留军:31976451|肖迎霜:23387443	7	政务大数据; 数据中心; 数据共享; 数据开放; 武汉;	""开发与挖掘庞大体量的政府数据",提升政务大数据应用价值,是当前我国大数据建设的重要任务,对促进经济增长和转型升级,推动经济社会全面发展,增强我国综合国力和国际竞争力具有重要意义。概述了我国当前政务大数据应用发展的背景和现状,从武汉市政务大数据建设实践出发分析了政务大数据建设中存在的主要问题,从创新管理、完善数据共享长效机制,应用驱动、探索政务大数据中心建设模式,"发掘应用、提升政务大数据社会效益等三个方面提出了化解政务大数据建设难题、提升政务大数据建设效益的有关建议。 ""	DZZW201707011",,,,,,,,,,,
"基于Web2.0与互联网思维的城市2.0研究	刘凌波:10135687|吴昊:09032527|彭正洪:08986758	8	互联网+; 互联网思维; Web2.0; 城市2.0; 大数据; 公众参与;	""基于Web2.0理论视角溯源互联网思维",揭示出与Web2.0理论的主体继承、本土化差异、商业原则融合的内涵关系特征,总结出互联网思维的3F3特征,"即用户思维的粉丝思维(Fans)、专注思维(Focus)和极致思维(Finest);平台思维的流量思维(Flow)、群体思维(Flock)和扁平思维(Flat);数据思维的算法思维(Function)、快速思维(Fast)和第一思维(First)。更进一步探讨了3F3特征下城市管理、规划和运营的城市2.0模式。 ""	DZZW201707012",,,,,,,,,,,,,,,,,
"行政诉讼电子化的根源阐释与蕴涵剖析――兼论行政诉讼法的应对	范伟:08982797	7	行政诉讼电子化; 电子政务; 电子诉讼; 电子行政行为; 权益保障; 行政诉讼法;	""行政诉讼作为化解行政纠纷的重要途径和最后防线",其与代表着高效的互联网技术的交融不可避免。行政诉讼电子化是行政诉讼的内在需求,是应对电子政务浪潮与电子行政行为冲击的应有之义。在实践中,电子民事诉讼已取得令人瞩目的发展。与解决平等主体间纠纷的民事诉讼不同,行政诉讼电子化应谨慎前行,电子行政诉讼的建立应循序渐进,可由地方先试先行,"最终以修改法律文本的形式予以确认。 ""	DZZW201707013",,,,,,,,,,,,,
"“互联网+”时代突发事件中政府信息公开研究综述	贺军:07436278|蒋新辉:37429166	9	互联网+; 突发事件; 政府信息公开; 应急管理;	""近年来",突发事件频繁发生,"互联网+""""概念的提出",对政府的信息公开提出了更高的要求,如何有效预防和解决突发事件是当前我国政府面临的一大难题。对互联网环境下突发事件中政府信息公开的特点、作用、政府与媒体的关系、信息技术的应用、存在的问题、影响因素及完善策略等七个方面的研究进行归纳、分析和评述,旨在了解该领域的研究脉络,找出研究的空白点和创新点,"把握未来的研究方向。 ""	DZZW201707014",,,,,,,,,,,,,
"基于转发行为的政务微博信息传播模式研究	陈然1:10856510	10	政务微博; 聚类分析; 新媒体; 微博;	""政务机构在微博平台的信息传播活动及其结果具有极大的意外性与不可控性。聚焦政务微博的信息传播与影响波及过程",以政务微博发布的信息为分析对象,利用微博转发行为数据,采用可视化分析与聚类分析相结合的方法,从传播过程的视角对政务微博信息传播的典型模式及影响因素进行挖掘,并从加强社交意识、营销意识和责任意识三个方面提出对策建议,"以期为政务微博的高效传播提供决策支持。 ""	DZZW201707015",,,,,,,,,,,,,,
