"新时期促进集成电路产业和软件产业高质量发展的若干政策		2	 	""<正>集成电路产业和软件产业是信息产业的核心",是引领新一轮科技革命和产业变革的关键力量。《国务院关于印发鼓励软件产业和集成电路产业发展若干政策的通知》(国发[2000]18号)、《国务院关于印发进一步鼓励软件产业和集成电路产业发展若干政策的通知》(国发[2011]4号)印发以来,我国集成电路产业和软件产业快速发展,有力支撑了国家信息化建设,促进了国民经济和社会持续健康发展。为进一步优化集成电路产业和软件产业发展环境,深化产业国际合作,提升产业创新能力和发展质量,"制定以下政策。 ""	DZZW202009001",,,,,,,,,,,,,
"2020工业互联网大会在线上召开		1	 	""<正>2020年8月29日","由工业和信息化部、北京市人民政府主办的2020工业互联网大会在线上召开。大会以""""赋能・融通・创新为新工业革命筑基""""为主题。工业和信息化部党组书记、部长肖亚庆",北京市委常委、副市长殷勇出席开幕式并致辞,工业和信息化部党组成员、副部长刘烈宏主持开幕式。肖亚庆指出,习近平总书记高度重视工业互联网发展,多次做出重要指示批示,要求实施工业互联网创新发展战略," ""	DZZW202009007",,,,,,,,,,,,,
"人工智能技术的社会风险与治理	何哲:39199838	13	人工智能; 社会风险; 全球治理; 协作治理;	""人工智能越来越嵌入到人类社会的同时",也相应形成了社会风险。通过对人工智能技术发展历程、趋势、核心特征和支撑要素,以及在人类社会的嵌入方式和驱动因素的系统分析,可以得出人工智能对人类产生的相应风险,并提出人工智能技术的风险治理策略。研究发现,人工智能对人类社会将主要产生十个方面的核心风险:隐私泄露、劳动竞争、主体多元、边界模糊、能力溢出、惩罚无效、伦理冲突、暴力扩张、种群替代和文明异化。从当前起,就整个人类社会而言,"要做好至少五个方面的准备:一是尽快取得全球对人工智能的风险共识;二是尽快增加人工智能的透明性研究;三是规范全球科研共同体的自我约束;四是推动各国尽快立法;五是加快建立全球协作治理机制。 ""	DZZW202009003",,,,,,,,,,,,,
"人工智能应用下的特大城市边缘城区治理：技术变革、价值隐忧与技术路径	张龙辉:30097244|肖克:22184473|王寒:31979262	14	人工智能; 城市治理; 特大城市; 边缘城区;	""特大城市边缘城区治理面临治理主体缺位、治理权力结构碎化、治理边界与行政边界分离以及治理资源供给边缘化等困境",寻求适应特大城市边缘城区空间治理特点的治理手段成为应对其治理困境的关键。通过一定的理论探讨和对相关数据、案例的分析,认为人工智能的应用在推动特大城市边缘城区治理技术变革的同时,也带来了算法伦理入侵、权力结构悖论、权利实现困境和数据价值歧视等价值隐忧,需要在利用技术变革、规制价值隐忧的基础上,"通过培育技术治理主体、建构技术治理权威、提升治理智能化水平、强化治理资源算法控制等技术路径有效解决特大城市边缘城区治理困境。 ""	DZZW202009004",,,,,,,,,,,,,,,
"智能时代技术治理的价值悖论及其消解	谭九生:09212501|杨建武:27779915	10	智能技术; 人工智能; 技术治理; 价值悖论;	""技术发展与政府治理本质上是共生与进步的双向互动关系。智能技术的发展为提升政府治理水平提供了全新工具。运用人工智能",政府治理实现了对安全、民主、自主、责任以及公正等价值跃进,但也造成了价值悖论。人工智能技术的安全性、政府治理结构的兼容性以及对技术进步返魅的互动耦合关系,为解读价值悖论生成提供了分析框架。面对智能技术治理带来的价值悖论,必须转变观念,消解悖论,"以推动智能治理走向善治。 ""	DZZW202009005",,,,,,,,,,,,,,
"重大突发公共卫生事件中的伪信息传播、治理困境及其突破路径――以新冠肺炎疫情为例	吴世文:13978774	11	新冠肺炎; 伪信息; 信息疫情; 公共治理; 网络舆情;	""疫情伪信息在网络空间中大量滋生并恶意传播","已成为新冠肺炎疫情的另一场""""灾难""""",亟需通过分析疫情伪信息的表现形式、主要内容、传播特征和来源等基本问题,"并从共同体角度提出公共治理的思路。研究显示:疫情伪信息不仅包括内容属性之""""伪""""",还因受众误读而产生,"它们以假新闻、错误的信息与谎言、事后证实非真的谣言、流言或传言、虚假广告等形式存在。疫情伪信息的全球治理举措包括技术手段、事实核查、专家介入、法律手段、公众参与、""""特别工作组""""等","但存在""""事前""""难以阻止、公众参与不够、全球协作无力、纠正不足等问题与困境。研究提出从""""网民共同体""""、社会共同体和人类命运共同体角度协同治理疫情伪信息的思路",主张网民参与甄别和纠正疫情伪信息的过程,"全球团结互助以消解隔阂。 ""	DZZW202009006",,,,,,,,,,,,
"网络文化软实力的综合评价方法与应用	""朱卫未1","2:11293256|林华萍3:38649539|叶美兰4:22196899""	9	网络文化; 软实力; 网络文化建设; 熵权法; TOPSIS;	""随着互联网技术的发展",网络文化应运而生,它以互联网为载体,带动传统文化产业的融合升级,拓展传统文化的内涵。区域网络文化软实力在国内和国际综合竞争中发挥的作用不断提升。结合当前网络环境特点,构建了网络文化软实力评价指标体系,选择基于熵权法及TOPSIS的方法对我国31个省域的网络文化软实力进行评价。结果表明,我国东中西部地区网络文化软实力发展存在不平衡现象,"且评价结果呈现出五种程度的网络文化建设水平。 ""	DZZW202009008",,,,,,,,,,,
"政务数据资产化管理的基础理论研究：资产属性、数据权属及定价方法	""张鹏1","2:10140756|蒋余浩3:38587294""	13	政务数据; 数据资源资产; 数据权属; 数据定价;	""政务数据蕴藏着极为丰富的经济价值和社会价值",尤其是具备引领各类社会主体协同开放各自掌握的大数据的潜力,但是政务数据资源的资产化管理无论从实践还是理论讨论来看,都属于薄弱环节,有关政务数据资源的资产属性、数据权属、可采用的定价方法等问题,迄今没有明确答案。基于现状分析和理论探讨,对政务数据的资产属性、权属原则和定价方法等基础理论问题进行研究,"提出创造""""数据资源资产""""的新资产概念、共有产权的数据权属原则和综合性数据定价的方法",试图构建政务数据资产化管理的基础理论,"形成""""开放为常态","不开放为例外""""的数据管理基本原则与""""依法开放","协作开发""""的数据资源共享原则。 ""	DZZW202009009",,,,,,,,
"数据时代的政府治理创新――基于数据开放共享的视角	段盛华1:06260922|于凤霞2:21655818|关乐宁2:42607136	10	政府治理; 数据开放; 数据共享; 数据治理; 协同治理;	""通过梳理传统治理模式在数据时代的不适应性",并结合近年来我国的创新实践,提出了数据时代政府治理新模式:以服务型政府为理念、以数据开放共享为路径,由包括政府、企业、社会组织等多方参与的协同治理体系。政府部门间的数据开放共享使得各部门在不打破专业分工的情况下,通过数据资源互联互通实现业务协同,为政府科学决策和宏观管理提供支撑;政府数据向社会的开放共享将极大地提高其他社会主体的内生治理效率,激发社会创新活力;包括平台企业在内的社会主体在发展中积累的数据,具有不同于政府数据的优势,这些社会主体向政府部门的数据开放共享,"也是政府治理不可或缺的支撑。 ""	DZZW202009010",,,,,,,,,,,
"共享经济业态下政府监管的战略选择――基于战略管理的SWOT-AHP分析	谭海波1:31070825|王英伟2:41129603	10	共享经济; 新业态; 政府监管; SWOT-AHP;	""共享经济业态下新商业模式的快速迭代对传统政府监管理念及监管方式带来了结构性冲击。基于传统经济模式的政府监管战略与共享经济不相适应的矛盾日渐突出。当前学界对政府应采取何种监管战略研究不足",未能提出适应于中国共享经济新业态的较为清晰的战略思想。以战略管理的SWOT分析框架为基础,剖析了政府在共享经济监管过程中内部条件的优势和劣势以及外部环境中的机会和威胁,并在此基础上结合层次分析法,构建SWOT-AHP分析模型,通过对SWOT中各要素的定性评价与定量测算进行战略匹配,进而提出有利于增强政府监管能力的战略选择,以明确政府在共享经济监管中的战略定位,"最大限度地发挥监管效力。 ""	DZZW202009011",,,,,,,,,,,,
"可持续发展视角的开放数据评估框架与全球实证	范佳佳:33508007	13	开放数据; 数据开放; 可持续发展;	""当前学界针对全球城市数据开放水平的评估",特别是对开放数据价值释放程度的评估研究较为匮乏。遵循数据可持续开放的价值理念,从数据流动全过程评估城市数据可持续开放问题,构建了包含价值释放在内的4个评估维度、77个评估指标的全球重要城市开放数据评估指标体系,并实证评估了27个全球重要城市的数据开放水平。评估发现,北美和亚洲国家城市数据开放表现突出,老牌欧洲城市差强人意,非洲、南美洲、大洋洲城市集体落伍;数据开放城市排名与经济实力无正相关关系,各城市开放数据经济价值释放程度差距巨大,城市综合指数差异悬殊,开放平台的用户参与度有待提高,"全球对开放数据在政治与社会的影响关注度不够。最后提出提升全球城市数据开放与应用水平、实现数据可持续开放与增值的政策建议。 ""	DZZW202009012",,,,,,,,,
"互联网使用对政府清廉感知的影响研究――基于CGSS数据的实证分析	邓崧:09334500|刘开孝:45599944	14	互联网使用; 政府清廉感知; 传统媒介; 新媒介; 反腐倡廉; 网络反腐;	""通过主观态度测量法了解公众对政府的清廉感知是当前廉政领域的普遍做法。基于CGSS2015微观数据",以把关人理论与框架效应理论为基础,运用主成分分析、序次Logistic回归和有序probit回归等方法来探究互联网使用情况对政府清廉感知的影响。研究发现:互联网使用频率、主要信息来源、空闲上网频率与政府清廉感知水平呈显著负相关。互联网使用频率越高、时间越长,公众的政府清廉感知水平就越低。媒介的信息化水平越高、互联网使用的偏好性越强,公众的政府清廉感知水平就越低。空闲时间上网频率越高、娱乐性目的越强,公众的政府清廉感知水平就越低。传统媒介的使用会显著提升政府的清廉感知水平,传统媒介使用频率越高,"公众的政府清廉感知水平就越高。 ""	DZZW202009013",,,,,,,,,,,,,
"卷首语		1	 	""<正>信息技术高速发展并深度融入人类社会生活",大量智能技术在很多领域有了越来越多的应用,智能化建设内容日趋丰富和复杂,对智能环境下的社会治理提出新的挑战。目前,迫切需要研究智能技术应用衍生的新兴治理规律,识别风险,扬长避短,"为智慧社会建设和良好转运提供理论支撑。本期""""专题研究""""即围绕""""智能技术治理""""刊发一组文章","从几个侧面探讨相关问题。《人工智能技术的社会风险与治理》通过对人工智能技术发展历程、趋势、 ""	DZZW202009002",,,,,,,,,,,,
"公共危机事件中政务短视频公众使用的实证研究――基于新冠肺炎疫情	汤志伟:06570033|赵迪:25281461|罗伊晗:45357588	13	新冠肺炎疫情; 公共危机事件; 政务短视频; 政务新媒体; UTAUT;	""政务短视频作为政务新媒体中的新生力量",在新冠肺炎疫情的危机应对工作中发挥了重要作用。结合疫情的公共危机事件背景,探析政务短视频的公众使用影响因素,有助于推动政务短视频良性发展运营,亦有利于政府危机应对工作的创新优化。基于UTAUT模型,引入政务短视频信任感知与疫情危机风险感知两个新变量,构建了新冠肺炎疫情中政务短视频公众使用的实证研究模型。通过问卷调查收集数据,并运用结构方程模型对假设进行检验。研究发现,绩效期望、促进条件、疫情危机风险感知可正向显著影响公众在新冠肺炎疫情中的政务短视频使用意愿,使用意愿正向显著影响使用行为;社会影响可显著影响其他原因变量,信任感知可显著影响绩效期望并会受到疫情危机风险感知的影响。因此,政务短视频的后续建设应加强公众参与,"注重供需均衡和多媒体合作。政府未来的危机管理工作应加强发挥政务短视频的作用优势。 ""	DZZW202008003",,,,,,,,
"网络言论信息的治理机制：功能分区、内容分级与场景化动态调控	陈曦:28296115	10	网络言论信息; 网络治理; 网络空间; 网络社会; 治理机制;	""良性网络言论信息的表达对于网络社会的治理具有重要意义",能够起到预警、协调、反馈、交互、影响、释放、解压等作用。网络治理需要为良性的网络言论信息提供通畅、有序、合理的表达环境。网络空间区域的社会功能存在差异,不同网络区域对于信息内容有着不同的治理逻辑和功能诉求,"需要树立""""边界原则+宽严有别""""的治理理念","以""""分而治之""""和""""场景化""""调控作为实施的基本手段。通过分析网络言论信息治理的基本原则",提出网络功能空间划分与内容信息分级,以及设计场景化网络言论信息动态调控机制,"对网络言论信息的治理机制进行构建。 ""	DZZW202008004",,,,,,,,,,,,,
"舆情视角下我国网络协商民主的方式、困境及进路	毕宏音:08916785|张丽红:10007089	12	网络舆情; 网络协商; 网络民主; 网络政治参与; 舆情;	""网络社会的勃兴促推了中国网络协商民主的发展。基于舆情视角的网络协商民主建设",使得网络舆情合理性表达机制嵌入网络协商民主大系统之中。网民与国家管理者作为网络协商民主大系统里的主客体要素,分别扮演着网络合理诉求表达主导者和网络协商民主制度化建设者角色。研究发现,两大主客体间的互动,"推动了""""刺激发生→汇集分析→接触交流→互动沟通→协商共识→决策引导→长效监督→保障约束""""机制的逐步形成",也催生出若干具有中国特色的网络协商民主实践创新模式。而思想认识、主体结构、表达内容、表达过程和制度建设等方面的缺失,"还需通过意识培养、文化弘扬、制度保障、技术赋能、队伍建设等多维手段加以全方位因应。 ""	DZZW202008005",,,,,,,,,,,,,,
"中央网信办等七部门联合印发《关于开展国家数字乡村试点工作的通知》		1	 	""<正>2020年7月","根据《中共中央国务院关于抓好""""三农""""领域重点工作确保如期实现全面小康的意见》《数字乡村发展战略纲要》和《2020年数字乡村发展工作要点》的要求",中央网信办、农业农村部、国家发展改革委、工业和信息化部、科技部、市场监管总局、国务院扶贫办印发《关于开展国家数字乡村试点工作的通知》,部署开展国家数字乡村试点工作。《通知》指出,数字乡村既是乡村振兴的战略方向,也是建设数字中国的重要内容。开展数字乡村试点是深入实施乡村振兴战略的具体行动,是推动农业农村现代化的有力抓手,也是释放数字红利催生乡村发展内生动力的重要举措。要按照实施乡村振兴战略的总体部署,以解放和发展数字化生产力、激发乡村振兴内生动力为主攻方向,以弥合城乡数字鸿沟、促进农业农村经济社会数字化转型为重点,积极探索数字乡村发展新模式,加快推进农业农村现代化建设,"促进农业全面升级、农村全面进步、农民全面发展。 ""	DZZW202008001",,,,,,,,
"《2020联合国电子政务调查报告（中文版）》在京发布		1	 	""<正>2020年7月26日",《2020联合国电子政务调查报告(中文版)》在北京发布。报告显示,我国电子政务发展指数排名跃升至历史新高,"这得益于我国不断深化""""放管服""""改革",并大力推进全国一体化政务服务平台建设,我国在线政务服务能力大幅提升,电子政务发展水平迈上新台阶。报告显示,我国电子政务发展指数从2018年的0.6811提高到2020年的0.7948,排名升至全球第45位,"达到""""非常高""""的水平",特别是作为衡量国家电子政务发展水平核心指标的在线服务指数升至0.9059,指数排名大幅提升到全球第9位,进入全球前十行列。从全球范围来看,各国电子政务发展水平持续提升。报告显示,"目前有65%的成员国处于""""高""""或""""非常高""""的电子政务发展指数组别。 ""	DZZW202008011",,,,,,
"《关于支持新业态新模式健康发展 激活消费市场带动扩大就业的意见》要点		1	 	""<正>2020年7月14日",国家发展改革委、中央网信办、工业和信息化部、教育部、人力资源社会保障部、交通运输部、农业农村部、商务部、文化和旅游部、国家卫生健康委、国务院国资委、市场监管总局、国家医疗保障局等部门联合印发《关于支持新业态新模式健康发展激活消费市场带动扩大就业的意见》(发改高技〔2020〕1157号),就积极探索线上服务新模式,加快推进产业数字化转型;壮大实体经济新动能激活消费新市场;培育发展共享经济新业态,"创造生产要素供给新方式提出要求。 ""	DZZW202008015",,,,,,,,,,,,,,,,
"基于区块链信任的“制度-效能”转化框架	刘海军:44462822|李晴:41789241	12	区块链; 信任; 制度优势; 治理效能; 智慧政府;	""将制度优势转化为治理效能",是我国国家治理现代化的主要逻辑。已有研究充分肯定制度优势及其转化为治理效能的现实意义,但缺乏具体转化方法论证。受制度繁简、理解差异、环境变化等因素制约,制度优势转化为治理效能的过程面临较大困难,主客体间信任关系成为最大变量。构筑于确定性物质基础之上的区块链信任超越技术范畴,广泛应用于金融、征信、扶贫等领域,"为探寻""""制度-效能""""转化的""""黑箱""""路径提供依据。依托区块链信任机理与结合体特征",尝试在信任体系化支撑下,以制度知识化为起点,经由机制合约化实现效能可视化,"打通""""制度-机制-效能-支撑""""闭合回路",为打造信任政府、智慧政府,"推进政府治理现代化提出基本思路。 ""	DZZW202008006",,,,,,,,
"浅论基于区块链的公共资源交易信用治理策略	""王丛虎1",2:09750521|王晓鹏1,2:38112923|肖源2,"3:30771533""	10	区块链技术; 公共资源交易; 信用治理;	""当前",我国公共资源交易信用治理面临监管碎片化程度较高、监管机制运行不畅、技术手段落后、信息技术标准不一等问题。区块链技术的分布式数据存储、共享机制、可追溯性和防篡改特性可与我国公共资源交易信用治理紧密结合,成为公共资源交易信用治理的新工具。为此,在公共资源交易领域国家应该充分借助区块链技术进行信用治理,建立基于区块链技术的公共资源交易主体协同联动机制,"有效促进公共资源交易的健康发展。 ""	DZZW202008007",,,,,,,,,,,,
"数字政府建设的理论逻辑与结构要素――基于上海市“一网通办”的实践与探索	谭必勇:22085761|刘芮:39498327	11	数字政府; 一网通办; 政府治理; 数字治理;	""数字政府是数据时代政府治理发展的方向","是助力""""智慧城市""""、建设""""数字中国""""的途径。基于文献梳理、案例解读和实证分析的方法",运用数据时代治理理论总结数字政府建设的特点与要求,进而从全链条服务平台、双引擎并驾齐驱、全媒体沟通反馈、多主体协同合作四个方面分析数字政府建设的结构要素。在此基础上,"以上海市""""一网通办""""的探索为基点",分析数字政府建设的内涵和路径,"为我国其他地区数字政府建设提供参考。 ""	DZZW202008008",,,,,,,,,,,,,,
"行政法视野下互联网新业态包容审慎监管原则研究	张效羽:45680289	11	行政法; 包容审慎监管; 比例原则; 司法审查; 合作治理; 互联网新业态;	""包容审慎监管原则是中国政府针对新业态监管的公共政策",也是一项崛起中的行政法原则。从当前治理话语分析,"包容审慎监管原则内涵分为""""包容创新""""""""审慎监管""""和""""有效监管""""三方面。其中包容创新的行政法意义在于容忍互联网新业态在发展初期的轻微""""非法状态""""",只要新业态没有违反基本法律秩序且没有显著社会危害性,行政机关就不应实施行政处罚。审慎监管的行政法意义在于避免将针对传统业态的监管规定直接类推适用于互联网新业态,监管机关对新业态实施监管时应当坚持比例原则和合作治理原则,避免不当监管扼杀创新。在实践中落实包容审慎监管原则,一是要坚持推进包容审慎监管原则的司法化,让法院用包容审慎监管原则判断行政行为的合法性;二是要建立包容审慎监管原则的制度,"通过合作治理、试验性监管和强化监管评估保障包容审慎监管原则的落实。 ""	DZZW202008009",,,,,,,,,,,
"总体国家安全观视域下《数据安全法》的价值与体系定位	朱雪忠:26330477|代志在:45148188	11	数据安全法; 国家安全; 网络安全; 数据安全; 信息安全;	""大数据战略给生产组织方式的变革带来了新机遇",也对国家安全尤其是情报安全提出了新挑战。文章以总体国家安全观为理论指导,在明确我国数据安全需求和制度供给的基础上,分析了《数据安全法》的价值定位和体系定位。具体而言,"《数据安全法》的价值定位应当符合总体国家安全观对""""发展与安全兼顾""""的要求并有具体的制度支撑;体系定位要在服从总体国家安全观全局规划的基础上",整合现有数据安全政策,避免过度介入已经或本应由其他法律规制的领域。《数据安全法》的定位问题是系统规划国家数据安全风险防控和治理体系建设的基础理论问题,"明确其价值与体系定位对进一步讨论其基本原则、具体条款和法律适用具有重要意义。 ""	DZZW202008010",,,,,,,,,,,,,
"反思与完善：算法行政背景下健康码的适用风险探析	陈禹衡:41732559|陈洪兵:37764037	9	人工智能; 健康码; 算法行政; 个人信息保护; 算法治理;	""人工智能技术的进步推动算法行政的发展",健康码作为算法行政的典型代表,有效提升了政府工作效率,但是在信息收集阶段以及实际适用阶段也存在相应的风险亟需解决。通过对健康码适用中的个人信息收集方式的研究,分析健康码实际适用带来的风险。采用文献分析法、比较法,对国内外有关个人信息保护、算法行政、算法偏见的相关文献进行分析。借鉴行政法中的法律位阶体系,对不同类型的健康码进行层级划分,并制定判断规则以消除不同类型健康码的适用冲突风险,规避个人信息收集和处理的风险;针对算法偏见风险构建健康码报错及追责机制,从而帮助政府更好地适用健康码,"推动算法行政的开展。 ""	DZZW202008012",,,,,,,,,,
"智慧纪检监察：概念框架、实践图谱和优化策略	曾智洪1:37190791|陈煜超1:45357587|吴金群2:10282253	11	纪检监察; 信息化; 智慧纪检; 智慧监督; 大数据权力; 数字化转型;	""信息时代纪检监察机关作为管党治党的重要力量",正面临着如何利用信息技术将反腐廉政制度优势转换为国家治理效能的新考验。全国许多地方把建设智慧纪检监察系统作为突破口,通过信息技术与纪检监察业务的深度融合,打破空间、时间和人力的限制,将其便捷、扁平、交互、智能的技术优势嵌入到权力监督和反腐倡廉领域。研究厘清了智慧纪检监察的概念意涵和基本框架,通过梳理具有代表性的地方案例,刻画了智慧纪检监察的实践图谱,利用DIKIW模型溯源了智慧纪检监察的逻辑起点和演进趋向,"并基于智慧纪检监察的治理反思提出其优化策略。 ""	DZZW202008013",,,,,,,,,,,,
