"中央网信办召开网络文化传播工作者座谈会		1	 	""<正>2015年11月12日","中央网信办在京召开网络文化传播工作者""""学习十八届五中全会精神","推进网络强国建设""""座谈会。中央网信办副主任任贤良出席座谈会并讲话。15位来自网络文化领域的专家学者围绕""""繁荣网络文化","建设网络强国""""主题进行了座谈。座谈会由中央网信办网络社会工作局负责同志主持。任贤良在座谈会上强调",网络文化传播工作者要切实提高对学习宣传贯彻五中全会精神极端重要性的认识,"深入把握 ""	DZZW201512007",,,,,,,,,,,,,,,
"全国统一的信用信息共享交换平台建设工作座谈会在京召开		1	 	""<正>2015年11月20日上午",中国国家发展和改革委员会副主任连维良主持召开了全国统一的信用信息共享交换平台建设工作座谈会并讲话。会议介绍并演示了国家共享交换平台先导工程建设运行情况,广东、浙江、黑龙江、江苏、辽宁、陕西六省就地方信用信息归集共享应用、地方平台与国家平台互联共享等作了交流介绍。连维良副主任听取汇报后,对国家共享交换平台先导工程建设及各地信用建设成果给予充分肯定,"指出当前信用建设 ""	DZZW201512013",,,,,,,,,,,,,,,,
"“RONG”系列之“大数据与政府治理”论坛在清华公管学院举办		1	 	""<正>2015年11月29日",清华大学公共管理学院联合数据科学研究院发起第六期RONG论坛,"针对""""大数据与政府治理""""的话题展开了为期一天的专场交流。论坛邀请了来自高校、政府机构、联合国开发署、相关企业等各方面专家进行分享交流",多维度展现了大数据分析能力与政府治理需求所碰撞出的火花。贵州省大数据办主任康克岩从实际情况出发,分享了贵州大数据发展的探索与实践,"回答了贵州为什么选择发展大数 ""	DZZW201512018",,,,,,,,,,,,,,,
"大数据思维形成的两种视角:信息技术驱动及应用拓展	胡小明:10590149	8	大数据; 政府数据; 数据开放; 电子治理;	""从大数据概念的界定和大数据理念切入",阐释了大数据产生的信息技术背景以及由此形成的新技术创新生态环境,并从信息驱动、技术驱动的角度分析了大数据理念革命、大数据应用的特点和难点,从政府和企业的视角辨析了大数据应用之短长。最后特别指出,大数据应用不存在捷径,应打好基础、循序渐进、稳步发展,"绝不应浮躁。 ""	DZZW201512008",,,,,,,,,,,,,,
"北京社区养老信息化建设构想	徐志立:11018147|王红霞:23574086	6	公共服务; 信息社会; 社区养老; 信息化; 老龄化; 可穿戴设备; 北京;	""中国养老服务所需的社会资源比较短缺",传统居家养老的功能日趋减弱,而单纯的机构养老又不能满足广大老年人多方面的养老需要。以北京市为例,从政府主导、社会养老机构、家庭和个人的角度分析了社区养老信息化发展的现状,根据现实所存在的问题,有针对性地提出了社区养老信息化建设可着手的几个方面:社区虚拟化养老服务,针对老年人的远程医疗服务体系,养老机构智能化管理服务系统,老年电子商务服务平台,"老年人信息化产品终端。 ""	DZZW201512009",,,,,,,,,,,
"基于投入产出视角的智慧城市评价研究	杨凯瑞1:27332590|张毅1:07607488	8	智慧城市; 投入要素; 产出成果; 评价指标;	""从投入产出的视角",以生产要素相关理论为依据,剖析智慧城市建设过程中的投入要素和成果产出,提出了智慧城市建设的投入产出模型。以此为基础,从投入和产出两个维度构建了智慧城市评价指标体系,"并据此提出了智慧城市建设过程中需要注意的问题。 ""	DZZW201512010",,,,,,,,,,,,,,,
"一种支持网格化管理的电子政务构架	李强:23336170	10	电子政务; 网格化管理; 社会管理; 系统架构; TOGAF; OGSA;	""社会管理网格化、信息化是当前电子政务开发和研究的热点",随着国内社会管理网格化的成功案例逐渐增多,标志着中国城市管理水平已经进入新的时代。而如何构建一个既可以支持网格化管理又可以面向整体规划的信息系统构架,仍需要更多的理论研究和实践探索。提出一种可以支持网格化管理的电子政务架构方案,通过吸取国际先进的架构技术,实现一种既可以面向整体规划,"又可以支持网格化管理的电子政务架构。 ""	DZZW201512011",,,,,,,,,,,,,,
"电子营业执照及其在工商全程电子化登记管理中的应用	陈红1:23407972|赵晶晶1:34030586|冯四风2:32061138|郭丽芳2:26728784	9	电子营业执照; 全程电子化登记管理; 工商管理; 电子档案; 电子政务;	""根据国家关于注册资本登记制度改革的要求",分析了工商注册制度便利化对电子营业执照的需求,提出了电子营业执照的定义,研究了电子营业执照的特性、分类及结构。根据对电子营业执照的分析,简述了电子营业执照系统结构和电子营业执照发放流程。分析了全程电子化登记管理的含义,研究了以电子营业执照为支撑的全程电子化登记管理方式,解决了企业网络身份识别、电子档案安全存储等问题,实现了真正意义上的全程电子化登记管理。最后,"详细阐述了电子营业执照应用流程。 ""	DZZW201512012",,,,,,,,,,,,
"地方政府网站信息公开专项评估研究	""费军1","2:14859526|王露1:10828357""	10	电子政务; 政府网站; 信息公开; 量化评估; AHP;	""自《中华人民共和国政府信息公开条例》颁布以来",各级地方政府信息公开工作取得较大进展,政府门户网站作为公众参与电子政务的主要平台,发挥了促进政民互动和合作治理的重要作用,但在信息公开的可执行性、有效性、公共服务性以及监督制度等方面仍存在不足,各地信息公开的绩效尚存差异。信息公开作为衡量政府门户网站绩效的核心指标,对其进行专项评估具有重要的现实意义。运用层次分析法构建了由4个一级指标和19个二级指标组成的政府网站信息公开评估指标体系,并以湖北省黄石、黄冈及宜昌等三个地级市政府门户网站为例进行量化评估,总结了三市地方政府网站信息公开工作在信息更新速度、规范性文件、行政审批信息、年度报告、信息公开检索等方面存在的地区差异。最后指出,推进政府网站信息公开,需要充分利用政府网站的载体作用,"努力加快和推动政府网站信息公开工作向基层延伸。 ""	DZZW201512014",,,,,,,,
"公众使用广东省网上办事大厅的情况及其影响因素调查	梁洁珍:33735370|刘伟章:07574132	8	网上办事大厅; 电子政务; 政府网站; 公共服务; 集约化;	""为了解公众使用广东省网上办事大厅的情况",对居住、生活在广州市的民众进行了访谈与问卷调查。调查发现:大多数人反映网上办事大厅的功能不完善,信息不完整以及更新不及时,网上办事速度慢,各级办事事项繁琐;不知道网上办事大厅、喜欢到实体部门办事、网上办事大厅操作复杂是造成公众没有使用过网上办事大厅的三大主要原因;不知道网上办事大厅、对使用网上办事大厅好处的认知度低、网上办事大厅的功能不完善造成了公众对网上办事大厅的使用率低;影响公众是否使用过网上办事大厅的主要因素为性别、文化程度、职业、网络使用时间;公众使用网上办事大厅服务层次的排序依次是基本信息服务、事务处理服务、信息交流服务。在此基础上,"针对提高公众对广东省网上办事大厅的使用率提出了若干政策建议。 ""	DZZW201512015",,,,,,,,,,,,,,,
"应急管理网站建设的展望研究	霍艳芳:28241563|王宁:08210643	5	电子政务; 应急管理网站; 公共危机事件; 危机公关; 公共管理;	""分析了中国应急管理网站建设的现状",结合美国联邦应急管理署FEMA网站的优秀案例,提出未来中国应急管理网站建设的新策略,如建设系统完善的应急管理网站体系、改革网站功能机制、建立健全公众参与体制等,"以期为提高政府应对公共危机事件的效率、扩大公众参与度提供参考。 ""	DZZW201512016",,,,,,,,,,,,,,,,
"北京智慧城市发展现状与建设对策研究	王红霞:23574086	7	智慧城市; 政府管理; 大数据; 电子政务;	""随着北京市流动人口、常住人口的增加",机动车保有量持续高速增长,"交通拥堵、景区超载、资源短缺等一系列""""城市病""""对北京城市发展的阻滞作用越来越明显。为了更好地解决这些问题并全面提升政府的社会管理水平",解决社会问题,缓解社会矛盾,对智慧城市的内涵与外延进行了深刻剖析,并借鉴国内外智慧城市建设与管理经验,对北京智慧城市建设现状进行了梳理,对未来发展趋势进行了预测,"以期为北京的城市规划、交通疏导、资源配置、人口管理、政策制定等政府管理行为提供决策支持。 ""	DZZW201512017",,,,,,,,,,,
"英国完善数据开放提升政府服务质量经验借鉴	贾一苇:12428016|刘鹭鸶:34030587	12	政府数据; 开放数据; 统计数据; 数据质量; 电子治理; 公共服务;	""英国政府在数据开放上是一个先行者","但存在""""政府发布数据质量不佳;官方谨慎态度阻碍数据开放的执行;公开的数据分散在各政府网站","限制了民众访问利用的积极性;数据开放利用引发隐私泄漏;公务员对数据解读能力不强""""等问题。为有效解决这些问题",英国2014年发布了《统计资料与数据开放――开发未利用的知识,赋予公民权利,提升政府服务质量》报告,提出了五方面具体措施,"并认为完善数据开放能提高政府效率、加强问责制以及促进经济增长。 ""	DZZW201512019",,,,,,,,,,,,,
"卷首语		1	 	""<正>互联网是20世纪最伟大的发明之一",它突破了国家和地域的界限,"发挥着""""连接一切""""的作用。互联网不仅形成了有效的公共领域",营造了有形的公共舆论,也充分运用新技术新应用创新了政府与公众沟通的模式,为公民、企业、社会组织等有关各方参与公共治理提供了可能。如今,互联网已经成为现代社会不可或缺的重要组成部分,"但同时也带来许多意想不到、需要解决的问题。本期的""""互联网治理专栏""""围绕网络意见人士、 ""	DZZW201512001",,,,,,,,,,,,,
"《电子政务》2015年总目录		5	 	 	DZZW201512020",,,,,,,,,,,,,,,,,,,,
"电子政府信用及其构成要素解析	""张锐昕1:07680235|张贝尔1","2:24784565""	4	电子政务; 电子治理; 信用; 电子政府信用; 信用要素;	""重点解析如何理解电子政府信用、电子政府信用的构成要素、电子政府信用构成及其信用主体模型",旨在保证电子政府自身良性秩序的前提下,推动政府信用建设,推进全社会信用体系建设,"努力营造和谐、诚信的网络秩序和社会环境。 ""	DZZW201511002",,,,,,,,,,,,,,,
"夯实电子政务的基石:加强电子政务信用建设	刘智勇:06559666	9	电子政务; 电子治理; 信用; 信息安全; 诚信;	""安全是电子政务的生命",信用则是电子政务的基石。电子政务信用与现实政府信用密切相关,同中有异,是原生性信用与次生性信用叠加的结果。当前,中国电子政务的信用度尚不太高,同时影响信用的风险因素不少。从道德、法制、技术等途径,加强电子政务信用风险监管,建设安全、诚信的电子政府,"不仅必要而且迫切。 ""	DZZW201511003",,,,,,,,,,,,
"协同治理视角下互联网金融征信治理问题研究	于洁:33713167|冯冰娜:33910380|樊博:09592194	10	电子治理; 互联网金融; 征信; 社会信用体系; 协同治理; 信用建设; 电子政务;	""2013年",互联网金融兴起并迅猛发展,一方面给中国经济社会发展带来了更加强劲的动力,另一方面也对当下社会征信体系建设提出了更高的要求,如何保证征信业的健康发展,继续完善中国的社会征信体系已成为社会各界共同关注的话题。基于已有研究成果,构建了利益状况、社会资本、制度和信息技术三类影响因素,协作和整合为中介变量,三大网络(社会关系网络、任务网络和知识网络)为考量因素的框架。基于该理论分析框架,认为当前利益格局混乱、社会资本培育力度不足、制度和信息技术保障不力、协作和整合力度不够是互联网金融征信治理中的突出问题。结合中国实际,认为在当前互联网金融背景下,有效推进互联网金融征信治理工作,需要优先理顺利益格局,着力培育社会资本,加快制度共识建设和信息技术保障支持,在此基础上要做好协作和整合工作,有效构建三大网络,"有效推进互联网金融征信治理工作。 ""	DZZW201511005",,,
"工业和信息化部发布《云计算综合标准化体系建设指南》		1	 	""<正>2015年10月9日",工业和信息化部正式发布《云计算综合标准化体系建设指南》(以下简称《指南》)。《指南》旨在借鉴国际云计算技术和标准研究成果,紧扣云计算服务和应用发展需求,充分发挥企业主体作用,加强标准战略研究和标准体系构建,明确云计算标准化研究方向,加快推进重要领域标准制定与贯彻实施,夯实云计算发展的技术基础,"为促进中国云计算持续快速健康发展做好支撑。 ""	DZZW201511004",,,,,,,,,,,,
"中央网信办召开系列座谈会 学习宣传贯彻十八届五中全会精神		1	 	""<正>2015年11月5日至6日","中央网信办连续召开""""学习宣传贯彻十八届五中全会精神","推进网络强国建设""""系列座谈会",来自网络安全和信息化领域的院士、专家学者,网站、互联网企业负责人以及中央国家机关代表参加,交流探讨学习心得,共商推进网络强国建设之策。与会人员一致认为,十八届五中全会将对中国未来发展产生深远影响,全会提出的一系列重要论断,"特别是""""创新、协调、绿色、开放、共享""""的发展理念以及网络强国战略、国家大数据战略、创新驱动发展战略、军民融合发展战略恰 ""	DZZW201511006",,,,,,,,,,,
"数字记忆国际论坛暨第六届中国电子文件管理论坛在京召开		1	 	""<正>2015年10月24-25日","数字记忆国际论坛暨第六届中国电子文件管理论坛在中国人民大学举行。本届论坛以""""数字记忆:构建、认同与传承""""为主题",由中国人民大学人文北京研究中心、电子文件管理研究中心和信息资源管理学院共同主办。论坛内容包括数字记忆的采集、整合、保管、利用、展示等方面的理论认知和实践成果,旨在搭建数字记忆领域的交流平台,"加强国内外相关机构与项目的沟 ""	DZZW201511014",,,,,,,,,,,,,,,,
"“互联网+”交通新业态下网络租约车的政策监管――兼评《网络预约出租汽车经营服务管理暂行办法(征求意见稿)》		6	互联网+; 专车; 网络约车; 专车新政; 共享经济; 网络预约出租汽车经营服务管理暂行办法;	""2015年10月10日",交通运输部对外发布了《网络预约出租汽车经营服务管理暂行办法(征求意见稿)》,围绕该暂行办法本身存在的问题、该暂行办法如若实施可能对创新和共享经济发展造成的不良影响等展开了探讨,在此基础上总结指出,"推动专车新政应当遵奉互联网思维、""""战略性模糊""""、差异化试点、尊重实践、协同监管、可操作性等发展原则。 ""	DZZW201511007",,,,,,,,,,,,,,,,
"从“网约车新政”透视转型期政府治理理念转变之必要性――“专车新政与共享经济发展”研讨会纪实		11	电子治理; 网络租约车; 政府治理; 专车新政; 共享经济; 互联网+;	""2015年10月10日",交通运输部对外发布《网络预约出租汽车经营服务管理暂行办法(征求意见稿)》(以下简称《办法》),引起了社会各界广泛关注和热烈讨论。为及时反映专家学者对这一问题的思考与意见,10月14日,"信息社会50人论坛组织召开""""专车新政与共享经济发展""""研讨会","会议由信息社会50人论坛轮值主席、国家信息中心信息化研究部主任张新红主持。与会嘉宾围绕该征求意见稿引发争议的深层次原因、有关规定对中国经济社会整体和产业发展可能造成的影响以及如何推动中国网络预约出租汽车等新兴业态发展等问题进行了交流。 ""	DZZW201511008",,,,,,,,,,,,,,,
"“互联网+”战略下创新创业模式的规范化发展――以“优步”互联网租约车服务为例	徐晓日:10582559|李思佳:31559405	8	公共管理; 公共服务; 互联网+; 网络约车; 网络租车; 电子治理; 打车软件; 互联网专车;	""随着中国进入""""互联网+""""新时代",一系列传统产业与互联网相结合的创新创业模式不断涌现,其发展有待规范化。以互联网和传统出租车行业的结合为例,"优步""""等互联网打车平台为用户提供了方便快捷、高性价比、高质量的服务模式",同时也存在着无法回避的问题,"如身份的合法性、社会安全隐患、用户权益保障、对传统出租业的冲击等等。在""""互联网+""""背景下",不应简单粗暴地叫停其发展,而应当通过法律制度建设、数量和价格改革、建立投诉机构、管控从业人员准入等多个方面规范化其发展,"引导传统出租车行业的革新。 ""	DZZW201511009",,,,,,,,,,,,
"微信平台政民交互的方式及其特点探析	李勇:10096044|龚小芳:33910387|田晶晶:29065848	8	政务微信; 微服务; 微治理; 政民交互; 移动服务;	""构建有效的政民交互平台是实现政府服务的重要方式",探寻政民交互平台的合理构建模式对政府服务具有重要意义。以案例分析的研究方法,对上海市政务微信公众号应用现状进行分析,总结了微信平台上政民交互的方式和特征,"提出了提高政务微信建设水平和完善微信条件下政民交互的对策建议。 ""	DZZW201511010",,,,,,,,,,,,,,,,
"微博热门话题及其线下行为转化研究	王国华:07592451|陈静:07583702|钟声扬:30053275	13	微博; 网络治理; 公共管理; 电子治理; 新媒体;	""对2014年1月至4月新浪微博每日排名前十的共计1200条热门话题进行分类研究",探索哪些话题更容易发展成为热门话题,哪些热门话题能够成功转化成为线下集体行为,并进一步对转化影响因素进行了分析。研究发现,社会类、公益类、娱乐类话题更容易发展成为热门话题,悲情类、争议类和戏谑类热门话题更容易转化成为线下集体事件,"影响转化的因素主要有热门话题类型、新旧媒体互动以及话题主持人身份等。 ""	DZZW201511011",,,,,,,,,,,,,,
"中国政务微博的发展现状及对策研究――基于对新浪省级政府微博的网络调查	陈艳红:10235896|姬荣荣:33910381	6	电子政务; 政务微博; 政务公开; 微博问政; 新媒体;	""通过对新浪网省级政府微博开通时间、发布内容、更新速度以及社会反响等的调查发现",中国政务微博虽然取得了一定成绩,但仍存在命名不规范、定位不明确、重视程度低、内容发布不规范以及管理松散等问题。为此应严格认证机制,明确功能定位,重视使用管理,规范内容发布以及完善监督机制,"推动政务微博健康有序发展。 ""	DZZW201511012",,,,,,,,,,,,,,
"公众与企业视角下的公共服务公平性:中国城市的调查发现	吴伟:25720602|于文轩:25720603|马亮:28517104	11	公共服务; 社会公平; 服务型政府; 城市管理; 政府绩效;	""确保公共服务的公平性",对于提升政府绩效和公众信任至关重要。2014年,"新加坡连氏基金会""""连氏中国服务型政府调查项目""""课题组电话调查了中国大陆36个城市的25370个居民和3687个企业",旨在考察公众和企业对公共服务公平性的感知。调查发现,城市居民和企业对公共服务的公平性较为满意,但平均评分都不高,表明仍然有很大的提升空间;调查还发现,城市公共服务水平与内部均衡程度存在较强的相关性,提示城市在平衡效率与公平方面大有可为。本文分析和报告了相关调查结果,"并提出了进一步提升公共服务公平性的对策建议。 ""	DZZW201511013",,,,,,,,,,,
"北京市在线公共服务用户接受度的比较研究	宋伯朝:32357005|孙宇:06373691	9	公共服务; 技术接受模型; 计划行为理论; 用户接受度; 结构方程模型;	""挂号平台与网上大厅是两类典型的在线公共服务",在技术接受模型与计划行为理论的基础上,结合各自用户特点,构建用户接受度模型。对患者(n=222)和证件申请者(n=204)进行抽样调查,并使用结构方程模型对样本数据进行比较分析和讨论。研究发现:感知到有用性、感知到好用性、人际影响、媒体影响、便利条件、自我效能对挂号平台与网上大厅的用户使用意图有显著影响;信息系统质量没有显著影响;医疗资源的稀缺性导致信任的影响不显著。最终基于比较研究的结果,"提出优化北京市在线公共服务用户接受度的对策建议。 ""	DZZW201511015",,,,,,,,,,,,,,,
"基于UTAUT模型的智慧养老用户使用行为影响因素研究――以武汉市“一键通”为例	毛羽:07599295|李冬玲:33910382	8	公共服务; “一键通”服务; UTAUT模型; 智慧养老; 智慧城市;	""""""一键通""""服务是湖北武汉市在综合武昌区""""智能养老服务体系""""和~口宗关街发展社区的固话智能呼叫系统的基础上",于2013年逐渐在全市推广的一项智能养老服务,但这项构思先进的智能养老服务却并没有达到理想效果。本文在UTAUT模型的基础上,增加了感知安全、感知信任两个因素,"构建""""一键通""""服务的用户接受模型","分析影响用户使用""""一键通""""服务的关键因素","从而为智慧养老服务提供建议和对策。 ""	DZZW201511016",,,,,,,,,,,,,,
"公共交通运营信息服务研究:公众需求与服务能力	刘新萍1:30147963|郑磊2:06712094|李洪克1:33555016	8	公共交通; 公共服务; 信息服务; 公众需求; 公共管理;	""以上海地铁为例",对公共交通运营信息服务的公众需求、服务现状与国内外标杆进行研究。研究表明,公众的公共交通信息需求具有场景化、差异化和个性化等特征,而现有的运营信息服务能力尚无法满足公众不断提升的信息需求,服务能力和公众需求之间存在差距。基于研究发现,"进一步从服务模式、服务内容、服务渠道、体制机制、技术支撑、开发模式等方面对公共交通运营信息服务能力建设提出建议。 ""	DZZW201511017",,,,,,,,,,,,,,,
"大数据时代行政决策评估进展研究	杨润美:33265806|邓崧:09334500	7	行政决策评估; 大数据; 数据管理; 循数评估;	""通过归纳分析、比较分析等研究方法",在梳理相关文献的基础上,回顾了数据挖掘的发展历程,比较分析了大数据时代行政决策评估相比于传统的决策评估所具有的特点,针对大数据时代行政决策评估所面对的机遇和挑战提出若干对策、建议,最后得出以下结论:大数据时代的行政决策评估在评估主体、对象、标准、程序、方法等方面具有鲜明特点,"面临着数据驱动的机遇和""""数据孤岛""""的挑战。 ""	DZZW201511018",,,,,,,,,,,,,,
"卷首语		1	 	""<正>信用是人类社会每个发展阶段都热议的话题",在维护社会正常运转中起着重要的基石作用。在当今向网络社会转型的过程中,由网络信息技术带来的社会运作模式转变给信用体系建设增添了新的变数,"探讨其中的规律对于社会治理体系和治理能力现代化建设无疑是十分必要也很有意义的。本期""""专题报告""""聚焦""""电子政府与信用体系""""","探讨在网络社会环境下电子政府与社会信用体系建设的关系。《电子政府信用及其构成要素解析》 ""	DZZW201511001",,,,,,,,,,,,,,,,
"电子政府信任:数字化时代政府信任的2.0版本	王连伟:30176026	8	电子治理; 电子政务; 电子政府; 政府信任; 信息社会;	""电子政府作为数字化时代政府的崭新形态",民主与公平是其双重使命。数字化时代的治理和电子民主成为西方新公共管理运动之后政府改革与治理领域的主旋律。电子政府信任是传统政府信任在数字化时代的蜕变和升华,完成了从1.0版本到2.0版本的升级。当前,中国电子政府建设过程中还存在着认识误区和实践困境:工具理性与价值理性的内在张力、控制思维与民主行政的逻辑冲突、全能主义与功能塌陷的实践悖论、官本思想与民间言论的双重话语。今后需要从顶层设计、制度性供给、业务流程、服务质量、配套改革等方面加强电子政府建设,提高民众对政府的信任度和满意度,"增强政府治理的社会根基。 ""	DZZW201510002",,,,,,,,,,,,,,,
